PokerStars Hand #249559300216: Tournament #3732098210, $1.84+$0.16 USD Hold'em No Limit - Level I (10/20) - 2024/03/22 15:35:57 CET [2024/03/22 10:35:57 ET]
Table '3732098210 1' 3-max Seat #1 is the button
Seat 1: Mahu2021 (500 in chips) 
Seat 2: Lipefefcf (500 in chips) 
Seat 3: Gary CANUCK (500 in chips) 
Lipefefcf: posts small blind 10
Gary CANUCK: posts big blind 20
*** HOLE CARDS ***
Dealt to Mahu2021 [2h 6h]
Mahu2021: folds 
Lipefefcf: folds 
Uncalled bet (10) returned to Gary CANUCK
Gary CANUCK collected 20 from pot
*** SUMMARY ***
Total pot 20 | Rake 0 
Seat 1: Mahu2021 (button) folded before Flop (didn't bet)
Seat 2: Lipefefcf (small blind) folded before Flop
Seat 3: Gary CANUCK (big blind) collected (20)



PokerStars Hand #249559303293: Tournament #3732098210, $1.84+$0.16 USD Hold'em No Limit - Level I (10/20) - 2024/03/22 15:36:11 CET [2024/03/22 10:36:11 ET]
Table '3732098210 1' 3-max Seat #2 is the button
Seat 1: Mahu2021 (500 in chips) 
Seat 2: Lipefefcf (490 in chips) 
Seat 3: Gary CANUCK (510 in chips) 
Gary CANUCK: posts small blind 10
Mahu2021: posts big blind 20
*** HOLE CARDS ***
Dealt to Mahu2021 [9h Qd]
Lipefefcf: folds 
Gary CANUCK: calls 10
Mahu2021: checks 
*** FLOP *** [8h Jh As]
Gary CANUCK: checks 
Mahu2021: bets 20
Gary CANUCK: folds 
Uncalled bet (20) returned to Mahu2021
Mahu2021 collected 40 from pot
Mahu2021: doesn't show hand 
*** SUMMARY ***
Total pot 40 | Rake 0 
Board [8h Jh As]
Seat 1: Mahu2021 (big blind) collected (40)
Seat 2: Lipefefcf (button) folded before Flop (didn't bet)
Seat 3: Gary CANUCK (small blind) folded on the Flop



PokerStars Hand #249559306095: Tournament #3732098210, $1.84+$0.16 USD Hold'em No Limit - Level I (10/20) - 2024/03/22 15:36:24 CET [2024/03/22 10:36:24 ET]
Table '3732098210 1' 3-max Seat #3 is the button
Seat 1: Mahu2021 (520 in chips) 
Seat 2: Lipefefcf (490 in chips) 
Seat 3: Gary CANUCK (490 in chips) 
Mahu2021: posts small blind 10
Lipefefcf: posts big blind 20
*** HOLE CARDS ***
Dealt to Mahu2021 [6s 4c]
Gary CANUCK: calls 20
Mahu2021: folds 
Lipefefcf: checks 
*** FLOP *** [4d Jc 3s]
Lipefefcf: checks 
Gary CANUCK: checks 
*** TURN *** [4d Jc 3s] [Ac]
Lipefefcf: checks 
Gary CANUCK: checks 
*** RIVER *** [4d Jc 3s Ac] [Qh]
Lipefefcf: checks 
Gary CANUCK: checks 
*** SHOW DOWN ***
Lipefefcf: shows [7s Kh] (high card Ace)
Gary CANUCK: mucks hand 
Lipefefcf collected 50 from pot
*** SUMMARY ***
Total pot 50 | Rake 0 
Board [4d Jc 3s Ac Qh]
Seat 1: Mahu2021 (small blind) folded before Flop
Seat 2: Lipefefcf (big blind) showed [7s Kh] and won (50) with high card Ace
Seat 3: Gary CANUCK (button) mucked [Td 8d]



PokerStars Hand #249559312737: Tournament #3732098210, $1.84+$0.16 USD Hold'em No Limit - Level I (10/20) - 2024/03/22 15:36:55 CET [2024/03/22 10:36:55 ET]
Table '3732098210 1' 3-max Seat #1 is the button
Seat 1: Mahu2021 (510 in chips) 
Seat 2: Lipefefcf (520 in chips) 
Seat 3: Gary CANUCK (470 in chips) 
Lipefefcf: posts small blind 10
Gary CANUCK: posts big blind 20
*** HOLE CARDS ***
Dealt to Mahu2021 [Kd 5c]
Mahu2021: folds 
Lipefefcf: calls 10
Gary CANUCK: checks 
*** FLOP *** [Jd 9c 3d]
Lipefefcf: checks 
Gary CANUCK: checks 
*** TURN *** [Jd 9c 3d] [5h]
Lipefefcf: checks 
Gary CANUCK: checks 
*** RIVER *** [Jd 9c 3d 5h] [7c]
Lipefefcf: checks 
Gary CANUCK: checks 
*** SHOW DOWN ***
Lipefefcf: shows [3s Ac] (a pair of Threes)
Gary CANUCK: mucks hand 
Lipefefcf collected 40 from pot
*** SUMMARY ***
Total pot 40 | Rake 0 
Board [Jd 9c 3d 5h 7c]
Seat 1: Mahu2021 (button) folded before Flop (didn't bet)
Seat 2: Lipefefcf (small blind) showed [3s Ac] and won (40) with a pair of Threes
Seat 3: Gary CANUCK (big blind) mucked [2c Th]



PokerStars Hand #249559317049: Tournament #3732098210, $1.84+$0.16 USD Hold'em No Limit - Level I (10/20) - 2024/03/22 15:37:15 CET [2024/03/22 10:37:15 ET]
Table '3732098210 1' 3-max Seat #2 is the button
Seat 1: Mahu2021 (510 in chips) 
Seat 2: Lipefefcf (540 in chips) 
Seat 3: Gary CANUCK (450 in chips) 
Gary CANUCK: posts small blind 10
Mahu2021: posts big blind 20
*** HOLE CARDS ***
Dealt to Mahu2021 [Ah 7h]
Lipefefcf: calls 20
Gary CANUCK: calls 10
Mahu2021: raises 60 to 80
Lipefefcf: calls 60
Gary CANUCK: calls 60
*** FLOP *** [8h Ks Jh]
Gary CANUCK: checks 
Mahu2021: bets 80
Lipefefcf: raises 80 to 160
Gary CANUCK: folds 
Mahu2021: calls 80
*** TURN *** [8h Ks Jh] [8s]
Mahu2021: checks 
Lipefefcf: bets 300 and is all-in
Mahu2021: calls 270 and is all-in
Uncalled bet (30) returned to Lipefefcf
*** RIVER *** [8h Ks Jh 8s] [Ts]
*** SHOW DOWN ***
Mahu2021: shows [Ah 7h] (a pair of Eights)
Lipefefcf: shows [Qs Kh] (two pair, Kings and Eights)
Lipefefcf collected 1100 from pot
Mahu2021 finished the tournament in 3rd place
*** SUMMARY ***
Total pot 1100 | Rake 0 
Board [8h Ks Jh 8s Ts]
Seat 1: Mahu2021 (big blind) showed [Ah 7h] and lost with a pair of Eights
Seat 2: Lipefefcf (button) showed [Qs Kh] and won (1100) with two pair, Kings and Eights
Seat 3: Gary CANUCK (small blind) folded on the Flop



