PokerStars Hand #244214108128: Tournament #3603157931, $0.92+$0.08 USD Hold'em No Limit - Level I (10/20) - 2023/06/11 17:04:20 CET [2023/06/11 11:04:20 ET]
Table '3603157931 1' 3-max Seat #1 is the button
Seat 1: provincial49 (500 in chips) 
Seat 2: Mahu2021 (500 in chips) 
Seat 3: Clark191213 (500 in chips) 
Mahu2021: posts small blind 10
Clark191213: posts big blind 20
*** HOLE CARDS ***
Dealt to Mahu2021 [4s Kc]
provincial49: raises 20 to 40
Mahu2021: folds 
Clark191213: raises 460 to 500 and is all-in
provincial49: calls 460 and is all-in
*** FLOP *** [2c Js 4h]
*** TURN *** [2c Js 4h] [3s]
*** RIVER *** [2c Js 4h 3s] [Ks]
*** SHOW DOWN ***
Clark191213: shows [8d 8s] (a pair of Eights)
provincial49: shows [Jd Kh] (two pair, Kings and Jacks)
provincial49 collected 1010 from pot
Clark191213 finished the tournament in 3rd place
*** SUMMARY ***
Total pot 1010 | Rake 0 
Board [2c Js 4h 3s Ks]
Seat 1: provincial49 (button) showed [Jd Kh] and won (1010) with two pair, Kings and Jacks
Seat 2: Mahu2021 (small blind) folded before Flop
Seat 3: Clark191213 (big blind) showed [8d 8s] and lost with a pair of Eights



PokerStars Hand #244214113531: Tournament #3603157931, $0.92+$0.08 USD Hold'em No Limit - Level I (10/20) - 2023/06/11 17:04:40 CET [2023/06/11 11:04:40 ET]
Table '3603157931 1' 3-max Seat #2 is the button
Seat 1: provincial49 (1010 in chips) 
Seat 2: Mahu2021 (490 in chips) 
Mahu2021: posts small blind 10
provincial49: posts big blind 20
*** HOLE CARDS ***
Dealt to Mahu2021 [8c Qs]
Mahu2021: calls 10
provincial49: checks 
*** FLOP *** [3s 9h Kd]
provincial49: checks 
Mahu2021: checks 
*** TURN *** [3s 9h Kd] [Th]
provincial49: checks 
Mahu2021: checks 
*** RIVER *** [3s 9h Kd Th] [6c]
provincial49: checks 
Mahu2021: checks 
*** SHOW DOWN ***
provincial49: shows [Js 3d] (a pair of Threes)
Mahu2021: mucks hand 
provincial49 collected 40 from pot
*** SUMMARY ***
Total pot 40 | Rake 0 
Board [3s 9h Kd Th 6c]
Seat 1: provincial49 (big blind) showed [Js 3d] and won (40) with a pair of Threes
Seat 2: Mahu2021 (button) (small blind) mucked [8c Qs]



PokerStars Hand #244214116999: Tournament #3603157931, $0.92+$0.08 USD Hold'em No Limit - Level I (10/20) - 2023/06/11 17:04:53 CET [2023/06/11 11:04:53 ET]
Table '3603157931 1' 3-max Seat #1 is the button
Seat 1: provincial49 (1030 in chips) 
Seat 2: Mahu2021 (470 in chips) 
provincial49: posts small blind 10
Mahu2021: posts big blind 20
*** HOLE CARDS ***
Dealt to Mahu2021 [5h 7d]
provincial49: raises 20 to 40
Mahu2021: calls 20
*** FLOP *** [6d Ah Qc]
Mahu2021: checks 
provincial49: bets 40
Mahu2021: folds 
Uncalled bet (40) returned to provincial49
provincial49 collected 80 from pot
provincial49: doesn't show hand 
*** SUMMARY ***
Total pot 80 | Rake 0 
Board [6d Ah Qc]
Seat 1: provincial49 (button) (small blind) collected (80)
Seat 2: Mahu2021 (big blind) folded on the Flop



PokerStars Hand #244214120041: Tournament #3603157931, $0.92+$0.08 USD Hold'em No Limit - Level I (10/20) - 2023/06/11 17:05:04 CET [2023/06/11 11:05:04 ET]
Table '3603157931 1' 3-max Seat #2 is the button
Seat 1: provincial49 (1070 in chips) 
Seat 2: Mahu2021 (430 in chips) 
Mahu2021: posts small blind 10
provincial49: posts big blind 20
*** HOLE CARDS ***
Dealt to Mahu2021 [2d 6h]
Mahu2021: folds 
Uncalled bet (10) returned to provincial49
provincial49 collected 20 from pot
provincial49: doesn't show hand 
*** SUMMARY ***
Total pot 20 | Rake 0 
Seat 1: provincial49 (big blind) collected (20)
Seat 2: Mahu2021 (button) (small blind) folded before Flop



PokerStars Hand #244214121266: Tournament #3603157931, $0.92+$0.08 USD Hold'em No Limit - Level I (10/20) - 2023/06/11 17:05:08 CET [2023/06/11 11:05:08 ET]
Table '3603157931 1' 3-max Seat #1 is the button
Seat 1: provincial49 (1080 in chips) 
Seat 2: Mahu2021 (420 in chips) 
provincial49: posts small blind 10
Mahu2021: posts big blind 20
*** HOLE CARDS ***
Dealt to Mahu2021 [6c 5s]
provincial49: folds 
Uncalled bet (10) returned to Mahu2021
Mahu2021 collected 20 from pot
Mahu2021: doesn't show hand 
*** SUMMARY ***
Total pot 20 | Rake 0 
Seat 1: provincial49 (button) (small blind) folded before Flop
Seat 2: Mahu2021 (big blind) collected (20)



PokerStars Hand #244214122635: Tournament #3603157931, $0.92+$0.08 USD Hold'em No Limit - Level I (10/20) - 2023/06/11 17:05:13 CET [2023/06/11 11:05:13 ET]
Table '3603157931 1' 3-max Seat #2 is the button
Seat 1: provincial49 (1070 in chips) 
Seat 2: Mahu2021 (430 in chips) 
Mahu2021: posts small blind 10
provincial49: posts big blind 20
*** HOLE CARDS ***
Dealt to Mahu2021 [Ks Qs]
Mahu2021: raises 20 to 40
provincial49: calls 20
*** FLOP *** [6d 2h 6s]
provincial49: checks 
Mahu2021: bets 40
provincial49: calls 40
*** TURN *** [6d 2h 6s] [Kh]
provincial49: checks 
Mahu2021: bets 160
provincial49: raises 180 to 340
Mahu2021: raises 10 to 350 and is all-in
provincial49: calls 10
*** RIVER *** [6d 2h 6s Kh] [4d]
*** SHOW DOWN ***
provincial49: shows [Ah 6c] (three of a kind, Sixes)
Mahu2021: shows [Ks Qs] (two pair, Kings and Sixes)
provincial49 collected 860 from pot
Mahu2021 finished the tournament in 2nd place
provincial49 wins the tournament and receives $3.00 - congratulations!
*** SUMMARY ***
Total pot 860 | Rake 0 
Board [6d 2h 6s Kh 4d]
Seat 1: provincial49 (big blind) showed [Ah 6c] and won (860) with three of a kind, Sixes
Seat 2: Mahu2021 (button) (small blind) showed [Ks Qs] and lost with two pair, Kings and Sixes



