PokerStars Hand #251453262015: Tournament #3777083183, $1.84+$0.16 USD Hold'em No Limit - Level I (10/20) - 2024/07/12 18:49:34 CET [2024/07/12 12:49:34 ET]
Table '3777083183 1' 3-max Seat #1 is the button
Seat 1: Mahu2021 (500 in chips) 
Seat 2: Sweede (500 in chips) 
Seat 3: kreatin21 (500 in chips) 
Sweede: posts small blind 10
kreatin21: posts big blind 20
*** HOLE CARDS ***
Dealt to Mahu2021 [9h 9s]
Mahu2021: raises 20 to 40
Sweede: folds 
kreatin21: calls 20
*** FLOP *** [Jh 5d Qs]
kreatin21: checks 
Mahu2021: bets 40
kreatin21: folds 
Uncalled bet (40) returned to Mahu2021
Mahu2021 collected 90 from pot
Mahu2021: doesn't show hand 
*** SUMMARY ***
Total pot 90 | Rake 0 
Board [Jh 5d Qs]
Seat 1: Mahu2021 (button) collected (90)
Seat 2: Sweede (small blind) folded before Flop
Seat 3: kreatin21 (big blind) folded on the Flop



PokerStars Hand #251453267756: Tournament #3777083183, $1.84+$0.16 USD Hold'em No Limit - Level I (10/20) - 2024/07/12 18:49:59 CET [2024/07/12 12:49:59 ET]
Table '3777083183 1' 3-max Seat #2 is the button
Seat 1: Mahu2021 (550 in chips) 
Seat 2: Sweede (490 in chips) 
Seat 3: kreatin21 (460 in chips) 
kreatin21: posts small blind 10
Mahu2021: posts big blind 20
*** HOLE CARDS ***
Dealt to Mahu2021 [6s 3s]
Sweede: folds 
kreatin21: calls 10
Mahu2021: checks 
*** FLOP *** [Ks Ac Kc]
kreatin21: checks 
Mahu2021: checks 
*** TURN *** [Ks Ac Kc] [5c]
kreatin21: checks 
Mahu2021: checks 
*** RIVER *** [Ks Ac Kc 5c] [3h]
kreatin21: bets 20
Mahu2021: calls 20
*** SHOW DOWN ***
kreatin21: shows [Kd 8c] (three of a kind, Kings)
Mahu2021: mucks hand 
kreatin21 collected 80 from pot
*** SUMMARY ***
Total pot 80 | Rake 0 
Board [Ks Ac Kc 5c 3h]
Seat 1: Mahu2021 (big blind) mucked [6s 3s]
Seat 2: Sweede (button) folded before Flop (didn't bet)
Seat 3: kreatin21 (small blind) showed [Kd 8c] and won (80) with three of a kind, Kings



PokerStars Hand #251453272172: Tournament #3777083183, $1.84+$0.16 USD Hold'em No Limit - Level I (10/20) - 2024/07/12 18:50:18 CET [2024/07/12 12:50:18 ET]
Table '3777083183 1' 3-max Seat #3 is the button
Seat 1: Mahu2021 (510 in chips) 
Seat 2: Sweede (490 in chips) 
Seat 3: kreatin21 (500 in chips) 
Mahu2021: posts small blind 10
Sweede: posts big blind 20
*** HOLE CARDS ***
Dealt to Mahu2021 [4d 5h]
kreatin21: folds 
Mahu2021: folds 
Uncalled bet (10) returned to Sweede
Sweede collected 20 from pot
*** SUMMARY ***
Total pot 20 | Rake 0 
Seat 1: Mahu2021 (small blind) folded before Flop
Seat 2: Sweede (big blind) collected (20)
Seat 3: kreatin21 (button) folded before Flop (didn't bet)



PokerStars Hand #251453273487: Tournament #3777083183, $1.84+$0.16 USD Hold'em No Limit - Level I (10/20) - 2024/07/12 18:50:24 CET [2024/07/12 12:50:24 ET]
Table '3777083183 1' 3-max Seat #1 is the button
Seat 1: Mahu2021 (500 in chips) 
Seat 2: Sweede (500 in chips) 
Seat 3: kreatin21 (500 in chips) 
Sweede: posts small blind 10
kreatin21: posts big blind 20
*** HOLE CARDS ***
Dealt to Mahu2021 [6s Ah]
Mahu2021: calls 20
Sweede: folds 
kreatin21: checks 
*** FLOP *** [5d Qs Qc]
kreatin21: checks 
Mahu2021: bets 40
kreatin21: folds 
Uncalled bet (40) returned to Mahu2021
Mahu2021 collected 50 from pot
Mahu2021: doesn't show hand 
*** SUMMARY ***
Total pot 50 | Rake 0 
Board [5d Qs Qc]
Seat 1: Mahu2021 (button) collected (50)
Seat 2: Sweede (small blind) folded before Flop
Seat 3: kreatin21 (big blind) folded on the Flop



PokerStars Hand #251453279200: Tournament #3777083183, $1.84+$0.16 USD Hold'em No Limit - Level I (10/20) - 2024/07/12 18:50:48 CET [2024/07/12 12:50:48 ET]
Table '3777083183 1' 3-max Seat #2 is the button
Seat 1: Mahu2021 (530 in chips) 
Seat 2: Sweede (490 in chips) 
Seat 3: kreatin21 (480 in chips) 
kreatin21: posts small blind 10
Mahu2021: posts big blind 20
*** HOLE CARDS ***
Dealt to Mahu2021 [Th 8s]
Sweede: raises 20 to 40
kreatin21: raises 420 to 460
Mahu2021: folds 
Sweede: folds 
Uncalled bet (420) returned to kreatin21
kreatin21 collected 100 from pot
kreatin21: doesn't show hand 
*** SUMMARY ***
Total pot 100 | Rake 0 
Seat 1: Mahu2021 (big blind) folded before Flop
Seat 2: Sweede (button) folded before Flop
Seat 3: kreatin21 (small blind) collected (100)



PokerStars Hand #251453281892: Tournament #3777083183, $1.84+$0.16 USD Hold'em No Limit - Level I (10/20) - 2024/07/12 18:51:00 CET [2024/07/12 12:51:00 ET]
Table '3777083183 1' 3-max Seat #3 is the button
Seat 1: Mahu2021 (510 in chips) 
Seat 2: Sweede (450 in chips) 
Seat 3: kreatin21 (540 in chips) 
Mahu2021: posts small blind 10
Sweede: posts big blind 20
*** HOLE CARDS ***
Dealt to Mahu2021 [Qd Th]
kreatin21: folds 
Mahu2021: raises 20 to 40
Sweede: calls 20
*** FLOP *** [7h Jh 3d]
Mahu2021: checks 
Sweede: bets 80
Mahu2021: folds 
Uncalled bet (80) returned to Sweede
Sweede collected 80 from pot
*** SUMMARY ***
Total pot 80 | Rake 0 
Board [7h Jh 3d]
Seat 1: Mahu2021 (small blind) folded on the Flop
Seat 2: Sweede (big blind) collected (80)
Seat 3: kreatin21 (button) folded before Flop (didn't bet)



PokerStars Hand #251453285223: Tournament #3777083183, $1.84+$0.16 USD Hold'em No Limit - Level I (10/20) - 2024/07/12 18:51:14 CET [2024/07/12 12:51:14 ET]
Table '3777083183 1' 3-max Seat #1 is the button
Seat 1: Mahu2021 (470 in chips) 
Seat 2: Sweede (490 in chips) 
Seat 3: kreatin21 (540 in chips) 
Sweede: posts small blind 10
kreatin21: posts big blind 20
*** HOLE CARDS ***
Dealt to Mahu2021 [3d 3c]
Mahu2021: calls 20
Sweede: raises 60 to 80
kreatin21: folds 
Mahu2021: calls 60
*** FLOP *** [Ah 8c Ad]
Sweede: checks 
Mahu2021: bets 390 and is all-in
Sweede: calls 390
*** TURN *** [Ah 8c Ad] [Qh]
*** RIVER *** [Ah 8c Ad Qh] [6h]
*** SHOW DOWN ***
Sweede: shows [Qc Jc] (two pair, Aces and Queens)
Mahu2021: shows [3d 3c] (two pair, Aces and Threes)
Sweede collected 960 from pot
Mahu2021 finished the tournament in 3rd place
*** SUMMARY ***
Total pot 960 | Rake 0 
Board [Ah 8c Ad Qh 6h]
Seat 1: Mahu2021 (button) showed [3d 3c] and lost with two pair, Aces and Threes
Seat 2: Sweede (small blind) showed [Qc Jc] and won (960) with two pair, Aces and Queens
Seat 3: kreatin21 (big blind) folded before Flop



