PokerStars Hand #248385365706: Tournament #3703725120, $1.84+$0.16 USD Hold'em No Limit - Level I (10/20) - 2024/01/20 10:39:54 CET [2024/01/20 4:39:54 ET]
Table '3703725120 1' 3-max Seat #1 is the button
Seat 1: missbrown51 (500 in chips) 
Seat 2: kking1313 (500 in chips) 
Seat 3: Mahu2021 (500 in chips) 
kking1313: posts small blind 10
Mahu2021: posts big blind 20
*** HOLE CARDS ***
Dealt to Mahu2021 [2s 3c]
missbrown51: calls 20
kking1313: raises 80 to 100
Mahu2021: folds 
missbrown51: calls 80
*** FLOP *** [7s Kc 2h]
kking1313: bets 400 and is all-in
missbrown51: folds 
Uncalled bet (400) returned to kking1313
kking1313 collected 220 from pot
kking1313: doesn't show hand 
*** SUMMARY ***
Total pot 220 | Rake 0 
Board [7s Kc 2h]
Seat 1: missbrown51 (button) folded on the Flop
Seat 2: kking1313 (small blind) collected (220)
Seat 3: Mahu2021 (big blind) folded before Flop



PokerStars Hand #248385367975: Tournament #3703725120, $1.84+$0.16 USD Hold'em No Limit - Level I (10/20) - 2024/01/20 10:40:09 CET [2024/01/20 4:40:09 ET]
Table '3703725120 1' 3-max Seat #2 is the button
Seat 1: missbrown51 (400 in chips) 
Seat 2: kking1313 (620 in chips) 
Seat 3: Mahu2021 (480 in chips) 
Mahu2021: posts small blind 10
missbrown51: posts big blind 20
*** HOLE CARDS ***
Dealt to Mahu2021 [2c 4s]
kking1313: calls 20
Mahu2021: folds 
missbrown51: checks 
*** FLOP *** [Jh 3h 3d]
missbrown51: bets 20
kking1313: calls 20
*** TURN *** [Jh 3h 3d] [Ac]
missbrown51: bets 60
kking1313: folds 
Uncalled bet (60) returned to missbrown51
missbrown51 collected 90 from pot
missbrown51: doesn't show hand 
*** SUMMARY ***
Total pot 90 | Rake 0 
Board [Jh 3h 3d Ac]
Seat 1: missbrown51 (big blind) collected (90)
Seat 2: kking1313 (button) folded on the Turn
Seat 3: Mahu2021 (small blind) folded before Flop



PokerStars Hand #248385370988: Tournament #3703725120, $1.84+$0.16 USD Hold'em No Limit - Level I (10/20) - 2024/01/20 10:40:30 CET [2024/01/20 4:40:30 ET]
Table '3703725120 1' 3-max Seat #3 is the button
Seat 1: missbrown51 (450 in chips) 
Seat 2: kking1313 (580 in chips) 
Seat 3: Mahu2021 (470 in chips) 
missbrown51: posts small blind 10
kking1313: posts big blind 20
*** HOLE CARDS ***
Dealt to Mahu2021 [9h 6d]
Mahu2021: folds 
missbrown51: calls 10
kking1313: raises 80 to 100
missbrown51: folds 
Uncalled bet (80) returned to kking1313
kking1313 collected 40 from pot
kking1313: doesn't show hand 
*** SUMMARY ***
Total pot 40 | Rake 0 
Seat 1: missbrown51 (small blind) folded before Flop
Seat 2: kking1313 (big blind) collected (40)
Seat 3: Mahu2021 (button) folded before Flop (didn't bet)



PokerStars Hand #248385372422: Tournament #3703725120, $1.84+$0.16 USD Hold'em No Limit - Level I (10/20) - 2024/01/20 10:40:40 CET [2024/01/20 4:40:40 ET]
Table '3703725120 1' 3-max Seat #1 is the button
Seat 1: missbrown51 (430 in chips) 
Seat 2: kking1313 (600 in chips) 
Seat 3: Mahu2021 (470 in chips) 
kking1313: posts small blind 10
Mahu2021: posts big blind 20
*** HOLE CARDS ***
Dealt to Mahu2021 [Qh 8d]
missbrown51: raises 180 to 200
kking1313: folds 
Mahu2021: folds 
Uncalled bet (180) returned to missbrown51
missbrown51 collected 50 from pot
missbrown51: doesn't show hand 
*** SUMMARY ***
Total pot 50 | Rake 0 
Seat 1: missbrown51 (button) collected (50)
Seat 2: kking1313 (small blind) folded before Flop
Seat 3: Mahu2021 (big blind) folded before Flop



PokerStars Hand #248385373842: Tournament #3703725120, $1.84+$0.16 USD Hold'em No Limit - Level I (10/20) - 2024/01/20 10:40:50 CET [2024/01/20 4:40:50 ET]
Table '3703725120 1' 3-max Seat #2 is the button
Seat 1: missbrown51 (460 in chips) 
Seat 2: kking1313 (590 in chips) 
Seat 3: Mahu2021 (450 in chips) 
Mahu2021: posts small blind 10
missbrown51: posts big blind 20
*** HOLE CARDS ***
Dealt to Mahu2021 [8d 2c]
kking1313: calls 20
Mahu2021: folds 
missbrown51: checks 
*** FLOP *** [Jh 7d 6h]
missbrown51: bets 20
kking1313: folds 
Uncalled bet (20) returned to missbrown51
missbrown51 collected 50 from pot
missbrown51: doesn't show hand 
*** SUMMARY ***
Total pot 50 | Rake 0 
Board [Jh 7d 6h]
Seat 1: missbrown51 (big blind) collected (50)
Seat 2: kking1313 (button) folded on the Flop
Seat 3: Mahu2021 (small blind) folded before Flop



PokerStars Hand #248385375727: Tournament #3703725120, $1.84+$0.16 USD Hold'em No Limit - Level I (10/20) - 2024/01/20 10:41:03 CET [2024/01/20 4:41:03 ET]
Table '3703725120 1' 3-max Seat #3 is the button
Seat 1: missbrown51 (490 in chips) 
Seat 2: kking1313 (570 in chips) 
Seat 3: Mahu2021 (440 in chips) 
missbrown51: posts small blind 10
kking1313: posts big blind 20
*** HOLE CARDS ***
Dealt to Mahu2021 [8c Qc]
Mahu2021: raises 20 to 40
missbrown51: folds 
kking1313: calls 20
*** FLOP *** [9s 2s 5h]
kking1313: bets 90
Mahu2021: folds 
Uncalled bet (90) returned to kking1313
kking1313 collected 90 from pot
kking1313: doesn't show hand 
*** SUMMARY ***
Total pot 90 | Rake 0 
Board [9s 2s 5h]
Seat 1: missbrown51 (small blind) folded before Flop
Seat 2: kking1313 (big blind) collected (90)
Seat 3: Mahu2021 (button) folded on the Flop



PokerStars Hand #248385377724: Tournament #3703725120, $1.84+$0.16 USD Hold'em No Limit - Level I (10/20) - 2024/01/20 10:41:17 CET [2024/01/20 4:41:17 ET]
Table '3703725120 1' 3-max Seat #1 is the button
Seat 1: missbrown51 (480 in chips) 
Seat 2: kking1313 (620 in chips) 
Seat 3: Mahu2021 (400 in chips) 
kking1313: posts small blind 10
Mahu2021: posts big blind 20
*** HOLE CARDS ***
Dealt to Mahu2021 [9c Ad]
missbrown51: calls 20
kking1313: raises 600 to 620 and is all-in
Mahu2021: folds 
missbrown51: folds 
Uncalled bet (600) returned to kking1313
kking1313 collected 60 from pot
kking1313: doesn't show hand 
*** SUMMARY ***
Total pot 60 | Rake 0 
Seat 1: missbrown51 (button) folded before Flop
Seat 2: kking1313 (small blind) collected (60)
Seat 3: Mahu2021 (big blind) folded before Flop



PokerStars Hand #248385379561: Tournament #3703725120, $1.84+$0.16 USD Hold'em No Limit - Level I (10/20) - 2024/01/20 10:41:31 CET [2024/01/20 4:41:31 ET]
Table '3703725120 1' 3-max Seat #2 is the button
Seat 1: missbrown51 (460 in chips) 
Seat 2: kking1313 (660 in chips) 
Seat 3: Mahu2021 (380 in chips) 
Mahu2021: posts small blind 10
missbrown51: posts big blind 20
*** HOLE CARDS ***
Dealt to Mahu2021 [Jd 9s]
kking1313: calls 20
Mahu2021: calls 10
missbrown51: checks 
*** FLOP *** [Jc Ts Ac]
Mahu2021: checks 
missbrown51: checks 
kking1313: checks 
*** TURN *** [Jc Ts Ac] [4s]
Mahu2021: checks 
missbrown51: checks 
kking1313: checks 
*** RIVER *** [Jc Ts Ac 4s] [8c]
Mahu2021: bets 60
missbrown51: folds 
kking1313: folds 
Uncalled bet (60) returned to Mahu2021
Mahu2021 collected 60 from pot
Mahu2021: doesn't show hand 
*** SUMMARY ***
Total pot 60 | Rake 0 
Board [Jc Ts Ac 4s 8c]
Seat 1: missbrown51 (big blind) folded on the River
Seat 2: kking1313 (button) folded on the River
Seat 3: Mahu2021 (small blind) collected (60)



PokerStars Hand #248385382447: Tournament #3703725120, $1.84+$0.16 USD Hold'em No Limit - Level I (10/20) - 2024/01/20 10:41:51 CET [2024/01/20 4:41:51 ET]
Table '3703725120 1' 3-max Seat #3 is the button
Seat 1: missbrown51 (440 in chips) 
Seat 2: kking1313 (640 in chips) 
Seat 3: Mahu2021 (420 in chips) 
missbrown51: posts small blind 10
kking1313: posts big blind 20
*** HOLE CARDS ***
Dealt to Mahu2021 [3d 3h]
Mahu2021: raises 400 to 420 and is all-in
missbrown51: folds 
kking1313: folds 
Uncalled bet (400) returned to Mahu2021
Mahu2021 collected 50 from pot
Mahu2021: doesn't show hand 
*** SUMMARY ***
Total pot 50 | Rake 0 
Seat 1: missbrown51 (small blind) folded before Flop
Seat 2: kking1313 (big blind) folded before Flop
Seat 3: Mahu2021 (button) collected (50)



PokerStars Hand #248385384650: Tournament #3703725120, $1.84+$0.16 USD Hold'em No Limit - Level II (15/30) - 2024/01/20 10:42:06 CET [2024/01/20 4:42:06 ET]
Table '3703725120 1' 3-max Seat #1 is the button
Seat 1: missbrown51 (430 in chips) 
Seat 2: kking1313 (620 in chips) 
Seat 3: Mahu2021 (450 in chips) 
kking1313: posts small blind 15
Mahu2021: posts big blind 30
*** HOLE CARDS ***
Dealt to Mahu2021 [4s 4h]
missbrown51: folds 
kking1313: raises 590 to 620 and is all-in
Mahu2021: calls 420 and is all-in
Uncalled bet (170) returned to kking1313
*** FLOP *** [Ad 6s As]
*** TURN *** [Ad 6s As] [Qh]
*** RIVER *** [Ad 6s As Qh] [Jc]
*** SHOW DOWN ***
kking1313: shows [3h Ac] (three of a kind, Aces)
Mahu2021: shows [4s 4h] (two pair, Aces and Fours)
kking1313 collected 900 from pot
Mahu2021 finished the tournament in 3rd place
*** SUMMARY ***
Total pot 900 | Rake 0 
Board [Ad 6s As Qh Jc]
Seat 1: missbrown51 (button) folded before Flop (didn't bet)
Seat 2: kking1313 (small blind) showed [3h Ac] and won (900) with three of a kind, Aces
Seat 3: Mahu2021 (big blind) showed [4s 4h] and lost with two pair, Aces and Fours



