PokerStars Hand #248839355769: Tournament #3714778308, $1.84+$0.16 USD Hold'em No Limit - Level I (10/20) - 2024/02/12 16:57:57 CET [2024/02/12 10:57:57 ET]
Table '3714778308 1' 3-max Seat #1 is the button
Seat 1: Mahu2021 (500 in chips) 
Seat 2: jayc1548 (500 in chips) 
Seat 3: njavens45 (500 in chips) 
jayc1548: posts small blind 10
njavens45: posts big blind 20
*** HOLE CARDS ***
Dealt to Mahu2021 [Jh Qc]
Mahu2021: raises 20 to 40
jayc1548: folds 
njavens45: calls 20
*** FLOP *** [2h 6h Qh]
njavens45: checks 
Mahu2021: bets 40
njavens45: folds 
Uncalled bet (40) returned to Mahu2021
Mahu2021 collected 90 from pot
Mahu2021: doesn't show hand 
*** SUMMARY ***
Total pot 90 | Rake 0 
Board [2h 6h Qh]
Seat 1: Mahu2021 (button) collected (90)
Seat 2: jayc1548 (small blind) folded before Flop
Seat 3: njavens45 (big blind) folded on the Flop



PokerStars Hand #248839358657: Tournament #3714778308, $1.84+$0.16 USD Hold'em No Limit - Level I (10/20) - 2024/02/12 16:58:12 CET [2024/02/12 10:58:12 ET]
Table '3714778308 1' 3-max Seat #2 is the button
Seat 1: Mahu2021 (550 in chips) 
Seat 2: jayc1548 (490 in chips) 
Seat 3: njavens45 (460 in chips) 
njavens45: posts small blind 10
Mahu2021: posts big blind 20
*** HOLE CARDS ***
Dealt to Mahu2021 [9d 3h]
jayc1548: raises 50 to 70
njavens45: calls 60
Mahu2021: folds 
*** FLOP *** [6h Js 8d]
njavens45: checks 
jayc1548: checks 
*** TURN *** [6h Js 8d] [9h]
njavens45: checks 
jayc1548: bets 160
njavens45: calls 160
*** RIVER *** [6h Js 8d 9h] [7s]
njavens45: checks 
jayc1548: checks 
*** SHOW DOWN ***
njavens45: shows [Ad Td] (a straight, Seven to Jack)
jayc1548: mucks hand 
njavens45 collected 480 from pot
*** SUMMARY ***
Total pot 480 | Rake 0 
Board [6h Js 8d 9h 7s]
Seat 1: Mahu2021 (big blind) folded before Flop
Seat 2: jayc1548 (button) mucked [Jh Jd]
Seat 3: njavens45 (small blind) showed [Ad Td] and won (480) with a straight, Seven to Jack



PokerStars Hand #248839362949: Tournament #3714778308, $1.84+$0.16 USD Hold'em No Limit - Level I (10/20) - 2024/02/12 16:58:34 CET [2024/02/12 10:58:34 ET]
Table '3714778308 1' 3-max Seat #3 is the button
Seat 1: Mahu2021 (530 in chips) 
Seat 2: jayc1548 (260 in chips) 
Seat 3: njavens45 (710 in chips) 
Mahu2021: posts small blind 10
jayc1548: posts big blind 20
*** HOLE CARDS ***
Dealt to Mahu2021 [Kd 3s]
njavens45: calls 20
Mahu2021: calls 10
jayc1548: raises 240 to 260 and is all-in
njavens45: calls 240
Mahu2021: folds 
*** FLOP *** [Ks 5s As]
*** TURN *** [Ks 5s As] [4h]
*** RIVER *** [Ks 5s As 4h] [Qh]
*** SHOW DOWN ***
jayc1548: shows [Ac Th] (a pair of Aces)
njavens45: shows [9c 9h] (a pair of Nines)
jayc1548 collected 540 from pot
*** SUMMARY ***
Total pot 540 | Rake 0 
Board [Ks 5s As 4h Qh]
Seat 1: Mahu2021 (small blind) folded before Flop
Seat 2: jayc1548 (big blind) showed [Ac Th] and won (540) with a pair of Aces
Seat 3: njavens45 (button) showed [9c 9h] and lost with a pair of Nines



PokerStars Hand #248839366630: Tournament #3714778308, $1.84+$0.16 USD Hold'em No Limit - Level I (10/20) - 2024/02/12 16:58:53 CET [2024/02/12 10:58:53 ET]
Table '3714778308 1' 3-max Seat #1 is the button
Seat 1: Mahu2021 (510 in chips) 
Seat 2: jayc1548 (540 in chips) 
Seat 3: njavens45 (450 in chips) 
jayc1548: posts small blind 10
njavens45: posts big blind 20
*** HOLE CARDS ***
Dealt to Mahu2021 [Qs Kc]
Mahu2021: raises 20 to 40
jayc1548: folds 
njavens45: calls 20
*** FLOP *** [Js 6h 8s]
njavens45: checks 
Mahu2021: checks 
*** TURN *** [Js 6h 8s] [Kd]
njavens45: bets 20
Mahu2021: calls 20
*** RIVER *** [Js 6h 8s Kd] [Ks]
njavens45: bets 130
Mahu2021: raises 320 to 450 and is all-in
njavens45: calls 260 and is all-in
Uncalled bet (60) returned to Mahu2021
*** SHOW DOWN ***
Mahu2021: shows [Qs Kc] (three of a kind, Kings)
njavens45: shows [Kh 6c] (a full house, Kings full of Sixes)
njavens45 collected 910 from pot
*** SUMMARY ***
Total pot 910 | Rake 0 
Board [Js 6h 8s Kd Ks]
Seat 1: Mahu2021 (button) showed [Qs Kc] and lost with three of a kind, Kings
Seat 2: jayc1548 (small blind) folded before Flop
Seat 3: njavens45 (big blind) showed [Kh 6c] and won (910) with a full house, Kings full of Sixes



PokerStars Hand #248839370460: Tournament #3714778308, $1.84+$0.16 USD Hold'em No Limit - Level I (10/20) - 2024/02/12 16:59:12 CET [2024/02/12 10:59:12 ET]
Table '3714778308 1' 3-max Seat #2 is the button
Seat 1: Mahu2021 (60 in chips) 
Seat 2: jayc1548 (530 in chips) 
Seat 3: njavens45 (910 in chips) 
njavens45: posts small blind 10
Mahu2021: posts big blind 20
*** HOLE CARDS ***
Dealt to Mahu2021 [5c 9h]
jayc1548: folds 
njavens45: calls 10
Mahu2021: checks 
*** FLOP *** [6h 4h 6s]
njavens45: checks 
Mahu2021: checks 
*** TURN *** [6h 4h 6s] [Td]
njavens45: bets 20
Mahu2021: folds 
Uncalled bet (20) returned to njavens45
njavens45 collected 40 from pot
*** SUMMARY ***
Total pot 40 | Rake 0 
Board [6h 4h 6s Td]
Seat 1: Mahu2021 (big blind) folded on the Turn
Seat 2: jayc1548 (button) folded before Flop (didn't bet)
Seat 3: njavens45 (small blind) collected (40)



PokerStars Hand #248839373439: Tournament #3714778308, $1.84+$0.16 USD Hold'em No Limit - Level I (10/20) - 2024/02/12 16:59:27 CET [2024/02/12 10:59:27 ET]
Table '3714778308 1' 3-max Seat #3 is the button
Seat 1: Mahu2021 (40 in chips) 
Seat 2: jayc1548 (530 in chips) 
Seat 3: njavens45 (930 in chips) 
Mahu2021: posts small blind 10
jayc1548: posts big blind 20
*** HOLE CARDS ***
Dealt to Mahu2021 [Ks Jc]
njavens45: calls 20
Mahu2021: raises 20 to 40 and is all-in
jayc1548: folds 
njavens45: calls 20
*** FLOP *** [3h 9c Jh]
*** TURN *** [3h 9c Jh] [7d]
*** RIVER *** [3h 9c Jh 7d] [4c]
*** SHOW DOWN ***
Mahu2021: shows [Ks Jc] (a pair of Jacks)
njavens45: shows [Ah 7h] (a pair of Sevens)
Mahu2021 collected 100 from pot
*** SUMMARY ***
Total pot 100 | Rake 0 
Board [3h 9c Jh 7d 4c]
Seat 1: Mahu2021 (small blind) showed [Ks Jc] and won (100) with a pair of Jacks
Seat 2: jayc1548 (big blind) folded before Flop
Seat 3: njavens45 (button) showed [Ah 7h] and lost with a pair of Sevens



PokerStars Hand #248839376303: Tournament #3714778308, $1.84+$0.16 USD Hold'em No Limit - Level I (10/20) - 2024/02/12 16:59:42 CET [2024/02/12 10:59:42 ET]
Table '3714778308 1' 3-max Seat #1 is the button
Seat 1: Mahu2021 (100 in chips) 
Seat 2: jayc1548 (510 in chips) 
Seat 3: njavens45 (890 in chips) 
jayc1548: posts small blind 10
njavens45: posts big blind 20
*** HOLE CARDS ***
Dealt to Mahu2021 [Ah Kh]
Mahu2021: raises 80 to 100 and is all-in
jayc1548: raises 410 to 510 and is all-in
njavens45: folds 
Uncalled bet (410) returned to jayc1548
*** FLOP *** [4d 4h Qc]
*** TURN *** [4d 4h Qc] [4c]
*** RIVER *** [4d 4h Qc 4c] [5h]
*** SHOW DOWN ***
jayc1548: shows [Qh As] (a full house, Fours full of Queens)
Mahu2021: shows [Ah Kh] (three of a kind, Fours)
jayc1548 collected 220 from pot
Mahu2021 finished the tournament in 3rd place
*** SUMMARY ***
Total pot 220 | Rake 0 
Board [4d 4h Qc 4c 5h]
Seat 1: Mahu2021 (button) showed [Ah Kh] and lost with three of a kind, Fours
Seat 2: jayc1548 (small blind) showed [Qh As] and won (220) with a full house, Fours full of Queens
Seat 3: njavens45 (big blind) folded before Flop



