PokerStars Hand #244604700994: Tournament #3612132590, $0.92+$0.08 USD Hold'em No Limit - Level I (10/20) - 2023/07/03 18:43:36 CET [2023/07/03 12:43:36 ET]
Table '3612132590 1' 3-max Seat #1 is the button
Seat 1: Mahu2021 (500 in chips) 
Seat 2: alexgorceag (500 in chips) 
Seat 3: ginolas69 (500 in chips) 
alexgorceag: posts small blind 10
ginolas69: posts big blind 20
*** HOLE CARDS ***
Dealt to Mahu2021 [5s Ts]
Mahu2021: folds 
alexgorceag: calls 10
ginolas69: checks 
*** FLOP *** [Td 6c Kd]
alexgorceag: checks 
ginolas69: checks 
*** TURN *** [Td 6c Kd] [6s]
alexgorceag: checks 
ginolas69: bets 20
alexgorceag: calls 20
*** RIVER *** [Td 6c Kd 6s] [4d]
alexgorceag: bets 100
ginolas69: folds 
Uncalled bet (100) returned to alexgorceag
alexgorceag collected 80 from pot
*** SUMMARY ***
Total pot 80 | Rake 0 
Board [Td 6c Kd 6s 4d]
Seat 1: Mahu2021 (button) folded before Flop (didn't bet)
Seat 2: alexgorceag (small blind) collected (80)
Seat 3: ginolas69 (big blind) folded on the River



PokerStars Hand #244604708331: Tournament #3612132590, $0.92+$0.08 USD Hold'em No Limit - Level I (10/20) - 2023/07/03 18:44:00 CET [2023/07/03 12:44:00 ET]
Table '3612132590 1' 3-max Seat #2 is the button
Seat 1: Mahu2021 (500 in chips) 
Seat 2: alexgorceag (540 in chips) 
Seat 3: ginolas69 (460 in chips) 
ginolas69: posts small blind 10
Mahu2021: posts big blind 20
*** HOLE CARDS ***
Dealt to Mahu2021 [2c 5d]
alexgorceag: calls 20
ginolas69: folds 
Mahu2021: checks 
*** FLOP *** [5s Ah 6c]
Mahu2021: checks 
alexgorceag: bets 60
Mahu2021: folds 
Uncalled bet (60) returned to alexgorceag
alexgorceag collected 50 from pot
*** SUMMARY ***
Total pot 50 | Rake 0 
Board [5s Ah 6c]
Seat 1: Mahu2021 (big blind) folded on the Flop
Seat 2: alexgorceag (button) collected (50)
Seat 3: ginolas69 (small blind) folded before Flop



PokerStars Hand #244604712248: Tournament #3612132590, $0.92+$0.08 USD Hold'em No Limit - Level I (10/20) - 2023/07/03 18:44:13 CET [2023/07/03 12:44:13 ET]
Table '3612132590 1' 3-max Seat #3 is the button
Seat 1: Mahu2021 (480 in chips) 
Seat 2: alexgorceag (570 in chips) 
Seat 3: ginolas69 (450 in chips) 
Mahu2021: posts small blind 10
alexgorceag: posts big blind 20
*** HOLE CARDS ***
Dealt to Mahu2021 [2d 5c]
ginolas69: folds 
Mahu2021: calls 10
alexgorceag: checks 
*** FLOP *** [7s 5s 9h]
Mahu2021: bets 20
alexgorceag: calls 20
*** TURN *** [7s 5s 9h] [3s]
Mahu2021: checks 
alexgorceag: checks 
*** RIVER *** [7s 5s 9h 3s] [Jh]
Mahu2021: checks 
alexgorceag: checks 
*** SHOW DOWN ***
Mahu2021: shows [2d 5c] (a pair of Fives)
alexgorceag: shows [Tc 7d] (a pair of Sevens)
alexgorceag collected 80 from pot
*** SUMMARY ***
Total pot 80 | Rake 0 
Board [7s 5s 9h 3s Jh]
Seat 1: Mahu2021 (small blind) showed [2d 5c] and lost with a pair of Fives
Seat 2: alexgorceag (big blind) showed [Tc 7d] and won (80) with a pair of Sevens
Seat 3: ginolas69 (button) folded before Flop (didn't bet)



PokerStars Hand #244604717268: Tournament #3612132590, $0.92+$0.08 USD Hold'em No Limit - Level I (10/20) - 2023/07/03 18:44:30 CET [2023/07/03 12:44:30 ET]
Table '3612132590 1' 3-max Seat #1 is the button
Seat 1: Mahu2021 (440 in chips) 
Seat 2: alexgorceag (610 in chips) 
Seat 3: ginolas69 (450 in chips) 
alexgorceag: posts small blind 10
ginolas69: posts big blind 20
*** HOLE CARDS ***
Dealt to Mahu2021 [Js 3h]
Mahu2021: folds 
alexgorceag: calls 10
ginolas69: checks 
*** FLOP *** [5d Kh 7d]
alexgorceag: checks 
ginolas69: checks 
*** TURN *** [5d Kh 7d] [5h]
alexgorceag: bets 40
ginolas69: folds 
Uncalled bet (40) returned to alexgorceag
alexgorceag collected 40 from pot
*** SUMMARY ***
Total pot 40 | Rake 0 
Board [5d Kh 7d 5h]
Seat 1: Mahu2021 (button) folded before Flop (didn't bet)
Seat 2: alexgorceag (small blind) collected (40)
Seat 3: ginolas69 (big blind) folded on the Turn



PokerStars Hand #244604725426: Tournament #3612132590, $0.92+$0.08 USD Hold'em No Limit - Level I (10/20) - 2023/07/03 18:44:58 CET [2023/07/03 12:44:58 ET]
Table '3612132590 1' 3-max Seat #2 is the button
Seat 1: Mahu2021 (440 in chips) 
Seat 2: alexgorceag (630 in chips) 
Seat 3: ginolas69 (430 in chips) 
ginolas69: posts small blind 10
Mahu2021: posts big blind 20
*** HOLE CARDS ***
Dealt to Mahu2021 [Qc 9s]
alexgorceag: calls 20
ginolas69: calls 10
Mahu2021: checks 
*** FLOP *** [4s 7h Ad]
ginolas69: checks 
Mahu2021: checks 
alexgorceag: checks 
*** TURN *** [4s 7h Ad] [Kd]
ginolas69: checks 
Mahu2021: checks 
alexgorceag: checks 
*** RIVER *** [4s 7h Ad Kd] [8c]
ginolas69: checks 
Mahu2021: checks 
alexgorceag: checks 
*** SHOW DOWN ***
ginolas69: shows [3d Qh] (high card Ace)
Mahu2021: shows [Qc 9s] (high card Ace - King+Queen+Nine kicker)
alexgorceag: mucks hand 
Mahu2021 collected 60 from pot
*** SUMMARY ***
Total pot 60 | Rake 0 
Board [4s 7h Ad Kd 8c]
Seat 1: Mahu2021 (big blind) showed [Qc 9s] and won (60) with high card Ace
Seat 2: alexgorceag (button) mucked [Ts 6s]
Seat 3: ginolas69 (small blind) showed [3d Qh] and lost with high card Ace



PokerStars Hand #244604733490: Tournament #3612132590, $0.92+$0.08 USD Hold'em No Limit - Level I (10/20) - 2023/07/03 18:45:25 CET [2023/07/03 12:45:25 ET]
Table '3612132590 1' 3-max Seat #3 is the button
Seat 1: Mahu2021 (480 in chips) 
Seat 2: alexgorceag (610 in chips) 
Seat 3: ginolas69 (410 in chips) 
Mahu2021: posts small blind 10
alexgorceag: posts big blind 20
*** HOLE CARDS ***
Dealt to Mahu2021 [6d Kh]
ginolas69: folds 
Mahu2021: calls 10
alexgorceag: raises 40 to 60
Mahu2021: folds 
Uncalled bet (40) returned to alexgorceag
alexgorceag collected 40 from pot
*** SUMMARY ***
Total pot 40 | Rake 0 
Seat 1: Mahu2021 (small blind) folded before Flop
Seat 2: alexgorceag (big blind) collected (40)
Seat 3: ginolas69 (button) folded before Flop (didn't bet)



PokerStars Hand #244604736615: Tournament #3612132590, $0.92+$0.08 USD Hold'em No Limit - Level I (10/20) - 2023/07/03 18:45:35 CET [2023/07/03 12:45:35 ET]
Table '3612132590 1' 3-max Seat #1 is the button
Seat 1: Mahu2021 (460 in chips) 
Seat 2: alexgorceag (630 in chips) 
Seat 3: ginolas69 (410 in chips) 
alexgorceag: posts small blind 10
ginolas69: posts big blind 20
*** HOLE CARDS ***
Dealt to Mahu2021 [9s Ks]
Mahu2021: raises 20 to 40
alexgorceag: calls 30
ginolas69: calls 20
*** FLOP *** [6h Qc 2d]
alexgorceag: checks 
ginolas69: checks 
Mahu2021: bets 40
alexgorceag: folds 
ginolas69: raises 40 to 80
Mahu2021: folds 
Uncalled bet (40) returned to ginolas69
ginolas69 collected 200 from pot
*** SUMMARY ***
Total pot 200 | Rake 0 
Board [6h Qc 2d]
Seat 1: Mahu2021 (button) folded on the Flop
Seat 2: alexgorceag (small blind) folded on the Flop
Seat 3: ginolas69 (big blind) collected (200)



PokerStars Hand #244604743315: Tournament #3612132590, $0.92+$0.08 USD Hold'em No Limit - Level II (15/30) - 2023/07/03 18:45:58 CET [2023/07/03 12:45:58 ET]
Table '3612132590 1' 3-max Seat #2 is the button
Seat 1: Mahu2021 (380 in chips) 
Seat 2: alexgorceag (590 in chips) 
Seat 3: ginolas69 (530 in chips) 
ginolas69: posts small blind 15
Mahu2021: posts big blind 30
*** HOLE CARDS ***
Dealt to Mahu2021 [Ad Th]
alexgorceag: calls 30
ginolas69: calls 15
Mahu2021: raises 90 to 120
alexgorceag: calls 90
ginolas69: folds 
*** FLOP *** [Kd 6s 3s]
Mahu2021: bets 260 and is all-in
alexgorceag: calls 260
*** TURN *** [Kd 6s 3s] [9h]
*** RIVER *** [Kd 6s 3s 9h] [6h]
*** SHOW DOWN ***
Mahu2021: shows [Ad Th] (a pair of Sixes)
alexgorceag: shows [Kh Td] (two pair, Kings and Sixes)
alexgorceag collected 790 from pot
Mahu2021 finished the tournament in 3rd place
*** SUMMARY ***
Total pot 790 | Rake 0 
Board [Kd 6s 3s 9h 6h]
Seat 1: Mahu2021 (big blind) showed [Ad Th] and lost with a pair of Sixes
Seat 2: alexgorceag (button) showed [Kh Td] and won (790) with two pair, Kings and Sixes
Seat 3: ginolas69 (small blind) folded before Flop



