PokerStars Hand #254611129067: Tournament #3852957970, $4.60+$0.40 USD Hold'em No Limit - Level I (10/20) - 2025/01/29 20:52:12 CET [2025/01/29 14:52:12 ET]
Table '3852957970 1' 3-max Seat #1 is the button
Seat 1: donk6021 (500 in chips) 
Seat 2: Hugo Broemme (500 in chips) 
Seat 3: Mahu2021 (500 in chips) 
Hugo Broemme: posts small blind 10
Mahu2021: posts big blind 20
*** HOLE CARDS ***
Dealt to Mahu2021 [4c Qd]
donk6021: folds 
Hugo Broemme: raises 30 to 50
Mahu2021: folds 
Uncalled bet (30) returned to Hugo Broemme
Hugo Broemme collected 40 from pot
Hugo Broemme: doesn't show hand 
*** SUMMARY ***
Total pot 40 | Rake 0 
Seat 1: donk6021 (button) folded before Flop (didn't bet)
Seat 2: Hugo Broemme (small blind) collected (40)
Seat 3: Mahu2021 (big blind) folded before Flop



PokerStars Hand #254611132725: Tournament #3852957970, $4.60+$0.40 USD Hold'em No Limit - Level I (10/20) - 2025/01/29 20:52:25 CET [2025/01/29 14:52:25 ET]
Table '3852957970 1' 3-max Seat #2 is the button
Seat 1: donk6021 (500 in chips) 
Seat 2: Hugo Broemme (520 in chips) 
Seat 3: Mahu2021 (480 in chips) 
Mahu2021: posts small blind 10
donk6021: posts big blind 20
*** HOLE CARDS ***
Dealt to Mahu2021 [3h 6s]
Hugo Broemme: folds 
Mahu2021: folds 
Uncalled bet (10) returned to donk6021
donk6021 collected 20 from pot
*** SUMMARY ***
Total pot 20 | Rake 0 
Seat 1: donk6021 (big blind) collected (20)
Seat 2: Hugo Broemme (button) folded before Flop (didn't bet)
Seat 3: Mahu2021 (small blind) folded before Flop



PokerStars Hand #254611134767: Tournament #3852957970, $4.60+$0.40 USD Hold'em No Limit - Level I (10/20) - 2025/01/29 20:52:32 CET [2025/01/29 14:52:32 ET]
Table '3852957970 1' 3-max Seat #3 is the button
Seat 1: donk6021 (510 in chips) 
Seat 2: Hugo Broemme (520 in chips) 
Seat 3: Mahu2021 (470 in chips) 
donk6021: posts small blind 10
Hugo Broemme: posts big blind 20
*** HOLE CARDS ***
Dealt to Mahu2021 [4h Ad]
Mahu2021: raises 20 to 40
donk6021: folds 
Hugo Broemme: calls 20
*** FLOP *** [3c 4d 9c]
Hugo Broemme: checks 
Mahu2021: bets 40
Hugo Broemme: raises 40 to 80
Mahu2021: calls 40
*** TURN *** [3c 4d 9c] [Ks]
Hugo Broemme: checks 
Mahu2021: checks 
*** RIVER *** [3c 4d 9c Ks] [Jd]
Hugo Broemme: bets 20
Mahu2021: calls 20
*** SHOW DOWN ***
Hugo Broemme: shows [9d 7h] (a pair of Nines)
Mahu2021: mucks hand 
Hugo Broemme collected 290 from pot
*** SUMMARY ***
Total pot 290 | Rake 0 
Board [3c 4d 9c Ks Jd]
Seat 1: donk6021 (small blind) folded before Flop
Seat 2: Hugo Broemme (big blind) showed [9d 7h] and won (290) with a pair of Nines
Seat 3: Mahu2021 (button) mucked [4h Ad]



PokerStars Hand #254611142945: Tournament #3852957970, $4.60+$0.40 USD Hold'em No Limit - Level I (10/20) - 2025/01/29 20:53:01 CET [2025/01/29 14:53:01 ET]
Table '3852957970 1' 3-max Seat #1 is the button
Seat 1: donk6021 (500 in chips) 
Seat 2: Hugo Broemme (670 in chips) 
Seat 3: Mahu2021 (330 in chips) 
Hugo Broemme: posts small blind 10
Mahu2021: posts big blind 20
*** HOLE CARDS ***
Dealt to Mahu2021 [4d 9s]
donk6021: folds 
Hugo Broemme: folds 
Uncalled bet (10) returned to Mahu2021
Mahu2021 collected 20 from pot
Mahu2021: doesn't show hand 
*** SUMMARY ***
Total pot 20 | Rake 0 
Seat 1: donk6021 (button) folded before Flop (didn't bet)
Seat 2: Hugo Broemme (small blind) folded before Flop
Seat 3: Mahu2021 (big blind) collected (20)



PokerStars Hand #254611145366: Tournament #3852957970, $4.60+$0.40 USD Hold'em No Limit - Level I (10/20) - 2025/01/29 20:53:09 CET [2025/01/29 14:53:09 ET]
Table '3852957970 1' 3-max Seat #2 is the button
Seat 1: donk6021 (500 in chips) 
Seat 2: Hugo Broemme (660 in chips) 
Seat 3: Mahu2021 (340 in chips) 
Mahu2021: posts small blind 10
donk6021: posts big blind 20
*** HOLE CARDS ***
Dealt to Mahu2021 [2d 6h]
Hugo Broemme: folds 
Mahu2021: folds 
Uncalled bet (10) returned to donk6021
donk6021 collected 20 from pot
*** SUMMARY ***
Total pot 20 | Rake 0 
Seat 1: donk6021 (big blind) collected (20)
Seat 2: Hugo Broemme (button) folded before Flop (didn't bet)
Seat 3: Mahu2021 (small blind) folded before Flop



PokerStars Hand #254611147184: Tournament #3852957970, $4.60+$0.40 USD Hold'em No Limit - Level I (10/20) - 2025/01/29 20:53:15 CET [2025/01/29 14:53:15 ET]
Table '3852957970 1' 3-max Seat #3 is the button
Seat 1: donk6021 (510 in chips) 
Seat 2: Hugo Broemme (660 in chips) 
Seat 3: Mahu2021 (330 in chips) 
donk6021: posts small blind 10
Hugo Broemme: posts big blind 20
*** HOLE CARDS ***
Dealt to Mahu2021 [Kh Qh]
Mahu2021: raises 20 to 40
donk6021: calls 30
Hugo Broemme: calls 20
*** FLOP *** [6s Ks 5h]
donk6021: bets 20
Hugo Broemme: calls 20
Mahu2021: raises 270 to 290 and is all-in
donk6021: calls 270
Hugo Broemme: folds 
*** TURN *** [6s Ks 5h] [9s]
*** RIVER *** [6s Ks 5h 9s] [8c]
*** SHOW DOWN ***
donk6021: shows [5s 4s] (a flush, King high)
Mahu2021: shows [Kh Qh] (a pair of Kings)
donk6021 collected 720 from pot
Mahu2021 finished the tournament in 3rd place
*** SUMMARY ***
Total pot 720 | Rake 0 
Board [6s Ks 5h 9s 8c]
Seat 1: donk6021 (small blind) showed [5s 4s] and won (720) with a flush, King high
Seat 2: Hugo Broemme (big blind) folded on the Flop
Seat 3: Mahu2021 (button) showed [Kh Qh] and lost with a pair of Kings



