PokerStars Hand #243245576832: Tournament #3581061628, $0.92+$0.08 USD Hold'em No Limit - Level I (10/20) - 2023/04/22 13:54:40 CET [2023/04/22 7:54:40 ET]
Table '3581061628 1' 3-max Seat #1 is the button
Seat 1: Gyciakasesu (500 in chips) 
Seat 2: Mahu2021 (500 in chips) 
Seat 3: Bartek_Nowy (500 in chips) 
Mahu2021: posts small blind 10
Bartek_Nowy: posts big blind 20
*** HOLE CARDS ***
Dealt to Mahu2021 [Ad 3c]
Gyciakasesu: folds 
Mahu2021: calls 10
Bartek_Nowy: checks 
*** FLOP *** [3s 5c 2d]
Mahu2021: bets 20
Bartek_Nowy: raises 40 to 60
Mahu2021: calls 40
*** TURN *** [3s 5c 2d] [7h]
Mahu2021: checks 
Bartek_Nowy: bets 60
Mahu2021: calls 60
*** RIVER *** [3s 5c 2d 7h] [8c]
Mahu2021: checks 
Bartek_Nowy: bets 40
Mahu2021: calls 40
*** SHOW DOWN ***
Bartek_Nowy: shows [9c 5d] (a pair of Fives)
Mahu2021: mucks hand 
Bartek_Nowy collected 360 from pot
*** SUMMARY ***
Total pot 360 | Rake 0 
Board [3s 5c 2d 7h 8c]
Seat 1: Gyciakasesu (button) folded before Flop (didn't bet)
Seat 2: Mahu2021 (small blind) mucked [Ad 3c]
Seat 3: Bartek_Nowy (big blind) showed [9c 5d] and won (360) with a pair of Fives



PokerStars Hand #243245582857: Tournament #3581061628, $0.92+$0.08 USD Hold'em No Limit - Level I (10/20) - 2023/04/22 13:55:13 CET [2023/04/22 7:55:13 ET]
Table '3581061628 1' 3-max Seat #2 is the button
Seat 1: Gyciakasesu (500 in chips) 
Seat 2: Mahu2021 (320 in chips) 
Seat 3: Bartek_Nowy (680 in chips) 
Bartek_Nowy: posts small blind 10
Gyciakasesu: posts big blind 20
*** HOLE CARDS ***
Dealt to Mahu2021 [9c 3s]
Mahu2021: folds 
Bartek_Nowy: calls 10
Gyciakasesu: checks 
*** FLOP *** [9s 4h 6h]
Bartek_Nowy: bets 40
Gyciakasesu: folds 
Uncalled bet (40) returned to Bartek_Nowy
Bartek_Nowy collected 40 from pot
*** SUMMARY ***
Total pot 40 | Rake 0 
Board [9s 4h 6h]
Seat 1: Gyciakasesu (big blind) folded on the Flop
Seat 2: Mahu2021 (button) folded before Flop (didn't bet)
Seat 3: Bartek_Nowy (small blind) collected (40)



PokerStars Hand #243245585904: Tournament #3581061628, $0.92+$0.08 USD Hold'em No Limit - Level I (10/20) - 2023/04/22 13:55:32 CET [2023/04/22 7:55:32 ET]
Table '3581061628 1' 3-max Seat #3 is the button
Seat 1: Gyciakasesu (480 in chips) 
Seat 2: Mahu2021 (320 in chips) 
Seat 3: Bartek_Nowy (700 in chips) 
Gyciakasesu: posts small blind 10
Mahu2021: posts big blind 20
*** HOLE CARDS ***
Dealt to Mahu2021 [Ad 5c]
Bartek_Nowy: raises 20 to 40
Gyciakasesu: folds 
Mahu2021: calls 20
*** FLOP *** [2s Ac Ah]
Mahu2021: checks 
Bartek_Nowy: checks 
*** TURN *** [2s Ac Ah] [7s]
Mahu2021: checks 
Bartek_Nowy: bets 45
Mahu2021: raises 45 to 90
Bartek_Nowy: calls 45
*** RIVER *** [2s Ac Ah 7s] [4d]
Mahu2021: bets 190 and is all-in
Bartek_Nowy: calls 190
*** SHOW DOWN ***
Mahu2021: shows [Ad 5c] (three of a kind, Aces)
Bartek_Nowy: shows [8h 7h] (two pair, Aces and Sevens)
Mahu2021 collected 650 from pot
*** SUMMARY ***
Total pot 650 | Rake 0 
Board [2s Ac Ah 7s 4d]
Seat 1: Gyciakasesu (small blind) folded before Flop
Seat 2: Mahu2021 (big blind) showed [Ad 5c] and won (650) with three of a kind, Aces
Seat 3: Bartek_Nowy (button) showed [8h 7h] and lost with two pair, Aces and Sevens



PokerStars Hand #243245589407: Tournament #3581061628, $0.92+$0.08 USD Hold'em No Limit - Level I (10/20) - 2023/04/22 13:55:54 CET [2023/04/22 7:55:54 ET]
Table '3581061628 1' 3-max Seat #1 is the button
Seat 1: Gyciakasesu (470 in chips) 
Seat 2: Mahu2021 (650 in chips) 
Seat 3: Bartek_Nowy (380 in chips) 
Mahu2021: posts small blind 10
Bartek_Nowy: posts big blind 20
*** HOLE CARDS ***
Dealt to Mahu2021 [Qh 8s]
Gyciakasesu: folds 
Mahu2021: calls 10
Bartek_Nowy: raises 20 to 40
Mahu2021: calls 20
*** FLOP *** [Qs 3d Kc]
Mahu2021: checks 
Bartek_Nowy: bets 80
Mahu2021: calls 80
*** TURN *** [Qs 3d Kc] [2d]
Mahu2021: checks 
Bartek_Nowy: bets 240
Mahu2021: raises 260 to 500
Bartek_Nowy: calls 20 and is all-in
Uncalled bet (240) returned to Mahu2021
*** RIVER *** [Qs 3d Kc 2d] [Ac]
*** SHOW DOWN ***
Mahu2021: shows [Qh 8s] (a pair of Queens)
Bartek_Nowy: shows [4s Kh] (a pair of Kings)
Bartek_Nowy collected 760 from pot
*** SUMMARY ***
Total pot 760 | Rake 0 
Board [Qs 3d Kc 2d Ac]
Seat 1: Gyciakasesu (button) folded before Flop (didn't bet)
Seat 2: Mahu2021 (small blind) showed [Qh 8s] and lost with a pair of Queens
Seat 3: Bartek_Nowy (big blind) showed [4s Kh] and won (760) with a pair of Kings



PokerStars Hand #243245593558: Tournament #3581061628, $0.92+$0.08 USD Hold'em No Limit - Level I (10/20) - 2023/04/22 13:56:20 CET [2023/04/22 7:56:20 ET]
Table '3581061628 1' 3-max Seat #2 is the button
Seat 1: Gyciakasesu (470 in chips) 
Seat 2: Mahu2021 (270 in chips) 
Seat 3: Bartek_Nowy (760 in chips) 
Bartek_Nowy: posts small blind 10
Gyciakasesu: posts big blind 20
*** HOLE CARDS ***
Dealt to Mahu2021 [2d 5s]
Mahu2021: folds 
Bartek_Nowy: folds 
Uncalled bet (10) returned to Gyciakasesu
Gyciakasesu collected 20 from pot
Gyciakasesu: doesn't show hand 
*** SUMMARY ***
Total pot 20 | Rake 0 
Seat 1: Gyciakasesu (big blind) collected (20)
Seat 2: Mahu2021 (button) folded before Flop (didn't bet)
Seat 3: Bartek_Nowy (small blind) folded before Flop



PokerStars Hand #243245596423: Tournament #3581061628, $0.92+$0.08 USD Hold'em No Limit - Level I (10/20) - 2023/04/22 13:56:38 CET [2023/04/22 7:56:38 ET]
Table '3581061628 1' 3-max Seat #3 is the button
Seat 1: Gyciakasesu (480 in chips) 
Seat 2: Mahu2021 (270 in chips) 
Seat 3: Bartek_Nowy (750 in chips) 
Gyciakasesu: posts small blind 10
Mahu2021: posts big blind 20
*** HOLE CARDS ***
Dealt to Mahu2021 [Qc 7s]
Bartek_Nowy: raises 20 to 40
Gyciakasesu: calls 30
Mahu2021: folds 
*** FLOP *** [4c 8s 3c]
Gyciakasesu: checks 
Bartek_Nowy: checks 
*** TURN *** [4c 8s 3c] [Js]
Gyciakasesu: checks 
Bartek_Nowy: checks 
*** RIVER *** [4c 8s 3c Js] [6h]
Gyciakasesu: bets 40
Bartek_Nowy: folds 
Uncalled bet (40) returned to Gyciakasesu
Gyciakasesu collected 100 from pot
Gyciakasesu: doesn't show hand 
*** SUMMARY ***
Total pot 100 | Rake 0 
Board [4c 8s 3c Js 6h]
Seat 1: Gyciakasesu (small blind) collected (100)
Seat 2: Mahu2021 (big blind) folded before Flop
Seat 3: Bartek_Nowy (button) folded on the River



PokerStars Hand #243245600486: Tournament #3581061628, $0.92+$0.08 USD Hold'em No Limit - Level I (10/20) - 2023/04/22 13:57:04 CET [2023/04/22 7:57:04 ET]
Table '3581061628 1' 3-max Seat #1 is the button
Seat 1: Gyciakasesu (540 in chips) 
Seat 2: Mahu2021 (250 in chips) 
Seat 3: Bartek_Nowy (710 in chips) 
Mahu2021: posts small blind 10
Bartek_Nowy: posts big blind 20
*** HOLE CARDS ***
Dealt to Mahu2021 [5s Jd]
Gyciakasesu: folds 
Mahu2021: calls 10
Bartek_Nowy: checks 
*** FLOP *** [9s 7s Th]
Mahu2021: checks 
Bartek_Nowy: bets 20
Mahu2021: raises 210 to 230 and is all-in
Bartek_Nowy: calls 210
*** TURN *** [9s 7s Th] [2d]
*** RIVER *** [9s 7s Th 2d] [9c]
*** SHOW DOWN ***
Mahu2021: shows [5s Jd] (a pair of Nines)
Bartek_Nowy: shows [8h Qh] (a pair of Nines - Queen kicker)
Bartek_Nowy collected 500 from pot
Mahu2021 finished the tournament in 3rd place
*** SUMMARY ***
Total pot 500 | Rake 0 
Board [9s 7s Th 2d 9c]
Seat 1: Gyciakasesu (button) folded before Flop (didn't bet)
Seat 2: Mahu2021 (small blind) showed [5s Jd] and lost with a pair of Nines
Seat 3: Bartek_Nowy (big blind) showed [8h Qh] and won (500) with a pair of Nines



