PokerStars Hand #242900280928: Tournament #3572570611, $0.92+$0.08 USD Hold'em No Limit - Level I (10/20) - 2023/04/05 15:49:06 CET [2023/04/05 9:49:06 ET]
Table '3572570611 1' 3-max Seat #1 is the button
Seat 1: Maxxxxxx97 (500 in chips) 
Seat 2: raf131 (500 in chips) 
Seat 3: Mahu2021 (500 in chips) 
raf131: posts small blind 10
Mahu2021: posts big blind 20
*** HOLE CARDS ***
Dealt to Mahu2021 [Kd 2s]
Maxxxxxx97: calls 20
raf131: raises 480 to 500 and is all-in
Mahu2021: folds 
Maxxxxxx97: folds 
Uncalled bet (480) returned to raf131
raf131 collected 60 from pot
*** SUMMARY ***
Total pot 60 | Rake 0 
Seat 1: Maxxxxxx97 (button) folded before Flop
Seat 2: raf131 (small blind) collected (60)
Seat 3: Mahu2021 (big blind) folded before Flop



PokerStars Hand #242900283046: Tournament #3572570611, $0.92+$0.08 USD Hold'em No Limit - Level I (10/20) - 2023/04/05 15:49:15 CET [2023/04/05 9:49:15 ET]
Table '3572570611 1' 3-max Seat #2 is the button
Seat 1: Maxxxxxx97 (480 in chips) 
Seat 2: raf131 (540 in chips) 
Seat 3: Mahu2021 (480 in chips) 
Mahu2021: posts small blind 10
Maxxxxxx97: posts big blind 20
*** HOLE CARDS ***
Dealt to Mahu2021 [4s 9h]
raf131: folds 
Mahu2021: folds 
Uncalled bet (10) returned to Maxxxxxx97
Maxxxxxx97 collected 20 from pot
Maxxxxxx97: doesn't show hand 
*** SUMMARY ***
Total pot 20 | Rake 0 
Seat 1: Maxxxxxx97 (big blind) collected (20)
Seat 2: raf131 (button) folded before Flop (didn't bet)
Seat 3: Mahu2021 (small blind) folded before Flop



PokerStars Hand #242900284140: Tournament #3572570611, $0.92+$0.08 USD Hold'em No Limit - Level I (10/20) - 2023/04/05 15:49:20 CET [2023/04/05 9:49:20 ET]
Table '3572570611 1' 3-max Seat #3 is the button
Seat 1: Maxxxxxx97 (490 in chips) 
Seat 2: raf131 (540 in chips) 
Seat 3: Mahu2021 (470 in chips) 
Maxxxxxx97: posts small blind 10
raf131: posts big blind 20
*** HOLE CARDS ***
Dealt to Mahu2021 [2d Td]
Mahu2021: folds 
Maxxxxxx97: raises 20 to 40
raf131: folds 
Uncalled bet (20) returned to Maxxxxxx97
Maxxxxxx97 collected 40 from pot
Maxxxxxx97: doesn't show hand 
*** SUMMARY ***
Total pot 40 | Rake 0 
Seat 1: Maxxxxxx97 (small blind) collected (40)
Seat 2: raf131 (big blind) folded before Flop
Seat 3: Mahu2021 (button) folded before Flop (didn't bet)



PokerStars Hand #242900285647: Tournament #3572570611, $0.92+$0.08 USD Hold'em No Limit - Level I (10/20) - 2023/04/05 15:49:27 CET [2023/04/05 9:49:27 ET]
Table '3572570611 1' 3-max Seat #1 is the button
Seat 1: Maxxxxxx97 (510 in chips) 
Seat 2: raf131 (520 in chips) 
Seat 3: Mahu2021 (470 in chips) 
raf131: posts small blind 10
Mahu2021: posts big blind 20
*** HOLE CARDS ***
Dealt to Mahu2021 [8c 4d]
Maxxxxxx97: calls 20
raf131: folds 
Mahu2021: checks 
*** FLOP *** [Jc Qd Ts]
Mahu2021: checks 
Maxxxxxx97: bets 20
Mahu2021: folds 
Uncalled bet (20) returned to Maxxxxxx97
Maxxxxxx97 collected 50 from pot
Maxxxxxx97: doesn't show hand 
*** SUMMARY ***
Total pot 50 | Rake 0 
Board [Jc Qd Ts]
Seat 1: Maxxxxxx97 (button) collected (50)
Seat 2: raf131 (small blind) folded before Flop
Seat 3: Mahu2021 (big blind) folded on the Flop



PokerStars Hand #242900288377: Tournament #3572570611, $0.92+$0.08 USD Hold'em No Limit - Level I (10/20) - 2023/04/05 15:49:38 CET [2023/04/05 9:49:38 ET]
Table '3572570611 1' 3-max Seat #2 is the button
Seat 1: Maxxxxxx97 (540 in chips) 
Seat 2: raf131 (510 in chips) 
Seat 3: Mahu2021 (450 in chips) 
Mahu2021: posts small blind 10
Maxxxxxx97: posts big blind 20
*** HOLE CARDS ***
Dealt to Mahu2021 [Th 3c]
raf131: calls 20
Mahu2021: folds 
Maxxxxxx97: checks 
*** FLOP *** [Qd 5d 8c]
Maxxxxxx97: checks 
raf131: checks 
*** TURN *** [Qd 5d 8c] [Kc]
Maxxxxxx97: bets 20
raf131: calls 20
*** RIVER *** [Qd 5d 8c Kc] [9d]
Maxxxxxx97: bets 20
raf131: folds 
Uncalled bet (20) returned to Maxxxxxx97
Maxxxxxx97 collected 90 from pot
Maxxxxxx97: doesn't show hand 
*** SUMMARY ***
Total pot 90 | Rake 0 
Board [Qd 5d 8c Kc 9d]
Seat 1: Maxxxxxx97 (big blind) collected (90)
Seat 2: raf131 (button) folded on the River
Seat 3: Mahu2021 (small blind) folded before Flop



PokerStars Hand #242900293535: Tournament #3572570611, $0.92+$0.08 USD Hold'em No Limit - Level I (10/20) - 2023/04/05 15:50:00 CET [2023/04/05 9:50:00 ET]
Table '3572570611 1' 3-max Seat #3 is the button
Seat 1: Maxxxxxx97 (590 in chips) 
Seat 2: raf131 (470 in chips) 
Seat 3: Mahu2021 (440 in chips) 
Maxxxxxx97: posts small blind 10
raf131: posts big blind 20
*** HOLE CARDS ***
Dealt to Mahu2021 [Ah 9c]
Mahu2021: raises 20 to 40
Maxxxxxx97: folds 
raf131: calls 20
*** FLOP *** [2c Ts 3c]
raf131: checks 
Mahu2021: checks 
*** TURN *** [2c Ts 3c] [7h]
raf131: checks 
Mahu2021: checks 
*** RIVER *** [2c Ts 3c 7h] [Qc]
raf131: checks 
Mahu2021: checks 
*** SHOW DOWN ***
raf131: shows [2h Ad] (a pair of Deuces)
Mahu2021: mucks hand 
raf131 collected 90 from pot
*** SUMMARY ***
Total pot 90 | Rake 0 
Board [2c Ts 3c 7h Qc]
Seat 1: Maxxxxxx97 (small blind) folded before Flop
Seat 2: raf131 (big blind) showed [2h Ad] and won (90) with a pair of Deuces
Seat 3: Mahu2021 (button) mucked [Ah 9c]



PokerStars Hand #242900297059: Tournament #3572570611, $0.92+$0.08 USD Hold'em No Limit - Level I (10/20) - 2023/04/05 15:50:15 CET [2023/04/05 9:50:15 ET]
Table '3572570611 1' 3-max Seat #1 is the button
Seat 1: Maxxxxxx97 (580 in chips) 
Seat 2: raf131 (520 in chips) 
Seat 3: Mahu2021 (400 in chips) 
raf131: posts small blind 10
Mahu2021: posts big blind 20
*** HOLE CARDS ***
Dealt to Mahu2021 [3d 4d]
Maxxxxxx97: calls 20
raf131: calls 10
Mahu2021: checks 
*** FLOP *** [7d Ts Qd]
raf131: checks 
Mahu2021: bets 60
Maxxxxxx97: calls 60
raf131: calls 60
*** TURN *** [7d Ts Qd] [Jh]
raf131: checks 
Mahu2021: checks 
Maxxxxxx97: bets 240
raf131: folds 
Mahu2021: folds 
Uncalled bet (240) returned to Maxxxxxx97
Maxxxxxx97 collected 240 from pot
Maxxxxxx97: doesn't show hand 
*** SUMMARY ***
Total pot 240 | Rake 0 
Board [7d Ts Qd Jh]
Seat 1: Maxxxxxx97 (button) collected (240)
Seat 2: raf131 (small blind) folded on the Turn
Seat 3: Mahu2021 (big blind) folded on the Turn



PokerStars Hand #242900303862: Tournament #3572570611, $0.92+$0.08 USD Hold'em No Limit - Level I (10/20) - 2023/04/05 15:50:45 CET [2023/04/05 9:50:45 ET]
Table '3572570611 1' 3-max Seat #2 is the button
Seat 1: Maxxxxxx97 (740 in chips) 
Seat 2: raf131 (440 in chips) 
Seat 3: Mahu2021 (320 in chips) 
Mahu2021: posts small blind 10
Maxxxxxx97: posts big blind 20
*** HOLE CARDS ***
Dealt to Mahu2021 [Qh 6h]
raf131: folds 
Mahu2021: calls 10
Maxxxxxx97: checks 
*** FLOP *** [9d 9h Kc]
Mahu2021: checks 
Maxxxxxx97: checks 
*** TURN *** [9d 9h Kc] [2h]
Mahu2021: bets 40
Maxxxxxx97: folds 
Uncalled bet (40) returned to Mahu2021
Mahu2021 collected 40 from pot
Mahu2021: doesn't show hand 
*** SUMMARY ***
Total pot 40 | Rake 0 
Board [9d 9h Kc 2h]
Seat 1: Maxxxxxx97 (big blind) folded on the Turn
Seat 2: raf131 (button) folded before Flop (didn't bet)
Seat 3: Mahu2021 (small blind) collected (40)



PokerStars Hand #242900307722: Tournament #3572570611, $0.92+$0.08 USD Hold'em No Limit - Level I (10/20) - 2023/04/05 15:51:01 CET [2023/04/05 9:51:01 ET]
Table '3572570611 1' 3-max Seat #3 is the button
Seat 1: Maxxxxxx97 (720 in chips) 
Seat 2: raf131 (440 in chips) 
Seat 3: Mahu2021 (340 in chips) 
Maxxxxxx97: posts small blind 10
raf131: posts big blind 20
*** HOLE CARDS ***
Dealt to Mahu2021 [3d 3h]
Mahu2021: raises 320 to 340 and is all-in
Maxxxxxx97: folds 
raf131: calls 320
*** FLOP *** [4c 7d Ac]
*** TURN *** [4c 7d Ac] [8h]
*** RIVER *** [4c 7d Ac 8h] [Js]
*** SHOW DOWN ***
raf131: shows [Ad Jc] (two pair, Aces and Jacks)
Mahu2021: shows [3d 3h] (a pair of Threes)
raf131 collected 690 from pot
Mahu2021 finished the tournament in 3rd place
*** SUMMARY ***
Total pot 690 | Rake 0 
Board [4c 7d Ac 8h Js]
Seat 1: Maxxxxxx97 (small blind) folded before Flop
Seat 2: raf131 (big blind) showed [Ad Jc] and won (690) with two pair, Aces and Jacks
Seat 3: Mahu2021 (button) showed [3d 3h] and lost with a pair of Threes



