PokerStars Hand #242942802130: Tournament #3573595737, $0.92+$0.08 USD Hold'em No Limit - Level I (10/20) - 2023/04/07 17:21:26 CET [2023/04/07 11:21:26 ET]
Table '3573595737 1' 3-max Seat #1 is the button
Seat 1: Gervinho2504 (500 in chips) 
Seat 2: BennyHenkman (500 in chips) 
Seat 3: Mahu2021 (500 in chips) 
BennyHenkman: posts small blind 10
Mahu2021: posts big blind 20
*** HOLE CARDS ***
Dealt to Mahu2021 [2c 4s]
Gervinho2504: folds 
BennyHenkman: calls 10
Mahu2021: checks 
*** FLOP *** [2h 2s 8d]
BennyHenkman: bets 40
Mahu2021: calls 40
*** TURN *** [2h 2s 8d] [2d]
BennyHenkman: checks 
Mahu2021: bets 40
BennyHenkman: calls 40
*** RIVER *** [2h 2s 8d 2d] [As]
BennyHenkman: bets 84
Mahu2021: raises 316 to 400 and is all-in
BennyHenkman: calls 316 and is all-in
*** SHOW DOWN ***
Mahu2021: shows [2c 4s] (four of a kind, Deuces)
BennyHenkman: shows [8c Ad] (a full house, Deuces full of Aces)
Mahu2021 collected 1000 from pot
BennyHenkman finished the tournament in 3rd place
*** SUMMARY ***
Total pot 1000 | Rake 0 
Board [2h 2s 8d 2d As]
Seat 1: Gervinho2504 (button) folded before Flop (didn't bet)
Seat 2: BennyHenkman (small blind) showed [8c Ad] and lost with a full house, Deuces full of Aces
Seat 3: Mahu2021 (big blind) showed [2c 4s] and won (1000) with four of a kind, Deuces



PokerStars Hand #242942810899: Tournament #3573595737, $0.92+$0.08 USD Hold'em No Limit - Level I (10/20) - 2023/04/07 17:21:54 CET [2023/04/07 11:21:54 ET]
Table '3573595737 1' 3-max Seat #3 is the button
Seat 1: Gervinho2504 (500 in chips) 
Seat 3: Mahu2021 (1000 in chips) 
Mahu2021: posts small blind 10
Gervinho2504: posts big blind 20
*** HOLE CARDS ***
Dealt to Mahu2021 [9s 2s]
Mahu2021: calls 10
Gervinho2504: checks 
*** FLOP *** [Kh 4c 4d]
Gervinho2504: checks 
Mahu2021: bets 20
Gervinho2504: folds 
Uncalled bet (20) returned to Mahu2021
Mahu2021 collected 40 from pot
Mahu2021: doesn't show hand 
*** SUMMARY ***
Total pot 40 | Rake 0 
Board [Kh 4c 4d]
Seat 1: Gervinho2504 (big blind) folded on the Flop
Seat 3: Mahu2021 (button) (small blind) collected (40)



PokerStars Hand #242942815120: Tournament #3573595737, $0.92+$0.08 USD Hold'em No Limit - Level I (10/20) - 2023/04/07 17:22:08 CET [2023/04/07 11:22:08 ET]
Table '3573595737 1' 3-max Seat #1 is the button
Seat 1: Gervinho2504 (480 in chips) 
Seat 3: Mahu2021 (1020 in chips) 
Gervinho2504: posts small blind 10
Mahu2021: posts big blind 20
*** HOLE CARDS ***
Dealt to Mahu2021 [Jc Jd]
Gervinho2504: raises 40 to 60
Mahu2021: raises 960 to 1020 and is all-in
Gervinho2504: calls 420 and is all-in
Uncalled bet (540) returned to Mahu2021
*** FLOP *** [4c 7d As]
*** TURN *** [4c 7d As] [9d]
*** RIVER *** [4c 7d As 9d] [3s]
*** SHOW DOWN ***
Mahu2021: shows [Jc Jd] (a pair of Jacks)
Gervinho2504: shows [Qc Ad] (a pair of Aces)
Gervinho2504 collected 960 from pot
*** SUMMARY ***
Total pot 960 | Rake 0 
Board [4c 7d As 9d 3s]
Seat 1: Gervinho2504 (button) (small blind) showed [Qc Ad] and won (960) with a pair of Aces
Seat 3: Mahu2021 (big blind) showed [Jc Jd] and lost with a pair of Jacks



PokerStars Hand #242942819898: Tournament #3573595737, $0.92+$0.08 USD Hold'em No Limit - Level I (10/20) - 2023/04/07 17:22:24 CET [2023/04/07 11:22:24 ET]
Table '3573595737 1' 3-max Seat #3 is the button
Seat 1: Gervinho2504 (960 in chips) 
Seat 3: Mahu2021 (540 in chips) 
Mahu2021: posts small blind 10
Gervinho2504: posts big blind 20
*** HOLE CARDS ***
Dealt to Mahu2021 [Kc Jc]
Mahu2021: raises 520 to 540 and is all-in
Gervinho2504: folds 
Uncalled bet (520) returned to Mahu2021
Mahu2021 collected 40 from pot
Mahu2021: doesn't show hand 
*** SUMMARY ***
Total pot 40 | Rake 0 
Seat 1: Gervinho2504 (big blind) folded before Flop
Seat 3: Mahu2021 (button) (small blind) collected (40)



PokerStars Hand #242942822153: Tournament #3573595737, $0.92+$0.08 USD Hold'em No Limit - Level I (10/20) - 2023/04/07 17:22:31 CET [2023/04/07 11:22:31 ET]
Table '3573595737 1' 3-max Seat #1 is the button
Seat 1: Gervinho2504 (940 in chips) 
Seat 3: Mahu2021 (560 in chips) 
Gervinho2504: posts small blind 10
Mahu2021: posts big blind 20
*** HOLE CARDS ***
Dealt to Mahu2021 [2s 8h]
Gervinho2504: calls 10
Mahu2021: checks 
*** FLOP *** [5c 8c Qs]
Mahu2021: checks 
Gervinho2504: checks 
*** TURN *** [5c 8c Qs] [9c]
Mahu2021: checks 
Gervinho2504: bets 20
Mahu2021: calls 20
*** RIVER *** [5c 8c Qs 9c] [2c]
Mahu2021: checks 
Gervinho2504: bets 40
Mahu2021: folds 
Uncalled bet (40) returned to Gervinho2504
Gervinho2504 collected 80 from pot
*** SUMMARY ***
Total pot 80 | Rake 0 
Board [5c 8c Qs 9c 2c]
Seat 1: Gervinho2504 (button) (small blind) collected (80)
Seat 3: Mahu2021 (big blind) folded on the River



PokerStars Hand #242942828308: Tournament #3573595737, $0.92+$0.08 USD Hold'em No Limit - Level I (10/20) - 2023/04/07 17:22:52 CET [2023/04/07 11:22:52 ET]
Table '3573595737 1' 3-max Seat #3 is the button
Seat 1: Gervinho2504 (980 in chips) 
Seat 3: Mahu2021 (520 in chips) 
Mahu2021: posts small blind 10
Gervinho2504: posts big blind 20
*** HOLE CARDS ***
Dealt to Mahu2021 [6s Kh]
Mahu2021: calls 10
Gervinho2504: raises 80 to 100
Mahu2021: folds 
Uncalled bet (80) returned to Gervinho2504
Gervinho2504 collected 40 from pot
*** SUMMARY ***
Total pot 40 | Rake 0 
Seat 1: Gervinho2504 (big blind) collected (40)
Seat 3: Mahu2021 (button) (small blind) folded before Flop



PokerStars Hand #242942831272: Tournament #3573595737, $0.92+$0.08 USD Hold'em No Limit - Level I (10/20) - 2023/04/07 17:23:02 CET [2023/04/07 11:23:02 ET]
Table '3573595737 1' 3-max Seat #1 is the button
Seat 1: Gervinho2504 (1000 in chips) 
Seat 3: Mahu2021 (500 in chips) 
Gervinho2504: posts small blind 10
Mahu2021: posts big blind 20
*** HOLE CARDS ***
Dealt to Mahu2021 [Jh Jd]
Gervinho2504: raises 40 to 60
Mahu2021: raises 440 to 500 and is all-in
Gervinho2504: folds 
Uncalled bet (440) returned to Mahu2021
Mahu2021 collected 120 from pot
Mahu2021: doesn't show hand 
*** SUMMARY ***
Total pot 120 | Rake 0 
Seat 1: Gervinho2504 (button) (small blind) folded before Flop
Seat 3: Mahu2021 (big blind) collected (120)



PokerStars Hand #242942834239: Tournament #3573595737, $0.92+$0.08 USD Hold'em No Limit - Level I (10/20) - 2023/04/07 17:23:12 CET [2023/04/07 11:23:12 ET]
Table '3573595737 1' 3-max Seat #3 is the button
Seat 1: Gervinho2504 (940 in chips) 
Seat 3: Mahu2021 (560 in chips) 
Mahu2021: posts small blind 10
Gervinho2504: posts big blind 20
*** HOLE CARDS ***
Dealt to Mahu2021 [9d Kd]
Mahu2021: calls 10
Gervinho2504: checks 
*** FLOP *** [9h Jd 9s]
Gervinho2504: checks 
Mahu2021: bets 20
Gervinho2504: calls 20
*** TURN *** [9h Jd 9s] [Ac]
Gervinho2504: bets 40
Mahu2021: calls 40
*** RIVER *** [9h Jd 9s Ac] [Ts]
Gervinho2504: bets 160
Mahu2021: calls 160
*** SHOW DOWN ***
Gervinho2504: shows [9c 8d] (three of a kind, Nines)
Mahu2021: shows [9d Kd] (three of a kind, Nines - Ace+King kicker)
Mahu2021 collected 480 from pot
*** SUMMARY ***
Total pot 480 | Rake 0 
Board [9h Jd 9s Ac Ts]
Seat 1: Gervinho2504 (big blind) showed [9c 8d] and lost with three of a kind, Nines
Seat 3: Mahu2021 (button) (small blind) showed [9d Kd] and won (480) with three of a kind, Nines



PokerStars Hand #242942842112: Tournament #3573595737, $0.92+$0.08 USD Hold'em No Limit - Level I (10/20) - 2023/04/07 17:23:37 CET [2023/04/07 11:23:37 ET]
Table '3573595737 1' 3-max Seat #1 is the button
Seat 1: Gervinho2504 (700 in chips) 
Seat 3: Mahu2021 (800 in chips) 
Gervinho2504: posts small blind 10
Mahu2021: posts big blind 20
*** HOLE CARDS ***
Dealt to Mahu2021 [Qc 2s]
Gervinho2504: raises 40 to 60
Mahu2021: calls 40
*** FLOP *** [Qd 5d 6d]
Mahu2021: bets 740 and is all-in
Gervinho2504: calls 640 and is all-in
Uncalled bet (100) returned to Mahu2021
*** TURN *** [Qd 5d 6d] [5s]
*** RIVER *** [Qd 5d 6d 5s] [7s]
*** SHOW DOWN ***
Mahu2021: shows [Qc 2s] (two pair, Queens and Fives)
Gervinho2504: shows [Kd 8h] (a pair of Fives)
Mahu2021 collected 1400 from pot
Gervinho2504 finished the tournament in 2nd place
Mahu2021 wins the tournament and receives $3.00 - congratulations!
*** SUMMARY ***
Total pot 1400 | Rake 0 
Board [Qd 5d 6d 5s 7s]
Seat 1: Gervinho2504 (button) (small blind) showed [Kd 8h] and lost with a pair of Fives
Seat 3: Mahu2021 (big blind) showed [Qc 2s] and won (1400) with two pair, Queens and Fives



