PokerStars Hand #248075837687: Tournament #3696405883, $1.84+$0.16 USD Hold'em No Limit - Level I (10/20) - 2024/01/05 12:35:16 CET [2024/01/05 6:35:16 ET]
Table '3696405883 1' 3-max Seat #1 is the button
Seat 1: Mahu2021 (500 in chips) 
Seat 2: Yarik9prs (500 in chips) 
Seat 3: ziogas393 (500 in chips) 
Yarik9prs: posts small blind 10
ziogas393: posts big blind 20
*** HOLE CARDS ***
Dealt to Mahu2021 [8h As]
Mahu2021: calls 20
Yarik9prs: folds 
ziogas393: checks 
*** FLOP *** [7h 4d Ad]
ziogas393: checks 
Mahu2021: checks 
*** TURN *** [7h 4d Ad] [9d]
ziogas393: checks 
Mahu2021: bets 20
ziogas393: folds 
Uncalled bet (20) returned to Mahu2021
Mahu2021 collected 50 from pot
Mahu2021: doesn't show hand 
*** SUMMARY ***
Total pot 50 | Rake 0 
Board [7h 4d Ad 9d]
Seat 1: Mahu2021 (button) collected (50)
Seat 2: Yarik9prs (small blind) folded before Flop
Seat 3: ziogas393 (big blind) folded on the Turn



PokerStars Hand #248075843897: Tournament #3696405883, $1.84+$0.16 USD Hold'em No Limit - Level I (10/20) - 2024/01/05 12:35:53 CET [2024/01/05 6:35:53 ET]
Table '3696405883 1' 3-max Seat #2 is the button
Seat 1: Mahu2021 (530 in chips) 
Seat 2: Yarik9prs (490 in chips) 
Seat 3: ziogas393 (480 in chips) 
ziogas393: posts small blind 10
Mahu2021: posts big blind 20
*** HOLE CARDS ***
Dealt to Mahu2021 [4d 3c]
Yarik9prs: folds 
ziogas393: folds 
Uncalled bet (10) returned to Mahu2021
Mahu2021 collected 20 from pot
Mahu2021: doesn't show hand 
*** SUMMARY ***
Total pot 20 | Rake 0 
Seat 1: Mahu2021 (big blind) collected (20)
Seat 2: Yarik9prs (button) folded before Flop (didn't bet)
Seat 3: ziogas393 (small blind) folded before Flop



PokerStars Hand #248075844906: Tournament #3696405883, $1.84+$0.16 USD Hold'em No Limit - Level I (10/20) - 2024/01/05 12:35:59 CET [2024/01/05 6:35:59 ET]
Table '3696405883 1' 3-max Seat #3 is the button
Seat 1: Mahu2021 (540 in chips) 
Seat 2: Yarik9prs (490 in chips) 
Seat 3: ziogas393 (470 in chips) 
Mahu2021: posts small blind 10
Yarik9prs: posts big blind 20
*** HOLE CARDS ***
Dealt to Mahu2021 [Ac 3h]
ziogas393: folds 
Mahu2021: calls 10
Yarik9prs: checks 
*** FLOP *** [Jh Td 6s]
Mahu2021: checks 
Yarik9prs: bets 20
Mahu2021: folds 
Uncalled bet (20) returned to Yarik9prs
Yarik9prs collected 40 from pot
Yarik9prs: doesn't show hand 
*** SUMMARY ***
Total pot 40 | Rake 0 
Board [Jh Td 6s]
Seat 1: Mahu2021 (small blind) folded on the Flop
Seat 2: Yarik9prs (big blind) collected (40)
Seat 3: ziogas393 (button) folded before Flop (didn't bet)



PokerStars Hand #248075848019: Tournament #3696405883, $1.84+$0.16 USD Hold'em No Limit - Level I (10/20) - 2024/01/05 12:36:17 CET [2024/01/05 6:36:17 ET]
Table '3696405883 1' 3-max Seat #1 is the button
Seat 1: Mahu2021 (520 in chips) 
Seat 2: Yarik9prs (510 in chips) 
Seat 3: ziogas393 (470 in chips) 
Yarik9prs: posts small blind 10
ziogas393: posts big blind 20
*** HOLE CARDS ***
Dealt to Mahu2021 [Jd 3s]
Mahu2021: folds 
Yarik9prs: folds 
Uncalled bet (10) returned to ziogas393
ziogas393 collected 20 from pot
ziogas393: doesn't show hand 
*** SUMMARY ***
Total pot 20 | Rake 0 
Seat 1: Mahu2021 (button) folded before Flop (didn't bet)
Seat 2: Yarik9prs (small blind) folded before Flop
Seat 3: ziogas393 (big blind) collected (20)



PokerStars Hand #248075849294: Tournament #3696405883, $1.84+$0.16 USD Hold'em No Limit - Level I (10/20) - 2024/01/05 12:36:25 CET [2024/01/05 6:36:25 ET]
Table '3696405883 1' 3-max Seat #2 is the button
Seat 1: Mahu2021 (520 in chips) 
Seat 2: Yarik9prs (500 in chips) 
Seat 3: ziogas393 (480 in chips) 
ziogas393: posts small blind 10
Mahu2021: posts big blind 20
*** HOLE CARDS ***
Dealt to Mahu2021 [As Ks]
Yarik9prs: folds 
ziogas393: calls 10
Mahu2021: raises 40 to 60
ziogas393: raises 420 to 480 and is all-in
Mahu2021: calls 420
*** FLOP *** [6h 9h Tc]
*** TURN *** [6h 9h Tc] [8d]
*** RIVER *** [6h 9h Tc 8d] [Qs]
*** SHOW DOWN ***
ziogas393: shows [Ad 6s] (a pair of Sixes)
Mahu2021: shows [As Ks] (high card Ace)
ziogas393 collected 960 from pot
*** SUMMARY ***
Total pot 960 | Rake 0 
Board [6h 9h Tc 8d Qs]
Seat 1: Mahu2021 (big blind) showed [As Ks] and lost with high card Ace
Seat 2: Yarik9prs (button) folded before Flop (didn't bet)
Seat 3: ziogas393 (small blind) showed [Ad 6s] and won (960) with a pair of Sixes



PokerStars Hand #248075853582: Tournament #3696405883, $1.84+$0.16 USD Hold'em No Limit - Level I (10/20) - 2024/01/05 12:36:50 CET [2024/01/05 6:36:50 ET]
Table '3696405883 1' 3-max Seat #3 is the button
Seat 1: Mahu2021 (40 in chips) 
Seat 2: Yarik9prs (500 in chips) 
Seat 3: ziogas393 (960 in chips) 
Mahu2021: posts small blind 10
Yarik9prs: posts big blind 20
*** HOLE CARDS ***
Dealt to Mahu2021 [Js 2c]
ziogas393: folds 
Mahu2021: raises 20 to 40 and is all-in
Yarik9prs: calls 20
*** FLOP *** [7h Jd Ts]
*** TURN *** [7h Jd Ts] [Jc]
*** RIVER *** [7h Jd Ts Jc] [Jh]
*** SHOW DOWN ***
Mahu2021: shows [Js 2c] (four of a kind, Jacks)
Yarik9prs: shows [7d 3s] (a full house, Jacks full of Sevens)
Mahu2021 collected 80 from pot
*** SUMMARY ***
Total pot 80 | Rake 0 
Board [7h Jd Ts Jc Jh]
Seat 1: Mahu2021 (small blind) showed [Js 2c] and won (80) with four of a kind, Jacks
Seat 2: Yarik9prs (big blind) showed [7d 3s] and lost with a full house, Jacks full of Sevens
Seat 3: ziogas393 (button) folded before Flop (didn't bet)



PokerStars Hand #248075857850: Tournament #3696405883, $1.84+$0.16 USD Hold'em No Limit - Level I (10/20) - 2024/01/05 12:37:14 CET [2024/01/05 6:37:14 ET]
Table '3696405883 1' 3-max Seat #1 is the button
Seat 1: Mahu2021 (80 in chips) 
Seat 2: Yarik9prs (460 in chips) 
Seat 3: ziogas393 (960 in chips) 
Yarik9prs: posts small blind 10
ziogas393: posts big blind 20
*** HOLE CARDS ***
Dealt to Mahu2021 [Kc Js]
Mahu2021: raises 60 to 80 and is all-in
Yarik9prs: folds 
ziogas393: calls 60
*** FLOP *** [Ks 2c 8c]
*** TURN *** [Ks 2c 8c] [6d]
*** RIVER *** [Ks 2c 8c 6d] [7h]
*** SHOW DOWN ***
ziogas393: shows [4s Ad] (high card Ace)
Mahu2021: shows [Kc Js] (a pair of Kings)
Mahu2021 collected 170 from pot
*** SUMMARY ***
Total pot 170 | Rake 0 
Board [Ks 2c 8c 6d 7h]
Seat 1: Mahu2021 (button) showed [Kc Js] and won (170) with a pair of Kings
Seat 2: Yarik9prs (small blind) folded before Flop
Seat 3: ziogas393 (big blind) showed [4s Ad] and lost with high card Ace



PokerStars Hand #248075860753: Tournament #3696405883, $1.84+$0.16 USD Hold'em No Limit - Level I (10/20) - 2024/01/05 12:37:31 CET [2024/01/05 6:37:31 ET]
Table '3696405883 1' 3-max Seat #2 is the button
Seat 1: Mahu2021 (170 in chips) 
Seat 2: Yarik9prs (450 in chips) 
Seat 3: ziogas393 (880 in chips) 
ziogas393: posts small blind 10
Mahu2021: posts big blind 20
*** HOLE CARDS ***
Dealt to Mahu2021 [4c 6h]
Yarik9prs: raises 20 to 40
ziogas393: folds 
Mahu2021: calls 20
*** FLOP *** [Ac 2s 6d]
Mahu2021: bets 130 and is all-in
Yarik9prs: calls 130
*** TURN *** [Ac 2s 6d] [9s]
*** RIVER *** [Ac 2s 6d 9s] [5h]
*** SHOW DOWN ***
Mahu2021: shows [4c 6h] (a pair of Sixes)
Yarik9prs: shows [8c As] (a pair of Aces)
Yarik9prs collected 350 from pot
Mahu2021 finished the tournament in 3rd place
*** SUMMARY ***
Total pot 350 | Rake 0 
Board [Ac 2s 6d 9s 5h]
Seat 1: Mahu2021 (big blind) showed [4c 6h] and lost with a pair of Sixes
Seat 2: Yarik9prs (button) showed [8c As] and won (350) with a pair of Aces
Seat 3: ziogas393 (small blind) folded before Flop



