PokerStars Hand #243189425143: Tournament #3579758968, $0.92+$0.08 USD Hold'em No Limit - Level I (10/20) - 2023/04/19 17:47:42 CET [2023/04/19 11:47:42 ET]
Table '3579758968 1' 3-max Seat #1 is the button
Seat 1: Mahu2021 (500 in chips) 
Seat 2: nicunicu78 (500 in chips) 
Seat 3: anjo10tl (500 in chips) 
nicunicu78: posts small blind 10
anjo10tl: posts big blind 20
*** HOLE CARDS ***
Dealt to Mahu2021 [4h Jh]
Mahu2021: folds 
nicunicu78: calls 10
anjo10tl: checks 
*** FLOP *** [Qd Js 3h]
nicunicu78: checks 
anjo10tl: checks 
*** TURN *** [Qd Js 3h] [4s]
nicunicu78: bets 20
anjo10tl: folds 
Uncalled bet (20) returned to nicunicu78
nicunicu78 collected 40 from pot
*** SUMMARY ***
Total pot 40 | Rake 0 
Board [Qd Js 3h 4s]
Seat 1: Mahu2021 (button) folded before Flop (didn't bet)
Seat 2: nicunicu78 (small blind) collected (40)
Seat 3: anjo10tl (big blind) folded on the Turn



PokerStars Hand #243189429636: Tournament #3579758968, $0.92+$0.08 USD Hold'em No Limit - Level I (10/20) - 2023/04/19 17:47:58 CET [2023/04/19 11:47:58 ET]
Table '3579758968 1' 3-max Seat #2 is the button
Seat 1: Mahu2021 (500 in chips) 
Seat 2: nicunicu78 (520 in chips) 
Seat 3: anjo10tl (480 in chips) 
anjo10tl: posts small blind 10
Mahu2021: posts big blind 20
*** HOLE CARDS ***
Dealt to Mahu2021 [5c Jd]
nicunicu78: folds 
anjo10tl: calls 10
Mahu2021: checks 
*** FLOP *** [9h Ac 3d]
anjo10tl: checks 
Mahu2021: checks 
*** TURN *** [9h Ac 3d] [Tc]
anjo10tl: checks 
Mahu2021: checks 
*** RIVER *** [9h Ac 3d Tc] [6d]
anjo10tl: checks 
Mahu2021: checks 
*** SHOW DOWN ***
anjo10tl: shows [Kc 2d] (high card Ace)
Mahu2021: mucks hand 
anjo10tl collected 40 from pot
*** SUMMARY ***
Total pot 40 | Rake 0 
Board [9h Ac 3d Tc 6d]
Seat 1: Mahu2021 (big blind) mucked [5c Jd]
Seat 2: nicunicu78 (button) folded before Flop (didn't bet)
Seat 3: anjo10tl (small blind) showed [Kc 2d] and won (40) with high card Ace



PokerStars Hand #243189434657: Tournament #3579758968, $0.92+$0.08 USD Hold'em No Limit - Level I (10/20) - 2023/04/19 17:48:16 CET [2023/04/19 11:48:16 ET]
Table '3579758968 1' 3-max Seat #3 is the button
Seat 1: Mahu2021 (480 in chips) 
Seat 2: nicunicu78 (520 in chips) 
Seat 3: anjo10tl (500 in chips) 
Mahu2021: posts small blind 10
nicunicu78: posts big blind 20
*** HOLE CARDS ***
Dealt to Mahu2021 [Qd 4c]
anjo10tl: folds 
Mahu2021: folds 
Uncalled bet (10) returned to nicunicu78
nicunicu78 collected 20 from pot
*** SUMMARY ***
Total pot 20 | Rake 0 
Seat 1: Mahu2021 (small blind) folded before Flop
Seat 2: nicunicu78 (big blind) collected (20)
Seat 3: anjo10tl (button) folded before Flop (didn't bet)



PokerStars Hand #243189436231: Tournament #3579758968, $0.92+$0.08 USD Hold'em No Limit - Level I (10/20) - 2023/04/19 17:48:22 CET [2023/04/19 11:48:22 ET]
Table '3579758968 1' 3-max Seat #1 is the button
Seat 1: Mahu2021 (470 in chips) 
Seat 2: nicunicu78 (530 in chips) 
Seat 3: anjo10tl (500 in chips) 
nicunicu78: posts small blind 10
anjo10tl: posts big blind 20
*** HOLE CARDS ***
Dealt to Mahu2021 [9d 2c]
Mahu2021: folds 
nicunicu78: calls 10
anjo10tl: raises 40 to 60
nicunicu78: calls 40
*** FLOP *** [9s 3s 8h]
nicunicu78: checks 
anjo10tl: checks 
*** TURN *** [9s 3s 8h] [Js]
nicunicu78: bets 40
anjo10tl: calls 40
*** RIVER *** [9s 3s 8h Js] [Ad]
nicunicu78: bets 20
anjo10tl: folds 
Uncalled bet (20) returned to nicunicu78
nicunicu78 collected 200 from pot
*** SUMMARY ***
Total pot 200 | Rake 0 
Board [9s 3s 8h Js Ad]
Seat 1: Mahu2021 (button) folded before Flop (didn't bet)
Seat 2: nicunicu78 (small blind) collected (200)
Seat 3: anjo10tl (big blind) folded on the River



PokerStars Hand #243189442496: Tournament #3579758968, $0.92+$0.08 USD Hold'em No Limit - Level I (10/20) - 2023/04/19 17:48:44 CET [2023/04/19 11:48:44 ET]
Table '3579758968 1' 3-max Seat #2 is the button
Seat 1: Mahu2021 (470 in chips) 
Seat 2: nicunicu78 (630 in chips) 
Seat 3: anjo10tl (400 in chips) 
anjo10tl: posts small blind 10
Mahu2021: posts big blind 20
*** HOLE CARDS ***
Dealt to Mahu2021 [4d 8s]
nicunicu78: folds 
anjo10tl: raises 40 to 60
Mahu2021: calls 40
*** FLOP *** [Js 9c Th]
anjo10tl: bets 20
Mahu2021: calls 20
*** TURN *** [Js 9c Th] [Ks]
anjo10tl: bets 160
Mahu2021: folds 
Uncalled bet (160) returned to anjo10tl
anjo10tl collected 160 from pot
*** SUMMARY ***
Total pot 160 | Rake 0 
Board [Js 9c Th Ks]
Seat 1: Mahu2021 (big blind) folded on the Turn
Seat 2: nicunicu78 (button) folded before Flop (didn't bet)
Seat 3: anjo10tl (small blind) collected (160)



PokerStars Hand #243189447857: Tournament #3579758968, $0.92+$0.08 USD Hold'em No Limit - Level I (10/20) - 2023/04/19 17:49:04 CET [2023/04/19 11:49:04 ET]
Table '3579758968 1' 3-max Seat #3 is the button
Seat 1: Mahu2021 (390 in chips) 
Seat 2: nicunicu78 (630 in chips) 
Seat 3: anjo10tl (480 in chips) 
Mahu2021: posts small blind 10
nicunicu78: posts big blind 20
*** HOLE CARDS ***
Dealt to Mahu2021 [5c 3c]
anjo10tl: folds 
Mahu2021: calls 10
nicunicu78: raises 40 to 60
Mahu2021: calls 40
*** FLOP *** [As 3d 4c]
Mahu2021: bets 330 and is all-in
nicunicu78: calls 330
*** TURN *** [As 3d 4c] [9d]
*** RIVER *** [As 3d 4c 9d] [Qh]
*** SHOW DOWN ***
Mahu2021: shows [5c 3c] (a pair of Threes)
nicunicu78: shows [Qs Ad] (two pair, Aces and Queens)
nicunicu78 collected 780 from pot
Mahu2021 finished the tournament in 3rd place
*** SUMMARY ***
Total pot 780 | Rake 0 
Board [As 3d 4c 9d Qh]
Seat 1: Mahu2021 (small blind) showed [5c 3c] and lost with a pair of Threes
Seat 2: nicunicu78 (big blind) showed [Qs Ad] and won (780) with two pair, Aces and Queens
Seat 3: anjo10tl (button) folded before Flop (didn't bet)



