PokerStars Hand #245047525099: Tournament #3623056208, $0.92+$0.08 USD Hold'em No Limit - Level I (10/20) - 2023/07/27 15:21:22 CET [2023/07/27 9:21:22 ET]
Table '3623056208 1' 3-max Seat #1 is the button
Seat 1: Mahu2021 (500 in chips) 
Seat 2: DRGODOY (500 in chips) 
Seat 3: emilycant5 (500 in chips) 
DRGODOY: posts small blind 10
emilycant5: posts big blind 20
*** HOLE CARDS ***
Dealt to Mahu2021 [Ah 7h]
Mahu2021: raises 20 to 40
DRGODOY: folds 
emilycant5: folds 
Uncalled bet (20) returned to Mahu2021
Mahu2021 collected 50 from pot
Mahu2021: doesn't show hand 
*** SUMMARY ***
Total pot 50 | Rake 0 
Seat 1: Mahu2021 (button) collected (50)
Seat 2: DRGODOY (small blind) folded before Flop
Seat 3: emilycant5 (big blind) folded before Flop



PokerStars Hand #245047526406: Tournament #3623056208, $0.92+$0.08 USD Hold'em No Limit - Level I (10/20) - 2023/07/27 15:21:29 CET [2023/07/27 9:21:29 ET]
Table '3623056208 1' 3-max Seat #2 is the button
Seat 1: Mahu2021 (530 in chips) 
Seat 2: DRGODOY (490 in chips) 
Seat 3: emilycant5 (480 in chips) 
emilycant5: posts small blind 10
Mahu2021: posts big blind 20
*** HOLE CARDS ***
Dealt to Mahu2021 [9s 8s]
DRGODOY: folds 
emilycant5: folds 
Uncalled bet (10) returned to Mahu2021
Mahu2021 collected 20 from pot
Mahu2021: doesn't show hand 
*** SUMMARY ***
Total pot 20 | Rake 0 
Seat 1: Mahu2021 (big blind) collected (20)
Seat 2: DRGODOY (button) folded before Flop (didn't bet)
Seat 3: emilycant5 (small blind) folded before Flop



PokerStars Hand #245047527932: Tournament #3623056208, $0.92+$0.08 USD Hold'em No Limit - Level I (10/20) - 2023/07/27 15:21:37 CET [2023/07/27 9:21:37 ET]
Table '3623056208 1' 3-max Seat #3 is the button
Seat 1: Mahu2021 (540 in chips) 
Seat 2: DRGODOY (490 in chips) 
Seat 3: emilycant5 (470 in chips) 
Mahu2021: posts small blind 10
DRGODOY: posts big blind 20
*** HOLE CARDS ***
Dealt to Mahu2021 [9h 3c]
emilycant5: folds 
Mahu2021: folds 
Uncalled bet (10) returned to DRGODOY
DRGODOY collected 20 from pot
*** SUMMARY ***
Total pot 20 | Rake 0 
Seat 1: Mahu2021 (small blind) folded before Flop
Seat 2: DRGODOY (big blind) collected (20)
Seat 3: emilycant5 (button) folded before Flop (didn't bet)



PokerStars Hand #245047529379: Tournament #3623056208, $0.92+$0.08 USD Hold'em No Limit - Level I (10/20) - 2023/07/27 15:21:44 CET [2023/07/27 9:21:44 ET]
Table '3623056208 1' 3-max Seat #1 is the button
Seat 1: Mahu2021 (530 in chips) 
Seat 2: DRGODOY (500 in chips) 
Seat 3: emilycant5 (470 in chips) 
DRGODOY: posts small blind 10
emilycant5: posts big blind 20
*** HOLE CARDS ***
Dealt to Mahu2021 [Tc 7s]
Mahu2021: folds 
DRGODOY: raises 20 to 40
emilycant5: calls 20
*** FLOP *** [4h 9h 6c]
DRGODOY: bets 20
emilycant5: calls 20
*** TURN *** [4h 9h 6c] [Jh]
DRGODOY: bets 20
emilycant5: calls 20
*** RIVER *** [4h 9h 6c Jh] [2s]
DRGODOY: bets 20
emilycant5: calls 20
*** SHOW DOWN ***
DRGODOY: shows [7h Ac] (high card Ace)
emilycant5: shows [Qs 4d] (a pair of Fours)
emilycant5 collected 200 from pot
*** SUMMARY ***
Total pot 200 | Rake 0 
Board [4h 9h 6c Jh 2s]
Seat 1: Mahu2021 (button) folded before Flop (didn't bet)
Seat 2: DRGODOY (small blind) showed [7h Ac] and lost with high card Ace
Seat 3: emilycant5 (big blind) showed [Qs 4d] and won (200) with a pair of Fours



PokerStars Hand #245047533639: Tournament #3623056208, $0.92+$0.08 USD Hold'em No Limit - Level I (10/20) - 2023/07/27 15:22:05 CET [2023/07/27 9:22:05 ET]
Table '3623056208 1' 3-max Seat #2 is the button
Seat 1: Mahu2021 (530 in chips) 
Seat 2: DRGODOY (400 in chips) 
Seat 3: emilycant5 (570 in chips) 
emilycant5: posts small blind 10
Mahu2021: posts big blind 20
*** HOLE CARDS ***
Dealt to Mahu2021 [Qc 6c]
DRGODOY: folds 
emilycant5: raises 40 to 60
Mahu2021: calls 40
*** FLOP *** [4d 3h As]
emilycant5: checks 
Mahu2021: checks 
*** TURN *** [4d 3h As] [Js]
emilycant5: bets 20
Mahu2021: folds 
Uncalled bet (20) returned to emilycant5
emilycant5 collected 120 from pot
emilycant5: doesn't show hand 
*** SUMMARY ***
Total pot 120 | Rake 0 
Board [4d 3h As Js]
Seat 1: Mahu2021 (big blind) folded on the Turn
Seat 2: DRGODOY (button) folded before Flop (didn't bet)
Seat 3: emilycant5 (small blind) collected (120)



PokerStars Hand #245047536590: Tournament #3623056208, $0.92+$0.08 USD Hold'em No Limit - Level I (10/20) - 2023/07/27 15:22:21 CET [2023/07/27 9:22:21 ET]
Table '3623056208 1' 3-max Seat #3 is the button
Seat 1: Mahu2021 (470 in chips) 
Seat 2: DRGODOY (400 in chips) 
Seat 3: emilycant5 (630 in chips) 
Mahu2021: posts small blind 10
DRGODOY: posts big blind 20
*** HOLE CARDS ***
Dealt to Mahu2021 [8s 8h]
emilycant5: raises 50 to 70
Mahu2021: calls 60
DRGODOY: calls 50
*** FLOP *** [9c Ah 3h]
Mahu2021: checks 
DRGODOY: checks 
emilycant5: bets 210
Mahu2021: folds 
DRGODOY: folds 
Uncalled bet (210) returned to emilycant5
emilycant5 collected 210 from pot
emilycant5: doesn't show hand 
*** SUMMARY ***
Total pot 210 | Rake 0 
Board [9c Ah 3h]
Seat 1: Mahu2021 (small blind) folded on the Flop
Seat 2: DRGODOY (big blind) folded on the Flop
Seat 3: emilycant5 (button) collected (210)



PokerStars Hand #245047540973: Tournament #3623056208, $0.92+$0.08 USD Hold'em No Limit - Level I (10/20) - 2023/07/27 15:22:43 CET [2023/07/27 9:22:43 ET]
Table '3623056208 1' 3-max Seat #1 is the button
Seat 1: Mahu2021 (400 in chips) 
Seat 2: DRGODOY (330 in chips) 
Seat 3: emilycant5 (770 in chips) 
DRGODOY: posts small blind 10
emilycant5: posts big blind 20
*** HOLE CARDS ***
Dealt to Mahu2021 [5c 6s]
Mahu2021: calls 20
DRGODOY: calls 10
emilycant5: raises 750 to 770 and is all-in
Mahu2021: folds 
DRGODOY: folds 
Uncalled bet (750) returned to emilycant5
emilycant5 collected 60 from pot
emilycant5: doesn't show hand 
*** SUMMARY ***
Total pot 60 | Rake 0 
Seat 1: Mahu2021 (button) folded before Flop
Seat 2: DRGODOY (small blind) folded before Flop
Seat 3: emilycant5 (big blind) collected (60)



PokerStars Hand #245047543641: Tournament #3623056208, $0.92+$0.08 USD Hold'em No Limit - Level I (10/20) - 2023/07/27 15:22:56 CET [2023/07/27 9:22:56 ET]
Table '3623056208 1' 3-max Seat #2 is the button
Seat 1: Mahu2021 (380 in chips) 
Seat 2: DRGODOY (310 in chips) 
Seat 3: emilycant5 (810 in chips) 
emilycant5: posts small blind 10
Mahu2021: posts big blind 20
*** HOLE CARDS ***
Dealt to Mahu2021 [8s Ac]
DRGODOY: folds 
emilycant5: raises 40 to 60
Mahu2021: calls 40
*** FLOP *** [4h 9d 5c]
emilycant5: bets 120
Mahu2021: raises 200 to 320 and is all-in
emilycant5: calls 200
*** TURN *** [4h 9d 5c] [9c]
*** RIVER *** [4h 9d 5c 9c] [5h]
*** SHOW DOWN ***
emilycant5: shows [Jc Js] (two pair, Jacks and Nines)
Mahu2021: shows [8s Ac] (two pair, Nines and Fives)
emilycant5 collected 760 from pot
Mahu2021 finished the tournament in 3rd place
*** SUMMARY ***
Total pot 760 | Rake 0 
Board [4h 9d 5c 9c 5h]
Seat 1: Mahu2021 (big blind) showed [8s Ac] and lost with two pair, Nines and Fives
Seat 2: DRGODOY (button) folded before Flop (didn't bet)
Seat 3: emilycant5 (small blind) showed [Jc Js] and won (760) with two pair, Jacks and Nines



