PokerStars Hand #253882761323: Tournament #3834697011, $0.46+$0.04 USD Hold'em No Limit - Level I (10/20) - 2024/12/16 16:58:15 CET [2024/12/16 10:58:15 ET]
Table '3834697011 1' 3-max Seat #1 is the button
Seat 1: zjjeb (500 in chips) 
Seat 2: Mahu2021 (500 in chips) 
Seat 3: wala899 (500 in chips) 
Mahu2021: posts small blind 10
wala899: posts big blind 20
*** HOLE CARDS ***
Dealt to Mahu2021 [Ad Th]
zjjeb: folds 
Mahu2021: raises 40 to 60
wala899: raises 40 to 100
Mahu2021: calls 40
*** FLOP *** [5s Qc Jd]
Mahu2021: checks 
wala899: checks 
*** TURN *** [5s Qc Jd] [4h]
Mahu2021: checks 
wala899: checks 
*** RIVER *** [5s Qc Jd 4h] [Jh]
Mahu2021: bets 40
wala899: calls 40
*** SHOW DOWN ***
Mahu2021: shows [Ad Th] (a pair of Jacks)
wala899: shows [6s 6h] (two pair, Jacks and Sixes)
wala899 collected 280 from pot
*** SUMMARY ***
Total pot 280 | Rake 0 
Board [5s Qc Jd 4h Jh]
Seat 1: zjjeb (button) folded before Flop (didn't bet)
Seat 2: Mahu2021 (small blind) showed [Ad Th] and lost with a pair of Jacks
Seat 3: wala899 (big blind) showed [6s 6h] and won (280) with two pair, Jacks and Sixes



PokerStars Hand #253882765013: Tournament #3834697011, $0.46+$0.04 USD Hold'em No Limit - Level I (10/20) - 2024/12/16 16:58:39 CET [2024/12/16 10:58:39 ET]
Table '3834697011 1' 3-max Seat #2 is the button
Seat 1: zjjeb (500 in chips) 
Seat 2: Mahu2021 (360 in chips) 
Seat 3: wala899 (640 in chips) 
wala899: posts small blind 10
zjjeb: posts big blind 20
*** HOLE CARDS ***
Dealt to Mahu2021 [Kd Td]
Mahu2021: raises 20 to 40
wala899: calls 30
zjjeb: calls 20
*** FLOP *** [Tc 7h 9s]
wala899: checks 
zjjeb: checks 
Mahu2021: bets 320 and is all-in
wala899: folds 
zjjeb: folds 
Uncalled bet (320) returned to Mahu2021
Mahu2021 collected 120 from pot
Mahu2021: doesn't show hand 
*** SUMMARY ***
Total pot 120 | Rake 0 
Board [Tc 7h 9s]
Seat 1: zjjeb (big blind) folded on the Flop
Seat 2: Mahu2021 (button) collected (120)
Seat 3: wala899 (small blind) folded on the Flop



PokerStars Hand #253882768507: Tournament #3834697011, $0.46+$0.04 USD Hold'em No Limit - Level I (10/20) - 2024/12/16 16:59:01 CET [2024/12/16 10:59:01 ET]
Table '3834697011 1' 3-max Seat #3 is the button
Seat 1: zjjeb (460 in chips) 
Seat 2: Mahu2021 (440 in chips) 
Seat 3: wala899 (600 in chips) 
zjjeb: posts small blind 10
Mahu2021: posts big blind 20
*** HOLE CARDS ***
Dealt to Mahu2021 [Tc 6s]
wala899: folds 
zjjeb: calls 10
Mahu2021: checks 
*** FLOP *** [Kc 8c Ah]
zjjeb: checks 
Mahu2021: checks 
*** TURN *** [Kc 8c Ah] [3d]
zjjeb: checks 
Mahu2021: checks 
*** RIVER *** [Kc 8c Ah 3d] [5h]
zjjeb: checks 
Mahu2021: checks 
*** SHOW DOWN ***
zjjeb: shows [2s Js] (high card Ace)
Mahu2021: mucks hand 
zjjeb collected 40 from pot
*** SUMMARY ***
Total pot 40 | Rake 0 
Board [Kc 8c Ah 3d 5h]
Seat 1: zjjeb (small blind) showed [2s Js] and won (40) with high card Ace
Seat 2: Mahu2021 (big blind) mucked [Tc 6s]
Seat 3: wala899 (button) folded before Flop (didn't bet)



PokerStars Hand #253882770747: Tournament #3834697011, $0.46+$0.04 USD Hold'em No Limit - Level I (10/20) - 2024/12/16 16:59:16 CET [2024/12/16 10:59:16 ET]
Table '3834697011 1' 3-max Seat #1 is the button
Seat 1: zjjeb (480 in chips) 
Seat 2: Mahu2021 (420 in chips) 
Seat 3: wala899 (600 in chips) 
Mahu2021: posts small blind 10
wala899: posts big blind 20
*** HOLE CARDS ***
Dealt to Mahu2021 [8h 9h]
zjjeb: folds 
Mahu2021: raises 20 to 40
wala899: calls 20
*** FLOP *** [Jc 2c Js]
Mahu2021: checks 
wala899: checks 
*** TURN *** [Jc 2c Js] [Td]
Mahu2021: bets 40
wala899: calls 40
*** RIVER *** [Jc 2c Js Td] [6c]
Mahu2021: checks 
wala899: checks 
*** SHOW DOWN ***
Mahu2021: shows [8h 9h] (a pair of Jacks)
wala899: shows [4h 4c] (two pair, Jacks and Fours)
wala899 collected 160 from pot
*** SUMMARY ***
Total pot 160 | Rake 0 
Board [Jc 2c Js Td 6c]
Seat 1: zjjeb (button) folded before Flop (didn't bet)
Seat 2: Mahu2021 (small blind) showed [8h 9h] and lost with a pair of Jacks
Seat 3: wala899 (big blind) showed [4h 4c] and won (160) with two pair, Jacks and Fours



PokerStars Hand #253882774297: Tournament #3834697011, $0.46+$0.04 USD Hold'em No Limit - Level I (10/20) - 2024/12/16 16:59:38 CET [2024/12/16 10:59:38 ET]
Table '3834697011 1' 3-max Seat #2 is the button
Seat 1: zjjeb (480 in chips) 
Seat 2: Mahu2021 (340 in chips) 
Seat 3: wala899 (680 in chips) 
wala899: posts small blind 10
zjjeb: posts big blind 20
*** HOLE CARDS ***
Dealt to Mahu2021 [Kd Ks]
Mahu2021: raises 40 to 60
wala899: folds 
zjjeb: calls 40
*** FLOP *** [Ts 8d 3s]
zjjeb: checks 
Mahu2021: bets 280 and is all-in
zjjeb: folds 
Uncalled bet (280) returned to Mahu2021
Mahu2021 collected 130 from pot
Mahu2021: doesn't show hand 
*** SUMMARY ***
Total pot 130 | Rake 0 
Board [Ts 8d 3s]
Seat 1: zjjeb (big blind) folded on the Flop
Seat 2: Mahu2021 (button) collected (130)
Seat 3: wala899 (small blind) folded before Flop



PokerStars Hand #253882777742: Tournament #3834697011, $0.46+$0.04 USD Hold'em No Limit - Level I (10/20) - 2024/12/16 17:00:00 CET [2024/12/16 11:00:00 ET]
Table '3834697011 1' 3-max Seat #3 is the button
Seat 1: zjjeb (420 in chips) 
Seat 2: Mahu2021 (410 in chips) 
Seat 3: wala899 (670 in chips) 
zjjeb: posts small blind 10
Mahu2021: posts big blind 20
*** HOLE CARDS ***
Dealt to Mahu2021 [8s 6d]
wala899: folds 
zjjeb: folds 
Uncalled bet (10) returned to Mahu2021
Mahu2021 collected 20 from pot
Mahu2021: doesn't show hand 
*** SUMMARY ***
Total pot 20 | Rake 0 
Seat 1: zjjeb (small blind) folded before Flop
Seat 2: Mahu2021 (big blind) collected (20)
Seat 3: wala899 (button) folded before Flop (didn't bet)



PokerStars Hand #253882778735: Tournament #3834697011, $0.46+$0.04 USD Hold'em No Limit - Level I (10/20) - 2024/12/16 17:00:06 CET [2024/12/16 11:00:06 ET]
Table '3834697011 1' 3-max Seat #1 is the button
Seat 1: zjjeb (410 in chips) 
Seat 2: Mahu2021 (420 in chips) 
Seat 3: wala899 (670 in chips) 
Mahu2021: posts small blind 10
wala899: posts big blind 20
*** HOLE CARDS ***
Dealt to Mahu2021 [Ks 8c]
zjjeb: folds 
Mahu2021: raises 20 to 40
wala899: folds 
Uncalled bet (20) returned to Mahu2021
Mahu2021 collected 40 from pot
Mahu2021: doesn't show hand 
*** SUMMARY ***
Total pot 40 | Rake 0 
Seat 1: zjjeb (button) folded before Flop (didn't bet)
Seat 2: Mahu2021 (small blind) collected (40)
Seat 3: wala899 (big blind) folded before Flop



PokerStars Hand #253882779941: Tournament #3834697011, $0.46+$0.04 USD Hold'em No Limit - Level I (10/20) - 2024/12/16 17:00:14 CET [2024/12/16 11:00:14 ET]
Table '3834697011 1' 3-max Seat #2 is the button
Seat 1: zjjeb (410 in chips) 
Seat 2: Mahu2021 (440 in chips) 
Seat 3: wala899 (650 in chips) 
wala899: posts small blind 10
zjjeb: posts big blind 20
*** HOLE CARDS ***
Dealt to Mahu2021 [Td Qd]
Mahu2021: raises 20 to 40
wala899: folds 
zjjeb: calls 20
*** FLOP *** [8d Js 6d]
zjjeb: checks 
Mahu2021: bets 40
zjjeb: calls 40
*** TURN *** [8d Js 6d] [Kh]
zjjeb: checks 
Mahu2021: bets 40
zjjeb: raises 290 to 330 and is all-in
Mahu2021: calls 290
*** RIVER *** [8d Js 6d Kh] [8c]
*** SHOW DOWN ***
zjjeb: shows [9d Ks] (two pair, Kings and Eights)
Mahu2021: shows [Td Qd] (a pair of Eights)
zjjeb collected 830 from pot
*** SUMMARY ***
Total pot 830 | Rake 0 
Board [8d Js 6d Kh 8c]
Seat 1: zjjeb (big blind) showed [9d Ks] and won (830) with two pair, Kings and Eights
Seat 2: Mahu2021 (button) showed [Td Qd] and lost with a pair of Eights
Seat 3: wala899 (small blind) folded before Flop



PokerStars Hand #253882786256: Tournament #3834697011, $0.46+$0.04 USD Hold'em No Limit - Level II (15/30) - 2024/12/16 17:00:51 CET [2024/12/16 11:00:51 ET]
Table '3834697011 1' 3-max Seat #3 is the button
Seat 1: zjjeb (830 in chips) 
Seat 2: Mahu2021 (30 in chips) 
Seat 3: wala899 (640 in chips) 
zjjeb: posts small blind 15
Mahu2021: posts big blind 30 and is all-in
*** HOLE CARDS ***
Dealt to Mahu2021 [2h 9h]
wala899: folds 
zjjeb: calls 15
*** FLOP *** [3c Th As]
*** TURN *** [3c Th As] [7d]
*** RIVER *** [3c Th As 7d] [7s]
*** SHOW DOWN ***
zjjeb: shows [6s 3h] (two pair, Sevens and Threes)
Mahu2021: shows [2h 9h] (a pair of Sevens)
zjjeb collected 60 from pot
Mahu2021 finished the tournament in 3rd place
*** SUMMARY ***
Total pot 60 | Rake 0 
Board [3c Th As 7d 7s]
Seat 1: zjjeb (small blind) showed [6s 3h] and won (60) with two pair, Sevens and Threes
Seat 2: Mahu2021 (big blind) showed [2h 9h] and lost with a pair of Sevens
Seat 3: wala899 (button) folded before Flop (didn't bet)



