PokerStars Hand #252892491016: Tournament #3811171111, $1.84+$0.16 USD Hold'em No Limit - Level I (10/20) - 2024/10/12 19:14:11 CET [2024/10/12 13:14:11 ET]
Table '3811171111 1' 3-max Seat #1 is the button
Seat 1: DeadEldric (500 in chips) 
Seat 2: tannure18 (500 in chips) 
Seat 3: Mahu2021 (500 in chips) 
tannure18: posts small blind 10
Mahu2021: posts big blind 20
*** HOLE CARDS ***
Dealt to Mahu2021 [Tc 6s]
DeadEldric: folds 
tannure18: raises 20 to 40
Mahu2021: calls 20
*** FLOP *** [9d 3d 6h]
tannure18: checks 
Mahu2021: checks 
*** TURN *** [9d 3d 6h] [Ts]
tannure18: checks 
Mahu2021: bets 80
tannure18: folds 
Uncalled bet (80) returned to Mahu2021
Mahu2021 collected 80 from pot
Mahu2021: doesn't show hand 
*** SUMMARY ***
Total pot 80 | Rake 0 
Board [9d 3d 6h Ts]
Seat 1: DeadEldric (button) folded before Flop (didn't bet)
Seat 2: tannure18 (small blind) folded on the Turn
Seat 3: Mahu2021 (big blind) collected (80)



PokerStars Hand #252892495430: Tournament #3811171111, $1.84+$0.16 USD Hold'em No Limit - Level I (10/20) - 2024/10/12 19:14:29 CET [2024/10/12 13:14:29 ET]
Table '3811171111 1' 3-max Seat #2 is the button
Seat 1: DeadEldric (500 in chips) 
Seat 2: tannure18 (460 in chips) 
Seat 3: Mahu2021 (540 in chips) 
Mahu2021: posts small blind 10
DeadEldric: posts big blind 20
*** HOLE CARDS ***
Dealt to Mahu2021 [Ks 4h]
tannure18: folds 
Mahu2021: calls 10
DeadEldric: checks 
*** FLOP *** [9c 7c Ts]
Mahu2021: checks 
DeadEldric: checks 
*** TURN *** [9c 7c Ts] [6d]
Mahu2021: checks 
DeadEldric: checks 
*** RIVER *** [9c 7c Ts 6d] [4c]
Mahu2021: bets 20
DeadEldric: calls 20
*** SHOW DOWN ***
Mahu2021: shows [Ks 4h] (a pair of Fours)
DeadEldric: shows [3h 5d] (a straight, Three to Seven)
DeadEldric collected 80 from pot
*** SUMMARY ***
Total pot 80 | Rake 0 
Board [9c 7c Ts 6d 4c]
Seat 1: DeadEldric (big blind) showed [3h 5d] and won (80) with a straight, Three to Seven
Seat 2: tannure18 (button) folded before Flop (didn't bet)
Seat 3: Mahu2021 (small blind) showed [Ks 4h] and lost with a pair of Fours



PokerStars Hand #252892499204: Tournament #3811171111, $1.84+$0.16 USD Hold'em No Limit - Level I (10/20) - 2024/10/12 19:14:43 CET [2024/10/12 13:14:43 ET]
Table '3811171111 1' 3-max Seat #3 is the button
Seat 1: DeadEldric (540 in chips) 
Seat 2: tannure18 (460 in chips) 
Seat 3: Mahu2021 (500 in chips) 
DeadEldric: posts small blind 10
tannure18: posts big blind 20
*** HOLE CARDS ***
Dealt to Mahu2021 [Ks 5s]
Mahu2021: calls 20
DeadEldric: calls 10
tannure18: checks 
*** FLOP *** [9h 7c Jh]
DeadEldric: checks 
tannure18: checks 
Mahu2021: checks 
*** TURN *** [9h 7c Jh] [Jd]
DeadEldric: checks 
tannure18: bets 40
Mahu2021: folds 
DeadEldric: calls 40
*** RIVER *** [9h 7c Jh Jd] [7s]
DeadEldric: checks 
tannure18: checks 
*** SHOW DOWN ***
DeadEldric: shows [8c 6s] (two pair, Jacks and Sevens)
tannure18: shows [Ad 2s] (two pair, Jacks and Sevens - Ace kicker)
tannure18 collected 140 from pot
*** SUMMARY ***
Total pot 140 | Rake 0 
Board [9h 7c Jh Jd 7s]
Seat 1: DeadEldric (small blind) showed [8c 6s] and lost with two pair, Jacks and Sevens
Seat 2: tannure18 (big blind) showed [Ad 2s] and won (140) with two pair, Jacks and Sevens
Seat 3: Mahu2021 (button) folded on the Turn



PokerStars Hand #252892505255: Tournament #3811171111, $1.84+$0.16 USD Hold'em No Limit - Level I (10/20) - 2024/10/12 19:15:06 CET [2024/10/12 13:15:06 ET]
Table '3811171111 1' 3-max Seat #1 is the button
Seat 1: DeadEldric (480 in chips) 
Seat 2: tannure18 (540 in chips) 
Seat 3: Mahu2021 (480 in chips) 
tannure18: posts small blind 10
Mahu2021: posts big blind 20
*** HOLE CARDS ***
Dealt to Mahu2021 [Td Jh]
DeadEldric: folds 
tannure18: folds 
Uncalled bet (10) returned to Mahu2021
Mahu2021 collected 20 from pot
Mahu2021: doesn't show hand 
*** SUMMARY ***
Total pot 20 | Rake 0 
Seat 1: DeadEldric (button) folded before Flop (didn't bet)
Seat 2: tannure18 (small blind) folded before Flop
Seat 3: Mahu2021 (big blind) collected (20)



PokerStars Hand #252892507102: Tournament #3811171111, $1.84+$0.16 USD Hold'em No Limit - Level I (10/20) - 2024/10/12 19:15:13 CET [2024/10/12 13:15:13 ET]
Table '3811171111 1' 3-max Seat #2 is the button
Seat 1: DeadEldric (480 in chips) 
Seat 2: tannure18 (530 in chips) 
Seat 3: Mahu2021 (490 in chips) 
Mahu2021: posts small blind 10
DeadEldric: posts big blind 20
*** HOLE CARDS ***
Dealt to Mahu2021 [4d 6c]
tannure18: raises 20 to 40
Mahu2021: folds 
DeadEldric: raises 100 to 140
tannure18: folds 
Uncalled bet (100) returned to DeadEldric
DeadEldric collected 90 from pot
DeadEldric: doesn't show hand 
*** SUMMARY ***
Total pot 90 | Rake 0 
Seat 1: DeadEldric (big blind) collected (90)
Seat 2: tannure18 (button) folded before Flop
Seat 3: Mahu2021 (small blind) folded before Flop



PokerStars Hand #252892512464: Tournament #3811171111, $1.84+$0.16 USD Hold'em No Limit - Level I (10/20) - 2024/10/12 19:15:33 CET [2024/10/12 13:15:33 ET]
Table '3811171111 1' 3-max Seat #3 is the button
Seat 1: DeadEldric (530 in chips) 
Seat 2: tannure18 (490 in chips) 
Seat 3: Mahu2021 (480 in chips) 
DeadEldric: posts small blind 10
tannure18: posts big blind 20
*** HOLE CARDS ***
Dealt to Mahu2021 [7d Tc]
Mahu2021: folds 
DeadEldric: raises 20 to 40
tannure18: calls 20
*** FLOP *** [9s 4s Jd]
DeadEldric: bets 40
tannure18: calls 40
*** TURN *** [9s 4s Jd] [Qs]
DeadEldric: checks 
tannure18: bets 80
DeadEldric: folds 
Uncalled bet (80) returned to tannure18
tannure18 collected 160 from pot
tannure18: doesn't show hand 
*** SUMMARY ***
Total pot 160 | Rake 0 
Board [9s 4s Jd Qs]
Seat 1: DeadEldric (small blind) folded on the Turn
Seat 2: tannure18 (big blind) collected (160)
Seat 3: Mahu2021 (button) folded before Flop (didn't bet)



PokerStars Hand #252892517693: Tournament #3811171111, $1.84+$0.16 USD Hold'em No Limit - Level I (10/20) - 2024/10/12 19:15:52 CET [2024/10/12 13:15:52 ET]
Table '3811171111 1' 3-max Seat #1 is the button
Seat 1: DeadEldric (450 in chips) 
Seat 2: tannure18 (570 in chips) 
Seat 3: Mahu2021 (480 in chips) 
tannure18: posts small blind 10
Mahu2021: posts big blind 20
*** HOLE CARDS ***
Dealt to Mahu2021 [Td 5h]
DeadEldric: folds 
tannure18: folds 
Uncalled bet (10) returned to Mahu2021
Mahu2021 collected 20 from pot
Mahu2021: doesn't show hand 
*** SUMMARY ***
Total pot 20 | Rake 0 
Seat 1: DeadEldric (button) folded before Flop (didn't bet)
Seat 2: tannure18 (small blind) folded before Flop
Seat 3: Mahu2021 (big blind) collected (20)



PokerStars Hand #252892518810: Tournament #3811171111, $1.84+$0.16 USD Hold'em No Limit - Level I (10/20) - 2024/10/12 19:15:56 CET [2024/10/12 13:15:56 ET]
Table '3811171111 1' 3-max Seat #2 is the button
Seat 1: DeadEldric (450 in chips) 
Seat 2: tannure18 (560 in chips) 
Seat 3: Mahu2021 (490 in chips) 
Mahu2021: posts small blind 10
DeadEldric: posts big blind 20
*** HOLE CARDS ***
Dealt to Mahu2021 [Td 9d]
tannure18: raises 20 to 40
Mahu2021: calls 30
DeadEldric: calls 20
*** FLOP *** [Ac Th 9h]
Mahu2021: checks 
DeadEldric: checks 
tannure18: bets 60
Mahu2021: raises 390 to 450 and is all-in
DeadEldric: folds 
tannure18: calls 390
*** TURN *** [Ac Th 9h] [4h]
*** RIVER *** [Ac Th 9h 4h] [Ad]
*** SHOW DOWN ***
Mahu2021: shows [Td 9d] (two pair, Aces and Tens)
tannure18: shows [7d Ah] (three of a kind, Aces)
tannure18 collected 1020 from pot
Mahu2021 finished the tournament in 3rd place
*** SUMMARY ***
Total pot 1020 | Rake 0 
Board [Ac Th 9h 4h Ad]
Seat 1: DeadEldric (big blind) folded on the Flop
Seat 2: tannure18 (button) showed [7d Ah] and won (1020) with three of a kind, Aces
Seat 3: Mahu2021 (small blind) showed [Td 9d] and lost with two pair, Aces and Tens



