PokerStars Hand #248507559699: Tournament #3707072995, $1.84+$0.16 USD Hold'em No Limit - Level I (10/20) - 2024/01/26 17:54:16 CET [2024/01/26 11:54:16 ET]
Table '3707072995 1' 3-max Seat #1 is the button
Seat 1: Pe4a77 (500 in chips) 
Seat 2: Mahu2021 (500 in chips) 
Seat 3: AleBartolome (500 in chips) 
Mahu2021: posts small blind 10
AleBartolome: posts big blind 20
*** HOLE CARDS ***
Dealt to Mahu2021 [Ts 9d]
Pe4a77: folds 
Mahu2021: calls 10
AleBartolome: raises 40 to 60
Mahu2021: folds 
Uncalled bet (40) returned to AleBartolome
AleBartolome collected 40 from pot
*** SUMMARY ***
Total pot 40 | Rake 0 
Seat 1: Pe4a77 (button) folded before Flop (didn't bet)
Seat 2: Mahu2021 (small blind) folded before Flop
Seat 3: AleBartolome (big blind) collected (40)



PokerStars Hand #248507562678: Tournament #3707072995, $1.84+$0.16 USD Hold'em No Limit - Level I (10/20) - 2024/01/26 17:54:26 CET [2024/01/26 11:54:26 ET]
Table '3707072995 1' 3-max Seat #2 is the button
Seat 1: Pe4a77 (500 in chips) 
Seat 2: Mahu2021 (480 in chips) 
Seat 3: AleBartolome (520 in chips) 
AleBartolome: posts small blind 10
Pe4a77: posts big blind 20
*** HOLE CARDS ***
Dealt to Mahu2021 [4d 9s]
Mahu2021: folds 
AleBartolome: raises 500 to 520 and is all-in
Pe4a77: folds 
Uncalled bet (500) returned to AleBartolome
AleBartolome collected 40 from pot
*** SUMMARY ***
Total pot 40 | Rake 0 
Seat 1: Pe4a77 (big blind) folded before Flop
Seat 2: Mahu2021 (button) folded before Flop (didn't bet)
Seat 3: AleBartolome (small blind) collected (40)



PokerStars Hand #248507564917: Tournament #3707072995, $1.84+$0.16 USD Hold'em No Limit - Level I (10/20) - 2024/01/26 17:54:35 CET [2024/01/26 11:54:35 ET]
Table '3707072995 1' 3-max Seat #3 is the button
Seat 1: Pe4a77 (480 in chips) 
Seat 2: Mahu2021 (480 in chips) 
Seat 3: AleBartolome (540 in chips) 
Pe4a77: posts small blind 10
Mahu2021: posts big blind 20
*** HOLE CARDS ***
Dealt to Mahu2021 [5c Ks]
AleBartolome: raises 20 to 40
Pe4a77: calls 30
Mahu2021: calls 20
*** FLOP *** [9s 9c 2h]
Pe4a77: checks 
Mahu2021: checks 
AleBartolome: checks 
*** TURN *** [9s 9c 2h] [Qd]
Pe4a77: checks 
Mahu2021: checks 
AleBartolome: bets 90
Pe4a77: calls 90
Mahu2021: folds 
*** RIVER *** [9s 9c 2h Qd] [6h]
Pe4a77: checks 
AleBartolome: bets 225
Pe4a77: folds 
Uncalled bet (225) returned to AleBartolome
AleBartolome collected 300 from pot
*** SUMMARY ***
Total pot 300 | Rake 0 
Board [9s 9c 2h Qd 6h]
Seat 1: Pe4a77 (small blind) folded on the River
Seat 2: Mahu2021 (big blind) folded on the Turn
Seat 3: AleBartolome (button) collected (300)



PokerStars Hand #248507576125: Tournament #3707072995, $1.84+$0.16 USD Hold'em No Limit - Level I (10/20) - 2024/01/26 17:55:17 CET [2024/01/26 11:55:17 ET]
Table '3707072995 1' 3-max Seat #1 is the button
Seat 1: Pe4a77 (350 in chips) 
Seat 2: Mahu2021 (440 in chips) 
Seat 3: AleBartolome (710 in chips) 
Mahu2021: posts small blind 10
AleBartolome: posts big blind 20
*** HOLE CARDS ***
Dealt to Mahu2021 [Ad Kh]
Pe4a77: calls 20
Mahu2021: raises 40 to 60
AleBartolome: folds 
Pe4a77: calls 40
*** FLOP *** [5d Tc Jc]
Mahu2021: checks 
Pe4a77: checks 
*** TURN *** [5d Tc Jc] [5h]
Mahu2021: checks 
Pe4a77: bets 90
Mahu2021: calls 90
*** RIVER *** [5d Tc Jc 5h] [4h]
Mahu2021: checks 
Pe4a77: bets 160
Mahu2021: folds 
Uncalled bet (160) returned to Pe4a77
Pe4a77 collected 320 from pot
*** SUMMARY ***
Total pot 320 | Rake 0 
Board [5d Tc Jc 5h 4h]
Seat 1: Pe4a77 (button) collected (320)
Seat 2: Mahu2021 (small blind) folded on the River
Seat 3: AleBartolome (big blind) folded before Flop



PokerStars Hand #248507581593: Tournament #3707072995, $1.84+$0.16 USD Hold'em No Limit - Level I (10/20) - 2024/01/26 17:55:42 CET [2024/01/26 11:55:42 ET]
Table '3707072995 1' 3-max Seat #2 is the button
Seat 1: Pe4a77 (520 in chips) 
Seat 2: Mahu2021 (290 in chips) 
Seat 3: AleBartolome (690 in chips) 
AleBartolome: posts small blind 10
Pe4a77: posts big blind 20
*** HOLE CARDS ***
Dealt to Mahu2021 [Js 8d]
Mahu2021: folds 
AleBartolome: raises 30 to 50
Pe4a77: calls 30
*** FLOP *** [5d Th 6c]
AleBartolome: checks 
Pe4a77: checks 
*** TURN *** [5d Th 6c] [Ad]
AleBartolome: bets 50
Pe4a77: calls 50
*** RIVER *** [5d Th 6c Ad] [9s]
AleBartolome: checks 
Pe4a77: checks 
*** SHOW DOWN ***
AleBartolome: shows [Kh 5c] (a pair of Fives)
Pe4a77: shows [6d 3d] (a pair of Sixes)
Pe4a77 collected 200 from pot
*** SUMMARY ***
Total pot 200 | Rake 0 
Board [5d Th 6c Ad 9s]
Seat 1: Pe4a77 (big blind) showed [6d 3d] and won (200) with a pair of Sixes
Seat 2: Mahu2021 (button) folded before Flop (didn't bet)
Seat 3: AleBartolome (small blind) showed [Kh 5c] and lost with a pair of Fives



PokerStars Hand #248507586802: Tournament #3707072995, $1.84+$0.16 USD Hold'em No Limit - Level I (10/20) - 2024/01/26 17:56:07 CET [2024/01/26 11:56:07 ET]
Table '3707072995 1' 3-max Seat #3 is the button
Seat 1: Pe4a77 (620 in chips) 
Seat 2: Mahu2021 (290 in chips) 
Seat 3: AleBartolome (590 in chips) 
Pe4a77: posts small blind 10
Mahu2021: posts big blind 20
*** HOLE CARDS ***
Dealt to Mahu2021 [5d 9d]
AleBartolome: raises 20 to 40
Pe4a77: calls 30
Mahu2021: calls 20
*** FLOP *** [4c 4s 4d]
Pe4a77: checks 
Mahu2021: checks 
AleBartolome: bets 60
Pe4a77: calls 60
Mahu2021: folds 
*** TURN *** [4c 4s 4d] [9c]
Pe4a77: checks 
AleBartolome: checks 
*** RIVER *** [4c 4s 4d 9c] [Qs]
Pe4a77: checks 
AleBartolome: checks 
*** SHOW DOWN ***
Pe4a77: shows [Ts Ad] (three of a kind, Fours)
AleBartolome: shows [7c 7d] (a full house, Fours full of Sevens)
AleBartolome collected 240 from pot
*** SUMMARY ***
Total pot 240 | Rake 0 
Board [4c 4s 4d 9c Qs]
Seat 1: Pe4a77 (small blind) showed [Ts Ad] and lost with three of a kind, Fours
Seat 2: Mahu2021 (big blind) folded on the Flop
Seat 3: AleBartolome (button) showed [7c 7d] and won (240) with a full house, Fours full of Sevens



PokerStars Hand #248507592236: Tournament #3707072995, $1.84+$0.16 USD Hold'em No Limit - Level I (10/20) - 2024/01/26 17:56:32 CET [2024/01/26 11:56:32 ET]
Table '3707072995 1' 3-max Seat #1 is the button
Seat 1: Pe4a77 (520 in chips) 
Seat 2: Mahu2021 (250 in chips) 
Seat 3: AleBartolome (730 in chips) 
Mahu2021: posts small blind 10
AleBartolome: posts big blind 20
*** HOLE CARDS ***
Dealt to Mahu2021 [4s 7s]
Pe4a77: folds 
Mahu2021: folds 
Uncalled bet (10) returned to AleBartolome
AleBartolome collected 20 from pot
*** SUMMARY ***
Total pot 20 | Rake 0 
Seat 1: Pe4a77 (button) folded before Flop (didn't bet)
Seat 2: Mahu2021 (small blind) folded before Flop
Seat 3: AleBartolome (big blind) collected (20)



PokerStars Hand #248507593481: Tournament #3707072995, $1.84+$0.16 USD Hold'em No Limit - Level I (10/20) - 2024/01/26 17:56:37 CET [2024/01/26 11:56:37 ET]
Table '3707072995 1' 3-max Seat #2 is the button
Seat 1: Pe4a77 (520 in chips) 
Seat 2: Mahu2021 (240 in chips) 
Seat 3: AleBartolome (740 in chips) 
AleBartolome: posts small blind 10
Pe4a77: posts big blind 20
*** HOLE CARDS ***
Dealt to Mahu2021 [9c Ks]
Mahu2021: raises 40 to 60
AleBartolome: calls 50
Pe4a77: folds 
*** FLOP *** [4h 6h Qc]
AleBartolome: bets 70
Mahu2021: raises 110 to 180 and is all-in
AleBartolome: calls 110
*** TURN *** [4h 6h Qc] [3d]
*** RIVER *** [4h 6h Qc 3d] [3h]
*** SHOW DOWN ***
AleBartolome: shows [Td Qd] (two pair, Queens and Threes)
Mahu2021: shows [9c Ks] (a pair of Threes)
AleBartolome collected 500 from pot
Mahu2021 finished the tournament in 3rd place
*** SUMMARY ***
Total pot 500 | Rake 0 
Board [4h 6h Qc 3d 3h]
Seat 1: Pe4a77 (big blind) folded before Flop
Seat 2: Mahu2021 (button) showed [9c Ks] and lost with a pair of Threes
Seat 3: AleBartolome (small blind) showed [Td Qd] and won (500) with two pair, Queens and Threes



