PokerStars Hand #243225856051: Tournament #3580609465, $0.92+$0.08 USD Hold'em No Limit - Level I (10/20) - 2023/04/21 15:06:59 CET [2023/04/21 9:06:59 ET]
Table '3580609465 1' 3-max Seat #1 is the button
Seat 1: jads1414 (500 in chips) 
Seat 2: Mahu2021 (500 in chips) 
Seat 3: helton=HP (500 in chips) 
Mahu2021: posts small blind 10
helton=HP: posts big blind 20
*** HOLE CARDS ***
Dealt to Mahu2021 [8c 9c]
jads1414: folds 
Mahu2021: calls 10
helton=HP: checks 
*** FLOP *** [Ad Qh 8d]
Mahu2021: bets 20
helton=HP: raises 80 to 100
Mahu2021: folds 
Uncalled bet (80) returned to helton=HP
helton=HP collected 80 from pot
*** SUMMARY ***
Total pot 80 | Rake 0 
Board [Ad Qh 8d]
Seat 1: jads1414 (button) folded before Flop (didn't bet)
Seat 2: Mahu2021 (small blind) folded on the Flop
Seat 3: helton=HP (big blind) collected (80)



PokerStars Hand #243225860912: Tournament #3580609465, $0.92+$0.08 USD Hold'em No Limit - Level I (10/20) - 2023/04/21 15:07:21 CET [2023/04/21 9:07:21 ET]
Table '3580609465 1' 3-max Seat #2 is the button
Seat 1: jads1414 (500 in chips) 
Seat 2: Mahu2021 (460 in chips) 
Seat 3: helton=HP (540 in chips) 
helton=HP: posts small blind 10
jads1414: posts big blind 20
*** HOLE CARDS ***
Dealt to Mahu2021 [9d 6s]
Mahu2021: folds 
helton=HP: calls 10
jads1414: checks 
*** FLOP *** [9h Js 4s]
helton=HP: bets 80
jads1414: folds 
Uncalled bet (80) returned to helton=HP
helton=HP collected 40 from pot
*** SUMMARY ***
Total pot 40 | Rake 0 
Board [9h Js 4s]
Seat 1: jads1414 (big blind) folded on the Flop
Seat 2: Mahu2021 (button) folded before Flop (didn't bet)
Seat 3: helton=HP (small blind) collected (40)



PokerStars Hand #243225864687: Tournament #3580609465, $0.92+$0.08 USD Hold'em No Limit - Level I (10/20) - 2023/04/21 15:07:38 CET [2023/04/21 9:07:38 ET]
Table '3580609465 1' 3-max Seat #3 is the button
Seat 1: jads1414 (480 in chips) 
Seat 2: Mahu2021 (460 in chips) 
Seat 3: helton=HP (560 in chips) 
jads1414: posts small blind 10
Mahu2021: posts big blind 20
*** HOLE CARDS ***
Dealt to Mahu2021 [4c Ah]
helton=HP: folds 
jads1414: raises 20 to 40
Mahu2021: calls 20
*** FLOP *** [Ks 9d 6c]
jads1414: bets 20
Mahu2021: calls 20
*** TURN *** [Ks 9d 6c] [4h]
jads1414: bets 78
Mahu2021: folds 
Uncalled bet (78) returned to jads1414
jads1414 collected 120 from pot
jads1414: doesn't show hand 
*** SUMMARY ***
Total pot 120 | Rake 0 
Board [Ks 9d 6c 4h]
Seat 1: jads1414 (small blind) collected (120)
Seat 2: Mahu2021 (big blind) folded on the Turn
Seat 3: helton=HP (button) folded before Flop (didn't bet)



PokerStars Hand #243225870364: Tournament #3580609465, $0.92+$0.08 USD Hold'em No Limit - Level I (10/20) - 2023/04/21 15:08:04 CET [2023/04/21 9:08:04 ET]
Table '3580609465 1' 3-max Seat #1 is the button
Seat 1: jads1414 (540 in chips) 
Seat 2: Mahu2021 (400 in chips) 
Seat 3: helton=HP (560 in chips) 
Mahu2021: posts small blind 10
helton=HP: posts big blind 20
*** HOLE CARDS ***
Dealt to Mahu2021 [7c 4d]
jads1414: raises 20 to 40
Mahu2021: folds 
helton=HP: calls 20
*** FLOP *** [6h 5h 4h]
helton=HP: bets 520 and is all-in
jads1414: folds 
Uncalled bet (520) returned to helton=HP
helton=HP collected 90 from pot
*** SUMMARY ***
Total pot 90 | Rake 0 
Board [6h 5h 4h]
Seat 1: jads1414 (button) folded on the Flop
Seat 2: Mahu2021 (small blind) folded before Flop
Seat 3: helton=HP (big blind) collected (90)



PokerStars Hand #243225874753: Tournament #3580609465, $0.92+$0.08 USD Hold'em No Limit - Level I (10/20) - 2023/04/21 15:08:24 CET [2023/04/21 9:08:24 ET]
Table '3580609465 1' 3-max Seat #2 is the button
Seat 1: jads1414 (500 in chips) 
Seat 2: Mahu2021 (390 in chips) 
Seat 3: helton=HP (610 in chips) 
helton=HP: posts small blind 10
jads1414: posts big blind 20
*** HOLE CARDS ***
Dealt to Mahu2021 [Js Th]
Mahu2021: calls 20
helton=HP: calls 10
jads1414: checks 
*** FLOP *** [9s Kc Ac]
helton=HP: checks 
jads1414: checks 
Mahu2021: checks 
*** TURN *** [9s Kc Ac] [Kd]
helton=HP: checks 
jads1414: checks 
Mahu2021: bets 60
helton=HP: folds 
jads1414: folds 
Uncalled bet (60) returned to Mahu2021
Mahu2021 collected 60 from pot
Mahu2021: doesn't show hand 
*** SUMMARY ***
Total pot 60 | Rake 0 
Board [9s Kc Ac Kd]
Seat 1: jads1414 (big blind) folded on the Turn
Seat 2: Mahu2021 (button) collected (60)
Seat 3: helton=HP (small blind) folded on the Turn



PokerStars Hand #243225881161: Tournament #3580609465, $0.92+$0.08 USD Hold'em No Limit - Level I (10/20) - 2023/04/21 15:08:54 CET [2023/04/21 9:08:54 ET]
Table '3580609465 1' 3-max Seat #3 is the button
Seat 1: jads1414 (480 in chips) 
Seat 2: Mahu2021 (430 in chips) 
Seat 3: helton=HP (590 in chips) 
jads1414: posts small blind 10
Mahu2021: posts big blind 20
*** HOLE CARDS ***
Dealt to Mahu2021 [6s Qc]
helton=HP: folds 
jads1414: raises 20 to 40
Mahu2021: calls 20
*** FLOP *** [Ts 9h Qs]
jads1414: bets 20
Mahu2021: raises 60 to 80
jads1414: calls 60
*** TURN *** [Ts 9h Qs] [3d]
jads1414: checks 
Mahu2021: bets 310 and is all-in
jads1414: calls 310
*** RIVER *** [Ts 9h Qs 3d] [2c]
*** SHOW DOWN ***
jads1414: shows [Qh Jc] (a pair of Queens)
Mahu2021: shows [6s Qc] (a pair of Queens - lower kicker)
jads1414 collected 860 from pot
Mahu2021 finished the tournament in 3rd place
*** SUMMARY ***
Total pot 860 | Rake 0 
Board [Ts 9h Qs 3d 2c]
Seat 1: jads1414 (small blind) showed [Qh Jc] and won (860) with a pair of Queens
Seat 2: Mahu2021 (big blind) showed [6s Qc] and lost with a pair of Queens
Seat 3: helton=HP (button) folded before Flop (didn't bet)



