PokerStars Hand #244510290079: Tournament #3609969638, $0.92+$0.08 USD Hold'em No Limit - Level I (10/20) - 2023/06/28 16:22:05 CET [2023/06/28 10:22:05 ET]
Table '3609969638 1' 3-max Seat #1 is the button
Seat 1: Pufu76 (500 in chips) 
Seat 2: Mahu2021 (500 in chips) 
Seat 3: Nomad857 (500 in chips) 
Mahu2021: posts small blind 10
Nomad857: posts big blind 20
*** HOLE CARDS ***
Dealt to Mahu2021 [Kd As]
Pufu76: folds 
Mahu2021: raises 40 to 60
Nomad857: calls 40
*** FLOP *** [6d Jc 8d]
Mahu2021: checks 
Nomad857: checks 
*** TURN *** [6d Jc 8d] [5s]
Mahu2021: checks 
Nomad857: bets 20
Mahu2021: calls 20
*** RIVER *** [6d Jc 8d 5s] [Js]
Mahu2021: checks 
Nomad857: checks 
*** SHOW DOWN ***
Mahu2021: shows [Kd As] (a pair of Jacks)
Nomad857: mucks hand 
Mahu2021 collected 160 from pot
*** SUMMARY ***
Total pot 160 | Rake 0 
Board [6d Jc 8d 5s Js]
Seat 1: Pufu76 (button) folded before Flop (didn't bet)
Seat 2: Mahu2021 (small blind) showed [Kd As] and won (160) with a pair of Jacks
Seat 3: Nomad857 (big blind) mucked [7d Kc]



PokerStars Hand #244510294964: Tournament #3609969638, $0.92+$0.08 USD Hold'em No Limit - Level I (10/20) - 2023/06/28 16:22:28 CET [2023/06/28 10:22:28 ET]
Table '3609969638 1' 3-max Seat #2 is the button
Seat 1: Pufu76 (500 in chips) 
Seat 2: Mahu2021 (580 in chips) 
Seat 3: Nomad857 (420 in chips) 
Nomad857: posts small blind 10
Pufu76: posts big blind 20
*** HOLE CARDS ***
Dealt to Mahu2021 [Qc Ac]
Mahu2021: raises 40 to 60
Nomad857: calls 50
Pufu76: folds 
*** FLOP *** [5d 7s 3h]
Nomad857: checks 
Mahu2021: checks 
*** TURN *** [5d 7s 3h] [6c]
Nomad857: checks 
Mahu2021: checks 
*** RIVER *** [5d 7s 3h 6c] [7h]
Nomad857: checks 
Mahu2021: checks 
*** SHOW DOWN ***
Nomad857: shows [Jh 2h] (a pair of Sevens)
Mahu2021: shows [Qc Ac] (a pair of Sevens - Ace kicker)
Mahu2021 collected 140 from pot
*** SUMMARY ***
Total pot 140 | Rake 0 
Board [5d 7s 3h 6c 7h]
Seat 1: Pufu76 (big blind) folded before Flop
Seat 2: Mahu2021 (button) showed [Qc Ac] and won (140) with a pair of Sevens
Seat 3: Nomad857 (small blind) showed [Jh 2h] and lost with a pair of Sevens



PokerStars Hand #244510299806: Tournament #3609969638, $0.92+$0.08 USD Hold'em No Limit - Level I (10/20) - 2023/06/28 16:22:50 CET [2023/06/28 10:22:50 ET]
Table '3609969638 1' 3-max Seat #3 is the button
Seat 1: Pufu76 (480 in chips) 
Seat 2: Mahu2021 (660 in chips) 
Seat 3: Nomad857 (360 in chips) 
Pufu76: posts small blind 10
Mahu2021: posts big blind 20
*** HOLE CARDS ***
Dealt to Mahu2021 [Kc Ah]
Nomad857: calls 20
Pufu76: calls 10
Mahu2021: raises 80 to 100
Nomad857: calls 80
Pufu76: folds 
*** FLOP *** [Tc 7h Jc]
Mahu2021: bets 560 and is all-in
Nomad857: folds 
Uncalled bet (560) returned to Mahu2021
Mahu2021 collected 220 from pot
Mahu2021: doesn't show hand 
*** SUMMARY ***
Total pot 220 | Rake 0 
Board [Tc 7h Jc]
Seat 1: Pufu76 (small blind) folded before Flop
Seat 2: Mahu2021 (big blind) collected (220)
Seat 3: Nomad857 (button) folded on the Flop



PokerStars Hand #244510305533: Tournament #3609969638, $0.92+$0.08 USD Hold'em No Limit - Level I (10/20) - 2023/06/28 16:23:16 CET [2023/06/28 10:23:16 ET]
Table '3609969638 1' 3-max Seat #1 is the button
Seat 1: Pufu76 (460 in chips) 
Seat 2: Mahu2021 (780 in chips) 
Seat 3: Nomad857 (260 in chips) 
Mahu2021: posts small blind 10
Nomad857: posts big blind 20
*** HOLE CARDS ***
Dealt to Mahu2021 [5s 3d]
Pufu76: raises 440 to 460 and is all-in
Mahu2021: folds 
Nomad857: folds 
Uncalled bet (440) returned to Pufu76
Pufu76 collected 50 from pot
Pufu76: doesn't show hand 
*** SUMMARY ***
Total pot 50 | Rake 0 
Seat 1: Pufu76 (button) collected (50)
Seat 2: Mahu2021 (small blind) folded before Flop
Seat 3: Nomad857 (big blind) folded before Flop



PokerStars Hand #244510307424: Tournament #3609969638, $0.92+$0.08 USD Hold'em No Limit - Level I (10/20) - 2023/06/28 16:23:25 CET [2023/06/28 10:23:25 ET]
Table '3609969638 1' 3-max Seat #2 is the button
Seat 1: Pufu76 (490 in chips) 
Seat 2: Mahu2021 (770 in chips) 
Seat 3: Nomad857 (240 in chips) 
Nomad857: posts small blind 10
Pufu76: posts big blind 20
*** HOLE CARDS ***
Dealt to Mahu2021 [As 4d]
Mahu2021: calls 20
Nomad857: raises 40 to 60
Pufu76: folds 
Mahu2021: calls 40
*** FLOP *** [Jh 8c 4h]
Nomad857: bets 20
Mahu2021: calls 20
*** TURN *** [Jh 8c 4h] [7d]
Nomad857: bets 20
Mahu2021: calls 20
*** RIVER *** [Jh 8c 4h 7d] [5s]
Nomad857: checks 
Mahu2021: checks 
*** SHOW DOWN ***
Nomad857: shows [9h Ad] (high card Ace)
Mahu2021: shows [As 4d] (a pair of Fours)
Mahu2021 collected 220 from pot
*** SUMMARY ***
Total pot 220 | Rake 0 
Board [Jh 8c 4h 7d 5s]
Seat 1: Pufu76 (big blind) folded before Flop
Seat 2: Mahu2021 (button) showed [As 4d] and won (220) with a pair of Fours
Seat 3: Nomad857 (small blind) showed [9h Ad] and lost with high card Ace



PokerStars Hand #244510312343: Tournament #3609969638, $0.92+$0.08 USD Hold'em No Limit - Level I (10/20) - 2023/06/28 16:23:47 CET [2023/06/28 10:23:47 ET]
Table '3609969638 1' 3-max Seat #3 is the button
Seat 1: Pufu76 (470 in chips) 
Seat 2: Mahu2021 (890 in chips) 
Seat 3: Nomad857 (140 in chips) 
Pufu76: posts small blind 10
Mahu2021: posts big blind 20
*** HOLE CARDS ***
Dealt to Mahu2021 [8d 2c]
Nomad857: calls 20
Pufu76: raises 450 to 470 and is all-in
Mahu2021: folds 
Nomad857: folds 
Uncalled bet (450) returned to Pufu76
Pufu76 collected 60 from pot
Pufu76: doesn't show hand 
*** SUMMARY ***
Total pot 60 | Rake 0 
Seat 1: Pufu76 (small blind) collected (60)
Seat 2: Mahu2021 (big blind) folded before Flop
Seat 3: Nomad857 (button) folded before Flop



PokerStars Hand #244510314311: Tournament #3609969638, $0.92+$0.08 USD Hold'em No Limit - Level I (10/20) - 2023/06/28 16:23:56 CET [2023/06/28 10:23:56 ET]
Table '3609969638 1' 3-max Seat #1 is the button
Seat 1: Pufu76 (510 in chips) 
Seat 2: Mahu2021 (870 in chips) 
Seat 3: Nomad857 (120 in chips) 
Mahu2021: posts small blind 10
Nomad857: posts big blind 20
*** HOLE CARDS ***
Dealt to Mahu2021 [Ks 4d]
Pufu76: folds 
Mahu2021: calls 10
Nomad857: raises 100 to 120 and is all-in
Mahu2021: calls 100
*** FLOP *** [Ts 2h Kd]
*** TURN *** [Ts 2h Kd] [Jh]
*** RIVER *** [Ts 2h Kd Jh] [2s]
*** SHOW DOWN ***
Mahu2021: shows [Ks 4d] (two pair, Kings and Deuces)
Nomad857: shows [Td Ad] (two pair, Tens and Deuces)
Mahu2021 collected 240 from pot
Nomad857 finished the tournament in 3rd place
*** SUMMARY ***
Total pot 240 | Rake 0 
Board [Ts 2h Kd Jh 2s]
Seat 1: Pufu76 (button) folded before Flop (didn't bet)
Seat 2: Mahu2021 (small blind) showed [Ks 4d] and won (240) with two pair, Kings and Deuces
Seat 3: Nomad857 (big blind) showed [Td Ad] and lost with two pair, Tens and Deuces



PokerStars Hand #244510318519: Tournament #3609969638, $0.92+$0.08 USD Hold'em No Limit - Level I (10/20) - 2023/06/28 16:24:16 CET [2023/06/28 10:24:16 ET]
Table '3609969638 1' 3-max Seat #2 is the button
Seat 1: Pufu76 (510 in chips) 
Seat 2: Mahu2021 (990 in chips) 
Mahu2021: posts small blind 10
Pufu76: posts big blind 20
*** HOLE CARDS ***
Dealt to Mahu2021 [8s Qd]
Mahu2021: raises 20 to 40
Pufu76: folds 
Uncalled bet (20) returned to Mahu2021
Mahu2021 collected 40 from pot
Mahu2021: doesn't show hand 
*** SUMMARY ***
Total pot 40 | Rake 0 
Seat 1: Pufu76 (big blind) folded before Flop
Seat 2: Mahu2021 (button) (small blind) collected (40)



