PokerStars Hand #245697146165: Tournament #3638661767, $0.92+$0.08 USD Hold'em No Limit - Level I (10/20) - 2023/08/31 20:45:40 CET [2023/08/31 14:45:40 ET]
Table '3638661767 1' 3-max Seat #1 is the button
Seat 1: JoshBilLPE (500 in chips) 
Seat 2: Bruna Gustavo (500 in chips) 
Seat 3: Mahu2021 (500 in chips) 
Bruna Gustavo: posts small blind 10
Mahu2021: posts big blind 20
*** HOLE CARDS ***
Dealt to Mahu2021 [5d Ts]
JoshBilLPE: folds 
Bruna Gustavo: calls 10
Mahu2021: checks 
*** FLOP *** [Ks Js 8c]
Bruna Gustavo: bets 20
Mahu2021: folds 
Uncalled bet (20) returned to Bruna Gustavo
Bruna Gustavo collected 40 from pot
*** SUMMARY ***
Total pot 40 | Rake 0 
Board [Ks Js 8c]
Seat 1: JoshBilLPE (button) folded before Flop (didn't bet)
Seat 2: Bruna Gustavo (small blind) collected (40)
Seat 3: Mahu2021 (big blind) folded on the Flop



PokerStars Hand #245697149766: Tournament #3638661767, $0.92+$0.08 USD Hold'em No Limit - Level I (10/20) - 2023/08/31 20:45:52 CET [2023/08/31 14:45:52 ET]
Table '3638661767 1' 3-max Seat #2 is the button
Seat 1: JoshBilLPE (500 in chips) 
Seat 2: Bruna Gustavo (520 in chips) 
Seat 3: Mahu2021 (480 in chips) 
Mahu2021: posts small blind 10
JoshBilLPE: posts big blind 20
*** HOLE CARDS ***
Dealt to Mahu2021 [Js 2s]
Bruna Gustavo: folds 
Mahu2021: calls 10
JoshBilLPE: raises 60 to 80
Mahu2021: calls 60
*** FLOP *** [Kc 6s 9d]
Mahu2021: checks 
JoshBilLPE: checks 
*** TURN *** [Kc 6s 9d] [8d]
Mahu2021: bets 40
JoshBilLPE: folds 
Uncalled bet (40) returned to Mahu2021
Mahu2021 collected 160 from pot
Mahu2021: doesn't show hand 
*** SUMMARY ***
Total pot 160 | Rake 0 
Board [Kc 6s 9d 8d]
Seat 1: JoshBilLPE (big blind) folded on the Turn
Seat 2: Bruna Gustavo (button) folded before Flop (didn't bet)
Seat 3: Mahu2021 (small blind) collected (160)



PokerStars Hand #245697162960: Tournament #3638661767, $0.92+$0.08 USD Hold'em No Limit - Level I (10/20) - 2023/08/31 20:46:34 CET [2023/08/31 14:46:34 ET]
Table '3638661767 1' 3-max Seat #3 is the button
Seat 1: JoshBilLPE (420 in chips) 
Seat 2: Bruna Gustavo (520 in chips) 
Seat 3: Mahu2021 (560 in chips) 
JoshBilLPE: posts small blind 10
Bruna Gustavo: posts big blind 20
*** HOLE CARDS ***
Dealt to Mahu2021 [8d Kh]
Mahu2021: folds 
JoshBilLPE: folds 
Uncalled bet (10) returned to Bruna Gustavo
Bruna Gustavo collected 20 from pot
*** SUMMARY ***
Total pot 20 | Rake 0 
Seat 1: JoshBilLPE (small blind) folded before Flop
Seat 2: Bruna Gustavo (big blind) collected (20)
Seat 3: Mahu2021 (button) folded before Flop (didn't bet)



PokerStars Hand #245697164983: Tournament #3638661767, $0.92+$0.08 USD Hold'em No Limit - Level I (10/20) - 2023/08/31 20:46:41 CET [2023/08/31 14:46:41 ET]
Table '3638661767 1' 3-max Seat #1 is the button
Seat 1: JoshBilLPE (410 in chips) 
Seat 2: Bruna Gustavo (530 in chips) 
Seat 3: Mahu2021 (560 in chips) 
Bruna Gustavo: posts small blind 10
Mahu2021: posts big blind 20
*** HOLE CARDS ***
Dealt to Mahu2021 [Th Qc]
JoshBilLPE: folds 
Bruna Gustavo: calls 10
Mahu2021: checks 
*** FLOP *** [8c 6s 4c]
Bruna Gustavo: checks 
Mahu2021: checks 
*** TURN *** [8c 6s 4c] [7c]
Bruna Gustavo: checks 
Mahu2021: bets 40
Bruna Gustavo: calls 40
*** RIVER *** [8c 6s 4c 7c] [7d]
Bruna Gustavo: bets 20
Mahu2021: folds 
Uncalled bet (20) returned to Bruna Gustavo
Bruna Gustavo collected 120 from pot
*** SUMMARY ***
Total pot 120 | Rake 0 
Board [8c 6s 4c 7c 7d]
Seat 1: JoshBilLPE (button) folded before Flop (didn't bet)
Seat 2: Bruna Gustavo (small blind) collected (120)
Seat 3: Mahu2021 (big blind) folded on the River



PokerStars Hand #245697171912: Tournament #3638661767, $0.92+$0.08 USD Hold'em No Limit - Level I (10/20) - 2023/08/31 20:47:02 CET [2023/08/31 14:47:02 ET]
Table '3638661767 1' 3-max Seat #2 is the button
Seat 1: JoshBilLPE (410 in chips) 
Seat 2: Bruna Gustavo (590 in chips) 
Seat 3: Mahu2021 (500 in chips) 
Mahu2021: posts small blind 10
JoshBilLPE: posts big blind 20
*** HOLE CARDS ***
Dealt to Mahu2021 [As 2c]
Bruna Gustavo: calls 20
Mahu2021: calls 10
JoshBilLPE: raises 40 to 60
Bruna Gustavo: calls 40
Mahu2021: calls 40
*** FLOP *** [Qh 5h 9d]
Mahu2021: checks 
JoshBilLPE: bets 80
Bruna Gustavo: calls 80
Mahu2021: folds 
*** TURN *** [Qh 5h 9d] [2h]
JoshBilLPE: bets 270 and is all-in
Bruna Gustavo: calls 270
*** RIVER *** [Qh 5h 9d 2h] [7s]
*** SHOW DOWN ***
JoshBilLPE: shows [Ad Ac] (a pair of Aces)
Bruna Gustavo: shows [Jc 9h] (a pair of Nines)
JoshBilLPE collected 880 from pot
*** SUMMARY ***
Total pot 880 | Rake 0 
Board [Qh 5h 9d 2h 7s]
Seat 1: JoshBilLPE (big blind) showed [Ad Ac] and won (880) with a pair of Aces
Seat 2: Bruna Gustavo (button) showed [Jc 9h] and lost with a pair of Nines
Seat 3: Mahu2021 (small blind) folded on the Flop



PokerStars Hand #245697184295: Tournament #3638661767, $0.92+$0.08 USD Hold'em No Limit - Level I (10/20) - 2023/08/31 20:47:42 CET [2023/08/31 14:47:42 ET]
Table '3638661767 1' 3-max Seat #3 is the button
Seat 1: JoshBilLPE (880 in chips) 
Seat 2: Bruna Gustavo (180 in chips) 
Seat 3: Mahu2021 (440 in chips) 
JoshBilLPE: posts small blind 10
Bruna Gustavo: posts big blind 20
*** HOLE CARDS ***
Dealt to Mahu2021 [4d Ad]
Mahu2021: raises 20 to 40
JoshBilLPE: folds 
Bruna Gustavo: raises 140 to 180 and is all-in
Mahu2021: calls 140
*** FLOP *** [Tc 7s Js]
*** TURN *** [Tc 7s Js] [5c]
*** RIVER *** [Tc 7s Js 5c] [8d]
*** SHOW DOWN ***
Bruna Gustavo: shows [2c 2d] (a pair of Deuces)
Mahu2021: shows [4d Ad] (high card Ace)
Bruna Gustavo collected 370 from pot
*** SUMMARY ***
Total pot 370 | Rake 0 
Board [Tc 7s Js 5c 8d]
Seat 1: JoshBilLPE (small blind) folded before Flop
Seat 2: Bruna Gustavo (big blind) showed [2c 2d] and won (370) with a pair of Deuces
Seat 3: Mahu2021 (button) showed [4d Ad] and lost with high card Ace



PokerStars Hand #245697189045: Tournament #3638661767, $0.92+$0.08 USD Hold'em No Limit - Level I (10/20) - 2023/08/31 20:47:57 CET [2023/08/31 14:47:57 ET]
Table '3638661767 1' 3-max Seat #1 is the button
Seat 1: JoshBilLPE (870 in chips) 
Seat 2: Bruna Gustavo (370 in chips) 
Seat 3: Mahu2021 (260 in chips) 
Bruna Gustavo: posts small blind 10
Mahu2021: posts big blind 20
*** HOLE CARDS ***
Dealt to Mahu2021 [Td 3c]
JoshBilLPE: folds 
Bruna Gustavo: calls 10
Mahu2021: checks 
*** FLOP *** [4d 3s 5h]
Bruna Gustavo: bets 20
Mahu2021: raises 220 to 240 and is all-in
Bruna Gustavo: calls 220
*** TURN *** [4d 3s 5h] [4s]
*** RIVER *** [4d 3s 5h 4s] [Qc]
*** SHOW DOWN ***
Bruna Gustavo: shows [5c Tc] (two pair, Fives and Fours)
Mahu2021: shows [Td 3c] (two pair, Fours and Threes)
Bruna Gustavo collected 520 from pot
Mahu2021 finished the tournament in 3rd place
*** SUMMARY ***
Total pot 520 | Rake 0 
Board [4d 3s 5h 4s Qc]
Seat 1: JoshBilLPE (button) folded before Flop (didn't bet)
Seat 2: Bruna Gustavo (small blind) showed [5c Tc] and won (520) with two pair, Fives and Fours
Seat 3: Mahu2021 (big blind) showed [Td 3c] and lost with two pair, Fours and Threes



