PokerStars Hand #243267877888: Tournament #3581558546, $0.92+$0.08 USD Hold'em No Limit - Level I (10/20) - 2023/04/23 16:11:56 CET [2023/04/23 10:11:56 ET]
Table '3581558546 1' 3-max Seat #1 is the button
Seat 1: arkanprod (500 in chips) 
Seat 2: Mahu2021 (500 in chips) 
Seat 3: Wildstyler001 (500 in chips) 
Mahu2021: posts small blind 10
Wildstyler001: posts big blind 20
*** HOLE CARDS ***
Dealt to Mahu2021 [3s 4d]
arkanprod: raises 20 to 40
Mahu2021: calls 30
Wildstyler001: folds 
*** FLOP *** [Th 2h 8c]
Mahu2021: checks 
arkanprod: checks 
*** TURN *** [Th 2h 8c] [Qc]
Mahu2021: checks 
arkanprod: checks 
*** RIVER *** [Th 2h 8c Qc] [4c]
Mahu2021: bets 40
arkanprod: folds 
Uncalled bet (40) returned to Mahu2021
Mahu2021 collected 100 from pot
Mahu2021: doesn't show hand 
*** SUMMARY ***
Total pot 100 | Rake 0 
Board [Th 2h 8c Qc 4c]
Seat 1: arkanprod (button) folded on the River
Seat 2: Mahu2021 (small blind) collected (100)
Seat 3: Wildstyler001 (big blind) folded before Flop



PokerStars Hand #243267885064: Tournament #3581558546, $0.92+$0.08 USD Hold'em No Limit - Level I (10/20) - 2023/04/23 16:12:21 CET [2023/04/23 10:12:21 ET]
Table '3581558546 1' 3-max Seat #2 is the button
Seat 1: arkanprod (460 in chips) 
Seat 2: Mahu2021 (560 in chips) 
Seat 3: Wildstyler001 (480 in chips) 
Wildstyler001: posts small blind 10
arkanprod: posts big blind 20
*** HOLE CARDS ***
Dealt to Mahu2021 [3c Ks]
Mahu2021: folds 
Wildstyler001: calls 10
arkanprod: checks 
*** FLOP *** [Ac 9c Js]
Wildstyler001: checks 
arkanprod: checks 
*** TURN *** [Ac 9c Js] [7s]
Wildstyler001: checks 
arkanprod: bets 30
Wildstyler001: calls 30
*** RIVER *** [Ac 9c Js 7s] [As]
Wildstyler001: checks 
arkanprod: checks 
*** SHOW DOWN ***
Wildstyler001: shows [Qs Kd] (a pair of Aces)
arkanprod: shows [3d 9h] (two pair, Aces and Nines)
arkanprod collected 100 from pot
*** SUMMARY ***
Total pot 100 | Rake 0 
Board [Ac 9c Js 7s As]
Seat 1: arkanprod (big blind) showed [3d 9h] and won (100) with two pair, Aces and Nines
Seat 2: Mahu2021 (button) folded before Flop (didn't bet)
Seat 3: Wildstyler001 (small blind) showed [Qs Kd] and lost with a pair of Aces



PokerStars Hand #243267893749: Tournament #3581558546, $0.92+$0.08 USD Hold'em No Limit - Level I (10/20) - 2023/04/23 16:12:53 CET [2023/04/23 10:12:53 ET]
Table '3581558546 1' 3-max Seat #3 is the button
Seat 1: arkanprod (510 in chips) 
Seat 2: Mahu2021 (560 in chips) 
Seat 3: Wildstyler001 (430 in chips) 
arkanprod: posts small blind 10
Mahu2021: posts big blind 20
*** HOLE CARDS ***
Dealt to Mahu2021 [Kc As]
Wildstyler001: calls 20
arkanprod: folds 
Mahu2021: raises 60 to 80
Wildstyler001: calls 60
*** FLOP *** [Qs Jh 9s]
Mahu2021: checks 
Wildstyler001: bets 180
Mahu2021: folds 
Uncalled bet (180) returned to Wildstyler001
Wildstyler001 collected 170 from pot
*** SUMMARY ***
Total pot 170 | Rake 0 
Board [Qs Jh 9s]
Seat 1: arkanprod (small blind) folded before Flop
Seat 2: Mahu2021 (big blind) folded on the Flop
Seat 3: Wildstyler001 (button) collected (170)



PokerStars Hand #243267899871: Tournament #3581558546, $0.92+$0.08 USD Hold'em No Limit - Level I (10/20) - 2023/04/23 16:13:16 CET [2023/04/23 10:13:16 ET]
Table '3581558546 1' 3-max Seat #1 is the button
Seat 1: arkanprod (500 in chips) 
Seat 2: Mahu2021 (480 in chips) 
Seat 3: Wildstyler001 (520 in chips) 
Mahu2021: posts small blind 10
Wildstyler001: posts big blind 20
*** HOLE CARDS ***
Dealt to Mahu2021 [5h Th]
arkanprod: folds 
Mahu2021: calls 10
Wildstyler001: checks 
*** FLOP *** [7c 4s 6s]
Mahu2021: bets 40
Wildstyler001: calls 40
*** TURN *** [7c 4s 6s] [5c]
Mahu2021: checks 
Wildstyler001: checks 
*** RIVER *** [7c 4s 6s 5c] [5d]
Mahu2021: bets 120
Wildstyler001: folds 
Uncalled bet (120) returned to Mahu2021
Mahu2021 collected 120 from pot
Mahu2021: doesn't show hand 
*** SUMMARY ***
Total pot 120 | Rake 0 
Board [7c 4s 6s 5c 5d]
Seat 1: arkanprod (button) folded before Flop (didn't bet)
Seat 2: Mahu2021 (small blind) collected (120)
Seat 3: Wildstyler001 (big blind) folded on the River



PokerStars Hand #243267905982: Tournament #3581558546, $0.92+$0.08 USD Hold'em No Limit - Level I (10/20) - 2023/04/23 16:13:38 CET [2023/04/23 10:13:38 ET]
Table '3581558546 1' 3-max Seat #2 is the button
Seat 1: arkanprod (500 in chips) 
Seat 2: Mahu2021 (540 in chips) 
Seat 3: Wildstyler001 (460 in chips) 
Wildstyler001: posts small blind 10
arkanprod: posts big blind 20
*** HOLE CARDS ***
Dealt to Mahu2021 [Qc 9h]
Mahu2021: calls 20
Wildstyler001: folds 
arkanprod: checks 
*** FLOP *** [3h 6s 8d]
arkanprod: checks 
Mahu2021: bets 40
arkanprod: calls 40
*** TURN *** [3h 6s 8d] [4s]
arkanprod: checks 
Mahu2021: checks 
*** RIVER *** [3h 6s 8d 4s] [5d]
arkanprod: checks 
Mahu2021: checks 
*** SHOW DOWN ***
arkanprod: shows [2d 8c] (a straight, Deuce to Six)
Mahu2021: mucks hand 
arkanprod collected 130 from pot
*** SUMMARY ***
Total pot 130 | Rake 0 
Board [3h 6s 8d 4s 5d]
Seat 1: arkanprod (big blind) showed [2d 8c] and won (130) with a straight, Deuce to Six
Seat 2: Mahu2021 (button) mucked [Qc 9h]
Seat 3: Wildstyler001 (small blind) folded before Flop



PokerStars Hand #243267914594: Tournament #3581558546, $0.92+$0.08 USD Hold'em No Limit - Level II (15/30) - 2023/04/23 16:14:08 CET [2023/04/23 10:14:08 ET]
Table '3581558546 1' 3-max Seat #3 is the button
Seat 1: arkanprod (570 in chips) 
Seat 2: Mahu2021 (480 in chips) 
Seat 3: Wildstyler001 (450 in chips) 
arkanprod: posts small blind 15
Mahu2021: posts big blind 30
*** HOLE CARDS ***
Dealt to Mahu2021 [6h 4d]
Wildstyler001: calls 30
arkanprod: calls 15
Mahu2021: checks 
*** FLOP *** [7d 3c 9h]
arkanprod: checks 
Mahu2021: checks 
Wildstyler001: checks 
*** TURN *** [7d 3c 9h] [8s]
arkanprod: checks 
Mahu2021: bets 90
Wildstyler001: folds 
arkanprod: calls 90
*** RIVER *** [7d 3c 9h 8s] [3d]
arkanprod: checks 
Mahu2021: bets 360 and is all-in
arkanprod: calls 360
*** SHOW DOWN ***
Mahu2021: shows [6h 4d] (a pair of Threes)
arkanprod: shows [9d Ks] (two pair, Nines and Threes)
arkanprod collected 990 from pot
Mahu2021 finished the tournament in 3rd place
*** SUMMARY ***
Total pot 990 | Rake 0 
Board [7d 3c 9h 8s 3d]
Seat 1: arkanprod (small blind) showed [9d Ks] and won (990) with two pair, Nines and Threes
Seat 2: Mahu2021 (big blind) showed [6h 4d] and lost with a pair of Threes
Seat 3: Wildstyler001 (button) folded on the Turn



