PokerStars Hand #249024924334: Tournament #3719628484, $1.84+$0.16 USD Hold'em No Limit - Level I (10/20) - 2024/02/22 13:52:52 CET [2024/02/22 7:52:52 ET]
Table '3719628484 1' 3-max Seat #1 is the button
Seat 1: Mahu2021 (500 in chips) 
Seat 2: arnulfson (500 in chips) 
Seat 3: Lehndorf70 (500 in chips) 
arnulfson: posts small blind 10
Lehndorf70: posts big blind 20
*** HOLE CARDS ***
Dealt to Mahu2021 [9d 3c]
Mahu2021: folds 
arnulfson: folds 
Uncalled bet (10) returned to Lehndorf70
Lehndorf70 collected 20 from pot
*** SUMMARY ***
Total pot 20 | Rake 0 
Seat 1: Mahu2021 (button) folded before Flop (didn't bet)
Seat 2: arnulfson (small blind) folded before Flop
Seat 3: Lehndorf70 (big blind) collected (20)



PokerStars Hand #249024925507: Tournament #3719628484, $1.84+$0.16 USD Hold'em No Limit - Level I (10/20) - 2024/02/22 13:52:59 CET [2024/02/22 7:52:59 ET]
Table '3719628484 1' 3-max Seat #2 is the button
Seat 1: Mahu2021 (500 in chips) 
Seat 2: arnulfson (490 in chips) 
Seat 3: Lehndorf70 (510 in chips) 
Lehndorf70: posts small blind 10
Mahu2021: posts big blind 20
*** HOLE CARDS ***
Dealt to Mahu2021 [Ad 5d]
arnulfson: folds 
Lehndorf70: calls 10
Mahu2021: checks 
*** FLOP *** [Tc 2c Ts]
Lehndorf70: bets 40
Mahu2021: calls 40
*** TURN *** [Tc 2c Ts] [4c]
Lehndorf70: bets 40
Mahu2021: calls 40
*** RIVER *** [Tc 2c Ts 4c] [8s]
Lehndorf70: bets 20
Mahu2021: calls 20
*** SHOW DOWN ***
Lehndorf70: shows [2h 4s] (two pair, Tens and Fours)
Mahu2021: mucks hand 
Lehndorf70 collected 240 from pot
*** SUMMARY ***
Total pot 240 | Rake 0 
Board [Tc 2c Ts 4c 8s]
Seat 1: Mahu2021 (big blind) mucked [Ad 5d]
Seat 2: arnulfson (button) folded before Flop (didn't bet)
Seat 3: Lehndorf70 (small blind) showed [2h 4s] and won (240) with two pair, Tens and Fours



PokerStars Hand #249024928735: Tournament #3719628484, $1.84+$0.16 USD Hold'em No Limit - Level I (10/20) - 2024/02/22 13:53:17 CET [2024/02/22 7:53:17 ET]
Table '3719628484 1' 3-max Seat #3 is the button
Seat 1: Mahu2021 (380 in chips) 
Seat 2: arnulfson (490 in chips) 
Seat 3: Lehndorf70 (630 in chips) 
Mahu2021: posts small blind 10
arnulfson: posts big blind 20
*** HOLE CARDS ***
Dealt to Mahu2021 [Qs Ts]
Lehndorf70: raises 40 to 60
Mahu2021: calls 50
arnulfson: folds 
*** FLOP *** [Kd 4s 2d]
Mahu2021: checks 
Lehndorf70: checks 
*** TURN *** [Kd 4s 2d] [8c]
Mahu2021: checks 
Lehndorf70: checks 
*** RIVER *** [Kd 4s 2d 8c] [6h]
Mahu2021: checks 
Lehndorf70: checks 
*** SHOW DOWN ***
Mahu2021: shows [Qs Ts] (high card King)
Lehndorf70: shows [Ac 9d] (high card Ace)
Lehndorf70 collected 140 from pot
*** SUMMARY ***
Total pot 140 | Rake 0 
Board [Kd 4s 2d 8c 6h]
Seat 1: Mahu2021 (small blind) showed [Qs Ts] and lost with high card King
Seat 2: arnulfson (big blind) folded before Flop
Seat 3: Lehndorf70 (button) showed [Ac 9d] and won (140) with high card Ace



PokerStars Hand #249024931361: Tournament #3719628484, $1.84+$0.16 USD Hold'em No Limit - Level I (10/20) - 2024/02/22 13:53:31 CET [2024/02/22 7:53:31 ET]
Table '3719628484 1' 3-max Seat #1 is the button
Seat 1: Mahu2021 (320 in chips) 
Seat 2: arnulfson (470 in chips) 
Seat 3: Lehndorf70 (710 in chips) 
arnulfson: posts small blind 10
Lehndorf70: posts big blind 20
*** HOLE CARDS ***
Dealt to Mahu2021 [5s 2h]
Mahu2021: folds 
arnulfson: folds 
Uncalled bet (10) returned to Lehndorf70
Lehndorf70 collected 20 from pot
*** SUMMARY ***
Total pot 20 | Rake 0 
Seat 1: Mahu2021 (button) folded before Flop (didn't bet)
Seat 2: arnulfson (small blind) folded before Flop
Seat 3: Lehndorf70 (big blind) collected (20)



PokerStars Hand #249024932769: Tournament #3719628484, $1.84+$0.16 USD Hold'em No Limit - Level I (10/20) - 2024/02/22 13:53:39 CET [2024/02/22 7:53:39 ET]
Table '3719628484 1' 3-max Seat #2 is the button
Seat 1: Mahu2021 (320 in chips) 
Seat 2: arnulfson (460 in chips) 
Seat 3: Lehndorf70 (720 in chips) 
Lehndorf70: posts small blind 10
Mahu2021: posts big blind 20
*** HOLE CARDS ***
Dealt to Mahu2021 [7s 2h]
arnulfson has timed out
arnulfson: folds 
arnulfson is sitting out
arnulfson has returned
Lehndorf70: raises 60 to 80
Mahu2021: folds 
Uncalled bet (60) returned to Lehndorf70
Lehndorf70 collected 40 from pot
*** SUMMARY ***
Total pot 40 | Rake 0 
Seat 1: Mahu2021 (big blind) folded before Flop
Seat 2: arnulfson (button) folded before Flop (didn't bet)
Seat 3: Lehndorf70 (small blind) collected (40)



PokerStars Hand #249024935873: Tournament #3719628484, $1.84+$0.16 USD Hold'em No Limit - Level I (10/20) - 2024/02/22 13:53:56 CET [2024/02/22 7:53:56 ET]
Table '3719628484 1' 3-max Seat #3 is the button
Seat 1: Mahu2021 (300 in chips) 
Seat 2: arnulfson (460 in chips) 
Seat 3: Lehndorf70 (740 in chips) 
Mahu2021: posts small blind 10
arnulfson: posts big blind 20
*** HOLE CARDS ***
Dealt to Mahu2021 [9c 8d]
Lehndorf70: raises 40 to 60
Mahu2021: calls 50
arnulfson: folds 
*** FLOP *** [Jc 4d 9s]
Mahu2021: bets 240 and is all-in
Lehndorf70: calls 240
*** TURN *** [Jc 4d 9s] [3d]
*** RIVER *** [Jc 4d 9s 3d] [As]
*** SHOW DOWN ***
Mahu2021: shows [9c 8d] (a pair of Nines)
Lehndorf70: shows [Ah 9h] (two pair, Aces and Nines)
Lehndorf70 collected 620 from pot
Mahu2021 finished the tournament in 3rd place
*** SUMMARY ***
Total pot 620 | Rake 0 
Board [Jc 4d 9s 3d As]
Seat 1: Mahu2021 (small blind) showed [9c 8d] and lost with a pair of Nines
Seat 2: arnulfson (big blind) folded before Flop
Seat 3: Lehndorf70 (button) showed [Ah 9h] and won (620) with two pair, Aces and Nines



