PokerStars Hand #249087198143: Tournament #3721083636, $4.60+$0.40 USD Hold'em No Limit - Level I (10/20) - 2024/02/25 18:02:00 CET [2024/02/25 12:02:00 ET]
Table '3721083636 1' 3-max Seat #1 is the button
Seat 1: Zheberklas (500 in chips) 
Seat 2: Mahu2021 (500 in chips) 
Seat 3: Sir_DeniZ (500 in chips) 
Mahu2021: posts small blind 10
Sir_DeniZ: posts big blind 20
*** HOLE CARDS ***
Dealt to Mahu2021 [Td 3h]
Zheberklas: raises 20 to 40
Mahu2021: folds 
Sir_DeniZ: raises 90 to 130
Zheberklas: calls 90
*** FLOP *** [9s Kd 7d]
Sir_DeniZ: bets 270
Zheberklas: folds 
Uncalled bet (270) returned to Sir_DeniZ
Sir_DeniZ collected 270 from pot
*** SUMMARY ***
Total pot 270 | Rake 0 
Board [9s Kd 7d]
Seat 1: Zheberklas (button) folded on the Flop
Seat 2: Mahu2021 (small blind) folded before Flop
Seat 3: Sir_DeniZ (big blind) collected (270)



PokerStars Hand #249087203320: Tournament #3721083636, $4.60+$0.40 USD Hold'em No Limit - Level I (10/20) - 2024/02/25 18:02:16 CET [2024/02/25 12:02:16 ET]
Table '3721083636 1' 3-max Seat #2 is the button
Seat 1: Zheberklas (370 in chips) 
Seat 2: Mahu2021 (490 in chips) 
Seat 3: Sir_DeniZ (640 in chips) 
Sir_DeniZ: posts small blind 10
Zheberklas: posts big blind 20
*** HOLE CARDS ***
Dealt to Mahu2021 [2h Ah]
Mahu2021: calls 20
Sir_DeniZ: folds 
Zheberklas: checks 
*** FLOP *** [8s Kc 3d]
Zheberklas: checks 
Mahu2021: bets 20
Zheberklas: calls 20
*** TURN *** [8s Kc 3d] [As]
Zheberklas: checks 
Mahu2021: bets 20
Zheberklas: calls 20
*** RIVER *** [8s Kc 3d As] [2s]
Zheberklas: checks 
Mahu2021: bets 130
Zheberklas: folds 
Uncalled bet (130) returned to Mahu2021
Mahu2021 collected 130 from pot
Mahu2021: doesn't show hand 
*** SUMMARY ***
Total pot 130 | Rake 0 
Board [8s Kc 3d As 2s]
Seat 1: Zheberklas (big blind) folded on the River
Seat 2: Mahu2021 (button) collected (130)
Seat 3: Sir_DeniZ (small blind) folded before Flop



PokerStars Hand #249087209236: Tournament #3721083636, $4.60+$0.40 USD Hold'em No Limit - Level I (10/20) - 2024/02/25 18:02:35 CET [2024/02/25 12:02:35 ET]
Table '3721083636 1' 3-max Seat #3 is the button
Seat 1: Zheberklas (310 in chips) 
Seat 2: Mahu2021 (560 in chips) 
Seat 3: Sir_DeniZ (630 in chips) 
Zheberklas: posts small blind 10
Mahu2021: posts big blind 20
*** HOLE CARDS ***
Dealt to Mahu2021 [Ah Qc]
Sir_DeniZ: raises 20 to 40
Zheberklas: folds 
Mahu2021: calls 20
*** FLOP *** [As 2h Jc]
Mahu2021: checks 
Sir_DeniZ: bets 45
Mahu2021: calls 45
*** TURN *** [As 2h Jc] [5s]
Mahu2021: checks 
Sir_DeniZ: bets 90
Mahu2021: calls 90
*** RIVER *** [As 2h Jc 5s] [5d]
Mahu2021: checks 
Sir_DeniZ: bets 360
Mahu2021: calls 360
*** SHOW DOWN ***
Sir_DeniZ: shows [Kd Ac] (two pair, Aces and Fives)
Mahu2021: mucks hand 
Sir_DeniZ collected 1080 from pot
*** SUMMARY ***
Total pot 1080 | Rake 0 
Board [As 2h Jc 5s 5d]
Seat 1: Zheberklas (small blind) folded before Flop
Seat 2: Mahu2021 (big blind) mucked [Ah Qc]
Seat 3: Sir_DeniZ (button) showed [Kd Ac] and won (1080) with two pair, Aces and Fives



PokerStars Hand #249087215517: Tournament #3721083636, $4.60+$0.40 USD Hold'em No Limit - Level I (10/20) - 2024/02/25 18:02:54 CET [2024/02/25 12:02:54 ET]
Table '3721083636 1' 3-max Seat #1 is the button
Seat 1: Zheberklas (300 in chips) 
Seat 2: Mahu2021 (25 in chips) 
Seat 3: Sir_DeniZ (1175 in chips) 
Mahu2021: posts small blind 10
Sir_DeniZ: posts big blind 20
*** HOLE CARDS ***
Dealt to Mahu2021 [Ts Jd]
Zheberklas: folds 
Mahu2021: raises 5 to 25 and is all-in
Sir_DeniZ: calls 5
*** FLOP *** [Td 9c 6d]
*** TURN *** [Td 9c 6d] [3s]
*** RIVER *** [Td 9c 6d 3s] [2h]
*** SHOW DOWN ***
Mahu2021: shows [Ts Jd] (a pair of Tens)
Sir_DeniZ: shows [Ah 3d] (a pair of Threes)
Mahu2021 collected 50 from pot
*** SUMMARY ***
Total pot 50 | Rake 0 
Board [Td 9c 6d 3s 2h]
Seat 1: Zheberklas (button) folded before Flop (didn't bet)
Seat 2: Mahu2021 (small blind) showed [Ts Jd] and won (50) with a pair of Tens
Seat 3: Sir_DeniZ (big blind) showed [Ah 3d] and lost with a pair of Threes



PokerStars Hand #249087219169: Tournament #3721083636, $4.60+$0.40 USD Hold'em No Limit - Level I (10/20) - 2024/02/25 18:03:06 CET [2024/02/25 12:03:06 ET]
Table '3721083636 1' 3-max Seat #2 is the button
Seat 1: Zheberklas (300 in chips) 
Seat 2: Mahu2021 (50 in chips) 
Seat 3: Sir_DeniZ (1150 in chips) 
Sir_DeniZ: posts small blind 10
Zheberklas: posts big blind 20
*** HOLE CARDS ***
Dealt to Mahu2021 [4d 6h]
Mahu2021: folds 
Sir_DeniZ: raises 20 to 40
Zheberklas: calls 20
*** FLOP *** [Jd Ts 7s]
Sir_DeniZ: bets 40
Zheberklas: calls 40
*** TURN *** [Jd Ts 7s] [2c]
Sir_DeniZ: bets 80
Zheberklas: calls 80
*** RIVER *** [Jd Ts 7s 2c] [8c]
Sir_DeniZ: checks 
Zheberklas: bets 140 and is all-in
Sir_DeniZ: calls 140
*** SHOW DOWN ***
Zheberklas: shows [9s 3s] (a straight, Seven to Jack)
Sir_DeniZ: shows [Jh Kd] (a pair of Jacks)
Zheberklas collected 600 from pot
*** SUMMARY ***
Total pot 600 | Rake 0 
Board [Jd Ts 7s 2c 8c]
Seat 1: Zheberklas (big blind) showed [9s 3s] and won (600) with a straight, Seven to Jack
Seat 2: Mahu2021 (button) folded before Flop (didn't bet)
Seat 3: Sir_DeniZ (small blind) showed [Jh Kd] and lost with a pair of Jacks



PokerStars Hand #249087226802: Tournament #3721083636, $4.60+$0.40 USD Hold'em No Limit - Level I (10/20) - 2024/02/25 18:03:30 CET [2024/02/25 12:03:30 ET]
Table '3721083636 1' 3-max Seat #3 is the button
Seat 1: Zheberklas (600 in chips) 
Seat 2: Mahu2021 (50 in chips) 
Seat 3: Sir_DeniZ (850 in chips) 
Zheberklas: posts small blind 10
Mahu2021: posts big blind 20
*** HOLE CARDS ***
Dealt to Mahu2021 [Qh 2d]
Sir_DeniZ: raises 40 to 60
Zheberklas: calls 50
Mahu2021: calls 30 and is all-in
*** FLOP *** [9s Jd 7c]
Zheberklas: checks 
Sir_DeniZ: checks 
*** TURN *** [9s Jd 7c] [Ad]
Zheberklas: checks 
Sir_DeniZ: checks 
*** RIVER *** [9s Jd 7c Ad] [Ac]
Zheberklas: checks 
Sir_DeniZ: checks 
*** SHOW DOWN ***
Zheberklas: shows [Qs 9h] (two pair, Aces and Nines)
Sir_DeniZ: mucks hand 
Zheberklas collected 20 from side pot
Mahu2021: mucks hand 
Zheberklas collected 150 from main pot
Mahu2021 finished the tournament in 3rd place
*** SUMMARY ***
Total pot 170 Main pot 150. Side pot 20. | Rake 0 
Board [9s Jd 7c Ad Ac]
Seat 1: Zheberklas (small blind) showed [Qs 9h] and won (170) with two pair, Aces and Nines
Seat 2: Mahu2021 (big blind) mucked [Qh 2d]
Seat 3: Sir_DeniZ (button) mucked [5c 3s]



