PokerStars Hand #248784862379: Tournament #3713525905, $1.84+$0.16 USD Hold'em No Limit - Level I (10/20) - 2024/02/09 21:50:17 CET [2024/02/09 15:50:17 ET]
Table '3713525905 1' 3-max Seat #1 is the button
Seat 1: nastay1988 (500 in chips) 
Seat 2: svetsen (500 in chips) 
Seat 3: Mahu2021 (500 in chips) 
svetsen: posts small blind 10
Mahu2021: posts big blind 20
*** HOLE CARDS ***
Dealt to Mahu2021 [7s 3c]
nastay1988: folds 
svetsen: calls 10
Mahu2021: checks 
*** FLOP *** [Ac As Js]
svetsen: checks 
Mahu2021: checks 
*** TURN *** [Ac As Js] [Ks]
svetsen: bets 20
Mahu2021: calls 20
*** RIVER *** [Ac As Js Ks] [3h]
svetsen: bets 20
Mahu2021: calls 20
*** SHOW DOWN ***
svetsen: shows [2h Kh] (two pair, Aces and Kings)
Mahu2021: mucks hand 
svetsen collected 120 from pot
*** SUMMARY ***
Total pot 120 | Rake 0 
Board [Ac As Js Ks 3h]
Seat 1: nastay1988 (button) folded before Flop (didn't bet)
Seat 2: svetsen (small blind) showed [2h Kh] and won (120) with two pair, Aces and Kings
Seat 3: Mahu2021 (big blind) mucked [7s 3c]



PokerStars Hand #248784870892: Tournament #3713525905, $1.84+$0.16 USD Hold'em No Limit - Level I (10/20) - 2024/02/09 21:50:40 CET [2024/02/09 15:50:40 ET]
Table '3713525905 1' 3-max Seat #2 is the button
Seat 1: nastay1988 (500 in chips) 
Seat 2: svetsen (560 in chips) 
Seat 3: Mahu2021 (440 in chips) 
Mahu2021: posts small blind 10
nastay1988: posts big blind 20
*** HOLE CARDS ***
Dealt to Mahu2021 [4h Kh]
svetsen: folds 
Mahu2021: raises 20 to 40
nastay1988: raises 460 to 500 and is all-in
Mahu2021: folds 
Uncalled bet (460) returned to nastay1988
nastay1988 collected 80 from pot
nastay1988: doesn't show hand 
*** SUMMARY ***
Total pot 80 | Rake 0 
Seat 1: nastay1988 (big blind) collected (80)
Seat 2: svetsen (button) folded before Flop (didn't bet)
Seat 3: Mahu2021 (small blind) folded before Flop



PokerStars Hand #248784874726: Tournament #3713525905, $1.84+$0.16 USD Hold'em No Limit - Level I (10/20) - 2024/02/09 21:50:51 CET [2024/02/09 15:50:51 ET]
Table '3713525905 1' 3-max Seat #3 is the button
Seat 1: nastay1988 (540 in chips) 
Seat 2: svetsen (560 in chips) 
Seat 3: Mahu2021 (400 in chips) 
nastay1988: posts small blind 10
svetsen: posts big blind 20
*** HOLE CARDS ***
Dealt to Mahu2021 [2d Jd]
Mahu2021: calls 20
nastay1988: folds 
svetsen: raises 20 to 40
Mahu2021: calls 20
*** FLOP *** [2s 7d Jh]
svetsen: checks 
Mahu2021: bets 40
svetsen: calls 40
*** TURN *** [2s 7d Jh] [Tc]
svetsen: checks 
Mahu2021: bets 40
svetsen: calls 40
*** RIVER *** [2s 7d Jh Tc] [5d]
svetsen: checks 
Mahu2021: bets 40
svetsen: folds 
Uncalled bet (40) returned to Mahu2021
Mahu2021 collected 250 from pot
Mahu2021: doesn't show hand 
*** SUMMARY ***
Total pot 250 | Rake 0 
Board [2s 7d Jh Tc 5d]
Seat 1: nastay1988 (small blind) folded before Flop
Seat 2: svetsen (big blind) folded on the River
Seat 3: Mahu2021 (button) collected (250)



PokerStars Hand #248784885359: Tournament #3713525905, $1.84+$0.16 USD Hold'em No Limit - Level I (10/20) - 2024/02/09 21:51:19 CET [2024/02/09 15:51:19 ET]
Table '3713525905 1' 3-max Seat #1 is the button
Seat 1: nastay1988 (530 in chips) 
Seat 2: svetsen (440 in chips) 
Seat 3: Mahu2021 (530 in chips) 
svetsen: posts small blind 10
Mahu2021: posts big blind 20
*** HOLE CARDS ***
Dealt to Mahu2021 [6s 4c]
nastay1988: raises 20 to 40
svetsen: calls 30
Mahu2021: folds 
*** FLOP *** [3h Th Qd]
svetsen: checks 
nastay1988: checks 
*** TURN *** [3h Th Qd] [Kc]
svetsen: bets 20
nastay1988: raises 40 to 60
svetsen: calls 40
*** RIVER *** [3h Th Qd Kc] [2s]
svetsen: checks 
nastay1988: bets 110
svetsen: folds 
Uncalled bet (110) returned to nastay1988
nastay1988 collected 220 from pot
nastay1988: doesn't show hand 
*** SUMMARY ***
Total pot 220 | Rake 0 
Board [3h Th Qd Kc 2s]
Seat 1: nastay1988 (button) collected (220)
Seat 2: svetsen (small blind) folded on the River
Seat 3: Mahu2021 (big blind) folded before Flop



PokerStars Hand #248784893101: Tournament #3713525905, $1.84+$0.16 USD Hold'em No Limit - Level I (10/20) - 2024/02/09 21:51:40 CET [2024/02/09 15:51:40 ET]
Table '3713525905 1' 3-max Seat #2 is the button
Seat 1: nastay1988 (650 in chips) 
Seat 2: svetsen (340 in chips) 
Seat 3: Mahu2021 (510 in chips) 
Mahu2021: posts small blind 10
nastay1988: posts big blind 20
*** HOLE CARDS ***
Dealt to Mahu2021 [9d Kc]
svetsen: raises 60 to 80
Mahu2021: folds 
nastay1988: folds 
Uncalled bet (60) returned to svetsen
svetsen collected 50 from pot
*** SUMMARY ***
Total pot 50 | Rake 0 
Seat 1: nastay1988 (big blind) folded before Flop
Seat 2: svetsen (button) collected (50)
Seat 3: Mahu2021 (small blind) folded before Flop



PokerStars Hand #248784898117: Tournament #3713525905, $1.84+$0.16 USD Hold'em No Limit - Level I (10/20) - 2024/02/09 21:51:54 CET [2024/02/09 15:51:54 ET]
Table '3713525905 1' 3-max Seat #3 is the button
Seat 1: nastay1988 (630 in chips) 
Seat 2: svetsen (370 in chips) 
Seat 3: Mahu2021 (500 in chips) 
nastay1988: posts small blind 10
svetsen: posts big blind 20
*** HOLE CARDS ***
Dealt to Mahu2021 [Qc Kc]
Mahu2021: raises 40 to 60
nastay1988: calls 50
svetsen: folds 
*** FLOP *** [9c Qs 5s]
nastay1988: checks 
Mahu2021: bets 140
nastay1988: raises 430 to 570 and is all-in
Mahu2021: calls 300 and is all-in
Uncalled bet (130) returned to nastay1988
*** TURN *** [9c Qs 5s] [Ts]
*** RIVER *** [9c Qs 5s Ts] [3d]
*** SHOW DOWN ***
nastay1988: shows [Ks 8s] (a flush, King high)
Mahu2021: shows [Qc Kc] (a pair of Queens)
nastay1988 collected 1020 from pot
Mahu2021 finished the tournament in 3rd place
*** SUMMARY ***
Total pot 1020 | Rake 0 
Board [9c Qs 5s Ts 3d]
Seat 1: nastay1988 (small blind) showed [Ks 8s] and won (1020) with a flush, King high
Seat 2: svetsen (big blind) folded before Flop
Seat 3: Mahu2021 (button) showed [Qc Kc] and lost with a pair of Queens



