PokerStars Hand #253197641540: Tournament #3818719209, $0.46+$0.04 USD Hold'em No Limit - Level I (10/20) - 2024/11/01 6:59:35 CET [2024/11/01 1:59:35 ET]
Table '3818719209 1' 3-max Seat #1 is the button
Seat 1: derhanischer (500 in chips) 
Seat 2: ViniJuty (500 in chips) 
Seat 3: Mahu2021 (500 in chips) 
ViniJuty: posts small blind 10
Mahu2021: posts big blind 20
*** HOLE CARDS ***
Dealt to Mahu2021 [6s 2d]
derhanischer: calls 20
ViniJuty: raises 480 to 500 and is all-in
Mahu2021: folds 
derhanischer: calls 480 and is all-in
*** FLOP *** [5d 6c 3d]
*** TURN *** [5d 6c 3d] [6h]
*** RIVER *** [5d 6c 3d 6h] [Ks]
*** SHOW DOWN ***
ViniJuty: shows [5h 5c] (a full house, Fives full of Sixes)
derhanischer: shows [Kd 9c] (two pair, Kings and Sixes)
ViniJuty collected 1020 from pot
derhanischer finished the tournament in 3rd place
*** SUMMARY ***
Total pot 1020 | Rake 0 
Board [5d 6c 3d 6h Ks]
Seat 1: derhanischer (button) showed [Kd 9c] and lost with two pair, Kings and Sixes
Seat 2: ViniJuty (small blind) showed [5h 5c] and won (1020) with a full house, Fives full of Sixes
Seat 3: Mahu2021 (big blind) folded before Flop



PokerStars Hand #253197643082: Tournament #3818719209, $0.46+$0.04 USD Hold'em No Limit - Level I (10/20) - 2024/11/01 6:59:57 CET [2024/11/01 1:59:57 ET]
Table '3818719209 1' 3-max Seat #3 is the button
Seat 2: ViniJuty (1020 in chips) 
Seat 3: Mahu2021 (480 in chips) 
Mahu2021: posts small blind 10
ViniJuty: posts big blind 20
*** HOLE CARDS ***
Dealt to Mahu2021 [2d 2s]
Mahu2021: raises 20 to 40
ViniJuty: calls 20
*** FLOP *** [4s 7d 2h]
ViniJuty: bets 20
Mahu2021: calls 20
*** TURN *** [4s 7d 2h] [Jc]
ViniJuty: checks 
Mahu2021: checks 
*** RIVER *** [4s 7d 2h Jc] [Qs]
ViniJuty: bets 20
Mahu2021: raises 80 to 100
ViniJuty: calls 80
*** SHOW DOWN ***
Mahu2021: shows [2d 2s] (three of a kind, Deuces)
ViniJuty: mucks hand 
Mahu2021 collected 320 from pot
*** SUMMARY ***
Total pot 320 | Rake 0 
Board [4s 7d 2h Jc Qs]
Seat 2: ViniJuty (big blind) mucked [3h Qd]
Seat 3: Mahu2021 (button) (small blind) showed [2d 2s] and won (320) with three of a kind, Deuces



PokerStars Hand #253197644996: Tournament #3818719209, $0.46+$0.04 USD Hold'em No Limit - Level I (10/20) - 2024/11/01 7:00:23 CET [2024/11/01 2:00:23 ET]
Table '3818719209 1' 3-max Seat #2 is the button
Seat 2: ViniJuty (860 in chips) 
Seat 3: Mahu2021 (640 in chips) 
ViniJuty: posts small blind 10
Mahu2021: posts big blind 20
*** HOLE CARDS ***
Dealt to Mahu2021 [3d 6h]
ViniJuty: calls 10
Mahu2021: checks 
*** FLOP *** [Th As 7d]
Mahu2021: checks 
ViniJuty: checks 
*** TURN *** [Th As 7d] [6c]
Mahu2021: checks 
ViniJuty: checks 
*** RIVER *** [Th As 7d 6c] [8c]
Mahu2021: checks 
ViniJuty: checks 
*** SHOW DOWN ***
Mahu2021: shows [3d 6h] (a pair of Sixes)
ViniJuty: mucks hand 
Mahu2021 collected 40 from pot
*** SUMMARY ***
Total pot 40 | Rake 0 
Board [Th As 7d 6c 8c]
Seat 2: ViniJuty (button) (small blind) mucked [4c Jh]
Seat 3: Mahu2021 (big blind) showed [3d 6h] and won (40) with a pair of Sixes



PokerStars Hand #253197646661: Tournament #3818719209, $0.46+$0.04 USD Hold'em No Limit - Level I (10/20) - 2024/11/01 7:00:44 CET [2024/11/01 2:00:44 ET]
Table '3818719209 1' 3-max Seat #3 is the button
Seat 2: ViniJuty (840 in chips) 
Seat 3: Mahu2021 (660 in chips) 
Mahu2021: posts small blind 10
ViniJuty: posts big blind 20
*** HOLE CARDS ***
Dealt to Mahu2021 [4s 7c]
Mahu2021: folds 
Uncalled bet (10) returned to ViniJuty
ViniJuty collected 20 from pot
*** SUMMARY ***
Total pot 20 | Rake 0 
Seat 2: ViniJuty (big blind) collected (20)
Seat 3: Mahu2021 (button) (small blind) folded before Flop



PokerStars Hand #253197646984: Tournament #3818719209, $0.46+$0.04 USD Hold'em No Limit - Level I (10/20) - 2024/11/01 7:00:49 CET [2024/11/01 2:00:49 ET]
Table '3818719209 1' 3-max Seat #2 is the button
Seat 2: ViniJuty (850 in chips) 
Seat 3: Mahu2021 (650 in chips) 
ViniJuty: posts small blind 10
Mahu2021: posts big blind 20
*** HOLE CARDS ***
Dealt to Mahu2021 [As 5c]
ViniJuty: calls 10
Mahu2021: checks 
*** FLOP *** [3c 3s 3d]
Mahu2021: checks 
ViniJuty: checks 
*** TURN *** [3c 3s 3d] [Qh]
Mahu2021: checks 
ViniJuty: checks 
*** RIVER *** [3c 3s 3d Qh] [Jd]
Mahu2021: checks 
ViniJuty: checks 
*** SHOW DOWN ***
Mahu2021: shows [As 5c] (three of a kind, Threes)
ViniJuty: mucks hand 
Mahu2021 collected 40 from pot
*** SUMMARY ***
Total pot 40 | Rake 0 
Board [3c 3s 3d Qh Jd]
Seat 2: ViniJuty (button) (small blind) mucked [4h 7s]
Seat 3: Mahu2021 (big blind) showed [As 5c] and won (40) with three of a kind, Threes



PokerStars Hand #253197648240: Tournament #3818719209, $0.46+$0.04 USD Hold'em No Limit - Level I (10/20) - 2024/11/01 7:01:05 CET [2024/11/01 2:01:05 ET]
Table '3818719209 1' 3-max Seat #3 is the button
Seat 2: ViniJuty (830 in chips) 
Seat 3: Mahu2021 (670 in chips) 
Mahu2021: posts small blind 10
ViniJuty: posts big blind 20
*** HOLE CARDS ***
Dealt to Mahu2021 [Tc Ts]
Mahu2021: raises 650 to 670 and is all-in
ViniJuty: calls 650
*** FLOP *** [6s Kd 4h]
*** TURN *** [6s Kd 4h] [6h]
*** RIVER *** [6s Kd 4h 6h] [2d]
*** SHOW DOWN ***
ViniJuty: shows [Kh Ks] (a full house, Kings full of Sixes)
Mahu2021: shows [Tc Ts] (two pair, Tens and Sixes)
ViniJuty collected 1340 from pot
Mahu2021 finished the tournament in 2nd place
ViniJuty wins the tournament - congratulations!
ViniJuty wins a '$1.00 Power Path Step 2 Ticket' ticket
*** SUMMARY ***
Total pot 1340 | Rake 0 
Board [6s Kd 4h 6h 2d]
Seat 2: ViniJuty (big blind) showed [Kh Ks] and won (1340) with a full house, Kings full of Sixes
Seat 3: Mahu2021 (button) (small blind) showed [Tc Ts] and lost with two pair, Tens and Sixes



