PokerStars Hand #243424391324: Tournament #3585097508, $0.92+$0.08 USD Hold'em No Limit - Level I (10/20) - 2023/05/01 12:53:25 CET [2023/05/01 6:53:25 ET]
Table '3585097508 1' 3-max Seat #1 is the button
Seat 1: Karelon0007 (500 in chips) 
Seat 2: Mahu2021 (500 in chips) 
Seat 3: sviker75 (500 in chips) 
Mahu2021: posts small blind 10
sviker75: posts big blind 20
*** HOLE CARDS ***
Dealt to Mahu2021 [2d 6s]
Karelon0007: calls 20
Mahu2021: folds 
sviker75: checks 
*** FLOP *** [As Kc Td]
sviker75: checks 
Karelon0007: checks 
*** TURN *** [As Kc Td] [6h]
sviker75: bets 20
Karelon0007: calls 20
*** RIVER *** [As Kc Td 6h] [2s]
sviker75: bets 60
Karelon0007: folds 
Uncalled bet (60) returned to sviker75
sviker75 collected 90 from pot
sviker75: doesn't show hand 
*** SUMMARY ***
Total pot 90 | Rake 0 
Board [As Kc Td 6h 2s]
Seat 1: Karelon0007 (button) folded on the River
Seat 2: Mahu2021 (small blind) folded before Flop
Seat 3: sviker75 (big blind) collected (90)



PokerStars Hand #243424396777: Tournament #3585097508, $0.92+$0.08 USD Hold'em No Limit - Level I (10/20) - 2023/05/01 12:53:56 CET [2023/05/01 6:53:56 ET]
Table '3585097508 1' 3-max Seat #2 is the button
Seat 1: Karelon0007 (460 in chips) 
Seat 2: Mahu2021 (490 in chips) 
Seat 3: sviker75 (550 in chips) 
sviker75: posts small blind 10
Karelon0007: posts big blind 20
*** HOLE CARDS ***
Dealt to Mahu2021 [7d Th]
Mahu2021: folds 
sviker75: calls 10
Karelon0007: checks 
*** FLOP *** [Tc 6d Qh]
sviker75: checks 
Karelon0007: checks 
*** TURN *** [Tc 6d Qh] [2c]
sviker75: bets 20
Karelon0007: folds 
Uncalled bet (20) returned to sviker75
sviker75 collected 40 from pot
sviker75: doesn't show hand 
*** SUMMARY ***
Total pot 40 | Rake 0 
Board [Tc 6d Qh 2c]
Seat 1: Karelon0007 (big blind) folded on the Turn
Seat 2: Mahu2021 (button) folded before Flop (didn't bet)
Seat 3: sviker75 (small blind) collected (40)



PokerStars Hand #243424401956: Tournament #3585097508, $0.92+$0.08 USD Hold'em No Limit - Level I (10/20) - 2023/05/01 12:54:25 CET [2023/05/01 6:54:25 ET]
Table '3585097508 1' 3-max Seat #3 is the button
Seat 1: Karelon0007 (440 in chips) 
Seat 2: Mahu2021 (490 in chips) 
Seat 3: sviker75 (570 in chips) 
Karelon0007: posts small blind 10
Mahu2021: posts big blind 20
*** HOLE CARDS ***
Dealt to Mahu2021 [2h 5d]
sviker75: folds 
Karelon0007: raises 40 to 60
Mahu2021: folds 
Uncalled bet (40) returned to Karelon0007
Karelon0007 collected 40 from pot
Karelon0007: doesn't show hand 
*** SUMMARY ***
Total pot 40 | Rake 0 
Seat 1: Karelon0007 (small blind) collected (40)
Seat 2: Mahu2021 (big blind) folded before Flop
Seat 3: sviker75 (button) folded before Flop (didn't bet)



PokerStars Hand #243424403790: Tournament #3585097508, $0.92+$0.08 USD Hold'em No Limit - Level I (10/20) - 2023/05/01 12:54:36 CET [2023/05/01 6:54:36 ET]
Table '3585097508 1' 3-max Seat #1 is the button
Seat 1: Karelon0007 (460 in chips) 
Seat 2: Mahu2021 (470 in chips) 
Seat 3: sviker75 (570 in chips) 
Mahu2021: posts small blind 10
sviker75: posts big blind 20
*** HOLE CARDS ***
Dealt to Mahu2021 [2h 7s]
Karelon0007: folds 
Mahu2021: folds 
Uncalled bet (10) returned to sviker75
sviker75 collected 20 from pot
sviker75: doesn't show hand 
*** SUMMARY ***
Total pot 20 | Rake 0 
Seat 1: Karelon0007 (button) folded before Flop (didn't bet)
Seat 2: Mahu2021 (small blind) folded before Flop
Seat 3: sviker75 (big blind) collected (20)



PokerStars Hand #243424404623: Tournament #3585097508, $0.92+$0.08 USD Hold'em No Limit - Level I (10/20) - 2023/05/01 12:54:41 CET [2023/05/01 6:54:41 ET]
Table '3585097508 1' 3-max Seat #2 is the button
Seat 1: Karelon0007 (460 in chips) 
Seat 2: Mahu2021 (460 in chips) 
Seat 3: sviker75 (580 in chips) 
sviker75: posts small blind 10
Karelon0007: posts big blind 20
*** HOLE CARDS ***
Dealt to Mahu2021 [9d 3h]
Mahu2021: folds 
sviker75: calls 10
Karelon0007: checks 
*** FLOP *** [5h 3d Kd]
sviker75: bets 20
Karelon0007: calls 20
*** TURN *** [5h 3d Kd] [4d]
sviker75: bets 40
Karelon0007: calls 40
*** RIVER *** [5h 3d Kd 4d] [3c]
sviker75: bets 60
Karelon0007: calls 60
*** SHOW DOWN ***
sviker75: shows [8h 7h] (a pair of Threes)
Karelon0007: shows [Qs 5c] (two pair, Fives and Threes)
Karelon0007 collected 280 from pot
*** SUMMARY ***
Total pot 280 | Rake 0 
Board [5h 3d Kd 4d 3c]
Seat 1: Karelon0007 (big blind) showed [Qs 5c] and won (280) with two pair, Fives and Threes
Seat 2: Mahu2021 (button) folded before Flop (didn't bet)
Seat 3: sviker75 (small blind) showed [8h 7h] and lost with a pair of Threes



PokerStars Hand #243424409157: Tournament #3585097508, $0.92+$0.08 USD Hold'em No Limit - Level I (10/20) - 2023/05/01 12:55:07 CET [2023/05/01 6:55:07 ET]
Table '3585097508 1' 3-max Seat #3 is the button
Seat 1: Karelon0007 (600 in chips) 
Seat 2: Mahu2021 (460 in chips) 
Seat 3: sviker75 (440 in chips) 
Karelon0007: posts small blind 10
Mahu2021: posts big blind 20
*** HOLE CARDS ***
Dealt to Mahu2021 [5h Kh]
sviker75: calls 20
Karelon0007: calls 10
Mahu2021: checks 
*** FLOP *** [7h Jh 8c]
Karelon0007: bets 80
Mahu2021: calls 80
sviker75: folds 
*** TURN *** [7h Jh 8c] [Td]
Karelon0007: bets 220
Mahu2021: calls 220
*** RIVER *** [7h Jh 8c Td] [8d]
Karelon0007: checks 
Mahu2021: bets 140 and is all-in
Karelon0007: calls 140
*** SHOW DOWN ***
Mahu2021: shows [5h Kh] (a pair of Eights)
Karelon0007: shows [Jd Tc] (two pair, Jacks and Tens)
Karelon0007 collected 940 from pot
Mahu2021 finished the tournament in 3rd place
*** SUMMARY ***
Total pot 940 | Rake 0 
Board [7h Jh 8c Td 8d]
Seat 1: Karelon0007 (small blind) showed [Jd Tc] and won (940) with two pair, Jacks and Tens
Seat 2: Mahu2021 (big blind) showed [5h Kh] and lost with a pair of Eights
Seat 3: sviker75 (button) folded on the Flop



