PokerStars Hand #249102331133: Tournament #3721386433, $1.84+$0.16 USD Hold'em No Limit - Level I (10/20) - 2024/02/26 11:22:29 CET [2024/02/26 5:22:29 ET]
Table '3721386433 1' 3-max Seat #1 is the button
Seat 1: bulkin 197 (500 in chips) 
Seat 2: Mahu2021 (500 in chips) 
Seat 3: vladthebas (500 in chips) 
Mahu2021: posts small blind 10
vladthebas: posts big blind 20
*** HOLE CARDS ***
Dealt to Mahu2021 [9c Jc]
bulkin 197: folds 
Mahu2021: calls 10
vladthebas: checks 
*** FLOP *** [7c Ah 7d]
Mahu2021: checks 
vladthebas: checks 
*** TURN *** [7c Ah 7d] [8s]
Mahu2021: checks 
vladthebas: bets 20
Mahu2021: calls 20
*** RIVER *** [7c Ah 7d 8s] [3s]
Mahu2021: checks 
vladthebas: bets 80
Mahu2021: folds 
Uncalled bet (80) returned to vladthebas
vladthebas collected 80 from pot
vladthebas: doesn't show hand 
*** SUMMARY ***
Total pot 80 | Rake 0 
Board [7c Ah 7d 8s 3s]
Seat 1: bulkin 197 (button) folded before Flop (didn't bet)
Seat 2: Mahu2021 (small blind) folded on the River
Seat 3: vladthebas (big blind) collected (80)



PokerStars Hand #249102334021: Tournament #3721386433, $1.84+$0.16 USD Hold'em No Limit - Level I (10/20) - 2024/02/26 11:22:51 CET [2024/02/26 5:22:51 ET]
Table '3721386433 1' 3-max Seat #2 is the button
Seat 1: bulkin 197 (500 in chips) 
Seat 2: Mahu2021 (460 in chips) 
Seat 3: vladthebas (540 in chips) 
vladthebas: posts small blind 10
bulkin 197: posts big blind 20
*** HOLE CARDS ***
Dealt to Mahu2021 [Jd 8d]
Mahu2021: calls 20
vladthebas: calls 10
bulkin 197: raises 40 to 60
Mahu2021: calls 40
vladthebas: calls 40
*** FLOP *** [2s 5c 7d]
vladthebas: checks 
bulkin 197: checks 
Mahu2021: checks 
*** TURN *** [2s 5c 7d] [Td]
vladthebas: bets 90
bulkin 197: calls 90
Mahu2021: calls 90
*** RIVER *** [2s 5c 7d Td] [5d]
vladthebas: bets 390 and is all-in
bulkin 197: folds 
Mahu2021: calls 310 and is all-in
Uncalled bet (80) returned to vladthebas
*** SHOW DOWN ***
vladthebas: shows [9h 5h] (three of a kind, Fives)
Mahu2021: shows [Jd 8d] (a flush, Jack high)
Mahu2021 collected 1070 from pot
*** SUMMARY ***
Total pot 1070 | Rake 0 
Board [2s 5c 7d Td 5d]
Seat 1: bulkin 197 (big blind) folded on the River
Seat 2: Mahu2021 (button) showed [Jd 8d] and won (1070) with a flush, Jack high
Seat 3: vladthebas (small blind) showed [9h 5h] and lost with three of a kind, Fives



PokerStars Hand #249102337594: Tournament #3721386433, $1.84+$0.16 USD Hold'em No Limit - Level I (10/20) - 2024/02/26 11:23:19 CET [2024/02/26 5:23:19 ET]
Table '3721386433 1' 3-max Seat #3 is the button
Seat 1: bulkin 197 (350 in chips) 
Seat 2: Mahu2021 (1070 in chips) 
Seat 3: vladthebas (80 in chips) 
bulkin 197: posts small blind 10
Mahu2021: posts big blind 20
*** HOLE CARDS ***
Dealt to Mahu2021 [Ts Qd]
vladthebas: folds 
bulkin 197: raises 330 to 350 and is all-in
Mahu2021: folds 
Uncalled bet (330) returned to bulkin 197
bulkin 197 collected 40 from pot
*** SUMMARY ***
Total pot 40 | Rake 0 
Seat 1: bulkin 197 (small blind) collected (40)
Seat 2: Mahu2021 (big blind) folded before Flop
Seat 3: vladthebas (button) folded before Flop (didn't bet)



PokerStars Hand #249102340838: Tournament #3721386433, $1.84+$0.16 USD Hold'em No Limit - Level I (10/20) - 2024/02/26 11:23:45 CET [2024/02/26 5:23:45 ET]
Table '3721386433 1' 3-max Seat #1 is the button
Seat 1: bulkin 197 (370 in chips) 
Seat 2: Mahu2021 (1050 in chips) 
Seat 3: vladthebas (80 in chips) 
Mahu2021: posts small blind 10
vladthebas: posts big blind 20
*** HOLE CARDS ***
Dealt to Mahu2021 [Ah 9h]
bulkin 197: raises 20 to 40
Mahu2021: calls 30
vladthebas: raises 40 to 80 and is all-in
bulkin 197: calls 40
Mahu2021: calls 40
*** FLOP *** [Td 9s Ad]
Mahu2021: bets 80
bulkin 197: folds 
Uncalled bet (80) returned to Mahu2021
*** TURN *** [Td 9s Ad] [Th]
*** RIVER *** [Td 9s Ad Th] [8c]
*** SHOW DOWN ***
Mahu2021: shows [Ah 9h] (two pair, Aces and Tens)
vladthebas: shows [5c 4d] (a pair of Tens)
Mahu2021 collected 240 from pot
vladthebas finished the tournament in 3rd place
*** SUMMARY ***
Total pot 240 | Rake 0 
Board [Td 9s Ad Th 8c]
Seat 1: bulkin 197 (button) folded on the Flop
Seat 2: Mahu2021 (small blind) showed [Ah 9h] and won (240) with two pair, Aces and Tens
Seat 3: vladthebas (big blind) showed [5c 4d] and lost with a pair of Tens



PokerStars Hand #249102343864: Tournament #3721386433, $1.84+$0.16 USD Hold'em No Limit - Level I (10/20) - 2024/02/26 11:24:09 CET [2024/02/26 5:24:09 ET]
Table '3721386433 1' 3-max Seat #2 is the button
Seat 1: bulkin 197 (290 in chips) 
Seat 2: Mahu2021 (1210 in chips) 
Mahu2021: posts small blind 10
bulkin 197: posts big blind 20
*** HOLE CARDS ***
Dealt to Mahu2021 [Qh Qc]
Mahu2021: calls 10
bulkin 197: raises 270 to 290 and is all-in
Mahu2021: calls 270
*** FLOP *** [Kh Js 8c]
*** TURN *** [Kh Js 8c] [5c]
*** RIVER *** [Kh Js 8c 5c] [Td]
*** SHOW DOWN ***
bulkin 197: shows [7h 7s] (a pair of Sevens)
Mahu2021: shows [Qh Qc] (a pair of Queens)
Mahu2021 collected 580 from pot
bulkin 197 finished the tournament in 2nd place
Mahu2021 wins the tournament and receives $4.00 - congratulations!
*** SUMMARY ***
Total pot 580 | Rake 0 
Board [Kh Js 8c 5c Td]
Seat 1: bulkin 197 (big blind) showed [7h 7s] and lost with a pair of Sevens
Seat 2: Mahu2021 (button) (small blind) showed [Qh Qc] and won (580) with a pair of Queens



