PokerStars Hand #244453621267: Tournament #3608685060, $0.92+$0.08 USD Hold'em No Limit - Level I (10/20) - 2023/06/25 10:10:10 CET [2023/06/25 4:10:10 ET]
Table '3608685060 1' 3-max Seat #1 is the button
Seat 1: etv2 (500 in chips) 
Seat 2: Mahu2021 (500 in chips) 
Seat 3: jvart (500 in chips) 
Mahu2021: posts small blind 10
jvart: posts big blind 20
*** HOLE CARDS ***
Dealt to Mahu2021 [Qc Qd]
etv2: calls 20
Mahu2021: raises 480 to 500 and is all-in
jvart: folds 
etv2: folds 
Uncalled bet (480) returned to Mahu2021
Mahu2021 collected 60 from pot
Mahu2021: doesn't show hand 
*** SUMMARY ***
Total pot 60 | Rake 0 
Seat 1: etv2 (button) folded before Flop
Seat 2: Mahu2021 (small blind) collected (60)
Seat 3: jvart (big blind) folded before Flop



PokerStars Hand #244453623384: Tournament #3608685060, $0.92+$0.08 USD Hold'em No Limit - Level I (10/20) - 2023/06/25 10:10:29 CET [2023/06/25 4:10:29 ET]
Table '3608685060 1' 3-max Seat #2 is the button
Seat 1: etv2 (480 in chips) 
Seat 2: Mahu2021 (540 in chips) 
Seat 3: jvart (480 in chips) 
jvart: posts small blind 10
etv2: posts big blind 20
*** HOLE CARDS ***
Dealt to Mahu2021 [9d Jc]
Mahu2021: folds 
jvart: folds 
Uncalled bet (10) returned to etv2
etv2 collected 20 from pot
*** SUMMARY ***
Total pot 20 | Rake 0 
Seat 1: etv2 (big blind) collected (20)
Seat 2: Mahu2021 (button) folded before Flop (didn't bet)
Seat 3: jvart (small blind) folded before Flop



PokerStars Hand #244453624137: Tournament #3608685060, $0.92+$0.08 USD Hold'em No Limit - Level I (10/20) - 2023/06/25 10:10:35 CET [2023/06/25 4:10:35 ET]
Table '3608685060 1' 3-max Seat #3 is the button
Seat 1: etv2 (490 in chips) 
Seat 2: Mahu2021 (540 in chips) 
Seat 3: jvart (470 in chips) 
etv2: posts small blind 10
Mahu2021: posts big blind 20
*** HOLE CARDS ***
Dealt to Mahu2021 [4s 7h]
jvart: folds 
etv2: raises 60 to 80
Mahu2021: folds 
Uncalled bet (60) returned to etv2
etv2 collected 40 from pot
*** SUMMARY ***
Total pot 40 | Rake 0 
Seat 1: etv2 (small blind) collected (40)
Seat 2: Mahu2021 (big blind) folded before Flop
Seat 3: jvart (button) folded before Flop (didn't bet)



PokerStars Hand #244453625539: Tournament #3608685060, $0.92+$0.08 USD Hold'em No Limit - Level I (10/20) - 2023/06/25 10:10:47 CET [2023/06/25 4:10:47 ET]
Table '3608685060 1' 3-max Seat #1 is the button
Seat 1: etv2 (510 in chips) 
Seat 2: Mahu2021 (520 in chips) 
Seat 3: jvart (470 in chips) 
Mahu2021: posts small blind 10
jvart: posts big blind 20
*** HOLE CARDS ***
Dealt to Mahu2021 [Ad Th]
etv2: folds 
Mahu2021: raises 20 to 40
jvart: calls 20
*** FLOP *** [As 2h 6s]
Mahu2021: bets 40
jvart: folds 
Uncalled bet (40) returned to Mahu2021
Mahu2021 collected 80 from pot
Mahu2021: doesn't show hand 
*** SUMMARY ***
Total pot 80 | Rake 0 
Board [As 2h 6s]
Seat 1: etv2 (button) folded before Flop (didn't bet)
Seat 2: Mahu2021 (small blind) collected (80)
Seat 3: jvart (big blind) folded on the Flop



PokerStars Hand #244453629251: Tournament #3608685060, $0.92+$0.08 USD Hold'em No Limit - Level I (10/20) - 2023/06/25 10:11:19 CET [2023/06/25 4:11:19 ET]
Table '3608685060 1' 3-max Seat #2 is the button
Seat 1: etv2 (510 in chips) 
Seat 2: Mahu2021 (560 in chips) 
Seat 3: jvart (430 in chips) 
jvart: posts small blind 10
etv2: posts big blind 20
*** HOLE CARDS ***
Dealt to Mahu2021 [Td 6d]
Mahu2021: folds 
jvart: folds 
Uncalled bet (10) returned to etv2
etv2 collected 20 from pot
*** SUMMARY ***
Total pot 20 | Rake 0 
Seat 1: etv2 (big blind) collected (20)
Seat 2: Mahu2021 (button) folded before Flop (didn't bet)
Seat 3: jvart (small blind) folded before Flop



PokerStars Hand #244453630046: Tournament #3608685060, $0.92+$0.08 USD Hold'em No Limit - Level I (10/20) - 2023/06/25 10:11:26 CET [2023/06/25 4:11:26 ET]
Table '3608685060 1' 3-max Seat #3 is the button
Seat 1: etv2 (520 in chips) 
Seat 2: Mahu2021 (560 in chips) 
Seat 3: jvart (420 in chips) 
etv2: posts small blind 10
Mahu2021: posts big blind 20
*** HOLE CARDS ***
Dealt to Mahu2021 [Kd 6d]
jvart: folds 
etv2: raises 40 to 60
Mahu2021: calls 40
*** FLOP *** [2s 6h Td]
etv2: checks 
Mahu2021: bets 60
etv2: calls 60
*** TURN *** [2s 6h Td] [7d]
etv2: checks 
Mahu2021: bets 240
etv2: raises 160 to 400 and is all-in
Mahu2021: calls 160
*** RIVER *** [2s 6h Td 7d] [9c]
*** SHOW DOWN ***
etv2: shows [2c 2h] (three of a kind, Deuces)
Mahu2021: shows [Kd 6d] (a pair of Sixes)
etv2 collected 1040 from pot
*** SUMMARY ***
Total pot 1040 | Rake 0 
Board [2s 6h Td 7d 9c]
Seat 1: etv2 (small blind) showed [2c 2h] and won (1040) with three of a kind, Deuces
Seat 2: Mahu2021 (big blind) showed [Kd 6d] and lost with a pair of Sixes
Seat 3: jvart (button) folded before Flop (didn't bet)



PokerStars Hand #244453633895: Tournament #3608685060, $0.92+$0.08 USD Hold'em No Limit - Level I (10/20) - 2023/06/25 10:11:59 CET [2023/06/25 4:11:59 ET]
Table '3608685060 1' 3-max Seat #1 is the button
Seat 1: etv2 (1040 in chips) 
Seat 2: Mahu2021 (40 in chips) 
Seat 3: jvart (420 in chips) 
Mahu2021: posts small blind 10
jvart: posts big blind 20
*** HOLE CARDS ***
Dealt to Mahu2021 [Ts 7h]
etv2: folds 
Mahu2021: raises 20 to 40 and is all-in
jvart: calls 20
*** FLOP *** [9h 7s 9d]
*** TURN *** [9h 7s 9d] [9c]
*** RIVER *** [9h 7s 9d 9c] [Kh]
*** SHOW DOWN ***
Mahu2021: shows [Ts 7h] (a full house, Nines full of Sevens)
jvart: shows [Td Jd] (three of a kind, Nines)
Mahu2021 collected 80 from pot
*** SUMMARY ***
Total pot 80 | Rake 0 
Board [9h 7s 9d 9c Kh]
Seat 1: etv2 (button) folded before Flop (didn't bet)
Seat 2: Mahu2021 (small blind) showed [Ts 7h] and won (80) with a full house, Nines full of Sevens
Seat 3: jvart (big blind) showed [Td Jd] and lost with three of a kind, Nines



PokerStars Hand #244453635767: Tournament #3608685060, $0.92+$0.08 USD Hold'em No Limit - Level I (10/20) - 2023/06/25 10:12:15 CET [2023/06/25 4:12:15 ET]
Table '3608685060 1' 3-max Seat #2 is the button
Seat 1: etv2 (1040 in chips) 
Seat 2: Mahu2021 (80 in chips) 
Seat 3: jvart (380 in chips) 
jvart: posts small blind 10
etv2: posts big blind 20
*** HOLE CARDS ***
Dealt to Mahu2021 [3s Kc]
Mahu2021: raises 60 to 80 and is all-in
jvart: folds 
etv2: calls 60
*** FLOP *** [2h 9c 5d]
*** TURN *** [2h 9c 5d] [Js]
*** RIVER *** [2h 9c 5d Js] [4s]
*** SHOW DOWN ***
etv2: shows [Ts As] (high card Ace)
Mahu2021: shows [3s Kc] (high card King)
etv2 collected 170 from pot
Mahu2021 finished the tournament in 3rd place
*** SUMMARY ***
Total pot 170 | Rake 0 
Board [2h 9c 5d Js 4s]
Seat 1: etv2 (big blind) showed [Ts As] and won (170) with high card Ace
Seat 2: Mahu2021 (button) showed [3s Kc] and lost with high card King
Seat 3: jvart (small blind) folded before Flop



