PokerStars Hand #253474108046: Tournament #3825143611, $0.46+$0.04 USD Hold'em No Limit - Level I (10/20) - 2024/11/19 12:22:08 CET [2024/11/19 6:22:08 ET]
Table '3825143611 1' 3-max Seat #1 is the button
Seat 1: alexmonf (500 in chips) 
Seat 2: Gaku00 (500 in chips) 
Seat 3: Mahu2021 (500 in chips) 
Gaku00: posts small blind 10
Mahu2021: posts big blind 20
*** HOLE CARDS ***
Dealt to Mahu2021 [Jh 9h]
alexmonf: calls 20
Gaku00: folds 
Mahu2021: checks 
*** FLOP *** [8h 5d 4c]
Mahu2021: checks 
alexmonf: checks 
*** TURN *** [8h 5d 4c] [Qd]
Mahu2021: checks 
alexmonf: bets 20
Mahu2021: calls 20
*** RIVER *** [8h 5d 4c Qd] [Td]
Mahu2021: bets 90
alexmonf: calls 90
*** SHOW DOWN ***
Mahu2021: shows [Jh 9h] (a straight, Eight to Queen)
alexmonf: mucks hand 
Mahu2021 collected 270 from pot
*** SUMMARY ***
Total pot 270 | Rake 0 
Board [8h 5d 4c Qd Td]
Seat 1: alexmonf (button) mucked [Jd Qc]
Seat 2: Gaku00 (small blind) folded before Flop
Seat 3: Mahu2021 (big blind) showed [Jh 9h] and won (270) with a straight, Eight to Queen



PokerStars Hand #253474111170: Tournament #3825143611, $0.46+$0.04 USD Hold'em No Limit - Level I (10/20) - 2024/11/19 12:22:35 CET [2024/11/19 6:22:35 ET]
Table '3825143611 1' 3-max Seat #2 is the button
Seat 1: alexmonf (370 in chips) 
Seat 2: Gaku00 (490 in chips) 
Seat 3: Mahu2021 (640 in chips) 
Mahu2021: posts small blind 10
alexmonf: posts big blind 20
*** HOLE CARDS ***
Dealt to Mahu2021 [Kc 4d]
Gaku00: raises 40 to 60
Mahu2021: folds 
alexmonf: calls 40
*** FLOP *** [4h 4c 2h]
alexmonf: checks 
Gaku00: bets 85
alexmonf: calls 85
*** TURN *** [4h 4c 2h] [4s]
alexmonf: checks 
Gaku00: bets 150
alexmonf: folds 
Uncalled bet (150) returned to Gaku00
Gaku00 collected 300 from pot
*** SUMMARY ***
Total pot 300 | Rake 0 
Board [4h 4c 2h 4s]
Seat 1: alexmonf (big blind) folded on the Turn
Seat 2: Gaku00 (button) collected (300)
Seat 3: Mahu2021 (small blind) folded before Flop



PokerStars Hand #253474114698: Tournament #3825143611, $0.46+$0.04 USD Hold'em No Limit - Level I (10/20) - 2024/11/19 12:23:04 CET [2024/11/19 6:23:04 ET]
Table '3825143611 1' 3-max Seat #3 is the button
Seat 1: alexmonf (225 in chips) 
Seat 2: Gaku00 (645 in chips) 
Seat 3: Mahu2021 (630 in chips) 
alexmonf: posts small blind 10
Gaku00: posts big blind 20
*** HOLE CARDS ***
Dealt to Mahu2021 [7c 5c]
Mahu2021: calls 20
alexmonf: calls 10
Gaku00: raises 60 to 80
Mahu2021: calls 60
alexmonf: calls 60
*** FLOP *** [2s 6h Qh]
alexmonf: checks 
Gaku00: bets 120
Mahu2021: folds 
alexmonf: folds 
Uncalled bet (120) returned to Gaku00
Gaku00 collected 240 from pot
*** SUMMARY ***
Total pot 240 | Rake 0 
Board [2s 6h Qh]
Seat 1: alexmonf (small blind) folded on the Flop
Seat 2: Gaku00 (big blind) collected (240)
Seat 3: Mahu2021 (button) folded on the Flop



PokerStars Hand #253474117875: Tournament #3825143611, $0.46+$0.04 USD Hold'em No Limit - Level I (10/20) - 2024/11/19 12:23:30 CET [2024/11/19 6:23:30 ET]
Table '3825143611 1' 3-max Seat #1 is the button
Seat 1: alexmonf (145 in chips) 
Seat 2: Gaku00 (805 in chips) 
Seat 3: Mahu2021 (550 in chips) 
Gaku00: posts small blind 10
Mahu2021: posts big blind 20
*** HOLE CARDS ***
Dealt to Mahu2021 [Jd 9h]
alexmonf: folds 
Gaku00: folds 
Uncalled bet (10) returned to Mahu2021
Mahu2021 collected 20 from pot
Mahu2021: doesn't show hand 
*** SUMMARY ***
Total pot 20 | Rake 0 
Seat 1: alexmonf (button) folded before Flop (didn't bet)
Seat 2: Gaku00 (small blind) folded before Flop
Seat 3: Mahu2021 (big blind) collected (20)



PokerStars Hand #253474118750: Tournament #3825143611, $0.46+$0.04 USD Hold'em No Limit - Level I (10/20) - 2024/11/19 12:23:38 CET [2024/11/19 6:23:38 ET]
Table '3825143611 1' 3-max Seat #2 is the button
Seat 1: alexmonf (145 in chips) 
Seat 2: Gaku00 (795 in chips) 
Seat 3: Mahu2021 (560 in chips) 
Mahu2021: posts small blind 10
alexmonf: posts big blind 20
*** HOLE CARDS ***
Dealt to Mahu2021 [4s 7c]
Gaku00: raises 20 to 40
Mahu2021: folds 
alexmonf: calls 20
*** FLOP *** [Qh As 8h]
alexmonf: checks 
Gaku00: bets 90
alexmonf: calls 90
*** TURN *** [Qh As 8h] [Td]
alexmonf: bets 15 and is all-in
Gaku00: calls 15
*** RIVER *** [Qh As 8h Td] [9d]
*** SHOW DOWN ***
alexmonf: shows [Kc Jh] (a straight, Ten to Ace)
Gaku00: shows [9c Qs] (two pair, Queens and Nines)
alexmonf collected 300 from pot
*** SUMMARY ***
Total pot 300 | Rake 0 
Board [Qh As 8h Td 9d]
Seat 1: alexmonf (big blind) showed [Kc Jh] and won (300) with a straight, Ten to Ace
Seat 2: Gaku00 (button) showed [9c Qs] and lost with two pair, Queens and Nines
Seat 3: Mahu2021 (small blind) folded before Flop



PokerStars Hand #253474121371: Tournament #3825143611, $0.46+$0.04 USD Hold'em No Limit - Level I (10/20) - 2024/11/19 12:24:00 CET [2024/11/19 6:24:00 ET]
Table '3825143611 1' 3-max Seat #3 is the button
Seat 1: alexmonf (300 in chips) 
Seat 2: Gaku00 (650 in chips) 
Seat 3: Mahu2021 (550 in chips) 
alexmonf: posts small blind 10
Gaku00: posts big blind 20
*** HOLE CARDS ***
Dealt to Mahu2021 [9c 8d]
Mahu2021: calls 20
alexmonf: calls 10
Gaku00: checks 
*** FLOP *** [8s Ts 8c]
alexmonf: checks 
Gaku00: checks 
Mahu2021: checks 
*** TURN *** [8s Ts 8c] [6c]
alexmonf: checks 
Gaku00: checks 
Mahu2021: bets 60
alexmonf: calls 60
Gaku00: folds 
*** RIVER *** [8s Ts 8c 6c] [Kh]
alexmonf: checks 
Mahu2021: bets 60
alexmonf: folds 
Uncalled bet (60) returned to Mahu2021
Mahu2021 collected 180 from pot
Mahu2021: doesn't show hand 
*** SUMMARY ***
Total pot 180 | Rake 0 
Board [8s Ts 8c 6c Kh]
Seat 1: alexmonf (small blind) folded on the River
Seat 2: Gaku00 (big blind) folded on the Turn
Seat 3: Mahu2021 (button) collected (180)



PokerStars Hand #253474126030: Tournament #3825143611, $0.46+$0.04 USD Hold'em No Limit - Level II (15/30) - 2024/11/19 12:24:38 CET [2024/11/19 6:24:38 ET]
Table '3825143611 1' 3-max Seat #1 is the button
Seat 1: alexmonf (220 in chips) 
Seat 2: Gaku00 (630 in chips) 
Seat 3: Mahu2021 (650 in chips) 
Gaku00: posts small blind 15
Mahu2021: posts big blind 30
*** HOLE CARDS ***
Dealt to Mahu2021 [2h Ad]
alexmonf: calls 30
Gaku00: folds 
Mahu2021: checks 
*** FLOP *** [Jd Kd 3h]
Mahu2021: checks 
alexmonf: bets 30
Mahu2021: calls 30
*** TURN *** [Jd Kd 3h] [5h]
Mahu2021: checks 
alexmonf: bets 30
Mahu2021: calls 30
*** RIVER *** [Jd Kd 3h 5h] [2s]
Mahu2021: checks 
alexmonf: bets 30
Mahu2021: folds 
Uncalled bet (30) returned to alexmonf
alexmonf collected 195 from pot
alexmonf: doesn't show hand 
*** SUMMARY ***
Total pot 195 | Rake 0 
Board [Jd Kd 3h 5h 2s]
Seat 1: alexmonf (button) collected (195)
Seat 2: Gaku00 (small blind) folded before Flop
Seat 3: Mahu2021 (big blind) folded on the River



PokerStars Hand #253474128162: Tournament #3825143611, $0.46+$0.04 USD Hold'em No Limit - Level II (15/30) - 2024/11/19 12:24:56 CET [2024/11/19 6:24:56 ET]
Table '3825143611 1' 3-max Seat #2 is the button
Seat 1: alexmonf (325 in chips) 
Seat 2: Gaku00 (615 in chips) 
Seat 3: Mahu2021 (560 in chips) 
Mahu2021: posts small blind 15
alexmonf: posts big blind 30
*** HOLE CARDS ***
Dealt to Mahu2021 [Ac 6h]
Gaku00: raises 60 to 90
Mahu2021: calls 75
alexmonf: folds 
*** FLOP *** [3d 4s Jh]
Mahu2021: bets 470 and is all-in
Gaku00: calls 470
*** TURN *** [3d 4s Jh] [9d]
*** RIVER *** [3d 4s Jh 9d] [2s]
*** SHOW DOWN ***
Mahu2021: shows [Ac 6h] (high card Ace)
Gaku00: shows [Ah Tc] (high card Ace - Jack+Ten kicker)
Gaku00 collected 1150 from pot
Mahu2021 finished the tournament in 3rd place
*** SUMMARY ***
Total pot 1150 | Rake 0 
Board [3d 4s Jh 9d 2s]
Seat 1: alexmonf (big blind) folded before Flop
Seat 2: Gaku00 (button) showed [Ah Tc] and won (1150) with high card Ace
Seat 3: Mahu2021 (small blind) showed [Ac 6h] and lost with high card Ace



