PokerStars Hand #252398541428: Tournament #3797719451, $1.40+$0.10 USD Hold'em No Limit - Level VI (250/500) - 2024/09/11 19:22:42 CET [2024/09/11 13:22:42 ET]
Table '3797719451 39' 8-max Seat #3 is the button
Seat 1: titus348 (9570 in chips) 
Seat 2: DerKarteMann (8970 in chips) 
Seat 3: Galvo97 (7220 in chips) 
Seat 4: Later P'tater (9886 in chips) 
Seat 5: hiTEF (10600 in chips) 
Seat 6: bar119119 (39064 in chips) 
Seat 7: Mahu2021 (10000 in chips) 
Seat 8: alexpipa27 (9450 in chips) 
titus348: posts the ante 50
DerKarteMann: posts the ante 50
Galvo97: posts the ante 50
Later P'tater: posts the ante 50
hiTEF: posts the ante 50
bar119119: posts the ante 50
Mahu2021: posts the ante 50
alexpipa27: posts the ante 50
Later P'tater: posts small blind 250
hiTEF: posts big blind 500
*** HOLE CARDS ***
Dealt to Mahu2021 [Kh Jc]
bar119119: folds 
Mahu2021: raises 9450 to 9950 and is all-in
alexpipa27: folds 
titus348: folds 
DerKarteMann: folds 
Galvo97: folds 
Later P'tater: folds 
hiTEF: folds 
Uncalled bet (9450) returned to Mahu2021
Mahu2021 collected 1650 from pot
Mahu2021: doesn't show hand 
*** SUMMARY ***
Total pot 1650 | Rake 0 
Seat 1: titus348 folded before Flop (didn't bet)
Seat 2: DerKarteMann folded before Flop (didn't bet)
Seat 3: Galvo97 (button) folded before Flop (didn't bet)
Seat 4: Later P'tater (small blind) folded before Flop
Seat 5: hiTEF (big blind) folded before Flop
Seat 6: bar119119 folded before Flop (didn't bet)
Seat 7: Mahu2021 collected (1650)
Seat 8: alexpipa27 folded before Flop (didn't bet)



PokerStars Hand #252398549817: Tournament #3797719451, $1.40+$0.10 USD Hold'em No Limit - Level VII (300/600) - 2024/09/11 19:23:11 CET [2024/09/11 13:23:11 ET]
Table '3797719451 39' 8-max Seat #4 is the button
Seat 1: titus348 (9520 in chips) 
Seat 2: DerKarteMann (8920 in chips) 
Seat 3: Galvo97 (7170 in chips) 
Seat 4: Later P'tater (9586 in chips) 
Seat 5: hiTEF (10050 in chips) 
Seat 6: bar119119 (39014 in chips) 
Seat 7: Mahu2021 (11100 in chips) 
Seat 8: alexpipa27 (9400 in chips) 
titus348: posts the ante 60
DerKarteMann: posts the ante 60
Galvo97: posts the ante 60
Later P'tater: posts the ante 60
hiTEF: posts the ante 60
bar119119: posts the ante 60
Mahu2021: posts the ante 60
alexpipa27: posts the ante 60
hiTEF: posts small blind 300
bar119119: posts big blind 600
*** HOLE CARDS ***
Dealt to Mahu2021 [6h Ad]
Mahu2021: raises 10440 to 11040 and is all-in
alexpipa27: folds 
titus348: folds 
DerKarteMann: calls 8860 and is all-in
Galvo97: folds 
Later P'tater: folds 
hiTEF: folds 
bar119119: folds 
Uncalled bet (2180) returned to Mahu2021
*** FLOP *** [8c 9h 3c]
*** TURN *** [8c 9h 3c] [3s]
*** RIVER *** [8c 9h 3c 3s] [Jh]
*** SHOW DOWN ***
Mahu2021: shows [6h Ad] (a pair of Threes)
DerKarteMann: shows [Ac Jd] (two pair, Jacks and Threes)
DerKarteMann collected 19100 from pot
*** SUMMARY ***
Total pot 19100 | Rake 0 
Board [8c 9h 3c 3s Jh]
Seat 1: titus348 folded before Flop (didn't bet)
Seat 2: DerKarteMann showed [Ac Jd] and won (19100) with two pair, Jacks and Threes
Seat 3: Galvo97 folded before Flop (didn't bet)
Seat 4: Later P'tater (button) folded before Flop (didn't bet)
Seat 5: hiTEF (small blind) folded before Flop
Seat 6: bar119119 (big blind) folded before Flop
Seat 7: Mahu2021 showed [6h Ad] and lost with a pair of Threes
Seat 8: alexpipa27 folded before Flop (didn't bet)



PokerStars Hand #252398556780: Tournament #3797719451, $1.40+$0.10 USD Hold'em No Limit - Level VII (300/600) - 2024/09/11 19:23:34 CET [2024/09/11 13:23:34 ET]
Table '3797719451 39' 8-max Seat #5 is the button
Seat 1: titus348 (9460 in chips) 
Seat 2: DerKarteMann (19100 in chips) 
Seat 3: Galvo97 (7110 in chips) 
Seat 4: Later P'tater (9526 in chips) 
Seat 5: hiTEF (9690 in chips) 
Seat 6: bar119119 (38354 in chips) 
Seat 7: Mahu2021 (2180 in chips) 
Seat 8: alexpipa27 (9340 in chips) 
titus348: posts the ante 60
DerKarteMann: posts the ante 60
Galvo97: posts the ante 60
Later P'tater: posts the ante 60
hiTEF: posts the ante 60
bar119119: posts the ante 60
Mahu2021: posts the ante 60
alexpipa27: posts the ante 60
bar119119: posts small blind 300
Mahu2021: posts big blind 600
*** HOLE CARDS ***
Dealt to Mahu2021 [2s 8s]
alexpipa27: calls 600
titus348: folds 
DerKarteMann: folds 
Galvo97: folds 
Later P'tater: raises 8866 to 9466 and is all-in
hiTEF: folds 
bar119119: folds 
Mahu2021: calls 1520 and is all-in
alexpipa27: folds 
Uncalled bet (7346) returned to Later P'tater
*** FLOP *** [Th 6h 9h]
*** TURN *** [Th 6h 9h] [6s]
*** RIVER *** [Th 6h 9h 6s] [6c]
*** SHOW DOWN ***
Mahu2021: shows [2s 8s] (three of a kind, Sixes)
Later P'tater: shows [Ts Kd] (a full house, Sixes full of Tens)
Later P'tater collected 5620 from pot
Mahu2021 finished the tournament
*** SUMMARY ***
Total pot 5620 | Rake 0 
Board [Th 6h 9h 6s 6c]
Seat 1: titus348 folded before Flop (didn't bet)
Seat 2: DerKarteMann folded before Flop (didn't bet)
Seat 3: Galvo97 folded before Flop (didn't bet)
Seat 4: Later P'tater showed [Ts Kd] and won (5620) with a full house, Sixes full of Tens
Seat 5: hiTEF (button) folded before Flop (didn't bet)
Seat 6: bar119119 (small blind) folded before Flop
Seat 7: Mahu2021 (big blind) showed [2s 8s] and lost with three of a kind, Sixes
Seat 8: alexpipa27 folded before Flop



