PokerStars Hand #246984604595: Tournament #3669735571, $1.84+$0.16 USD Hold'em No Limit - Level I (10/20) - 2023/11/07 22:07:34 CET [2023/11/07 16:07:34 ET]
Table '3669735571 1' 3-max Seat #1 is the button
Seat 1: R0astednuts (500 in chips) 
Seat 2: 4mitzi2351 (500 in chips) 
Seat 3: Mahu2021 (500 in chips) 
4mitzi2351: posts small blind 10
Mahu2021: posts big blind 20
*** HOLE CARDS ***
Dealt to Mahu2021 [9d 8s]
R0astednuts: folds 
4mitzi2351: calls 10
Mahu2021: checks 
*** FLOP *** [3c 7s Jd]
4mitzi2351: checks 
Mahu2021: bets 20
4mitzi2351: calls 20
*** TURN *** [3c 7s Jd] [8c]
4mitzi2351: checks 
Mahu2021: checks 
*** RIVER *** [3c 7s Jd 8c] [Kh]
4mitzi2351: bets 20
Mahu2021: calls 20
*** SHOW DOWN ***
4mitzi2351: shows [Kc Qh] (a pair of Kings)
Mahu2021: mucks hand 
4mitzi2351 collected 120 from pot
*** SUMMARY ***
Total pot 120 | Rake 0 
Board [3c 7s Jd 8c Kh]
Seat 1: R0astednuts (button) folded before Flop (didn't bet)
Seat 2: 4mitzi2351 (small blind) showed [Kc Qh] and won (120) with a pair of Kings
Seat 3: Mahu2021 (big blind) mucked [9d 8s]



PokerStars Hand #246984611858: Tournament #3669735571, $1.84+$0.16 USD Hold'em No Limit - Level I (10/20) - 2023/11/07 22:07:54 CET [2023/11/07 16:07:54 ET]
Table '3669735571 1' 3-max Seat #2 is the button
Seat 1: R0astednuts (500 in chips) 
Seat 2: 4mitzi2351 (560 in chips) 
Seat 3: Mahu2021 (440 in chips) 
Mahu2021: posts small blind 10
R0astednuts: posts big blind 20
*** HOLE CARDS ***
Dealt to Mahu2021 [Ts As]
4mitzi2351: calls 20
Mahu2021: raises 40 to 60
R0astednuts: folds 
4mitzi2351: folds 
Uncalled bet (40) returned to Mahu2021
Mahu2021 collected 60 from pot
Mahu2021: doesn't show hand 
*** SUMMARY ***
Total pot 60 | Rake 0 
Seat 1: R0astednuts (big blind) folded before Flop
Seat 2: 4mitzi2351 (button) folded before Flop
Seat 3: Mahu2021 (small blind) collected (60)



PokerStars Hand #246984615488: Tournament #3669735571, $1.84+$0.16 USD Hold'em No Limit - Level I (10/20) - 2023/11/07 22:08:04 CET [2023/11/07 16:08:04 ET]
Table '3669735571 1' 3-max Seat #3 is the button
Seat 1: R0astednuts (480 in chips) 
Seat 2: 4mitzi2351 (540 in chips) 
Seat 3: Mahu2021 (480 in chips) 
R0astednuts: posts small blind 10
4mitzi2351: posts big blind 20
*** HOLE CARDS ***
Dealt to Mahu2021 [7h 4h]
Mahu2021: calls 20
R0astednuts: raises 50 to 70
4mitzi2351: folds 
Mahu2021: calls 50
*** FLOP *** [5s 4c Ah]
R0astednuts: bets 70
Mahu2021: calls 70
*** TURN *** [5s 4c Ah] [7d]
R0astednuts: bets 130
Mahu2021: raises 210 to 340 and is all-in
R0astednuts: calls 210 and is all-in
*** RIVER *** [5s 4c Ah 7d] [9c]
*** SHOW DOWN ***
R0astednuts: shows [Ad Jc] (a pair of Aces)
Mahu2021: shows [7h 4h] (two pair, Sevens and Fours)
Mahu2021 collected 980 from pot
R0astednuts finished the tournament in 3rd place
*** SUMMARY ***
Total pot 980 | Rake 0 
Board [5s 4c Ah 7d 9c]
Seat 1: R0astednuts (small blind) showed [Ad Jc] and lost with a pair of Aces
Seat 2: 4mitzi2351 (big blind) folded before Flop
Seat 3: Mahu2021 (button) showed [7h 4h] and won (980) with two pair, Sevens and Fours



PokerStars Hand #246984630812: Tournament #3669735571, $1.84+$0.16 USD Hold'em No Limit - Level I (10/20) - 2023/11/07 22:08:47 CET [2023/11/07 16:08:47 ET]
Table '3669735571 1' 3-max Seat #2 is the button
Seat 2: 4mitzi2351 (520 in chips) 
Seat 3: Mahu2021 (980 in chips) 
4mitzi2351: posts small blind 10
Mahu2021: posts big blind 20
*** HOLE CARDS ***
Dealt to Mahu2021 [4h 5d]
4mitzi2351: calls 10
Mahu2021: checks 
*** FLOP *** [Jc 9d Js]
Mahu2021: checks 
4mitzi2351: bets 20
Mahu2021: calls 20
*** TURN *** [Jc 9d Js] [8h]
Mahu2021: checks 
4mitzi2351: bets 80
Mahu2021: folds 
Uncalled bet (80) returned to 4mitzi2351
4mitzi2351 collected 80 from pot
4mitzi2351: doesn't show hand 
*** SUMMARY ***
Total pot 80 | Rake 0 
Board [Jc 9d Js 8h]
Seat 2: 4mitzi2351 (button) (small blind) collected (80)
Seat 3: Mahu2021 (big blind) folded on the Turn



PokerStars Hand #246984636971: Tournament #3669735571, $1.84+$0.16 USD Hold'em No Limit - Level I (10/20) - 2023/11/07 22:09:04 CET [2023/11/07 16:09:04 ET]
Table '3669735571 1' 3-max Seat #3 is the button
Seat 2: 4mitzi2351 (560 in chips) 
Seat 3: Mahu2021 (940 in chips) 
Mahu2021: posts small blind 10
4mitzi2351: posts big blind 20
*** HOLE CARDS ***
Dealt to Mahu2021 [2h Ac]
Mahu2021: raises 20 to 40
4mitzi2351: calls 20
*** FLOP *** [Kh Qd 8d]
4mitzi2351: bets 80
Mahu2021: folds 
Uncalled bet (80) returned to 4mitzi2351
4mitzi2351 collected 80 from pot
4mitzi2351: doesn't show hand 
*** SUMMARY ***
Total pot 80 | Rake 0 
Board [Kh Qd 8d]
Seat 2: 4mitzi2351 (big blind) collected (80)
Seat 3: Mahu2021 (button) (small blind) folded on the Flop



PokerStars Hand #246984641060: Tournament #3669735571, $1.84+$0.16 USD Hold'em No Limit - Level I (10/20) - 2023/11/07 22:09:15 CET [2023/11/07 16:09:15 ET]
Table '3669735571 1' 3-max Seat #2 is the button
Seat 2: 4mitzi2351 (600 in chips) 
Seat 3: Mahu2021 (900 in chips) 
4mitzi2351: posts small blind 10
Mahu2021: posts big blind 20
*** HOLE CARDS ***
Dealt to Mahu2021 [Kd 7d]
4mitzi2351: calls 10
Mahu2021: raises 40 to 60
4mitzi2351: calls 40
*** FLOP *** [Ad 2h 9c]
Mahu2021: checks 
4mitzi2351: checks 
*** TURN *** [Ad 2h 9c] [Qh]
Mahu2021: checks 
4mitzi2351: checks 
*** RIVER *** [Ad 2h 9c Qh] [7s]
Mahu2021: checks 
4mitzi2351: checks 
*** SHOW DOWN ***
Mahu2021: shows [Kd 7d] (a pair of Sevens)
4mitzi2351: mucks hand 
Mahu2021 collected 120 from pot
*** SUMMARY ***
Total pot 120 | Rake 0 
Board [Ad 2h 9c Qh 7s]
Seat 2: 4mitzi2351 (button) (small blind) mucked [5c 4c]
Seat 3: Mahu2021 (big blind) showed [Kd 7d] and won (120) with a pair of Sevens



PokerStars Hand #246984647990: Tournament #3669735571, $1.84+$0.16 USD Hold'em No Limit - Level I (10/20) - 2023/11/07 22:09:35 CET [2023/11/07 16:09:35 ET]
Table '3669735571 1' 3-max Seat #3 is the button
Seat 2: 4mitzi2351 (540 in chips) 
Seat 3: Mahu2021 (960 in chips) 
Mahu2021: posts small blind 10
4mitzi2351: posts big blind 20
*** HOLE CARDS ***
Dealt to Mahu2021 [4s Jh]
Mahu2021: folds 
Uncalled bet (10) returned to 4mitzi2351
4mitzi2351 collected 20 from pot
4mitzi2351: doesn't show hand 
*** SUMMARY ***
Total pot 20 | Rake 0 
Seat 2: 4mitzi2351 (big blind) collected (20)
Seat 3: Mahu2021 (button) (small blind) folded before Flop



PokerStars Hand #246984649865: Tournament #3669735571, $1.84+$0.16 USD Hold'em No Limit - Level I (10/20) - 2023/11/07 22:09:40 CET [2023/11/07 16:09:40 ET]
Table '3669735571 1' 3-max Seat #2 is the button
Seat 2: 4mitzi2351 (550 in chips) 
Seat 3: Mahu2021 (950 in chips) 
4mitzi2351: posts small blind 10
Mahu2021: posts big blind 20
*** HOLE CARDS ***
Dealt to Mahu2021 [Qh 4h]
4mitzi2351: folds 
Uncalled bet (10) returned to Mahu2021
Mahu2021 collected 20 from pot
Mahu2021: doesn't show hand 
*** SUMMARY ***
Total pot 20 | Rake 0 
Seat 2: 4mitzi2351 (button) (small blind) folded before Flop
Seat 3: Mahu2021 (big blind) collected (20)



PokerStars Hand #246984651825: Tournament #3669735571, $1.84+$0.16 USD Hold'em No Limit - Level I (10/20) - 2023/11/07 22:09:45 CET [2023/11/07 16:09:45 ET]
Table '3669735571 1' 3-max Seat #3 is the button
Seat 2: 4mitzi2351 (540 in chips) 
Seat 3: Mahu2021 (960 in chips) 
Mahu2021: posts small blind 10
4mitzi2351: posts big blind 20
*** HOLE CARDS ***
Dealt to Mahu2021 [Ad Qh]
Mahu2021: raises 40 to 60
4mitzi2351: calls 40
*** FLOP *** [Jh 4h Ah]
4mitzi2351: bets 480 and is all-in
Mahu2021: calls 480
*** TURN *** [Jh 4h Ah] [6d]
*** RIVER *** [Jh 4h Ah 6d] [Qs]
*** SHOW DOWN ***
4mitzi2351: shows [9h 8s] (high card Ace)
Mahu2021: shows [Ad Qh] (two pair, Aces and Queens)
Mahu2021 collected 1080 from pot
4mitzi2351 finished the tournament in 2nd place
Mahu2021 wins the tournament and receives $6.00 - congratulations!
*** SUMMARY ***
Total pot 1080 | Rake 0 
Board [Jh 4h Ah 6d Qs]
Seat 2: 4mitzi2351 (big blind) showed [9h 8s] and lost with high card Ace
Seat 3: Mahu2021 (button) (small blind) showed [Ad Qh] and won (1080) with two pair, Aces and Queens



