PokerStars Hand #246542721316: Tournament #3659200406, $0.92+$0.08 USD Hold'em No Limit - Level I (10/20) - 2023/10/15 8:58:05 CET [2023/10/15 2:58:05 ET]
Table '3659200406 1' 3-max Seat #1 is the button
Seat 1: ramblinryanson (500 in chips) 
Seat 2: Mahu2021 (500 in chips) 
Seat 3: KovalSM101 (500 in chips) 
Mahu2021: posts small blind 10
KovalSM101: posts big blind 20
*** HOLE CARDS ***
Dealt to Mahu2021 [Th Qh]
ramblinryanson: folds 
Mahu2021: raises 20 to 40
KovalSM101: calls 20
*** FLOP *** [Js 4c 8s]
Mahu2021: checks 
KovalSM101: bets 40
Mahu2021: calls 40
*** TURN *** [Js 4c 8s] [5s]
Mahu2021: checks 
KovalSM101: bets 420 and is all-in
Mahu2021: folds 
Uncalled bet (420) returned to KovalSM101
KovalSM101 collected 160 from pot
*** SUMMARY ***
Total pot 160 | Rake 0 
Board [Js 4c 8s 5s]
Seat 1: ramblinryanson (button) folded before Flop (didn't bet)
Seat 2: Mahu2021 (small blind) folded on the Turn
Seat 3: KovalSM101 (big blind) collected (160)



PokerStars Hand #246542723234: Tournament #3659200406, $0.92+$0.08 USD Hold'em No Limit - Level I (10/20) - 2023/10/15 8:58:27 CET [2023/10/15 2:58:27 ET]
Table '3659200406 1' 3-max Seat #2 is the button
Seat 1: ramblinryanson (500 in chips) 
Seat 2: Mahu2021 (420 in chips) 
Seat 3: KovalSM101 (580 in chips) 
KovalSM101: posts small blind 10
ramblinryanson: posts big blind 20
*** HOLE CARDS ***
Dealt to Mahu2021 [Th Ks]
Mahu2021: raises 20 to 40
KovalSM101: calls 30
ramblinryanson: calls 20
*** FLOP *** [7c 4d 8s]
KovalSM101: bets 60
ramblinryanson: calls 60
Mahu2021: folds 
*** TURN *** [7c 4d 8s] [Qs]
KovalSM101: bets 120
ramblinryanson: folds 
Uncalled bet (120) returned to KovalSM101
KovalSM101 collected 240 from pot
*** SUMMARY ***
Total pot 240 | Rake 0 
Board [7c 4d 8s Qs]
Seat 1: ramblinryanson (big blind) folded on the Turn
Seat 2: Mahu2021 (button) folded on the Flop
Seat 3: KovalSM101 (small blind) collected (240)



PokerStars Hand #246542725500: Tournament #3659200406, $0.92+$0.08 USD Hold'em No Limit - Level I (10/20) - 2023/10/15 8:58:51 CET [2023/10/15 2:58:51 ET]
Table '3659200406 1' 3-max Seat #3 is the button
Seat 1: ramblinryanson (400 in chips) 
Seat 2: Mahu2021 (380 in chips) 
Seat 3: KovalSM101 (720 in chips) 
ramblinryanson: posts small blind 10
Mahu2021: posts big blind 20
*** HOLE CARDS ***
Dealt to Mahu2021 [5c 6h]
KovalSM101: calls 20
ramblinryanson: calls 10
Mahu2021: checks 
*** FLOP *** [9d 9c 8h]
ramblinryanson: checks 
Mahu2021: bets 20
KovalSM101: calls 20
ramblinryanson: calls 20
*** TURN *** [9d 9c 8h] [Tc]
ramblinryanson: checks 
Mahu2021: checks 
KovalSM101: bets 60
ramblinryanson: calls 60
Mahu2021: folds 
*** RIVER *** [9d 9c 8h Tc] [5h]
ramblinryanson: checks 
KovalSM101: bets 240
ramblinryanson: folds 
Uncalled bet (240) returned to KovalSM101
KovalSM101 collected 240 from pot
*** SUMMARY ***
Total pot 240 | Rake 0 
Board [9d 9c 8h Tc 5h]
Seat 1: ramblinryanson (small blind) folded on the River
Seat 2: Mahu2021 (big blind) folded on the Turn
Seat 3: KovalSM101 (button) collected (240)



PokerStars Hand #246542728487: Tournament #3659200406, $0.92+$0.08 USD Hold'em No Limit - Level I (10/20) - 2023/10/15 8:59:24 CET [2023/10/15 2:59:24 ET]
Table '3659200406 1' 3-max Seat #1 is the button
Seat 1: ramblinryanson (300 in chips) 
Seat 2: Mahu2021 (340 in chips) 
Seat 3: KovalSM101 (860 in chips) 
Mahu2021: posts small blind 10
KovalSM101: posts big blind 20
*** HOLE CARDS ***
Dealt to Mahu2021 [Ac Jd]
ramblinryanson: folds 
Mahu2021: raises 20 to 40
KovalSM101: calls 20
*** FLOP *** [3h 4s Td]
Mahu2021: bets 40
KovalSM101: folds 
Uncalled bet (40) returned to Mahu2021
Mahu2021 collected 80 from pot
Mahu2021: doesn't show hand 
*** SUMMARY ***
Total pot 80 | Rake 0 
Board [3h 4s Td]
Seat 1: ramblinryanson (button) folded before Flop (didn't bet)
Seat 2: Mahu2021 (small blind) collected (80)
Seat 3: KovalSM101 (big blind) folded on the Flop



PokerStars Hand #246542729505: Tournament #3659200406, $0.92+$0.08 USD Hold'em No Limit - Level I (10/20) - 2023/10/15 8:59:35 CET [2023/10/15 2:59:35 ET]
Table '3659200406 1' 3-max Seat #2 is the button
Seat 1: ramblinryanson (300 in chips) 
Seat 2: Mahu2021 (380 in chips) 
Seat 3: KovalSM101 (820 in chips) 
KovalSM101: posts small blind 10
ramblinryanson: posts big blind 20
*** HOLE CARDS ***
Dealt to Mahu2021 [As 5c]
Mahu2021: raises 20 to 40
KovalSM101: folds 
ramblinryanson: calls 20
*** FLOP *** [Qd 6c Kh]
ramblinryanson: checks 
Mahu2021: checks 
*** TURN *** [Qd 6c Kh] [Jh]
ramblinryanson: bets 40
Mahu2021: calls 40
*** RIVER *** [Qd 6c Kh Jh] [9c]
ramblinryanson: bets 85
Mahu2021: folds 
Uncalled bet (85) returned to ramblinryanson
ramblinryanson collected 170 from pot
ramblinryanson: doesn't show hand 
*** SUMMARY ***
Total pot 170 | Rake 0 
Board [Qd 6c Kh Jh 9c]
Seat 1: ramblinryanson (big blind) collected (170)
Seat 2: Mahu2021 (button) folded on the River
Seat 3: KovalSM101 (small blind) folded before Flop



PokerStars Hand #246542732649: Tournament #3659200406, $0.92+$0.08 USD Hold'em No Limit - Level I (10/20) - 2023/10/15 9:00:10 CET [2023/10/15 3:00:10 ET]
Table '3659200406 1' 3-max Seat #3 is the button
Seat 1: ramblinryanson (390 in chips) 
Seat 2: Mahu2021 (300 in chips) 
Seat 3: KovalSM101 (810 in chips) 
ramblinryanson: posts small blind 10
Mahu2021: posts big blind 20
*** HOLE CARDS ***
Dealt to Mahu2021 [5h 8h]
KovalSM101: raises 40 to 60
ramblinryanson: calls 50
Mahu2021: calls 40
*** FLOP *** [3d 7d 9s]
ramblinryanson: checks 
Mahu2021: bets 240 and is all-in
KovalSM101: calls 240
ramblinryanson: folds 
*** TURN *** [3d 7d 9s] [Qd]
*** RIVER *** [3d 7d 9s Qd] [4h]
*** SHOW DOWN ***
Mahu2021: shows [5h 8h] (high card Queen)
KovalSM101: shows [Tc Kh] (high card King)
KovalSM101 collected 660 from pot
Mahu2021 finished the tournament in 3rd place
*** SUMMARY ***
Total pot 660 | Rake 0 
Board [3d 7d 9s Qd 4h]
Seat 1: ramblinryanson (small blind) folded on the Flop
Seat 2: Mahu2021 (big blind) showed [5h 8h] and lost with high card Queen
Seat 3: KovalSM101 (button) showed [Tc Kh] and won (660) with high card King



