PokerStars Hand #242991261964: Tournament #3575195220, $0.92+$0.08 USD Hold'em No Limit - Level I (10/20) - 2023/04/09 22:16:25 CET [2023/04/09 16:16:25 ET]
Table '3575195220 1' 3-max Seat #1 is the button
Seat 1: Jamer_pc (500 in chips) 
Seat 2: Cy17i (500 in chips) 
Seat 3: Mahu2021 (500 in chips) 
Cy17i: posts small blind 10
Mahu2021: posts big blind 20
*** HOLE CARDS ***
Dealt to Mahu2021 [6h 2s]
Jamer_pc: folds 
Cy17i: calls 10
Mahu2021: checks 
*** FLOP *** [2c 5s Qh]
Cy17i: checks 
Mahu2021: bets 20
Cy17i: folds 
Uncalled bet (20) returned to Mahu2021
Mahu2021 collected 40 from pot
Mahu2021: doesn't show hand 
*** SUMMARY ***
Total pot 40 | Rake 0 
Board [2c 5s Qh]
Seat 1: Jamer_pc (button) folded before Flop (didn't bet)
Seat 2: Cy17i (small blind) folded on the Flop
Seat 3: Mahu2021 (big blind) collected (40)



PokerStars Hand #242991271589: Tournament #3575195220, $0.92+$0.08 USD Hold'em No Limit - Level I (10/20) - 2023/04/09 22:16:45 CET [2023/04/09 16:16:45 ET]
Table '3575195220 1' 3-max Seat #2 is the button
Seat 1: Jamer_pc (500 in chips) 
Seat 2: Cy17i (480 in chips) 
Seat 3: Mahu2021 (520 in chips) 
Mahu2021: posts small blind 10
Jamer_pc: posts big blind 20
*** HOLE CARDS ***
Dealt to Mahu2021 [8s 2d]
Cy17i: folds 
Mahu2021: folds 
Uncalled bet (10) returned to Jamer_pc
Jamer_pc collected 20 from pot
Jamer_pc: doesn't show hand 
*** SUMMARY ***
Total pot 20 | Rake 0 
Seat 1: Jamer_pc (big blind) collected (20)
Seat 2: Cy17i (button) folded before Flop (didn't bet)
Seat 3: Mahu2021 (small blind) folded before Flop



PokerStars Hand #242991275415: Tournament #3575195220, $0.92+$0.08 USD Hold'em No Limit - Level I (10/20) - 2023/04/09 22:16:53 CET [2023/04/09 16:16:53 ET]
Table '3575195220 1' 3-max Seat #3 is the button
Seat 1: Jamer_pc (510 in chips) 
Seat 2: Cy17i (480 in chips) 
Seat 3: Mahu2021 (510 in chips) 
Jamer_pc: posts small blind 10
Cy17i: posts big blind 20
*** HOLE CARDS ***
Dealt to Mahu2021 [3h Qs]
Mahu2021: folds 
Jamer_pc: folds 
Uncalled bet (10) returned to Cy17i
Cy17i collected 20 from pot
*** SUMMARY ***
Total pot 20 | Rake 0 
Seat 1: Jamer_pc (small blind) folded before Flop
Seat 2: Cy17i (big blind) collected (20)
Seat 3: Mahu2021 (button) folded before Flop (didn't bet)



PokerStars Hand #242991278786: Tournament #3575195220, $0.92+$0.08 USD Hold'em No Limit - Level I (10/20) - 2023/04/09 22:17:00 CET [2023/04/09 16:17:00 ET]
Table '3575195220 1' 3-max Seat #1 is the button
Seat 1: Jamer_pc (500 in chips) 
Seat 2: Cy17i (490 in chips) 
Seat 3: Mahu2021 (510 in chips) 
Cy17i: posts small blind 10
Mahu2021: posts big blind 20
*** HOLE CARDS ***
Dealt to Mahu2021 [Jd Jh]
Jamer_pc: folds 
Cy17i: calls 10
Mahu2021: raises 490 to 510 and is all-in
Cy17i: folds 
Uncalled bet (490) returned to Mahu2021
Mahu2021 collected 40 from pot
Mahu2021: doesn't show hand 
*** SUMMARY ***
Total pot 40 | Rake 0 
Seat 1: Jamer_pc (button) folded before Flop (didn't bet)
Seat 2: Cy17i (small blind) folded before Flop
Seat 3: Mahu2021 (big blind) collected (40)



PokerStars Hand #242991286288: Tournament #3575195220, $0.92+$0.08 USD Hold'em No Limit - Level I (10/20) - 2023/04/09 22:17:16 CET [2023/04/09 16:17:16 ET]
Table '3575195220 1' 3-max Seat #2 is the button
Seat 1: Jamer_pc (500 in chips) 
Seat 2: Cy17i (470 in chips) 
Seat 3: Mahu2021 (530 in chips) 
Mahu2021: posts small blind 10
Jamer_pc: posts big blind 20
*** HOLE CARDS ***
Dealt to Mahu2021 [4c 5d]
Cy17i: raises 20 to 40
Mahu2021: folds 
Jamer_pc: folds 
Uncalled bet (20) returned to Cy17i
Cy17i collected 50 from pot
*** SUMMARY ***
Total pot 50 | Rake 0 
Seat 1: Jamer_pc (big blind) folded before Flop
Seat 2: Cy17i (button) collected (50)
Seat 3: Mahu2021 (small blind) folded before Flop



PokerStars Hand #242991290283: Tournament #3575195220, $0.92+$0.08 USD Hold'em No Limit - Level I (10/20) - 2023/04/09 22:17:24 CET [2023/04/09 16:17:24 ET]
Table '3575195220 1' 3-max Seat #3 is the button
Seat 1: Jamer_pc (480 in chips) 
Seat 2: Cy17i (500 in chips) 
Seat 3: Mahu2021 (520 in chips) 
Jamer_pc: posts small blind 10
Cy17i: posts big blind 20
*** HOLE CARDS ***
Dealt to Mahu2021 [9c Kd]
Mahu2021: raises 20 to 40
Jamer_pc: raises 440 to 480 and is all-in
Cy17i: folds 
Mahu2021: calls 440
*** FLOP *** [Qh 6c 2s]
*** TURN *** [Qh 6c 2s] [Qs]
*** RIVER *** [Qh 6c 2s Qs] [5s]
*** SHOW DOWN ***
Jamer_pc: shows [Qd Jc] (three of a kind, Queens)
Mahu2021: shows [9c Kd] (a pair of Queens)
Jamer_pc collected 980 from pot
*** SUMMARY ***
Total pot 980 | Rake 0 
Board [Qh 6c 2s Qs 5s]
Seat 1: Jamer_pc (small blind) showed [Qd Jc] and won (980) with three of a kind, Queens
Seat 2: Cy17i (big blind) folded before Flop
Seat 3: Mahu2021 (button) showed [9c Kd] and lost with a pair of Queens



PokerStars Hand #242991307339: Tournament #3575195220, $0.92+$0.08 USD Hold'em No Limit - Level I (10/20) - 2023/04/09 22:18:00 CET [2023/04/09 16:18:00 ET]
Table '3575195220 1' 3-max Seat #1 is the button
Seat 1: Jamer_pc (980 in chips) 
Seat 2: Cy17i (480 in chips) 
Seat 3: Mahu2021 (40 in chips) 
Cy17i: posts small blind 10
Mahu2021: posts big blind 20
*** HOLE CARDS ***
Dealt to Mahu2021 [6d 4c]
Jamer_pc: raises 20 to 40
Cy17i: folds 
Mahu2021: calls 20 and is all-in
*** FLOP *** [5s Jd Ah]
*** TURN *** [5s Jd Ah] [As]
*** RIVER *** [5s Jd Ah As] [Kc]
*** SHOW DOWN ***
Mahu2021: shows [6d 4c] (a pair of Aces)
Jamer_pc: shows [8h Jh] (two pair, Aces and Jacks)
Jamer_pc collected 90 from pot
Mahu2021 finished the tournament in 3rd place
*** SUMMARY ***
Total pot 90 | Rake 0 
Board [5s Jd Ah As Kc]
Seat 1: Jamer_pc (button) showed [8h Jh] and won (90) with two pair, Aces and Jacks
Seat 2: Cy17i (small blind) folded before Flop
Seat 3: Mahu2021 (big blind) showed [6d 4c] and lost with a pair of Aces



