PokerStars Hand #245696980152: Tournament #3638658076, $0.92+$0.08 USD Hold'em No Limit - Level I (10/20) - 2023/08/31 20:36:46 CET [2023/08/31 14:36:46 ET]
Table '3638658076 1' 3-max Seat #1 is the button
Seat 1: kr1nts77 (500 in chips) 
Seat 2: Mahu2021 (500 in chips) 
Seat 3: Xande085 (500 in chips) 
Mahu2021: posts small blind 10
Xande085: posts big blind 20
*** HOLE CARDS ***
Dealt to Mahu2021 [8c Kc]
kr1nts77: raises 20 to 40
Mahu2021: calls 30
Xande085: folds 
*** FLOP *** [Ad Jc 3c]
Mahu2021: checks 
kr1nts77: bets 55
Mahu2021: calls 55
*** TURN *** [Ad Jc 3c] [Qh]
Mahu2021: checks 
kr1nts77: checks 
*** RIVER *** [Ad Jc 3c Qh] [6c]
Mahu2021: bets 60
kr1nts77: folds 
Uncalled bet (60) returned to Mahu2021
Mahu2021 collected 210 from pot
Mahu2021: doesn't show hand 
*** SUMMARY ***
Total pot 210 | Rake 0 
Board [Ad Jc 3c Qh 6c]
Seat 1: kr1nts77 (button) folded on the River
Seat 2: Mahu2021 (small blind) collected (210)
Seat 3: Xande085 (big blind) folded before Flop



PokerStars Hand #245696990407: Tournament #3638658076, $0.92+$0.08 USD Hold'em No Limit - Level I (10/20) - 2023/08/31 20:37:19 CET [2023/08/31 14:37:19 ET]
Table '3638658076 1' 3-max Seat #2 is the button
Seat 1: kr1nts77 (405 in chips) 
Seat 2: Mahu2021 (615 in chips) 
Seat 3: Xande085 (480 in chips) 
Xande085: posts small blind 10
kr1nts77: posts big blind 20
*** HOLE CARDS ***
Dealt to Mahu2021 [3d 4c]
Mahu2021: folds 
Xande085: raises 40 to 60
kr1nts77: calls 40
*** FLOP *** [Tc Qs 7d]
Xande085: bets 60
kr1nts77: calls 60
*** TURN *** [Tc Qs 7d] [4s]
Xande085: bets 240
kr1nts77: folds 
Uncalled bet (240) returned to Xande085
Xande085 collected 240 from pot
Xande085: doesn't show hand 
*** SUMMARY ***
Total pot 240 | Rake 0 
Board [Tc Qs 7d 4s]
Seat 1: kr1nts77 (big blind) folded on the Turn
Seat 2: Mahu2021 (button) folded before Flop (didn't bet)
Seat 3: Xande085 (small blind) collected (240)



PokerStars Hand #245697002576: Tournament #3638658076, $0.92+$0.08 USD Hold'em No Limit - Level I (10/20) - 2023/08/31 20:37:58 CET [2023/08/31 14:37:58 ET]
Table '3638658076 1' 3-max Seat #3 is the button
Seat 1: kr1nts77 (285 in chips) 
Seat 2: Mahu2021 (615 in chips) 
Seat 3: Xande085 (600 in chips) 
kr1nts77: posts small blind 10
Mahu2021: posts big blind 20
*** HOLE CARDS ***
Dealt to Mahu2021 [Js 3s]
Xande085: folds 
kr1nts77: raises 30 to 50
Mahu2021: calls 30
*** FLOP *** [Qs 4d 4c]
kr1nts77: checks 
Mahu2021: checks 
*** TURN *** [Qs 4d 4c] [Jc]
kr1nts77: bets 55
Mahu2021: calls 55
*** RIVER *** [Qs 4d 4c Jc] [Th]
kr1nts77: bets 180 and is all-in
Mahu2021: folds 
Uncalled bet (180) returned to kr1nts77
kr1nts77 collected 210 from pot
kr1nts77: doesn't show hand 
*** SUMMARY ***
Total pot 210 | Rake 0 
Board [Qs 4d 4c Jc Th]
Seat 1: kr1nts77 (small blind) collected (210)
Seat 2: Mahu2021 (big blind) folded on the River
Seat 3: Xande085 (button) folded before Flop (didn't bet)



PokerStars Hand #245697018178: Tournament #3638658076, $0.92+$0.08 USD Hold'em No Limit - Level I (10/20) - 2023/08/31 20:38:48 CET [2023/08/31 14:38:48 ET]
Table '3638658076 1' 3-max Seat #1 is the button
Seat 1: kr1nts77 (390 in chips) 
Seat 2: Mahu2021 (510 in chips) 
Seat 3: Xande085 (600 in chips) 
Mahu2021: posts small blind 10
Xande085: posts big blind 20
*** HOLE CARDS ***
Dealt to Mahu2021 [3c Js]
kr1nts77: raises 20 to 40
Mahu2021: folds 
Xande085: folds 
Uncalled bet (20) returned to kr1nts77
kr1nts77 collected 50 from pot
kr1nts77: doesn't show hand 
*** SUMMARY ***
Total pot 50 | Rake 0 
Seat 1: kr1nts77 (button) collected (50)
Seat 2: Mahu2021 (small blind) folded before Flop
Seat 3: Xande085 (big blind) folded before Flop



PokerStars Hand #245697022037: Tournament #3638658076, $0.92+$0.08 USD Hold'em No Limit - Level I (10/20) - 2023/08/31 20:39:00 CET [2023/08/31 14:39:00 ET]
Table '3638658076 1' 3-max Seat #2 is the button
Seat 1: kr1nts77 (420 in chips) 
Seat 2: Mahu2021 (500 in chips) 
Seat 3: Xande085 (580 in chips) 
Xande085: posts small blind 10
kr1nts77: posts big blind 20
*** HOLE CARDS ***
Dealt to Mahu2021 [9h 6s]
Mahu2021: folds 
Xande085: raises 40 to 60
kr1nts77: folds 
Uncalled bet (40) returned to Xande085
Xande085 collected 40 from pot
Xande085: doesn't show hand 
*** SUMMARY ***
Total pot 40 | Rake 0 
Seat 1: kr1nts77 (big blind) folded before Flop
Seat 2: Mahu2021 (button) folded before Flop (didn't bet)
Seat 3: Xande085 (small blind) collected (40)



PokerStars Hand #245697029148: Tournament #3638658076, $0.92+$0.08 USD Hold'em No Limit - Level I (10/20) - 2023/08/31 20:39:24 CET [2023/08/31 14:39:24 ET]
Table '3638658076 1' 3-max Seat #3 is the button
Seat 1: kr1nts77 (400 in chips) 
Seat 2: Mahu2021 (500 in chips) 
Seat 3: Xande085 (600 in chips) 
kr1nts77: posts small blind 10
Mahu2021: posts big blind 20
*** HOLE CARDS ***
Dealt to Mahu2021 [Qc Kd]
Xande085: raises 20 to 40
kr1nts77: folds 
Mahu2021: calls 20
*** FLOP *** [4d Js 3s]
Mahu2021: checks 
Xande085: bets 60
Mahu2021: folds 
Uncalled bet (60) returned to Xande085
Xande085 collected 90 from pot
Xande085: doesn't show hand 
*** SUMMARY ***
Total pot 90 | Rake 0 
Board [4d Js 3s]
Seat 1: kr1nts77 (small blind) folded before Flop
Seat 2: Mahu2021 (big blind) folded on the Flop
Seat 3: Xande085 (button) collected (90)



PokerStars Hand #245697035695: Tournament #3638658076, $0.92+$0.08 USD Hold'em No Limit - Level I (10/20) - 2023/08/31 20:39:45 CET [2023/08/31 14:39:45 ET]
Table '3638658076 1' 3-max Seat #1 is the button
Seat 1: kr1nts77 (390 in chips) 
Seat 2: Mahu2021 (460 in chips) 
Seat 3: Xande085 (650 in chips) 
Mahu2021: posts small blind 10
Xande085: posts big blind 20
*** HOLE CARDS ***
Dealt to Mahu2021 [4h Ad]
kr1nts77: folds 
Mahu2021: raises 20 to 40
Xande085: raises 80 to 120
Mahu2021: calls 80
*** FLOP *** [4c 5d Ks]
Mahu2021: bets 340 and is all-in
Xande085: calls 340
*** TURN *** [4c 5d Ks] [Jc]
*** RIVER *** [4c 5d Ks Jc] [3h]
*** SHOW DOWN ***
Mahu2021: shows [4h Ad] (a pair of Fours)
Xande085: shows [Ac As] (a pair of Aces)
Xande085 collected 920 from pot
Mahu2021 finished the tournament in 3rd place
*** SUMMARY ***
Total pot 920 | Rake 0 
Board [4c 5d Ks Jc 3h]
Seat 1: kr1nts77 (button) folded before Flop (didn't bet)
Seat 2: Mahu2021 (small blind) showed [4h Ad] and lost with a pair of Fours
Seat 3: Xande085 (big blind) showed [Ac As] and won (920) with a pair of Aces



