PokerStars Hand #245725817896: Tournament #3639375383, $0.92+$0.08 USD Hold'em No Limit - Level I (10/20) - 2023/09/02 10:09:14 CET [2023/09/02 4:09:14 ET]
Table '3639375383 1' 3-max Seat #1 is the button
Seat 1: anti-xaker (500 in chips) 
Seat 2: Mahu2021 (500 in chips) 
Seat 3: kepilali1 (500 in chips) 
Mahu2021: posts small blind 10
kepilali1: posts big blind 20
*** HOLE CARDS ***
Dealt to Mahu2021 [Jd 7h]
anti-xaker: folds 
Mahu2021: calls 10
kepilali1: checks 
*** FLOP *** [6c Tc 6s]
Mahu2021: checks 
kepilali1: checks 
*** TURN *** [6c Tc 6s] [9c]
Mahu2021: bets 20
kepilali1: calls 20
*** RIVER *** [6c Tc 6s 9c] [Qs]
Mahu2021: checks 
kepilali1: bets 40
Mahu2021: folds 
Uncalled bet (40) returned to kepilali1
kepilali1 collected 80 from pot
*** SUMMARY ***
Total pot 80 | Rake 0 
Board [6c Tc 6s 9c Qs]
Seat 1: anti-xaker (button) folded before Flop (didn't bet)
Seat 2: Mahu2021 (small blind) folded on the River
Seat 3: kepilali1 (big blind) collected (80)



PokerStars Hand #245725820586: Tournament #3639375383, $0.92+$0.08 USD Hold'em No Limit - Level I (10/20) - 2023/09/02 10:09:36 CET [2023/09/02 4:09:36 ET]
Table '3639375383 1' 3-max Seat #2 is the button
Seat 1: anti-xaker (500 in chips) 
Seat 2: Mahu2021 (460 in chips) 
Seat 3: kepilali1 (540 in chips) 
kepilali1: posts small blind 10
anti-xaker: posts big blind 20
*** HOLE CARDS ***
Dealt to Mahu2021 [Tc 2h]
Mahu2021: folds 
kepilali1: folds 
Uncalled bet (10) returned to anti-xaker
anti-xaker collected 20 from pot
anti-xaker: doesn't show hand 
*** SUMMARY ***
Total pot 20 | Rake 0 
Seat 1: anti-xaker (big blind) collected (20)
Seat 2: Mahu2021 (button) folded before Flop (didn't bet)
Seat 3: kepilali1 (small blind) folded before Flop



PokerStars Hand #245725821283: Tournament #3639375383, $0.92+$0.08 USD Hold'em No Limit - Level I (10/20) - 2023/09/02 10:09:41 CET [2023/09/02 4:09:41 ET]
Table '3639375383 1' 3-max Seat #3 is the button
Seat 1: anti-xaker (510 in chips) 
Seat 2: Mahu2021 (460 in chips) 
Seat 3: kepilali1 (530 in chips) 
anti-xaker: posts small blind 10
Mahu2021: posts big blind 20
*** HOLE CARDS ***
Dealt to Mahu2021 [2c 9s]
kepilali1: folds 
anti-xaker: folds 
Uncalled bet (10) returned to Mahu2021
Mahu2021 collected 20 from pot
Mahu2021: doesn't show hand 
*** SUMMARY ***
Total pot 20 | Rake 0 
Seat 1: anti-xaker (small blind) folded before Flop
Seat 2: Mahu2021 (big blind) collected (20)
Seat 3: kepilali1 (button) folded before Flop (didn't bet)



PokerStars Hand #245725822297: Tournament #3639375383, $0.92+$0.08 USD Hold'em No Limit - Level I (10/20) - 2023/09/02 10:09:49 CET [2023/09/02 4:09:49 ET]
Table '3639375383 1' 3-max Seat #1 is the button
Seat 1: anti-xaker (500 in chips) 
Seat 2: Mahu2021 (470 in chips) 
Seat 3: kepilali1 (530 in chips) 
Mahu2021: posts small blind 10
kepilali1: posts big blind 20
*** HOLE CARDS ***
Dealt to Mahu2021 [3d 4s]
anti-xaker: folds 
Mahu2021: calls 10
kepilali1: raises 60 to 80
Mahu2021: folds 
Uncalled bet (60) returned to kepilali1
kepilali1 collected 40 from pot
*** SUMMARY ***
Total pot 40 | Rake 0 
Seat 1: anti-xaker (button) folded before Flop (didn't bet)
Seat 2: Mahu2021 (small blind) folded before Flop
Seat 3: kepilali1 (big blind) collected (40)



PokerStars Hand #245725824136: Tournament #3639375383, $0.92+$0.08 USD Hold'em No Limit - Level I (10/20) - 2023/09/02 10:10:04 CET [2023/09/02 4:10:04 ET]
Table '3639375383 1' 3-max Seat #2 is the button
Seat 1: anti-xaker (500 in chips) 
Seat 2: Mahu2021 (450 in chips) 
Seat 3: kepilali1 (550 in chips) 
kepilali1: posts small blind 10
anti-xaker: posts big blind 20
*** HOLE CARDS ***
Dealt to Mahu2021 [Th 5d]
Mahu2021: folds 
kepilali1: folds 
Uncalled bet (10) returned to anti-xaker
anti-xaker collected 20 from pot
anti-xaker: doesn't show hand 
*** SUMMARY ***
Total pot 20 | Rake 0 
Seat 1: anti-xaker (big blind) collected (20)
Seat 2: Mahu2021 (button) folded before Flop (didn't bet)
Seat 3: kepilali1 (small blind) folded before Flop



PokerStars Hand #245725824825: Tournament #3639375383, $0.92+$0.08 USD Hold'em No Limit - Level I (10/20) - 2023/09/02 10:10:10 CET [2023/09/02 4:10:10 ET]
Table '3639375383 1' 3-max Seat #3 is the button
Seat 1: anti-xaker (510 in chips) 
Seat 2: Mahu2021 (450 in chips) 
Seat 3: kepilali1 (540 in chips) 
anti-xaker: posts small blind 10
Mahu2021: posts big blind 20
*** HOLE CARDS ***
Dealt to Mahu2021 [Jc Qc]
kepilali1: folds 
anti-xaker: raises 490 to 510 and is all-in
Mahu2021: folds 
Uncalled bet (490) returned to anti-xaker
anti-xaker collected 40 from pot
anti-xaker: doesn't show hand 
*** SUMMARY ***
Total pot 40 | Rake 0 
Seat 1: anti-xaker (small blind) collected (40)
Seat 2: Mahu2021 (big blind) folded before Flop
Seat 3: kepilali1 (button) folded before Flop (didn't bet)



PokerStars Hand #245725826584: Tournament #3639375383, $0.92+$0.08 USD Hold'em No Limit - Level I (10/20) - 2023/09/02 10:10:24 CET [2023/09/02 4:10:24 ET]
Table '3639375383 1' 3-max Seat #1 is the button
Seat 1: anti-xaker (530 in chips) 
Seat 2: Mahu2021 (430 in chips) 
Seat 3: kepilali1 (540 in chips) 
Mahu2021: posts small blind 10
kepilali1: posts big blind 20
*** HOLE CARDS ***
Dealt to Mahu2021 [6c 9h]
anti-xaker: raises 20 to 40
Mahu2021: folds 
kepilali1: calls 20
*** FLOP *** [Kd Td 8c]
kepilali1: bets 20
anti-xaker: folds 
Uncalled bet (20) returned to kepilali1
kepilali1 collected 90 from pot
*** SUMMARY ***
Total pot 90 | Rake 0 
Board [Kd Td 8c]
Seat 1: anti-xaker (button) folded on the Flop
Seat 2: Mahu2021 (small blind) folded before Flop
Seat 3: kepilali1 (big blind) collected (90)



PokerStars Hand #245725828698: Tournament #3639375383, $0.92+$0.08 USD Hold'em No Limit - Level I (10/20) - 2023/09/02 10:10:41 CET [2023/09/02 4:10:41 ET]
Table '3639375383 1' 3-max Seat #2 is the button
Seat 1: anti-xaker (490 in chips) 
Seat 2: Mahu2021 (420 in chips) 
Seat 3: kepilali1 (590 in chips) 
kepilali1: posts small blind 10
anti-xaker: posts big blind 20
*** HOLE CARDS ***
Dealt to Mahu2021 [Jh Qc]
Mahu2021: raises 20 to 40
kepilali1: folds 
anti-xaker: calls 20
*** FLOP *** [Jc As 3s]
anti-xaker: checks 
Mahu2021: bets 40
anti-xaker: raises 80 to 120
Mahu2021: raises 260 to 380 and is all-in
anti-xaker: calls 260
*** TURN *** [Jc As 3s] [Th]
*** RIVER *** [Jc As 3s Th] [4d]
*** SHOW DOWN ***
anti-xaker: shows [3h Ah] (two pair, Aces and Threes)
Mahu2021: shows [Jh Qc] (a pair of Jacks)
anti-xaker collected 850 from pot
Mahu2021 finished the tournament in 3rd place
*** SUMMARY ***
Total pot 850 | Rake 0 
Board [Jc As 3s Th 4d]
Seat 1: anti-xaker (big blind) showed [3h Ah] and won (850) with two pair, Aces and Threes
Seat 2: Mahu2021 (button) showed [Jh Qc] and lost with a pair of Jacks
Seat 3: kepilali1 (small blind) folded before Flop



