PokerStars Hand #243973155968: Tournament #3597563243, $0.92+$0.08 USD Hold'em No Limit - Level I (10/20) - 2023/05/29 14:32:51 CET [2023/05/29 8:32:51 ET]
Table '3597563243 1' 3-max Seat #1 is the button
Seat 1: alk859 (500 in chips) 
Seat 2: lamy R537 (500 in chips) 
Seat 3: Mahu2021 (500 in chips) 
lamy R537: posts small blind 10
Mahu2021: posts big blind 20
*** HOLE CARDS ***
Dealt to Mahu2021 [Qh Th]
alk859: raises 40 to 60
lamy R537: calls 50
Mahu2021: calls 40
*** FLOP *** [6h 7c 9c]
lamy R537: checks 
Mahu2021: checks 
alk859: bets 440 and is all-in
lamy R537: folds 
Mahu2021: folds 
Uncalled bet (440) returned to alk859
alk859 collected 180 from pot
*** SUMMARY ***
Total pot 180 | Rake 0 
Board [6h 7c 9c]
Seat 1: alk859 (button) collected (180)
Seat 2: lamy R537 (small blind) folded on the Flop
Seat 3: Mahu2021 (big blind) folded on the Flop



PokerStars Hand #243973159937: Tournament #3597563243, $0.92+$0.08 USD Hold'em No Limit - Level I (10/20) - 2023/05/29 14:33:12 CET [2023/05/29 8:33:12 ET]
Table '3597563243 1' 3-max Seat #2 is the button
Seat 1: alk859 (620 in chips) 
Seat 2: lamy R537 (440 in chips) 
Seat 3: Mahu2021 (440 in chips) 
Mahu2021: posts small blind 10
alk859: posts big blind 20
*** HOLE CARDS ***
Dealt to Mahu2021 [Jd Qc]
lamy R537: calls 20
Mahu2021: calls 10
alk859: raises 600 to 620 and is all-in
lamy R537: folds 
Mahu2021: folds 
Uncalled bet (600) returned to alk859
alk859 collected 60 from pot
*** SUMMARY ***
Total pot 60 | Rake 0 
Seat 1: alk859 (big blind) collected (60)
Seat 2: lamy R537 (button) folded before Flop
Seat 3: Mahu2021 (small blind) folded before Flop



PokerStars Hand #243973161867: Tournament #3597563243, $0.92+$0.08 USD Hold'em No Limit - Level I (10/20) - 2023/05/29 14:33:22 CET [2023/05/29 8:33:22 ET]
Table '3597563243 1' 3-max Seat #3 is the button
Seat 1: alk859 (660 in chips) 
Seat 2: lamy R537 (420 in chips) 
Seat 3: Mahu2021 (420 in chips) 
alk859: posts small blind 10
lamy R537: posts big blind 20
*** HOLE CARDS ***
Dealt to Mahu2021 [Qh 4h]
Mahu2021: folds 
alk859: calls 10
lamy R537: checks 
*** FLOP *** [3c 8c Qs]
alk859: checks 
lamy R537: checks 
*** TURN *** [3c 8c Qs] [4c]
alk859: checks 
lamy R537: bets 40
alk859: calls 40
*** RIVER *** [3c 8c Qs 4c] [5c]
alk859: checks 
lamy R537: bets 60
alk859: folds 
Uncalled bet (60) returned to lamy R537
lamy R537 collected 120 from pot
*** SUMMARY ***
Total pot 120 | Rake 0 
Board [3c 8c Qs 4c 5c]
Seat 1: alk859 (small blind) folded on the River
Seat 2: lamy R537 (big blind) collected (120)
Seat 3: Mahu2021 (button) folded before Flop (didn't bet)



PokerStars Hand #243973166208: Tournament #3597563243, $0.92+$0.08 USD Hold'em No Limit - Level I (10/20) - 2023/05/29 14:33:44 CET [2023/05/29 8:33:44 ET]
Table '3597563243 1' 3-max Seat #1 is the button
Seat 1: alk859 (600 in chips) 
Seat 2: lamy R537 (480 in chips) 
Seat 3: Mahu2021 (420 in chips) 
lamy R537: posts small blind 10
Mahu2021: posts big blind 20
*** HOLE CARDS ***
Dealt to Mahu2021 [2c As]
alk859: raises 20 to 40
lamy R537: calls 30
Mahu2021: calls 20
*** FLOP *** [3c Kh Ad]
lamy R537: bets 40
Mahu2021: calls 40
alk859: folds 
*** TURN *** [3c Kh Ad] [Ts]
lamy R537: checks 
Mahu2021: bets 200
lamy R537: folds 
Uncalled bet (200) returned to Mahu2021
Mahu2021 collected 200 from pot
Mahu2021: doesn't show hand 
*** SUMMARY ***
Total pot 200 | Rake 0 
Board [3c Kh Ad Ts]
Seat 1: alk859 (button) folded on the Flop
Seat 2: lamy R537 (small blind) folded on the Turn
Seat 3: Mahu2021 (big blind) collected (200)



PokerStars Hand #243973170012: Tournament #3597563243, $0.92+$0.08 USD Hold'em No Limit - Level I (10/20) - 2023/05/29 14:34:04 CET [2023/05/29 8:34:04 ET]
Table '3597563243 1' 3-max Seat #2 is the button
Seat 1: alk859 (560 in chips) 
Seat 2: lamy R537 (400 in chips) 
Seat 3: Mahu2021 (540 in chips) 
Mahu2021: posts small blind 10
alk859: posts big blind 20
*** HOLE CARDS ***
Dealt to Mahu2021 [9c 7h]
lamy R537: raises 20 to 40
Mahu2021: folds 
alk859: folds 
Uncalled bet (20) returned to lamy R537
lamy R537 collected 50 from pot
*** SUMMARY ***
Total pot 50 | Rake 0 
Seat 1: alk859 (big blind) folded before Flop
Seat 2: lamy R537 (button) collected (50)
Seat 3: Mahu2021 (small blind) folded before Flop



PokerStars Hand #243973172706: Tournament #3597563243, $0.92+$0.08 USD Hold'em No Limit - Level I (10/20) - 2023/05/29 14:34:18 CET [2023/05/29 8:34:18 ET]
Table '3597563243 1' 3-max Seat #3 is the button
Seat 1: alk859 (540 in chips) 
Seat 2: lamy R537 (430 in chips) 
Seat 3: Mahu2021 (530 in chips) 
alk859: posts small blind 10
lamy R537: posts big blind 20
*** HOLE CARDS ***
Dealt to Mahu2021 [Th Ad]
Mahu2021: raises 20 to 40
alk859: raises 500 to 540 and is all-in
lamy R537: folds 
Mahu2021: calls 490 and is all-in
Uncalled bet (10) returned to alk859
*** FLOP *** [3c 7s 7h]
*** TURN *** [3c 7s 7h] [Ks]
*** RIVER *** [3c 7s 7h Ks] [Qh]
*** SHOW DOWN ***
alk859: shows [Tc Kc] (two pair, Kings and Sevens)
Mahu2021: shows [Th Ad] (a pair of Sevens)
alk859 collected 1080 from pot
Mahu2021 finished the tournament in 3rd place
*** SUMMARY ***
Total pot 1080 | Rake 0 
Board [3c 7s 7h Ks Qh]
Seat 1: alk859 (small blind) showed [Tc Kc] and won (1080) with two pair, Kings and Sevens
Seat 2: lamy R537 (big blind) folded before Flop
Seat 3: Mahu2021 (button) showed [Th Ad] and lost with a pair of Sevens



