PokerStars Hand #244636578790: Tournament #3612859395, $0.92+$0.08 USD Hold'em No Limit - Level I (10/20) - 2023/07/05 10:47:54 CET [2023/07/05 4:47:54 ET]
Table '3612859395 1' 3-max Seat #1 is the button
Seat 1: GIN1007 (500 in chips) 
Seat 2: ripapa999 (500 in chips) 
Seat 3: Mahu2021 (500 in chips) 
ripapa999: posts small blind 10
Mahu2021: posts big blind 20
*** HOLE CARDS ***
Dealt to Mahu2021 [Qc 3c]
GIN1007: folds 
ripapa999: calls 10
Mahu2021: checks 
*** FLOP *** [Ac Qs Ts]
ripapa999 has timed out
ripapa999: checks 
Mahu2021: bets 20
ripapa999 has timed out
ripapa999: folds 
ripapa999 is sitting out
Uncalled bet (20) returned to Mahu2021
Mahu2021 collected 40 from pot
Mahu2021: doesn't show hand 
*** SUMMARY ***
Total pot 40 | Rake 0 
Board [Ac Qs Ts]
Seat 1: GIN1007 (button) folded before Flop (didn't bet)
Seat 2: ripapa999 (small blind) folded on the Flop
Seat 3: Mahu2021 (big blind) collected (40)



PokerStars Hand #244636584319: Tournament #3612859395, $0.92+$0.08 USD Hold'em No Limit - Level I (10/20) - 2023/07/05 10:48:40 CET [2023/07/05 4:48:40 ET]
Table '3612859395 1' 3-max Seat #2 is the button
Seat 1: GIN1007 (500 in chips) 
Seat 2: ripapa999 (480 in chips) is sitting out
Seat 3: Mahu2021 (520 in chips) 
Mahu2021: posts small blind 10
GIN1007: posts big blind 20
*** HOLE CARDS ***
Dealt to Mahu2021 [Jh 9s]
ripapa999: folds 
Mahu2021: calls 10
GIN1007: checks 
*** FLOP *** [9d 4h 7d]
Mahu2021: bets 20
GIN1007: calls 20
*** TURN *** [9d 4h 7d] [5c]
Mahu2021: bets 20
GIN1007: calls 20
*** RIVER *** [9d 4h 7d 5c] [Tc]
Mahu2021: bets 20
GIN1007: folds 
Uncalled bet (20) returned to Mahu2021
Mahu2021 collected 120 from pot
Mahu2021: doesn't show hand 
*** SUMMARY ***
Total pot 120 | Rake 0 
Board [9d 4h 7d 5c Tc]
Seat 1: GIN1007 (big blind) folded on the River
Seat 2: ripapa999 (button) folded before Flop (didn't bet)
Seat 3: Mahu2021 (small blind) collected (120)



PokerStars Hand #244636586608: Tournament #3612859395, $0.92+$0.08 USD Hold'em No Limit - Level I (10/20) - 2023/07/05 10:48:59 CET [2023/07/05 4:48:59 ET]
Table '3612859395 1' 3-max Seat #3 is the button
Seat 1: GIN1007 (440 in chips) 
Seat 2: ripapa999 (480 in chips) is sitting out
Seat 3: Mahu2021 (580 in chips) 
GIN1007: posts small blind 10
ripapa999: posts big blind 20
*** HOLE CARDS ***
Dealt to Mahu2021 [Td 9d]
Mahu2021: raises 20 to 40
GIN1007: calls 30
ripapa999: folds 
*** FLOP *** [8h Ac Ad]
GIN1007: bets 20
Mahu2021: folds 
Uncalled bet (20) returned to GIN1007
GIN1007 collected 100 from pot
*** SUMMARY ***
Total pot 100 | Rake 0 
Board [8h Ac Ad]
Seat 1: GIN1007 (small blind) collected (100)
Seat 2: ripapa999 (big blind) folded before Flop
Seat 3: Mahu2021 (button) folded on the Flop



PokerStars Hand #244636587762: Tournament #3612859395, $0.92+$0.08 USD Hold'em No Limit - Level I (10/20) - 2023/07/05 10:49:09 CET [2023/07/05 4:49:09 ET]
Table '3612859395 1' 3-max Seat #1 is the button
Seat 1: GIN1007 (500 in chips) 
Seat 2: ripapa999 (460 in chips) is sitting out
Seat 3: Mahu2021 (540 in chips) 
ripapa999: posts small blind 10
Mahu2021: posts big blind 20
*** HOLE CARDS ***
Dealt to Mahu2021 [Qd Td]
GIN1007: folds 
ripapa999: folds 
Uncalled bet (10) returned to Mahu2021
Mahu2021 collected 20 from pot
Mahu2021: doesn't show hand 
*** SUMMARY ***
Total pot 20 | Rake 0 
Seat 1: GIN1007 (button) folded before Flop (didn't bet)
Seat 2: ripapa999 (small blind) folded before Flop
Seat 3: Mahu2021 (big blind) collected (20)



PokerStars Hand #244636588321: Tournament #3612859395, $0.92+$0.08 USD Hold'em No Limit - Level I (10/20) - 2023/07/05 10:49:14 CET [2023/07/05 4:49:14 ET]
Table '3612859395 1' 3-max Seat #2 is the button
Seat 1: GIN1007 (500 in chips) 
Seat 2: ripapa999 (450 in chips) is sitting out
Seat 3: Mahu2021 (550 in chips) 
Mahu2021: posts small blind 10
GIN1007: posts big blind 20
*** HOLE CARDS ***
Dealt to Mahu2021 [Qd Ac]
ripapa999: folds 
Mahu2021: raises 20 to 40
GIN1007: raises 80 to 120
Mahu2021: raises 430 to 550 and is all-in
GIN1007: calls 380 and is all-in
Uncalled bet (50) returned to Mahu2021
*** FLOP *** [9h Ts 6s]
*** TURN *** [9h Ts 6s] [5h]
*** RIVER *** [9h Ts 6s 5h] [3d]
*** SHOW DOWN ***
Mahu2021: shows [Qd Ac] (high card Ace)
GIN1007: shows [9s Js] (a pair of Nines)
GIN1007 collected 1000 from pot
*** SUMMARY ***
Total pot 1000 | Rake 0 
Board [9h Ts 6s 5h 3d]
Seat 1: GIN1007 (big blind) showed [9s Js] and won (1000) with a pair of Nines
Seat 2: ripapa999 (button) folded before Flop (didn't bet)
Seat 3: Mahu2021 (small blind) showed [Qd Ac] and lost with high card Ace



PokerStars Hand #244636590268: Tournament #3612859395, $0.92+$0.08 USD Hold'em No Limit - Level I (10/20) - 2023/07/05 10:49:30 CET [2023/07/05 4:49:30 ET]
Table '3612859395 1' 3-max Seat #3 is the button
Seat 1: GIN1007 (1000 in chips) 
Seat 2: ripapa999 (450 in chips) is sitting out
Seat 3: Mahu2021 (50 in chips) 
GIN1007: posts small blind 10
ripapa999: posts big blind 20
*** HOLE CARDS ***
Dealt to Mahu2021 [6s Jd]
Mahu2021: raises 30 to 50 and is all-in
GIN1007: calls 40
ripapa999: folds 
*** FLOP *** [2h Tc 2s]
*** TURN *** [2h Tc 2s] [7d]
*** RIVER *** [2h Tc 2s 7d] [Ac]
*** SHOW DOWN ***
GIN1007: shows [8h Kc] (a pair of Deuces)
Mahu2021: shows [6s Jd] (a pair of Deuces - lower kicker)
GIN1007 collected 120 from pot
Mahu2021 finished the tournament in 3rd place
*** SUMMARY ***
Total pot 120 | Rake 0 
Board [2h Tc 2s 7d Ac]
Seat 1: GIN1007 (small blind) showed [8h Kc] and won (120) with a pair of Deuces
Seat 2: ripapa999 (big blind) folded before Flop
Seat 3: Mahu2021 (button) showed [6s Jd] and lost with a pair of Deuces



