PokerStars Hand #246514786523: Tournament #3658524290, $0.92+$0.08 USD Hold'em No Limit - Level I (10/20) - 2023/10/13 21:44:10 CET [2023/10/13 15:44:10 ET]
Table '3658524290 1' 3-max Seat #1 is the button
Seat 1: tarzan519 (500 in chips) 
Seat 2: Mahu2021 (500 in chips) 
Seat 3: rolls123 (500 in chips) 
Mahu2021: posts small blind 10
rolls123: posts big blind 20
*** HOLE CARDS ***
Dealt to Mahu2021 [5h 5c]
tarzan519: calls 20
Mahu2021: calls 10
rolls123: checks 
*** FLOP *** [7c 4c 9h]
Mahu2021: bets 20
rolls123: raises 75 to 95
tarzan519: calls 95
Mahu2021: folds 
*** TURN *** [7c 4c 9h] [4d]
rolls123: bets 203
tarzan519: raises 182 to 385 and is all-in
rolls123: calls 182 and is all-in
*** RIVER *** [7c 4c 9h 4d] [6s]
*** SHOW DOWN ***
rolls123: shows [9c Kd] (two pair, Nines and Fours)
tarzan519: shows [6h Tc] (two pair, Sixes and Fours)
rolls123 collected 1040 from pot
tarzan519 finished the tournament in 3rd place
*** SUMMARY ***
Total pot 1040 | Rake 0 
Board [7c 4c 9h 4d 6s]
Seat 1: tarzan519 (button) showed [6h Tc] and lost with two pair, Sixes and Fours
Seat 2: Mahu2021 (small blind) folded on the Flop
Seat 3: rolls123 (big blind) showed [9c Kd] and won (1040) with two pair, Nines and Fours



PokerStars Hand #246514796851: Tournament #3658524290, $0.92+$0.08 USD Hold'em No Limit - Level I (10/20) - 2023/10/13 21:44:39 CET [2023/10/13 15:44:39 ET]
Table '3658524290 1' 3-max Seat #3 is the button
Seat 2: Mahu2021 (460 in chips) 
Seat 3: rolls123 (1040 in chips) 
rolls123: posts small blind 10
Mahu2021: posts big blind 20
*** HOLE CARDS ***
Dealt to Mahu2021 [2h 5h]
rolls123: folds 
Uncalled bet (10) returned to Mahu2021
Mahu2021 collected 20 from pot
Mahu2021: doesn't show hand 
*** SUMMARY ***
Total pot 20 | Rake 0 
Seat 2: Mahu2021 (big blind) collected (20)
Seat 3: rolls123 (button) (small blind) folded before Flop



PokerStars Hand #246514797933: Tournament #3658524290, $0.92+$0.08 USD Hold'em No Limit - Level I (10/20) - 2023/10/13 21:44:42 CET [2023/10/13 15:44:42 ET]
Table '3658524290 1' 3-max Seat #2 is the button
Seat 2: Mahu2021 (470 in chips) 
Seat 3: rolls123 (1030 in chips) 
Mahu2021: posts small blind 10
rolls123: posts big blind 20
*** HOLE CARDS ***
Dealt to Mahu2021 [Kc 6c]
Mahu2021: raises 20 to 40
rolls123: calls 20
*** FLOP *** [3h 7c 6d]
rolls123: checks 
Mahu2021: bets 80
rolls123: folds 
Uncalled bet (80) returned to Mahu2021
Mahu2021 collected 80 from pot
Mahu2021: doesn't show hand 
*** SUMMARY ***
Total pot 80 | Rake 0 
Board [3h 7c 6d]
Seat 2: Mahu2021 (button) (small blind) collected (80)
Seat 3: rolls123 (big blind) folded on the Flop



PokerStars Hand #246514803040: Tournament #3658524290, $0.92+$0.08 USD Hold'em No Limit - Level I (10/20) - 2023/10/13 21:44:56 CET [2023/10/13 15:44:56 ET]
Table '3658524290 1' 3-max Seat #3 is the button
Seat 2: Mahu2021 (510 in chips) 
Seat 3: rolls123 (990 in chips) 
rolls123: posts small blind 10
Mahu2021: posts big blind 20
*** HOLE CARDS ***
Dealt to Mahu2021 [4s Jd]
rolls123: raises 20 to 40
Mahu2021: folds 
Uncalled bet (20) returned to rolls123
rolls123 collected 40 from pot
rolls123: doesn't show hand 
*** SUMMARY ***
Total pot 40 | Rake 0 
Seat 2: Mahu2021 (big blind) folded before Flop
Seat 3: rolls123 (button) (small blind) collected (40)



PokerStars Hand #246514804614: Tournament #3658524290, $0.92+$0.08 USD Hold'em No Limit - Level I (10/20) - 2023/10/13 21:45:01 CET [2023/10/13 15:45:01 ET]
Table '3658524290 1' 3-max Seat #2 is the button
Seat 2: Mahu2021 (490 in chips) 
Seat 3: rolls123 (1010 in chips) 
Mahu2021: posts small blind 10
rolls123: posts big blind 20
*** HOLE CARDS ***
Dealt to Mahu2021 [Jh 7c]
Mahu2021: calls 10
rolls123: raises 40 to 60
Mahu2021: folds 
Uncalled bet (40) returned to rolls123
rolls123 collected 40 from pot
rolls123: doesn't show hand 
*** SUMMARY ***
Total pot 40 | Rake 0 
Seat 2: Mahu2021 (button) (small blind) folded before Flop
Seat 3: rolls123 (big blind) collected (40)



PokerStars Hand #246514807785: Tournament #3658524290, $0.92+$0.08 USD Hold'em No Limit - Level I (10/20) - 2023/10/13 21:45:09 CET [2023/10/13 15:45:09 ET]
Table '3658524290 1' 3-max Seat #3 is the button
Seat 2: Mahu2021 (470 in chips) 
Seat 3: rolls123 (1030 in chips) 
rolls123: posts small blind 10
Mahu2021: posts big blind 20
*** HOLE CARDS ***
Dealt to Mahu2021 [Kc Ad]
rolls123: raises 20 to 40
Mahu2021: raises 430 to 470 and is all-in
rolls123: calls 430
*** FLOP *** [6c 8c 9s]
*** TURN *** [6c 8c 9s] [7c]
*** RIVER *** [6c 8c 9s 7c] [7h]
*** SHOW DOWN ***
Mahu2021: shows [Kc Ad] (a pair of Sevens)
rolls123: shows [Ts Td] (a straight, Six to Ten)
rolls123 collected 940 from pot
Mahu2021 finished the tournament in 2nd place
rolls123 wins the tournament and receives $2.00 - congratulations!
*** SUMMARY ***
Total pot 940 | Rake 0 
Board [6c 8c 9s 7c 7h]
Seat 2: Mahu2021 (big blind) showed [Kc Ad] and lost with a pair of Sevens
Seat 3: rolls123 (button) (small blind) showed [Ts Td] and won (940) with a straight, Six to Ten



