PokerStars Hand #252591612000: Tournament #3804233574, $1.84+$0.16 USD Hold'em No Limit - Level I (10/20) - 2024/09/23 18:41:09 CET [2024/09/23 12:41:09 ET]
Table '3804233574 1' 3-max Seat #1 is the button
Seat 1: alencasbtc (500 in chips) 
Seat 2: observador100 (500 in chips) 
Seat 3: Mahu2021 (500 in chips) 
observador100: posts small blind 10
Mahu2021: posts big blind 20
*** HOLE CARDS ***
Dealt to Mahu2021 [Td Qh]
alencasbtc: calls 20
observador100: folds 
Mahu2021: checks 
*** FLOP *** [5c 8h Jd]
Mahu2021: checks 
alencasbtc: checks 
*** TURN *** [5c 8h Jd] [6c]
Mahu2021: bets 20
alencasbtc: calls 20
*** RIVER *** [5c 8h Jd 6c] [Tc]
Mahu2021: bets 60
alencasbtc: folds 
Uncalled bet (60) returned to Mahu2021
Mahu2021 collected 90 from pot
Mahu2021: doesn't show hand 
*** SUMMARY ***
Total pot 90 | Rake 0 
Board [5c 8h Jd 6c Tc]
Seat 1: alencasbtc (button) folded on the River
Seat 2: observador100 (small blind) folded before Flop
Seat 3: Mahu2021 (big blind) collected (90)



PokerStars Hand #252591619384: Tournament #3804233574, $1.84+$0.16 USD Hold'em No Limit - Level I (10/20) - 2024/09/23 18:41:37 CET [2024/09/23 12:41:37 ET]
Table '3804233574 1' 3-max Seat #2 is the button
Seat 1: alencasbtc (460 in chips) 
Seat 2: observador100 (490 in chips) 
Seat 3: Mahu2021 (550 in chips) 
Mahu2021: posts small blind 10
alencasbtc: posts big blind 20
*** HOLE CARDS ***
Dealt to Mahu2021 [5h Qs]
observador100: folds 
Mahu2021: calls 10
alencasbtc: raises 60 to 80
Mahu2021: folds 
Uncalled bet (60) returned to alencasbtc
alencasbtc collected 40 from pot
alencasbtc: doesn't show hand 
*** SUMMARY ***
Total pot 40 | Rake 0 
Seat 1: alencasbtc (big blind) collected (40)
Seat 2: observador100 (button) folded before Flop (didn't bet)
Seat 3: Mahu2021 (small blind) folded before Flop



PokerStars Hand #252591621977: Tournament #3804233574, $1.84+$0.16 USD Hold'em No Limit - Level I (10/20) - 2024/09/23 18:41:47 CET [2024/09/23 12:41:47 ET]
Table '3804233574 1' 3-max Seat #3 is the button
Seat 1: alencasbtc (480 in chips) 
Seat 2: observador100 (490 in chips) 
Seat 3: Mahu2021 (530 in chips) 
alencasbtc: posts small blind 10
observador100: posts big blind 20
*** HOLE CARDS ***
Dealt to Mahu2021 [Ts 5h]
Mahu2021: folds 
alencasbtc: folds 
Uncalled bet (10) returned to observador100
observador100 collected 20 from pot
observador100: doesn't show hand 
*** SUMMARY ***
Total pot 20 | Rake 0 
Seat 1: alencasbtc (small blind) folded before Flop
Seat 2: observador100 (big blind) collected (20)
Seat 3: Mahu2021 (button) folded before Flop (didn't bet)



PokerStars Hand #252591623469: Tournament #3804233574, $1.84+$0.16 USD Hold'em No Limit - Level I (10/20) - 2024/09/23 18:41:53 CET [2024/09/23 12:41:53 ET]
Table '3804233574 1' 3-max Seat #1 is the button
Seat 1: alencasbtc (470 in chips) 
Seat 2: observador100 (500 in chips) 
Seat 3: Mahu2021 (530 in chips) 
observador100: posts small blind 10
Mahu2021: posts big blind 20
*** HOLE CARDS ***
Dealt to Mahu2021 [Qs 3s]
alencasbtc: folds 
observador100: raises 40 to 60
Mahu2021: calls 40
*** FLOP *** [5d 9c Ts]
observador100: bets 120
Mahu2021: folds 
Uncalled bet (120) returned to observador100
observador100 collected 120 from pot
observador100: doesn't show hand 
*** SUMMARY ***
Total pot 120 | Rake 0 
Board [5d 9c Ts]
Seat 1: alencasbtc (button) folded before Flop (didn't bet)
Seat 2: observador100 (small blind) collected (120)
Seat 3: Mahu2021 (big blind) folded on the Flop



PokerStars Hand #252591628089: Tournament #3804233574, $1.84+$0.16 USD Hold'em No Limit - Level I (10/20) - 2024/09/23 18:42:11 CET [2024/09/23 12:42:11 ET]
Table '3804233574 1' 3-max Seat #2 is the button
Seat 1: alencasbtc (470 in chips) 
Seat 2: observador100 (560 in chips) 
Seat 3: Mahu2021 (470 in chips) 
Mahu2021: posts small blind 10
alencasbtc: posts big blind 20
*** HOLE CARDS ***
Dealt to Mahu2021 [Ks 7h]
observador100: raises 20 to 40
Mahu2021: calls 30
alencasbtc: folds 
*** FLOP *** [7d 8s Qc]
Mahu2021: checks 
observador100: bets 40
Mahu2021: calls 40
*** TURN *** [7d 8s Qc] [Ad]
Mahu2021: checks 
observador100: bets 92
Mahu2021: folds 
Uncalled bet (92) returned to observador100
observador100 collected 180 from pot
observador100: doesn't show hand 
*** SUMMARY ***
Total pot 180 | Rake 0 
Board [7d 8s Qc Ad]
Seat 1: alencasbtc (big blind) folded before Flop
Seat 2: observador100 (button) collected (180)
Seat 3: Mahu2021 (small blind) folded on the Turn



PokerStars Hand #252591632813: Tournament #3804233574, $1.84+$0.16 USD Hold'em No Limit - Level I (10/20) - 2024/09/23 18:42:29 CET [2024/09/23 12:42:29 ET]
Table '3804233574 1' 3-max Seat #3 is the button
Seat 1: alencasbtc (450 in chips) 
Seat 2: observador100 (660 in chips) 
Seat 3: Mahu2021 (390 in chips) 
alencasbtc: posts small blind 10
observador100: posts big blind 20
*** HOLE CARDS ***
Dealt to Mahu2021 [6h 4d]
Mahu2021: folds 
alencasbtc: calls 10
observador100: checks 
*** FLOP *** [Qc 8h Ad]
alencasbtc: checks 
observador100: checks 
*** TURN *** [Qc 8h Ad] [7s]
alencasbtc: bets 40
observador100: folds 
Uncalled bet (40) returned to alencasbtc
alencasbtc collected 40 from pot
alencasbtc: doesn't show hand 
*** SUMMARY ***
Total pot 40 | Rake 0 
Board [Qc 8h Ad 7s]
Seat 1: alencasbtc (small blind) collected (40)
Seat 2: observador100 (big blind) folded on the Turn
Seat 3: Mahu2021 (button) folded before Flop (didn't bet)



PokerStars Hand #252591638044: Tournament #3804233574, $1.84+$0.16 USD Hold'em No Limit - Level I (10/20) - 2024/09/23 18:42:49 CET [2024/09/23 12:42:49 ET]
Table '3804233574 1' 3-max Seat #1 is the button
Seat 1: alencasbtc (470 in chips) 
Seat 2: observador100 (640 in chips) 
Seat 3: Mahu2021 (390 in chips) 
observador100: posts small blind 10
Mahu2021: posts big blind 20
*** HOLE CARDS ***
Dealt to Mahu2021 [4s 4d]
alencasbtc: folds 
observador100: raises 30 to 50
Mahu2021: calls 30
*** FLOP *** [4c Th 9s]
observador100: checks 
Mahu2021: bets 40
observador100: calls 40
*** TURN *** [4c Th 9s] [Js]
observador100: checks 
Mahu2021: checks 
*** RIVER *** [4c Th 9s Js] [Jc]
observador100: bets 41
Mahu2021: raises 99 to 140
observador100: raises 410 to 550 and is all-in
Mahu2021: calls 160 and is all-in
Uncalled bet (250) returned to observador100
*** SHOW DOWN ***
observador100: shows [Jd 9c] (a full house, Jacks full of Nines)
Mahu2021: shows [4s 4d] (a full house, Fours full of Jacks)
observador100 collected 780 from pot
Mahu2021 finished the tournament in 3rd place
*** SUMMARY ***
Total pot 780 | Rake 0 
Board [4c Th 9s Js Jc]
Seat 1: alencasbtc (button) folded before Flop (didn't bet)
Seat 2: observador100 (small blind) showed [Jd 9c] and won (780) with a full house, Jacks full of Nines
Seat 3: Mahu2021 (big blind) showed [4s 4d] and lost with a full house, Fours full of Jacks



