PokerStars Hand #253199610197: Tournament #3818780480, $1.84+$0.16 USD Hold'em No Limit - Level I (10/20) - 2024/11/01 12:30:04 CET [2024/11/01 7:30:04 ET]
Table '3818780480 1' 3-max Seat #1 is the button
Seat 1: firefriend (500 in chips) 
Seat 2: lalex4971 (500 in chips) 
Seat 3: Mahu2021 (500 in chips) 
lalex4971: posts small blind 10
Mahu2021: posts big blind 20
*** HOLE CARDS ***
Dealt to Mahu2021 [2h 2s]
firefriend: folds 
lalex4971: folds 
Uncalled bet (10) returned to Mahu2021
Mahu2021 collected 20 from pot
Mahu2021: doesn't show hand 
*** SUMMARY ***
Total pot 20 | Rake 0 
Seat 1: firefriend (button) folded before Flop (didn't bet)
Seat 2: lalex4971 (small blind) folded before Flop
Seat 3: Mahu2021 (big blind) collected (20)



PokerStars Hand #253199611286: Tournament #3818780480, $1.84+$0.16 USD Hold'em No Limit - Level I (10/20) - 2024/11/01 12:30:12 CET [2024/11/01 7:30:12 ET]
Table '3818780480 1' 3-max Seat #2 is the button
Seat 1: firefriend (500 in chips) 
Seat 2: lalex4971 (490 in chips) 
Seat 3: Mahu2021 (510 in chips) 
Mahu2021: posts small blind 10
firefriend: posts big blind 20
*** HOLE CARDS ***
Dealt to Mahu2021 [5c Js]
lalex4971: folds 
Mahu2021: folds 
Uncalled bet (10) returned to firefriend
firefriend collected 20 from pot
*** SUMMARY ***
Total pot 20 | Rake 0 
Seat 1: firefriend (big blind) collected (20)
Seat 2: lalex4971 (button) folded before Flop (didn't bet)
Seat 3: Mahu2021 (small blind) folded before Flop



PokerStars Hand #253199612047: Tournament #3818780480, $1.84+$0.16 USD Hold'em No Limit - Level I (10/20) - 2024/11/01 12:30:17 CET [2024/11/01 7:30:17 ET]
Table '3818780480 1' 3-max Seat #3 is the button
Seat 1: firefriend (510 in chips) 
Seat 2: lalex4971 (490 in chips) 
Seat 3: Mahu2021 (500 in chips) 
firefriend: posts small blind 10
lalex4971: posts big blind 20
*** HOLE CARDS ***
Dealt to Mahu2021 [Ah Ad]
Mahu2021: raises 20 to 40
firefriend: folds 
lalex4971: folds 
Uncalled bet (20) returned to Mahu2021
Mahu2021 collected 50 from pot
Mahu2021: doesn't show hand 
*** SUMMARY ***
Total pot 50 | Rake 0 
Seat 1: firefriend (small blind) folded before Flop
Seat 2: lalex4971 (big blind) folded before Flop
Seat 3: Mahu2021 (button) collected (50)



PokerStars Hand #253199613588: Tournament #3818780480, $1.84+$0.16 USD Hold'em No Limit - Level I (10/20) - 2024/11/01 12:30:29 CET [2024/11/01 7:30:29 ET]
Table '3818780480 1' 3-max Seat #1 is the button
Seat 1: firefriend (500 in chips) 
Seat 2: lalex4971 (470 in chips) 
Seat 3: Mahu2021 (530 in chips) 
lalex4971: posts small blind 10
Mahu2021: posts big blind 20
*** HOLE CARDS ***
Dealt to Mahu2021 [Kc 2c]
firefriend: raises 60 to 80
lalex4971: folds 
Mahu2021: calls 60
*** FLOP *** [Ts 4c Td]
Mahu2021: checks 
firefriend: bets 80
Mahu2021: folds 
Uncalled bet (80) returned to firefriend
firefriend collected 170 from pot
*** SUMMARY ***
Total pot 170 | Rake 0 
Board [Ts 4c Td]
Seat 1: firefriend (button) collected (170)
Seat 2: lalex4971 (small blind) folded before Flop
Seat 3: Mahu2021 (big blind) folded on the Flop



PokerStars Hand #253199616271: Tournament #3818780480, $1.84+$0.16 USD Hold'em No Limit - Level I (10/20) - 2024/11/01 12:30:49 CET [2024/11/01 7:30:49 ET]
Table '3818780480 1' 3-max Seat #2 is the button
Seat 1: firefriend (590 in chips) 
Seat 2: lalex4971 (460 in chips) 
Seat 3: Mahu2021 (450 in chips) 
Mahu2021: posts small blind 10
firefriend: posts big blind 20
*** HOLE CARDS ***
Dealt to Mahu2021 [Ac 9h]
lalex4971: folds 
Mahu2021: raises 20 to 40
firefriend: calls 20
*** FLOP *** [7c Th 9d]
Mahu2021: bets 40
firefriend: calls 40
*** TURN *** [7c Th 9d] [Ad]
Mahu2021: bets 40
firefriend: raises 80 to 120
Mahu2021: raises 250 to 370 and is all-in
firefriend: calls 250
*** RIVER *** [7c Th 9d Ad] [5s]
*** SHOW DOWN ***
Mahu2021: shows [Ac 9h] (two pair, Aces and Nines)
firefriend: shows [Ah 2c] (a pair of Aces)
Mahu2021 collected 900 from pot
*** SUMMARY ***
Total pot 900 | Rake 0 
Board [7c Th 9d Ad 5s]
Seat 1: firefriend (big blind) showed [Ah 2c] and lost with a pair of Aces
Seat 2: lalex4971 (button) folded before Flop (didn't bet)
Seat 3: Mahu2021 (small blind) showed [Ac 9h] and won (900) with two pair, Aces and Nines



PokerStars Hand #253199618887: Tournament #3818780480, $1.84+$0.16 USD Hold'em No Limit - Level I (10/20) - 2024/11/01 12:31:09 CET [2024/11/01 7:31:09 ET]
Table '3818780480 1' 3-max Seat #3 is the button
Seat 1: firefriend (140 in chips) 
Seat 2: lalex4971 (460 in chips) 
Seat 3: Mahu2021 (900 in chips) 
firefriend: posts small blind 10
lalex4971: posts big blind 20
*** HOLE CARDS ***
Dealt to Mahu2021 [7h 9s]
Mahu2021: folds 
firefriend: folds 
Uncalled bet (10) returned to lalex4971
lalex4971 collected 20 from pot
lalex4971: doesn't show hand 
*** SUMMARY ***
Total pot 20 | Rake 0 
Seat 1: firefriend (small blind) folded before Flop
Seat 2: lalex4971 (big blind) collected (20)
Seat 3: Mahu2021 (button) folded before Flop (didn't bet)



PokerStars Hand #253199619518: Tournament #3818780480, $1.84+$0.16 USD Hold'em No Limit - Level I (10/20) - 2024/11/01 12:31:14 CET [2024/11/01 7:31:14 ET]
Table '3818780480 1' 3-max Seat #1 is the button
Seat 1: firefriend (130 in chips) 
Seat 2: lalex4971 (470 in chips) 
Seat 3: Mahu2021 (900 in chips) 
lalex4971: posts small blind 10
Mahu2021: posts big blind 20
*** HOLE CARDS ***
Dealt to Mahu2021 [Qc Th]
firefriend: raises 40 to 60
lalex4971: folds 
Mahu2021: calls 40
*** FLOP *** [Tc Jd 7d]
Mahu2021: bets 80
firefriend: calls 70 and is all-in
Uncalled bet (10) returned to Mahu2021
*** TURN *** [Tc Jd 7d] [5c]
*** RIVER *** [Tc Jd 7d 5c] [Jh]
*** SHOW DOWN ***
Mahu2021: shows [Qc Th] (two pair, Jacks and Tens)
firefriend: shows [8d Kh] (a pair of Jacks)
Mahu2021 collected 270 from pot
firefriend finished the tournament in 3rd place
*** SUMMARY ***
Total pot 270 | Rake 0 
Board [Tc Jd 7d 5c Jh]
Seat 1: firefriend (button) showed [8d Kh] and lost with a pair of Jacks
Seat 2: lalex4971 (small blind) folded before Flop
Seat 3: Mahu2021 (big blind) showed [Qc Th] and won (270) with two pair, Jacks and Tens



PokerStars Hand #253199623399: Tournament #3818780480, $1.84+$0.16 USD Hold'em No Limit - Level I (10/20) - 2024/11/01 12:31:43 CET [2024/11/01 7:31:43 ET]
Table '3818780480 1' 3-max Seat #3 is the button
Seat 2: lalex4971 (460 in chips) 
Seat 3: Mahu2021 (1040 in chips) 
Mahu2021: posts small blind 10
lalex4971: posts big blind 20
*** HOLE CARDS ***
Dealt to Mahu2021 [5d 6d]
Mahu2021: raises 20 to 40
lalex4971: calls 20
*** FLOP *** [Qc 9d Js]
lalex4971: checks 
Mahu2021: checks 
*** TURN *** [Qc 9d Js] [Qs]
lalex4971: bets 60
Mahu2021: folds 
Uncalled bet (60) returned to lalex4971
lalex4971 collected 80 from pot
lalex4971: doesn't show hand 
*** SUMMARY ***
Total pot 80 | Rake 0 
Board [Qc 9d Js Qs]
Seat 2: lalex4971 (big blind) collected (80)
Seat 3: Mahu2021 (button) (small blind) folded on the Turn



PokerStars Hand #253199626854: Tournament #3818780480, $1.84+$0.16 USD Hold'em No Limit - Level II (15/30) - 2024/11/01 12:32:09 CET [2024/11/01 7:32:09 ET]
Table '3818780480 1' 3-max Seat #2 is the button
Seat 2: lalex4971 (500 in chips) 
Seat 3: Mahu2021 (1000 in chips) 
lalex4971: posts small blind 15
Mahu2021: posts big blind 30
*** HOLE CARDS ***
Dealt to Mahu2021 [6d 6h]
lalex4971: raises 45 to 75
Mahu2021: raises 925 to 1000 and is all-in
lalex4971: calls 425 and is all-in
Uncalled bet (500) returned to Mahu2021
*** FLOP *** [5h Ts 2d]
*** TURN *** [5h Ts 2d] [Ac]
*** RIVER *** [5h Ts 2d Ac] [8d]
*** SHOW DOWN ***
Mahu2021: shows [6d 6h] (a pair of Sixes)
lalex4971: shows [Jc 9c] (high card Ace)
Mahu2021 collected 1000 from pot
lalex4971 finished the tournament in 2nd place
Mahu2021 wins the tournament and receives $4.00 - congratulations!
*** SUMMARY ***
Total pot 1000 | Rake 0 
Board [5h Ts 2d Ac 8d]
Seat 2: lalex4971 (button) (small blind) showed [Jc 9c] and lost with high card Ace
Seat 3: Mahu2021 (big blind) showed [6d 6h] and won (1000) with a pair of Sixes



