PokerStars Hand #252574305727: Tournament #3803889195, $1.84+$0.16 USD Hold'em No Limit - Level I (10/20) - 2024/09/22 18:04:10 CET [2024/09/22 12:04:10 ET]
Table '3803889195 1' 3-max Seat #1 is the button
Seat 1: Mahu2021 (500 in chips) 
Seat 2: iainmac78 (500 in chips) 
Seat 3: citizen6e (500 in chips) 
iainmac78: posts small blind 10
citizen6e: posts big blind 20
*** HOLE CARDS ***
Dealt to Mahu2021 [2c Qh]
Mahu2021: folds 
iainmac78: calls 10
citizen6e: checks 
*** FLOP *** [8c 6d 5s]
iainmac78: bets 20
citizen6e: folds 
Uncalled bet (20) returned to iainmac78
iainmac78 collected 40 from pot
iainmac78: doesn't show hand 
*** SUMMARY ***
Total pot 40 | Rake 0 
Board [8c 6d 5s]
Seat 1: Mahu2021 (button) folded before Flop (didn't bet)
Seat 2: iainmac78 (small blind) collected (40)
Seat 3: citizen6e (big blind) folded on the Flop



PokerStars Hand #252574308783: Tournament #3803889195, $1.84+$0.16 USD Hold'em No Limit - Level I (10/20) - 2024/09/22 18:04:22 CET [2024/09/22 12:04:22 ET]
Table '3803889195 1' 3-max Seat #2 is the button
Seat 1: Mahu2021 (500 in chips) 
Seat 2: iainmac78 (520 in chips) 
Seat 3: citizen6e (480 in chips) 
citizen6e: posts small blind 10
Mahu2021: posts big blind 20
*** HOLE CARDS ***
Dealt to Mahu2021 [Ah 6s]
iainmac78: calls 20
citizen6e: folds 
Mahu2021: checks 
*** FLOP *** [8c Ks 5d]
Mahu2021: checks 
iainmac78: bets 20
Mahu2021: folds 
Uncalled bet (20) returned to iainmac78
iainmac78 collected 50 from pot
iainmac78: doesn't show hand 
*** SUMMARY ***
Total pot 50 | Rake 0 
Board [8c Ks 5d]
Seat 1: Mahu2021 (big blind) folded on the Flop
Seat 2: iainmac78 (button) collected (50)
Seat 3: citizen6e (small blind) folded before Flop



PokerStars Hand #252574313057: Tournament #3803889195, $1.84+$0.16 USD Hold'em No Limit - Level I (10/20) - 2024/09/22 18:04:39 CET [2024/09/22 12:04:39 ET]
Table '3803889195 1' 3-max Seat #3 is the button
Seat 1: Mahu2021 (480 in chips) 
Seat 2: iainmac78 (550 in chips) 
Seat 3: citizen6e (470 in chips) 
Mahu2021: posts small blind 10
iainmac78: posts big blind 20
*** HOLE CARDS ***
Dealt to Mahu2021 [Ts 9c]
citizen6e: folds 
Mahu2021: raises 20 to 40
iainmac78: calls 20
*** FLOP *** [Ac 3d 7h]
Mahu2021: checks 
iainmac78: checks 
*** TURN *** [Ac 3d 7h] [6h]
Mahu2021: checks 
iainmac78: checks 
*** RIVER *** [Ac 3d 7h 6h] [7c]
Mahu2021: checks 
iainmac78: checks 
*** SHOW DOWN ***
Mahu2021: shows [Ts 9c] (a pair of Sevens)
iainmac78: mucks hand 
Mahu2021 collected 80 from pot
*** SUMMARY ***
Total pot 80 | Rake 0 
Board [Ac 3d 7h 6h 7c]
Seat 1: Mahu2021 (small blind) showed [Ts 9c] and won (80) with a pair of Sevens
Seat 2: iainmac78 (big blind) mucked [Tc 2c]
Seat 3: citizen6e (button) folded before Flop (didn't bet)



PokerStars Hand #252574316767: Tournament #3803889195, $1.84+$0.16 USD Hold'em No Limit - Level I (10/20) - 2024/09/22 18:04:53 CET [2024/09/22 12:04:53 ET]
Table '3803889195 1' 3-max Seat #1 is the button
Seat 1: Mahu2021 (520 in chips) 
Seat 2: iainmac78 (510 in chips) 
Seat 3: citizen6e (470 in chips) 
iainmac78: posts small blind 10
citizen6e: posts big blind 20
*** HOLE CARDS ***
Dealt to Mahu2021 [Kd Td]
Mahu2021: raises 20 to 40
iainmac78: calls 30
citizen6e: raises 430 to 470 and is all-in
Mahu2021: folds 
iainmac78: folds 
Uncalled bet (430) returned to citizen6e
citizen6e collected 120 from pot
citizen6e: doesn't show hand 
*** SUMMARY ***
Total pot 120 | Rake 0 
Seat 1: Mahu2021 (button) folded before Flop
Seat 2: iainmac78 (small blind) folded before Flop
Seat 3: citizen6e (big blind) collected (120)



PokerStars Hand #252574319428: Tournament #3803889195, $1.84+$0.16 USD Hold'em No Limit - Level I (10/20) - 2024/09/22 18:05:03 CET [2024/09/22 12:05:03 ET]
Table '3803889195 1' 3-max Seat #2 is the button
Seat 1: Mahu2021 (480 in chips) 
Seat 2: iainmac78 (470 in chips) 
Seat 3: citizen6e (550 in chips) 
citizen6e: posts small blind 10
Mahu2021: posts big blind 20
*** HOLE CARDS ***
Dealt to Mahu2021 [Ah Th]
iainmac78: folds 
citizen6e: folds 
Uncalled bet (10) returned to Mahu2021
Mahu2021 collected 20 from pot
Mahu2021: doesn't show hand 
*** SUMMARY ***
Total pot 20 | Rake 0 
Seat 1: Mahu2021 (big blind) collected (20)
Seat 2: iainmac78 (button) folded before Flop (didn't bet)
Seat 3: citizen6e (small blind) folded before Flop



PokerStars Hand #252574320831: Tournament #3803889195, $1.84+$0.16 USD Hold'em No Limit - Level I (10/20) - 2024/09/22 18:05:08 CET [2024/09/22 12:05:08 ET]
Table '3803889195 1' 3-max Seat #3 is the button
Seat 1: Mahu2021 (490 in chips) 
Seat 2: iainmac78 (470 in chips) 
Seat 3: citizen6e (540 in chips) 
Mahu2021: posts small blind 10
iainmac78: posts big blind 20
*** HOLE CARDS ***
Dealt to Mahu2021 [8h 5c]
citizen6e: folds 
Mahu2021: folds 
Uncalled bet (10) returned to iainmac78
iainmac78 collected 20 from pot
iainmac78: doesn't show hand 
*** SUMMARY ***
Total pot 20 | Rake 0 
Seat 1: Mahu2021 (small blind) folded before Flop
Seat 2: iainmac78 (big blind) collected (20)
Seat 3: citizen6e (button) folded before Flop (didn't bet)



PokerStars Hand #252574322184: Tournament #3803889195, $1.84+$0.16 USD Hold'em No Limit - Level I (10/20) - 2024/09/22 18:05:13 CET [2024/09/22 12:05:13 ET]
Table '3803889195 1' 3-max Seat #1 is the button
Seat 1: Mahu2021 (480 in chips) 
Seat 2: iainmac78 (480 in chips) 
Seat 3: citizen6e (540 in chips) 
iainmac78: posts small blind 10
citizen6e: posts big blind 20
*** HOLE CARDS ***
Dealt to Mahu2021 [6s 6h]
Mahu2021: raises 20 to 40
iainmac78: calls 30
citizen6e: folds 
*** FLOP *** [6c Kh 3c]
iainmac78: bets 20
Mahu2021: calls 20
*** TURN *** [6c Kh 3c] [5h]
iainmac78: bets 20
Mahu2021: calls 20
*** RIVER *** [6c Kh 3c 5h] [7c]
iainmac78: bets 20
Mahu2021: raises 60 to 80
iainmac78: raises 320 to 400 and is all-in
Mahu2021: calls 320 and is all-in
*** SHOW DOWN ***
iainmac78: shows [2d 4h] (a straight, Three to Seven)
Mahu2021: shows [6s 6h] (three of a kind, Sixes)
iainmac78 collected 980 from pot
Mahu2021 finished the tournament in 3rd place
*** SUMMARY ***
Total pot 980 | Rake 0 
Board [6c Kh 3c 5h 7c]
Seat 1: Mahu2021 (button) showed [6s 6h] and lost with three of a kind, Sixes
Seat 2: iainmac78 (small blind) showed [2d 4h] and won (980) with a straight, Three to Seven
Seat 3: citizen6e (big blind) folded before Flop



