PokerStars Hand #242814316113: Tournament #3570621296, $0.92+$0.08 USD Hold'em No Limit - Level I (10/20) - 2023/04/01 13:28:04 CET [2023/04/01 7:28:04 ET]
Table '3570621296 1' 3-max Seat #1 is the button
Seat 1: Mahu2021 (500 in chips) 
Seat 2: xXPoKerFr102 (500 in chips) 
Seat 3: azimmaro (500 in chips) 
xXPoKerFr102: posts small blind 10
azimmaro: posts big blind 20
*** HOLE CARDS ***
Dealt to Mahu2021 [3s Qs]
Mahu2021: calls 20
xXPoKerFr102: folds 
azimmaro: checks 
*** FLOP *** [3h Ts Jh]
azimmaro: checks 
Mahu2021: bets 20
azimmaro: calls 20
*** TURN *** [3h Ts Jh] [Js]
azimmaro: checks 
Mahu2021: bets 90
azimmaro: folds 
Uncalled bet (90) returned to Mahu2021
Mahu2021 collected 90 from pot
Mahu2021: doesn't show hand 
*** SUMMARY ***
Total pot 90 | Rake 0 
Board [3h Ts Jh Js]
Seat 1: Mahu2021 (button) collected (90)
Seat 2: xXPoKerFr102 (small blind) folded before Flop
Seat 3: azimmaro (big blind) folded on the Turn



PokerStars Hand #242814319857: Tournament #3570621296, $0.92+$0.08 USD Hold'em No Limit - Level I (10/20) - 2023/04/01 13:28:24 CET [2023/04/01 7:28:24 ET]
Table '3570621296 1' 3-max Seat #2 is the button
Seat 1: Mahu2021 (550 in chips) 
Seat 2: xXPoKerFr102 (490 in chips) 
Seat 3: azimmaro (460 in chips) 
azimmaro: posts small blind 10
Mahu2021: posts big blind 20
*** HOLE CARDS ***
Dealt to Mahu2021 [9h 7c]
xXPoKerFr102: folds 
azimmaro: raises 40 to 60
Mahu2021: folds 
Uncalled bet (40) returned to azimmaro
azimmaro collected 40 from pot
*** SUMMARY ***
Total pot 40 | Rake 0 
Seat 1: Mahu2021 (big blind) folded before Flop
Seat 2: xXPoKerFr102 (button) folded before Flop (didn't bet)
Seat 3: azimmaro (small blind) collected (40)



PokerStars Hand #242814321902: Tournament #3570621296, $0.92+$0.08 USD Hold'em No Limit - Level I (10/20) - 2023/04/01 13:28:35 CET [2023/04/01 7:28:35 ET]
Table '3570621296 1' 3-max Seat #3 is the button
Seat 1: Mahu2021 (530 in chips) 
Seat 2: xXPoKerFr102 (490 in chips) 
Seat 3: azimmaro (480 in chips) 
Mahu2021: posts small blind 10
xXPoKerFr102: posts big blind 20
*** HOLE CARDS ***
Dealt to Mahu2021 [Js Qd]
azimmaro: raises 20 to 40
Mahu2021: calls 30
xXPoKerFr102: calls 20
*** FLOP *** [As 9s Jc]
Mahu2021: checks 
xXPoKerFr102: checks 
azimmaro: checks 
*** TURN *** [As 9s Jc] [3h]
Mahu2021: checks 
xXPoKerFr102: bets 40
azimmaro: calls 40
Mahu2021: calls 40
*** RIVER *** [As 9s Jc 3h] [Jh]
Mahu2021: checks 
xXPoKerFr102: bets 100
azimmaro: calls 100
Mahu2021: raises 350 to 450 and is all-in
xXPoKerFr102: folds 
azimmaro: folds 
Uncalled bet (350) returned to Mahu2021
Mahu2021 collected 540 from pot
Mahu2021: doesn't show hand 
*** SUMMARY ***
Total pot 540 | Rake 0 
Board [As 9s Jc 3h Jh]
Seat 1: Mahu2021 (small blind) collected (540)
Seat 2: xXPoKerFr102 (big blind) folded on the River
Seat 3: azimmaro (button) folded on the River



PokerStars Hand #242814330664: Tournament #3570621296, $0.92+$0.08 USD Hold'em No Limit - Level I (10/20) - 2023/04/01 13:29:21 CET [2023/04/01 7:29:21 ET]
Table '3570621296 1' 3-max Seat #1 is the button
Seat 1: Mahu2021 (890 in chips) 
Seat 2: xXPoKerFr102 (310 in chips) 
Seat 3: azimmaro (300 in chips) 
xXPoKerFr102: posts small blind 10
azimmaro: posts big blind 20
*** HOLE CARDS ***
Dealt to Mahu2021 [3c Jc]
Mahu2021: calls 20
xXPoKerFr102: calls 10
azimmaro: checks 
*** FLOP *** [2s Ks 2c]
xXPoKerFr102: checks 
azimmaro: checks 
Mahu2021: bets 20
xXPoKerFr102: folds 
azimmaro: calls 20
*** TURN *** [2s Ks 2c] [3d]
azimmaro: checks 
Mahu2021: checks 
*** RIVER *** [2s Ks 2c 3d] [Jh]
azimmaro: bets 60
Mahu2021: calls 60
*** SHOW DOWN ***
azimmaro: shows [Kd 6s] (two pair, Kings and Deuces)
Mahu2021: mucks hand 
azimmaro collected 220 from pot
*** SUMMARY ***
Total pot 220 | Rake 0 
Board [2s Ks 2c 3d Jh]
Seat 1: Mahu2021 (button) mucked [3c Jc]
Seat 2: xXPoKerFr102 (small blind) folded on the Flop
Seat 3: azimmaro (big blind) showed [Kd 6s] and won (220) with two pair, Kings and Deuces



PokerStars Hand #242814335307: Tournament #3570621296, $0.92+$0.08 USD Hold'em No Limit - Level I (10/20) - 2023/04/01 13:29:46 CET [2023/04/01 7:29:46 ET]
Table '3570621296 1' 3-max Seat #2 is the button
Seat 1: Mahu2021 (790 in chips) 
Seat 2: xXPoKerFr102 (290 in chips) 
Seat 3: azimmaro (420 in chips) 
azimmaro: posts small blind 10
Mahu2021: posts big blind 20
*** HOLE CARDS ***
Dealt to Mahu2021 [Kh Ad]
xXPoKerFr102: raises 20 to 40
azimmaro: raises 20 to 60
Mahu2021: raises 730 to 790 and is all-in
xXPoKerFr102: calls 250 and is all-in
azimmaro: calls 360 and is all-in
Uncalled bet (370) returned to Mahu2021
*** FLOP *** [7h 4h 8h]
*** TURN *** [7h 4h 8h] [3c]
*** RIVER *** [7h 4h 8h 3c] [As]
*** SHOW DOWN ***
azimmaro: shows [9h 9s] (a pair of Nines)
Mahu2021: shows [Kh Ad] (a pair of Aces)
Mahu2021 collected 260 from side pot
xXPoKerFr102: shows [9d 8d] (a pair of Eights)
Mahu2021 collected 870 from main pot
azimmaro finished the tournament in 2nd place
xXPoKerFr102 finished the tournament in 3rd place
Mahu2021 wins the tournament and receives $2.00 - congratulations!
*** SUMMARY ***
Total pot 1130 Main pot 870. Side pot 260. | Rake 0 
Board [7h 4h 8h 3c As]
Seat 1: Mahu2021 (big blind) showed [Kh Ad] and won (1130) with a pair of Aces
Seat 2: xXPoKerFr102 (button) showed [9d 8d] and lost with a pair of Eights
Seat 3: azimmaro (small blind) showed [9h 9s] and lost with a pair of Nines



