PokerStars Hand #244408708192: Tournament #3607629627, $0.92+$0.08 USD Hold'em No Limit - Level I (10/20) - 2023/06/22 19:47:25 CET [2023/06/22 13:47:25 ET]
Table '3607629627 1' 3-max Seat #1 is the button
Seat 1: Mahu2021 (500 in chips) 
Seat 2: Shera8088 (500 in chips) 
Seat 3: Fordsay (500 in chips) 
Shera8088: posts small blind 10
Fordsay: posts big blind 20
*** HOLE CARDS ***
Dealt to Mahu2021 [8d 6c]
Mahu2021: folds 
Shera8088: raises 40 to 60
Fordsay: calls 40
*** FLOP *** [8c 9h Qd]
Shera8088: checks 
Fordsay: bets 20
Shera8088: calls 20
*** TURN *** [8c 9h Qd] [6d]
Shera8088: bets 80
Fordsay: calls 80
*** RIVER *** [8c 9h Qd 6d] [5h]
Shera8088: checks 
Fordsay: bets 340 and is all-in
Shera8088: folds 
Uncalled bet (340) returned to Fordsay
Fordsay collected 320 from pot
Fordsay: doesn't show hand 
*** SUMMARY ***
Total pot 320 | Rake 0 
Board [8c 9h Qd 6d 5h]
Seat 1: Mahu2021 (button) folded before Flop (didn't bet)
Seat 2: Shera8088 (small blind) folded on the River
Seat 3: Fordsay (big blind) collected (320)



PokerStars Hand #244408717094: Tournament #3607629627, $0.92+$0.08 USD Hold'em No Limit - Level I (10/20) - 2023/06/22 19:47:58 CET [2023/06/22 13:47:58 ET]
Table '3607629627 1' 3-max Seat #2 is the button
Seat 1: Mahu2021 (500 in chips) 
Seat 2: Shera8088 (340 in chips) 
Seat 3: Fordsay (660 in chips) 
Fordsay: posts small blind 10
Mahu2021: posts big blind 20
*** HOLE CARDS ***
Dealt to Mahu2021 [2h 8c]
Shera8088: raises 50 to 70
Fordsay: folds 
Mahu2021: folds 
Uncalled bet (50) returned to Shera8088
Shera8088 collected 50 from pot
*** SUMMARY ***
Total pot 50 | Rake 0 
Seat 1: Mahu2021 (big blind) folded before Flop
Seat 2: Shera8088 (button) collected (50)
Seat 3: Fordsay (small blind) folded before Flop



PokerStars Hand #244408718936: Tournament #3607629627, $0.92+$0.08 USD Hold'em No Limit - Level I (10/20) - 2023/06/22 19:48:04 CET [2023/06/22 13:48:04 ET]
Table '3607629627 1' 3-max Seat #3 is the button
Seat 1: Mahu2021 (480 in chips) 
Seat 2: Shera8088 (370 in chips) 
Seat 3: Fordsay (650 in chips) 
Mahu2021: posts small blind 10
Shera8088: posts big blind 20
*** HOLE CARDS ***
Dealt to Mahu2021 [9s 4c]
Fordsay: folds 
Mahu2021: folds 
Uncalled bet (10) returned to Shera8088
Shera8088 collected 20 from pot
*** SUMMARY ***
Total pot 20 | Rake 0 
Seat 1: Mahu2021 (small blind) folded before Flop
Seat 2: Shera8088 (big blind) collected (20)
Seat 3: Fordsay (button) folded before Flop (didn't bet)



PokerStars Hand #244408721204: Tournament #3607629627, $0.92+$0.08 USD Hold'em No Limit - Level I (10/20) - 2023/06/22 19:48:13 CET [2023/06/22 13:48:13 ET]
Table '3607629627 1' 3-max Seat #1 is the button
Seat 1: Mahu2021 (470 in chips) 
Seat 2: Shera8088 (380 in chips) 
Seat 3: Fordsay (650 in chips) 
Shera8088: posts small blind 10
Fordsay: posts big blind 20
*** HOLE CARDS ***
Dealt to Mahu2021 [6d 3d]
Mahu2021: calls 20
Shera8088: raises 360 to 380 and is all-in
Fordsay: folds 
Mahu2021: folds 
Uncalled bet (360) returned to Shera8088
Shera8088 collected 60 from pot
*** SUMMARY ***
Total pot 60 | Rake 0 
Seat 1: Mahu2021 (button) folded before Flop
Seat 2: Shera8088 (small blind) collected (60)
Seat 3: Fordsay (big blind) folded before Flop



PokerStars Hand #244408723900: Tournament #3607629627, $0.92+$0.08 USD Hold'em No Limit - Level I (10/20) - 2023/06/22 19:48:22 CET [2023/06/22 13:48:22 ET]
Table '3607629627 1' 3-max Seat #2 is the button
Seat 1: Mahu2021 (450 in chips) 
Seat 2: Shera8088 (420 in chips) 
Seat 3: Fordsay (630 in chips) 
Fordsay: posts small blind 10
Mahu2021: posts big blind 20
*** HOLE CARDS ***
Dealt to Mahu2021 [8s Jh]
Shera8088: raises 400 to 420 and is all-in
Fordsay: folds 
Mahu2021: folds 
Uncalled bet (400) returned to Shera8088
Shera8088 collected 50 from pot
*** SUMMARY ***
Total pot 50 | Rake 0 
Seat 1: Mahu2021 (big blind) folded before Flop
Seat 2: Shera8088 (button) collected (50)
Seat 3: Fordsay (small blind) folded before Flop



PokerStars Hand #244408726044: Tournament #3607629627, $0.92+$0.08 USD Hold'em No Limit - Level I (10/20) - 2023/06/22 19:48:30 CET [2023/06/22 13:48:30 ET]
Table '3607629627 1' 3-max Seat #3 is the button
Seat 1: Mahu2021 (430 in chips) 
Seat 2: Shera8088 (450 in chips) 
Seat 3: Fordsay (620 in chips) 
Mahu2021: posts small blind 10
Shera8088: posts big blind 20
*** HOLE CARDS ***
Dealt to Mahu2021 [Qc 7s]
Fordsay: folds 
Mahu2021: folds 
Uncalled bet (10) returned to Shera8088
Shera8088 collected 20 from pot
*** SUMMARY ***
Total pot 20 | Rake 0 
Seat 1: Mahu2021 (small blind) folded before Flop
Seat 2: Shera8088 (big blind) collected (20)
Seat 3: Fordsay (button) folded before Flop (didn't bet)



PokerStars Hand #244408727693: Tournament #3607629627, $0.92+$0.08 USD Hold'em No Limit - Level I (10/20) - 2023/06/22 19:48:36 CET [2023/06/22 13:48:36 ET]
Table '3607629627 1' 3-max Seat #1 is the button
Seat 1: Mahu2021 (420 in chips) 
Seat 2: Shera8088 (460 in chips) 
Seat 3: Fordsay (620 in chips) 
Shera8088: posts small blind 10
Fordsay: posts big blind 20
*** HOLE CARDS ***
Dealt to Mahu2021 [Kd 8c]
Mahu2021: calls 20
Shera8088: folds 
Fordsay: checks 
*** FLOP *** [6c Jc Qh]
Fordsay: checks 
Mahu2021: bets 50
Fordsay: folds 
Uncalled bet (50) returned to Mahu2021
Mahu2021 collected 50 from pot
Mahu2021: doesn't show hand 
*** SUMMARY ***
Total pot 50 | Rake 0 
Board [6c Jc Qh]
Seat 1: Mahu2021 (button) collected (50)
Seat 2: Shera8088 (small blind) folded before Flop
Seat 3: Fordsay (big blind) folded on the Flop



PokerStars Hand #244408731933: Tournament #3607629627, $0.92+$0.08 USD Hold'em No Limit - Level I (10/20) - 2023/06/22 19:48:52 CET [2023/06/22 13:48:52 ET]
Table '3607629627 1' 3-max Seat #2 is the button
Seat 1: Mahu2021 (450 in chips) 
Seat 2: Shera8088 (450 in chips) 
Seat 3: Fordsay (600 in chips) 
Fordsay: posts small blind 10
Mahu2021: posts big blind 20
*** HOLE CARDS ***
Dealt to Mahu2021 [Kc 2h]
Shera8088: folds 
Fordsay: calls 10
Mahu2021: checks 
*** FLOP *** [5d Jc Kd]
Fordsay: bets 20
Mahu2021: calls 20
*** TURN *** [5d Jc Kd] [4s]
Fordsay: bets 40
Mahu2021: calls 40
*** RIVER *** [5d Jc Kd 4s] [4d]
Fordsay: bets 520 and is all-in
Mahu2021: calls 370 and is all-in
Uncalled bet (150) returned to Fordsay
*** SHOW DOWN ***
Fordsay: shows [8d 7d] (a flush, King high)
Mahu2021: shows [Kc 2h] (two pair, Kings and Fours)
Fordsay collected 900 from pot
Mahu2021 finished the tournament in 3rd place
*** SUMMARY ***
Total pot 900 | Rake 0 
Board [5d Jc Kd 4s 4d]
Seat 1: Mahu2021 (big blind) showed [Kc 2h] and lost with two pair, Kings and Fours
Seat 2: Shera8088 (button) folded before Flop (didn't bet)
Seat 3: Fordsay (small blind) showed [8d 7d] and won (900) with a flush, King high



