PokerStars Hand #252775090342: Tournament #3808380585, $1.84+$0.16 USD Hold'em No Limit - Level I (10/20) - 2024/10/05 10:15:38 CET [2024/10/05 4:15:38 ET]
Table '3808380585 1' 3-max Seat #1 is the button
Seat 1: bigblinder1 (500 in chips) 
Seat 2: Ara Duff (500 in chips) 
Seat 3: Mahu2021 (500 in chips) 
Ara Duff: posts small blind 10
Mahu2021: posts big blind 20
*** HOLE CARDS ***
Dealt to Mahu2021 [9s 3c]
bigblinder1: calls 20
Ara Duff: calls 10
Mahu2021: checks 
*** FLOP *** [Kc Jd 6c]
Ara Duff: checks 
Mahu2021: checks 
bigblinder1: checks 
*** TURN *** [Kc Jd 6c] [Kd]
Ara Duff: bets 40
Mahu2021: folds 
bigblinder1: folds 
Uncalled bet (40) returned to Ara Duff
Ara Duff collected 60 from pot
Ara Duff: doesn't show hand 
*** SUMMARY ***
Total pot 60 | Rake 0 
Board [Kc Jd 6c Kd]
Seat 1: bigblinder1 (button) folded on the Turn
Seat 2: Ara Duff (small blind) collected (60)
Seat 3: Mahu2021 (big blind) folded on the Turn



PokerStars Hand #252775092896: Tournament #3808380585, $1.84+$0.16 USD Hold'em No Limit - Level I (10/20) - 2024/10/05 10:16:03 CET [2024/10/05 4:16:03 ET]
Table '3808380585 1' 3-max Seat #2 is the button
Seat 1: bigblinder1 (480 in chips) 
Seat 2: Ara Duff (540 in chips) 
Seat 3: Mahu2021 (480 in chips) 
Mahu2021: posts small blind 10
bigblinder1: posts big blind 20
*** HOLE CARDS ***
Dealt to Mahu2021 [3h 8s]
Ara Duff: folds 
Mahu2021: folds 
Uncalled bet (10) returned to bigblinder1
bigblinder1 collected 20 from pot
*** SUMMARY ***
Total pot 20 | Rake 0 
Seat 1: bigblinder1 (big blind) collected (20)
Seat 2: Ara Duff (button) folded before Flop (didn't bet)
Seat 3: Mahu2021 (small blind) folded before Flop



PokerStars Hand #252775093673: Tournament #3808380585, $1.84+$0.16 USD Hold'em No Limit - Level I (10/20) - 2024/10/05 10:16:11 CET [2024/10/05 4:16:11 ET]
Table '3808380585 1' 3-max Seat #3 is the button
Seat 1: bigblinder1 (490 in chips) 
Seat 2: Ara Duff (540 in chips) 
Seat 3: Mahu2021 (470 in chips) 
bigblinder1: posts small blind 10
Ara Duff: posts big blind 20
*** HOLE CARDS ***
Dealt to Mahu2021 [Kc 9h]
Mahu2021: raises 20 to 40
bigblinder1: folds 
Ara Duff: calls 20
*** FLOP *** [8s 2s Qc]
Ara Duff: checks 
Mahu2021: checks 
*** TURN *** [8s 2s Qc] [2c]
Ara Duff: checks 
Mahu2021: checks 
*** RIVER *** [8s 2s Qc 2c] [2h]
Ara Duff: checks 
Mahu2021: bets 40
Ara Duff: calls 40
*** SHOW DOWN ***
Mahu2021: shows [Kc 9h] (three of a kind, Deuces)
Ara Duff: mucks hand 
Mahu2021 collected 170 from pot
*** SUMMARY ***
Total pot 170 | Rake 0 
Board [8s 2s Qc 2c 2h]
Seat 1: bigblinder1 (small blind) folded before Flop
Seat 2: Ara Duff (big blind) mucked [4c 9s]
Seat 3: Mahu2021 (button) showed [Kc 9h] and won (170) with three of a kind, Deuces



PokerStars Hand #252775096249: Tournament #3808380585, $1.84+$0.16 USD Hold'em No Limit - Level I (10/20) - 2024/10/05 10:16:37 CET [2024/10/05 4:16:37 ET]
Table '3808380585 1' 3-max Seat #1 is the button
Seat 1: bigblinder1 (480 in chips) 
Seat 2: Ara Duff (460 in chips) 
Seat 3: Mahu2021 (560 in chips) 
Ara Duff: posts small blind 10
Mahu2021: posts big blind 20
*** HOLE CARDS ***
Dealt to Mahu2021 [Ac 2d]
bigblinder1: calls 20
Ara Duff: raises 40 to 60
Mahu2021: folds 
bigblinder1: calls 40
*** FLOP *** [6s 8d 8h]
Ara Duff: bets 70
bigblinder1: raises 280 to 350
Ara Duff: folds 
Uncalled bet (280) returned to bigblinder1
bigblinder1 collected 280 from pot
*** SUMMARY ***
Total pot 280 | Rake 0 
Board [6s 8d 8h]
Seat 1: bigblinder1 (button) collected (280)
Seat 2: Ara Duff (small blind) folded on the Flop
Seat 3: Mahu2021 (big blind) folded before Flop



PokerStars Hand #252775098459: Tournament #3808380585, $1.84+$0.16 USD Hold'em No Limit - Level I (10/20) - 2024/10/05 10:16:58 CET [2024/10/05 4:16:58 ET]
Table '3808380585 1' 3-max Seat #2 is the button
Seat 1: bigblinder1 (630 in chips) 
Seat 2: Ara Duff (330 in chips) 
Seat 3: Mahu2021 (540 in chips) 
Mahu2021: posts small blind 10
bigblinder1: posts big blind 20
*** HOLE CARDS ***
Dealt to Mahu2021 [2d Qh]
Ara Duff: calls 20
Mahu2021: calls 10
bigblinder1: checks 
*** FLOP *** [As 7s Qc]
Mahu2021: checks 
bigblinder1: checks 
Ara Duff: bets 40
Mahu2021: folds 
bigblinder1: folds 
Uncalled bet (40) returned to Ara Duff
Ara Duff collected 60 from pot
Ara Duff: doesn't show hand 
*** SUMMARY ***
Total pot 60 | Rake 0 
Board [As 7s Qc]
Seat 1: bigblinder1 (big blind) folded on the Flop
Seat 2: Ara Duff (button) collected (60)
Seat 3: Mahu2021 (small blind) folded on the Flop



PokerStars Hand #252775100522: Tournament #3808380585, $1.84+$0.16 USD Hold'em No Limit - Level I (10/20) - 2024/10/05 10:17:19 CET [2024/10/05 4:17:19 ET]
Table '3808380585 1' 3-max Seat #3 is the button
Seat 1: bigblinder1 (610 in chips) 
Seat 2: Ara Duff (370 in chips) 
Seat 3: Mahu2021 (520 in chips) 
bigblinder1: posts small blind 10
Ara Duff: posts big blind 20
*** HOLE CARDS ***
Dealt to Mahu2021 [3c Ad]
Mahu2021: calls 20
bigblinder1: folds 
Ara Duff: checks 
*** FLOP *** [Ah 5s Kh]
Ara Duff: bets 40
Mahu2021: calls 40
*** TURN *** [Ah 5s Kh] [8c]
Ara Duff: bets 40
Mahu2021: calls 40
*** RIVER *** [Ah 5s Kh 8c] [8s]
Ara Duff: bets 60
Mahu2021: calls 60
*** SHOW DOWN ***
Ara Duff: shows [2d Ac] (two pair, Aces and Eights)
Mahu2021: shows [3c Ad] (two pair, Aces and Eights)
Ara Duff collected 165 from pot
Mahu2021 collected 165 from pot
*** SUMMARY ***
Total pot 330 | Rake 0 
Board [Ah 5s Kh 8c 8s]
Seat 1: bigblinder1 (small blind) folded before Flop
Seat 2: Ara Duff (big blind) showed [2d Ac] and won (165) with two pair, Aces and Eights
Seat 3: Mahu2021 (button) showed [3c Ad] and won (165) with two pair, Aces and Eights



PokerStars Hand #252775102573: Tournament #3808380585, $1.84+$0.16 USD Hold'em No Limit - Level I (10/20) - 2024/10/05 10:17:39 CET [2024/10/05 4:17:39 ET]
Table '3808380585 1' 3-max Seat #1 is the button
Seat 1: bigblinder1 (600 in chips) 
Seat 2: Ara Duff (375 in chips) 
Seat 3: Mahu2021 (525 in chips) 
Ara Duff: posts small blind 10
Mahu2021: posts big blind 20
*** HOLE CARDS ***
Dealt to Mahu2021 [5d 6c]
bigblinder1: calls 20
Ara Duff: calls 10
Mahu2021: checks 
*** FLOP *** [3d Kd 8s]
Ara Duff: bets 40
Mahu2021: folds 
bigblinder1: calls 40
*** TURN *** [3d Kd 8s] [Ad]
Ara Duff: bets 40
bigblinder1: folds 
Uncalled bet (40) returned to Ara Duff
Ara Duff collected 140 from pot
Ara Duff: doesn't show hand 
*** SUMMARY ***
Total pot 140 | Rake 0 
Board [3d Kd 8s Ad]
Seat 1: bigblinder1 (button) folded on the Turn
Seat 2: Ara Duff (small blind) collected (140)
Seat 3: Mahu2021 (big blind) folded on the Flop



PokerStars Hand #252775105779: Tournament #3808380585, $1.84+$0.16 USD Hold'em No Limit - Level II (15/30) - 2024/10/05 10:18:10 CET [2024/10/05 4:18:10 ET]
Table '3808380585 1' 3-max Seat #2 is the button
Seat 1: bigblinder1 (540 in chips) 
Seat 2: Ara Duff (455 in chips) 
Seat 3: Mahu2021 (505 in chips) 
Mahu2021: posts small blind 15
bigblinder1: posts big blind 30
*** HOLE CARDS ***
Dealt to Mahu2021 [5h 2s]
Ara Duff: calls 30
Mahu2021: folds 
bigblinder1: checks 
*** FLOP *** [As 4d Kd]
bigblinder1: checks 
Ara Duff: bets 60
bigblinder1: folds 
Uncalled bet (60) returned to Ara Duff
Ara Duff collected 75 from pot
Ara Duff: doesn't show hand 
*** SUMMARY ***
Total pot 75 | Rake 0 
Board [As 4d Kd]
Seat 1: bigblinder1 (big blind) folded on the Flop
Seat 2: Ara Duff (button) collected (75)
Seat 3: Mahu2021 (small blind) folded before Flop



PokerStars Hand #252775107097: Tournament #3808380585, $1.84+$0.16 USD Hold'em No Limit - Level II (15/30) - 2024/10/05 10:18:24 CET [2024/10/05 4:18:24 ET]
Table '3808380585 1' 3-max Seat #3 is the button
Seat 1: bigblinder1 (510 in chips) 
Seat 2: Ara Duff (500 in chips) 
Seat 3: Mahu2021 (490 in chips) 
bigblinder1: posts small blind 15
Ara Duff: posts big blind 30
*** HOLE CARDS ***
Dealt to Mahu2021 [2c 5c]
Mahu2021: calls 30
bigblinder1: calls 15
Ara Duff: raises 60 to 90
Mahu2021: folds 
bigblinder1: folds 
Uncalled bet (60) returned to Ara Duff
Ara Duff collected 90 from pot
Ara Duff: doesn't show hand 
*** SUMMARY ***
Total pot 90 | Rake 0 
Seat 1: bigblinder1 (small blind) folded before Flop
Seat 2: Ara Duff (big blind) collected (90)
Seat 3: Mahu2021 (button) folded before Flop



PokerStars Hand #252775108549: Tournament #3808380585, $1.84+$0.16 USD Hold'em No Limit - Level II (15/30) - 2024/10/05 10:18:38 CET [2024/10/05 4:18:38 ET]
Table '3808380585 1' 3-max Seat #1 is the button
Seat 1: bigblinder1 (480 in chips) 
Seat 2: Ara Duff (560 in chips) 
Seat 3: Mahu2021 (460 in chips) 
Ara Duff: posts small blind 15
Mahu2021: posts big blind 30
*** HOLE CARDS ***
Dealt to Mahu2021 [3h 3s]
bigblinder1: folds 
Ara Duff: raises 60 to 90
Mahu2021: raises 370 to 460 and is all-in
Ara Duff: calls 370
*** FLOP *** [Ac As 7d]
*** TURN *** [Ac As 7d] [8h]
*** RIVER *** [Ac As 7d 8h] [Jd]
*** SHOW DOWN ***
Ara Duff: shows [Th Ts] (two pair, Aces and Tens)
Mahu2021: shows [3h 3s] (two pair, Aces and Threes)
Ara Duff collected 920 from pot
Mahu2021 finished the tournament in 3rd place
*** SUMMARY ***
Total pot 920 | Rake 0 
Board [Ac As 7d 8h Jd]
Seat 1: bigblinder1 (button) folded before Flop (didn't bet)
Seat 2: Ara Duff (small blind) showed [Th Ts] and won (920) with two pair, Aces and Tens
Seat 3: Mahu2021 (big blind) showed [3h 3s] and lost with two pair, Aces and Threes



