PokerStars Hand #244510204233: Tournament #3609967766, $0.92+$0.08 USD Hold'em No Limit - Level I (10/20) - 2023/06/28 16:15:31 CET [2023/06/28 10:15:31 ET]
Table '3609967766 1' 3-max Seat #1 is the button
Seat 1: Kazinke (500 in chips) 
Seat 2: PAOVALEN (500 in chips) 
Seat 3: Mahu2021 (500 in chips) 
PAOVALEN: posts small blind 10
Mahu2021: posts big blind 20
*** HOLE CARDS ***
Dealt to Mahu2021 [Ts 9h]
Kazinke: raises 20 to 40
PAOVALEN: folds 
Mahu2021: calls 20
*** FLOP *** [Ac 8c 4c]
Mahu2021: checks 
Kazinke: checks 
*** TURN *** [Ac 8c 4c] [8s]
Mahu2021: checks 
Kazinke: bets 40
Mahu2021: folds 
Uncalled bet (40) returned to Kazinke
Kazinke collected 90 from pot
Kazinke: doesn't show hand 
*** SUMMARY ***
Total pot 90 | Rake 0 
Board [Ac 8c 4c 8s]
Seat 1: Kazinke (button) collected (90)
Seat 2: PAOVALEN (small blind) folded before Flop
Seat 3: Mahu2021 (big blind) folded on the Turn



PokerStars Hand #244510208587: Tournament #3609967766, $0.92+$0.08 USD Hold'em No Limit - Level I (10/20) - 2023/06/28 16:15:51 CET [2023/06/28 10:15:51 ET]
Table '3609967766 1' 3-max Seat #2 is the button
Seat 1: Kazinke (550 in chips) 
Seat 2: PAOVALEN (490 in chips) 
Seat 3: Mahu2021 (460 in chips) 
Mahu2021: posts small blind 10
Kazinke: posts big blind 20
*** HOLE CARDS ***
Dealt to Mahu2021 [6h 9h]
PAOVALEN: folds 
Mahu2021: raises 20 to 40
Kazinke: calls 20
*** FLOP *** [Jd 5c 4c]
Mahu2021: checks 
Kazinke: checks 
*** TURN *** [Jd 5c 4c] [7s]
Mahu2021: bets 40
Kazinke: calls 40
*** RIVER *** [Jd 5c 4c 7s] [4s]
Mahu2021: bets 160
Kazinke: calls 160
*** SHOW DOWN ***
Mahu2021: shows [6h 9h] (a pair of Fours)
Kazinke: shows [6s As] (a pair of Fours - Ace kicker)
Kazinke collected 480 from pot
*** SUMMARY ***
Total pot 480 | Rake 0 
Board [Jd 5c 4c 7s 4s]
Seat 1: Kazinke (big blind) showed [6s As] and won (480) with a pair of Fours
Seat 2: PAOVALEN (button) folded before Flop (didn't bet)
Seat 3: Mahu2021 (small blind) showed [6h 9h] and lost with a pair of Fours



PokerStars Hand #244510214015: Tournament #3609967766, $0.92+$0.08 USD Hold'em No Limit - Level I (10/20) - 2023/06/28 16:16:16 CET [2023/06/28 10:16:16 ET]
Table '3609967766 1' 3-max Seat #3 is the button
Seat 1: Kazinke (790 in chips) 
Seat 2: PAOVALEN (490 in chips) 
Seat 3: Mahu2021 (220 in chips) 
Kazinke: posts small blind 10
PAOVALEN: posts big blind 20
*** HOLE CARDS ***
Dealt to Mahu2021 [5d 4s]
Mahu2021: folds 
Kazinke: folds 
Uncalled bet (10) returned to PAOVALEN
PAOVALEN collected 20 from pot
PAOVALEN: doesn't show hand 
*** SUMMARY ***
Total pot 20 | Rake 0 
Seat 1: Kazinke (small blind) folded before Flop
Seat 2: PAOVALEN (big blind) collected (20)
Seat 3: Mahu2021 (button) folded before Flop (didn't bet)



PokerStars Hand #244510215430: Tournament #3609967766, $0.92+$0.08 USD Hold'em No Limit - Level I (10/20) - 2023/06/28 16:16:22 CET [2023/06/28 10:16:22 ET]
Table '3609967766 1' 3-max Seat #1 is the button
Seat 1: Kazinke (780 in chips) 
Seat 2: PAOVALEN (500 in chips) 
Seat 3: Mahu2021 (220 in chips) 
PAOVALEN: posts small blind 10
Mahu2021: posts big blind 20
*** HOLE CARDS ***
Dealt to Mahu2021 [3h 8h]
Kazinke: raises 20 to 40
PAOVALEN: calls 30
Mahu2021: folds 
*** FLOP *** [4c 3s 6c]
PAOVALEN: checks 
Kazinke: bets 50
PAOVALEN: folds 
Uncalled bet (50) returned to Kazinke
Kazinke collected 100 from pot
Kazinke: doesn't show hand 
*** SUMMARY ***
Total pot 100 | Rake 0 
Board [4c 3s 6c]
Seat 1: Kazinke (button) collected (100)
Seat 2: PAOVALEN (small blind) folded on the Flop
Seat 3: Mahu2021 (big blind) folded before Flop



PokerStars Hand #244510220960: Tournament #3609967766, $0.92+$0.08 USD Hold'em No Limit - Level I (10/20) - 2023/06/28 16:16:47 CET [2023/06/28 10:16:47 ET]
Table '3609967766 1' 3-max Seat #2 is the button
Seat 1: Kazinke (840 in chips) 
Seat 2: PAOVALEN (460 in chips) 
Seat 3: Mahu2021 (200 in chips) 
Mahu2021: posts small blind 10
Kazinke: posts big blind 20
*** HOLE CARDS ***
Dealt to Mahu2021 [5h Ks]
PAOVALEN: folds 
Mahu2021: raises 180 to 200 and is all-in
Kazinke: folds 
Uncalled bet (180) returned to Mahu2021
Mahu2021 collected 40 from pot
Mahu2021: doesn't show hand 
*** SUMMARY ***
Total pot 40 | Rake 0 
Seat 1: Kazinke (big blind) folded before Flop
Seat 2: PAOVALEN (button) folded before Flop (didn't bet)
Seat 3: Mahu2021 (small blind) collected (40)



PokerStars Hand #244510224010: Tournament #3609967766, $0.92+$0.08 USD Hold'em No Limit - Level I (10/20) - 2023/06/28 16:17:02 CET [2023/06/28 10:17:02 ET]
Table '3609967766 1' 3-max Seat #3 is the button
Seat 1: Kazinke (820 in chips) 
Seat 2: PAOVALEN (460 in chips) 
Seat 3: Mahu2021 (220 in chips) 
Kazinke: posts small blind 10
PAOVALEN: posts big blind 20
*** HOLE CARDS ***
Dealt to Mahu2021 [Ac 2d]
Mahu2021: calls 20
Kazinke: raises 50 to 70
PAOVALEN: folds 
Mahu2021: raises 150 to 220 and is all-in
Kazinke: calls 150
*** FLOP *** [3h Jh 5c]
*** TURN *** [3h Jh 5c] [7h]
*** RIVER *** [3h Jh 5c 7h] [8h]
*** SHOW DOWN ***
Kazinke: shows [Ah Kd] (a flush, Ace high)
Mahu2021: shows [Ac 2d] (high card Ace)
Kazinke collected 460 from pot
Mahu2021 finished the tournament in 3rd place
*** SUMMARY ***
Total pot 460 | Rake 0 
Board [3h Jh 5c 7h 8h]
Seat 1: Kazinke (small blind) showed [Ah Kd] and won (460) with a flush, Ace high
Seat 2: PAOVALEN (big blind) folded before Flop
Seat 3: Mahu2021 (button) showed [Ac 2d] and lost with high card Ace



