PokerStars Hand #242991723335: Tournament #3575203297, $0.92+$0.08 USD Hold'em No Limit - Level I (10/20) - 2023/04/09 22:32:34 CET [2023/04/09 16:32:34 ET]
Table '3575203297 1' 3-max Seat #1 is the button
Seat 1: Sindaragosa (500 in chips) 
Seat 2: Mahu2021 (500 in chips) 
Seat 3: holzi-hansn (500 in chips) 
Mahu2021: posts small blind 10
holzi-hansn: posts big blind 20
*** HOLE CARDS ***
Dealt to Mahu2021 [9s 9c]
Sindaragosa: raises 20 to 40
Mahu2021: raises 460 to 500 and is all-in
holzi-hansn: folds 
Sindaragosa: folds 
Uncalled bet (460) returned to Mahu2021
Mahu2021 collected 100 from pot
Mahu2021: doesn't show hand 
*** SUMMARY ***
Total pot 100 | Rake 0 
Seat 1: Sindaragosa (button) folded before Flop
Seat 2: Mahu2021 (small blind) collected (100)
Seat 3: holzi-hansn (big blind) folded before Flop



PokerStars Hand #242991729416: Tournament #3575203297, $0.92+$0.08 USD Hold'em No Limit - Level I (10/20) - 2023/04/09 22:32:47 CET [2023/04/09 16:32:47 ET]
Table '3575203297 1' 3-max Seat #2 is the button
Seat 1: Sindaragosa (460 in chips) 
Seat 2: Mahu2021 (560 in chips) 
Seat 3: holzi-hansn (480 in chips) 
holzi-hansn: posts small blind 10
Sindaragosa: posts big blind 20
*** HOLE CARDS ***
Dealt to Mahu2021 [3c Jh]
Mahu2021: folds 
holzi-hansn: folds 
Uncalled bet (10) returned to Sindaragosa
Sindaragosa collected 20 from pot
*** SUMMARY ***
Total pot 20 | Rake 0 
Seat 1: Sindaragosa (big blind) collected (20)
Seat 2: Mahu2021 (button) folded before Flop (didn't bet)
Seat 3: holzi-hansn (small blind) folded before Flop



PokerStars Hand #242991731869: Tournament #3575203297, $0.92+$0.08 USD Hold'em No Limit - Level I (10/20) - 2023/04/09 22:32:52 CET [2023/04/09 16:32:52 ET]
Table '3575203297 1' 3-max Seat #3 is the button
Seat 1: Sindaragosa (470 in chips) 
Seat 2: Mahu2021 (560 in chips) 
Seat 3: holzi-hansn (470 in chips) 
Sindaragosa: posts small blind 10
Mahu2021: posts big blind 20
*** HOLE CARDS ***
Dealt to Mahu2021 [8s 4h]
holzi-hansn: raises 450 to 470 and is all-in
Sindaragosa: folds 
Mahu2021: folds 
Uncalled bet (450) returned to holzi-hansn
holzi-hansn collected 50 from pot
holzi-hansn: doesn't show hand 
*** SUMMARY ***
Total pot 50 | Rake 0 
Seat 1: Sindaragosa (small blind) folded before Flop
Seat 2: Mahu2021 (big blind) folded before Flop
Seat 3: holzi-hansn (button) collected (50)



PokerStars Hand #242991735249: Tournament #3575203297, $0.92+$0.08 USD Hold'em No Limit - Level I (10/20) - 2023/04/09 22:32:59 CET [2023/04/09 16:32:59 ET]
Table '3575203297 1' 3-max Seat #1 is the button
Seat 1: Sindaragosa (460 in chips) 
Seat 2: Mahu2021 (540 in chips) 
Seat 3: holzi-hansn (500 in chips) 
Mahu2021: posts small blind 10
holzi-hansn: posts big blind 20
*** HOLE CARDS ***
Dealt to Mahu2021 [9c 6s]
Sindaragosa: folds 
Mahu2021: calls 10
holzi-hansn: raises 480 to 500 and is all-in
Mahu2021: folds 
Uncalled bet (480) returned to holzi-hansn
holzi-hansn collected 40 from pot
holzi-hansn: doesn't show hand 
*** SUMMARY ***
Total pot 40 | Rake 0 
Seat 1: Sindaragosa (button) folded before Flop (didn't bet)
Seat 2: Mahu2021 (small blind) folded before Flop
Seat 3: holzi-hansn (big blind) collected (40)



PokerStars Hand #242991739333: Tournament #3575203297, $0.92+$0.08 USD Hold'em No Limit - Level I (10/20) - 2023/04/09 22:33:08 CET [2023/04/09 16:33:08 ET]
Table '3575203297 1' 3-max Seat #2 is the button
Seat 1: Sindaragosa (460 in chips) 
Seat 2: Mahu2021 (520 in chips) 
Seat 3: holzi-hansn (520 in chips) 
holzi-hansn: posts small blind 10
Sindaragosa: posts big blind 20
*** HOLE CARDS ***
Dealt to Mahu2021 [Qc 3s]
Mahu2021: folds 
holzi-hansn: calls 10
Sindaragosa: checks 
*** FLOP *** [Qs Kd 6h]
holzi-hansn: checks 
Sindaragosa: checks 
*** TURN *** [Qs Kd 6h] [As]
holzi-hansn: checks 
Sindaragosa: checks 
*** RIVER *** [Qs Kd 6h As] [9c]
holzi-hansn: checks 
Sindaragosa: checks 
*** SHOW DOWN ***
holzi-hansn: shows [8s 5d] (high card Ace)
Sindaragosa: shows [2s 2d] (a pair of Deuces)
Sindaragosa collected 40 from pot
*** SUMMARY ***
Total pot 40 | Rake 0 
Board [Qs Kd 6h As 9c]
Seat 1: Sindaragosa (big blind) showed [2s 2d] and won (40) with a pair of Deuces
Seat 2: Mahu2021 (button) folded before Flop (didn't bet)
Seat 3: holzi-hansn (small blind) showed [8s 5d] and lost with high card Ace



PokerStars Hand #242991747855: Tournament #3575203297, $0.92+$0.08 USD Hold'em No Limit - Level I (10/20) - 2023/04/09 22:33:26 CET [2023/04/09 16:33:26 ET]
Table '3575203297 1' 3-max Seat #3 is the button
Seat 1: Sindaragosa (480 in chips) 
Seat 2: Mahu2021 (520 in chips) 
Seat 3: holzi-hansn (500 in chips) 
Sindaragosa: posts small blind 10
Mahu2021: posts big blind 20
*** HOLE CARDS ***
Dealt to Mahu2021 [9c Jd]
holzi-hansn: raises 480 to 500 and is all-in
Sindaragosa: folds 
Mahu2021: folds 
Uncalled bet (480) returned to holzi-hansn
holzi-hansn collected 50 from pot
holzi-hansn: doesn't show hand 
*** SUMMARY ***
Total pot 50 | Rake 0 
Seat 1: Sindaragosa (small blind) folded before Flop
Seat 2: Mahu2021 (big blind) folded before Flop
Seat 3: holzi-hansn (button) collected (50)



PokerStars Hand #242991751040: Tournament #3575203297, $0.92+$0.08 USD Hold'em No Limit - Level I (10/20) - 2023/04/09 22:33:33 CET [2023/04/09 16:33:33 ET]
Table '3575203297 1' 3-max Seat #1 is the button
Seat 1: Sindaragosa (470 in chips) 
Seat 2: Mahu2021 (500 in chips) 
Seat 3: holzi-hansn (530 in chips) 
Mahu2021: posts small blind 10
holzi-hansn: posts big blind 20
*** HOLE CARDS ***
Dealt to Mahu2021 [8c 4h]
Sindaragosa: folds 
Mahu2021: folds 
Uncalled bet (10) returned to holzi-hansn
holzi-hansn collected 20 from pot
holzi-hansn: doesn't show hand 
*** SUMMARY ***
Total pot 20 | Rake 0 
Seat 1: Sindaragosa (button) folded before Flop (didn't bet)
Seat 2: Mahu2021 (small blind) folded before Flop
Seat 3: holzi-hansn (big blind) collected (20)



PokerStars Hand #242991754365: Tournament #3575203297, $0.92+$0.08 USD Hold'em No Limit - Level I (10/20) - 2023/04/09 22:33:40 CET [2023/04/09 16:33:40 ET]
Table '3575203297 1' 3-max Seat #2 is the button
Seat 1: Sindaragosa (470 in chips) 
Seat 2: Mahu2021 (490 in chips) 
Seat 3: holzi-hansn (540 in chips) 
holzi-hansn: posts small blind 10
Sindaragosa: posts big blind 20
*** HOLE CARDS ***
Dealt to Mahu2021 [Qs As]
Mahu2021: raises 20 to 40
holzi-hansn: calls 30
Sindaragosa: folds 
*** FLOP *** [Kh Ts 2s]
holzi-hansn: checks 
Mahu2021: bets 100
holzi-hansn: raises 400 to 500 and is all-in
Mahu2021: calls 350 and is all-in
Uncalled bet (50) returned to holzi-hansn
*** TURN *** [Kh Ts 2s] [8h]
*** RIVER *** [Kh Ts 2s 8h] [Tc]
*** SHOW DOWN ***
holzi-hansn: shows [5d Kd] (two pair, Kings and Tens)
Mahu2021: shows [Qs As] (a pair of Tens)
holzi-hansn collected 1000 from pot
Mahu2021 finished the tournament in 3rd place
*** SUMMARY ***
Total pot 1000 | Rake 0 
Board [Kh Ts 2s 8h Tc]
Seat 1: Sindaragosa (big blind) folded before Flop
Seat 2: Mahu2021 (button) showed [Qs As] and lost with a pair of Tens
Seat 3: holzi-hansn (small blind) showed [5d Kd] and won (1000) with two pair, Kings and Tens



