PokerStars Zoom Hand #254736747843:  Hold'em No Limit ($0.05/$0.10) - 2025/02/06 19:24:38 CET [2025/02/06 13:24:38 ET]
Table 'Aludra' 6-max Seat #1 is the button
Seat 1: ksjhs4207 ($9.84 in chips) 
Seat 2: sigmanolimit ($16.25 in chips) 
Seat 3: Mahu2021 ($10 in chips) 
Seat 4: Pokkermastaa ($19.78 in chips) 
Seat 5: andreuler ($10 in chips) 
Seat 6: sup what ($12.82 in chips) 
sigmanolimit: posts small blind $0.05
Mahu2021: posts big blind $0.10
*** HOLE CARDS ***
Dealt to Mahu2021 [Jc 7c]
Pokkermastaa: folds 
andreuler: folds 
sup what: raises $0.15 to $0.25
ksjhs4207: folds 
sigmanolimit: folds 
Mahu2021: calls $0.15
*** FLOP *** [7d Tc 6h]
Mahu2021: checks 
sup what: checks 
*** TURN *** [7d Tc 6h] [9d]
Mahu2021: checks 
sup what: checks 
*** RIVER *** [7d Tc 6h 9d] [3s]
Mahu2021: bets $0.53
sup what: calls $0.53
*** SHOW DOWN ***
Mahu2021: shows [Jc 7c] (a pair of Sevens)
sup what: shows [Ks Kc] (a pair of Kings)
sup what collected $1.54 from pot
*** SUMMARY ***
Total pot $1.61 | Rake $0.07 
Board [7d Tc 6h 9d 3s]
Seat 1: ksjhs4207 (button) folded before Flop (didn't bet)
Seat 2: sigmanolimit (small blind) folded before Flop
Seat 3: Mahu2021 (big blind) showed [Jc 7c] and lost with a pair of Sevens
Seat 4: Pokkermastaa folded before Flop (didn't bet)
Seat 5: andreuler folded before Flop (didn't bet)
Seat 6: sup what showed [Ks Kc] and won ($1.54) with a pair of Kings



PokerStars Zoom Hand #254736762166:  Hold'em No Limit ($0.05/$0.10) - 2025/02/06 19:25:30 CET [2025/02/06 13:25:30 ET]
Table 'Aludra' 6-max Seat #1 is the button
Seat 1: Jamikaze1337 ($7.94 in chips) 
Seat 2: HarvardFaculty ($15.31 in chips) 
Seat 3: Bonditten ($8.95 in chips) 
Seat 4: Tayandme ($7.95 in chips) 
Seat 5: Mahu2021 ($9.17 in chips) 
Seat 6: 1KleX ($8.14 in chips) 
HarvardFaculty: posts small blind $0.05
Bonditten: posts big blind $0.10
*** HOLE CARDS ***
Dealt to Mahu2021 [8s 7d]
Tayandme: raises $0.20 to $0.30
Mahu2021: folds 
1KleX: folds 
Jamikaze1337: folds 
HarvardFaculty: calls $0.25
Bonditten: folds 
*** FLOP *** [As 8c Ts]
HarvardFaculty: checks 
Tayandme: bets $0.34
HarvardFaculty: folds 
Uncalled bet ($0.34) returned to Tayandme
Tayandme collected $0.67 from pot
Tayandme: doesn't show hand 
*** SUMMARY ***
Total pot $0.70 | Rake $0.03 
Board [As 8c Ts]
Seat 1: Jamikaze1337 (button) folded before Flop (didn't bet)
Seat 2: HarvardFaculty (small blind) folded on the Flop
Seat 3: Bonditten (big blind) folded before Flop
Seat 4: Tayandme collected ($0.67)
Seat 5: Mahu2021 folded before Flop (didn't bet)
Seat 6: 1KleX folded before Flop (didn't bet)



PokerStars Zoom Hand #254736760921:  Hold'em No Limit ($0.05/$0.10) - 2025/02/06 19:25:25 CET [2025/02/06 13:25:25 ET]
Table 'Aludra' 6-max Seat #1 is the button
Seat 1: morraish ($12.27 in chips) 
Seat 2: Mahu2021 ($9.22 in chips) 
Seat 3: langosport ($8.52 in chips) 
Seat 4: todd17800 ($15.88 in chips) 
Seat 5: sup what ($9.78 in chips) 
Seat 6: lEternamente ($10 in chips) 
Mahu2021: posts small blind $0.05
langosport: posts big blind $0.10
*** HOLE CARDS ***
Dealt to Mahu2021 [4c Tc]
todd17800: raises $0.10 to $0.20
sup what: raises $0.60 to $0.80
lEternamente: folds 
morraish: folds 
Mahu2021: folds 
langosport: folds 
todd17800: raises $15.08 to $15.88 and is all-in
sup what: calls $8.98 and is all-in
Uncalled bet ($6.10) returned to todd17800
sup what has timed out
*** FLOP *** [5d 5s 6d]
*** TURN *** [5d 5s 6d] [9c]
*** RIVER *** [5d 5s 6d 9c] [6h]
*** SHOW DOWN ***
todd17800: shows [Ac Kc] (two pair, Sixes and Fives)
sup what: shows [Kh As] (two pair, Sixes and Fives)
todd17800 collected $9.41 from pot
sup what collected $9.41 from pot
*** SUMMARY ***
Total pot $19.71 | Rake $0.89 
Board [5d 5s 6d 9c 6h]
Seat 1: morraish (button) folded before Flop (didn't bet)
Seat 2: Mahu2021 (small blind) folded before Flop
Seat 3: langosport (big blind) folded before Flop
Seat 4: todd17800 showed [Ac Kc] and won ($9.41) with two pair, Sixes and Fives
Seat 5: sup what showed [Kh As] and won ($9.41) with two pair, Sixes and Fives
Seat 6: lEternamente folded before Flop (didn't bet)



PokerStars Zoom Hand #254736763411:  Hold'em No Limit ($0.05/$0.10) - 2025/02/06 19:25:34 CET [2025/02/06 13:25:34 ET]
Table 'Aludra' 6-max Seat #1 is the button
Seat 1: Mahu2021 ($9.17 in chips) 
Seat 2: langosport ($8.42 in chips) 
Seat 3: morraish ($12.27 in chips) 
Seat 4: vassili_10 ($11.22 in chips) 
Seat 5: 1KleX ($8.14 in chips) 
Seat 6: Bafo de Mé ($10.23 in chips) 
langosport: posts small blind $0.05
morraish: posts big blind $0.10
*** HOLE CARDS ***
Dealt to Mahu2021 [6d 7d]
vassili_10: folds 
1KleX: folds 
Bafo de Mé: folds 
Mahu2021: raises $0.20 to $0.30
langosport: raises $0.70 to $1
morraish: folds 
Mahu2021: calls $0.70
*** FLOP *** [Ks 2s 6h]
langosport: bets $0.20
Mahu2021: calls $0.20
*** TURN *** [Ks 2s 6h] [6s]
langosport: bets $1.20
Mahu2021: raises $6.77 to $7.97 and is all-in
langosport: calls $6.02 and is all-in
Uncalled bet ($0.75) returned to Mahu2021
langosport has timed out
*** RIVER *** [Ks 2s 6h 6s] [3h]
*** SHOW DOWN ***
langosport: shows [Kd Kc] (a full house, Kings full of Sixes)
Mahu2021: shows [6d 7d] (three of a kind, Sixes)
langosport collected $16.18 from pot
*** SUMMARY ***
Total pot $16.94 | Rake $0.76 
Board [Ks 2s 6h 6s 3h]
Seat 1: Mahu2021 (button) showed [6d 7d] and lost with three of a kind, Sixes
Seat 2: langosport (small blind) showed [Kd Kc] and won ($16.18) with a full house, Kings full of Sixes
Seat 3: morraish (big blind) folded before Flop
Seat 4: vassili_10 folded before Flop (didn't bet)
Seat 5: 1KleX folded before Flop (didn't bet)
Seat 6: Bafo de Mé folded before Flop (didn't bet)



