PokerStars Hand #245217626085: Tournament #3627193681, $0.92+$0.08 USD Hold'em No Limit - Level I (10/20) - 2023/08/05 17:26:13 CET [2023/08/05 11:26:13 ET]
Table '3627193681 1' 3-max Seat #1 is the button
Seat 1: Mahu2021 (500 in chips) 
Seat 2: mike 162157 (500 in chips) 
Seat 3: shakhtior (500 in chips) 
mike 162157: posts small blind 10
shakhtior: posts big blind 20
*** HOLE CARDS ***
Dealt to Mahu2021 [9h Ad]
Mahu2021: raises 20 to 40
mike 162157: calls 30
shakhtior: folds 
*** FLOP *** [9c 3c Qc]
mike 162157: checks 
Mahu2021: bets 100
mike 162157: folds 
Uncalled bet (100) returned to Mahu2021
Mahu2021 collected 100 from pot
Mahu2021: doesn't show hand 
*** SUMMARY ***
Total pot 100 | Rake 0 
Board [9c 3c Qc]
Seat 1: Mahu2021 (button) collected (100)
Seat 2: mike 162157 (small blind) folded on the Flop
Seat 3: shakhtior (big blind) folded before Flop



PokerStars Hand #245217629373: Tournament #3627193681, $0.92+$0.08 USD Hold'em No Limit - Level I (10/20) - 2023/08/05 17:26:25 CET [2023/08/05 11:26:25 ET]
Table '3627193681 1' 3-max Seat #2 is the button
Seat 1: Mahu2021 (560 in chips) 
Seat 2: mike 162157 (460 in chips) 
Seat 3: shakhtior (480 in chips) 
shakhtior: posts small blind 10
Mahu2021: posts big blind 20
*** HOLE CARDS ***
Dealt to Mahu2021 [4s 6d]
mike 162157: raises 20 to 40
shakhtior: folds 
Mahu2021: folds 
Uncalled bet (20) returned to mike 162157
mike 162157 collected 50 from pot
mike 162157: doesn't show hand 
*** SUMMARY ***
Total pot 50 | Rake 0 
Seat 1: Mahu2021 (big blind) folded before Flop
Seat 2: mike 162157 (button) collected (50)
Seat 3: shakhtior (small blind) folded before Flop



PokerStars Hand #245217631295: Tournament #3627193681, $0.92+$0.08 USD Hold'em No Limit - Level I (10/20) - 2023/08/05 17:26:32 CET [2023/08/05 11:26:32 ET]
Table '3627193681 1' 3-max Seat #3 is the button
Seat 1: Mahu2021 (540 in chips) 
Seat 2: mike 162157 (490 in chips) 
Seat 3: shakhtior (470 in chips) 
Mahu2021: posts small blind 10
mike 162157: posts big blind 20
*** HOLE CARDS ***
Dealt to Mahu2021 [2s Td]
shakhtior: folds 
Mahu2021: folds 
Uncalled bet (10) returned to mike 162157
mike 162157 collected 20 from pot
mike 162157: doesn't show hand 
*** SUMMARY ***
Total pot 20 | Rake 0 
Seat 1: Mahu2021 (small blind) folded before Flop
Seat 2: mike 162157 (big blind) collected (20)
Seat 3: shakhtior (button) folded before Flop (didn't bet)



PokerStars Hand #245217633232: Tournament #3627193681, $0.92+$0.08 USD Hold'em No Limit - Level I (10/20) - 2023/08/05 17:26:39 CET [2023/08/05 11:26:39 ET]
Table '3627193681 1' 3-max Seat #1 is the button
Seat 1: Mahu2021 (530 in chips) 
Seat 2: mike 162157 (500 in chips) 
Seat 3: shakhtior (470 in chips) 
mike 162157: posts small blind 10
shakhtior: posts big blind 20
*** HOLE CARDS ***
Dealt to Mahu2021 [Ts Kh]
Mahu2021: raises 20 to 40
mike 162157: calls 30
shakhtior: folds 
*** FLOP *** [6h Qs 8c]
mike 162157: checks 
Mahu2021: checks 
*** TURN *** [6h Qs 8c] [Jc]
mike 162157: bets 20
Mahu2021: raises 100 to 120
mike 162157: calls 100
*** RIVER *** [6h Qs 8c Jc] [5h]
mike 162157: checks 
Mahu2021: checks 
*** SHOW DOWN ***
mike 162157: shows [Jh 7d] (a pair of Jacks)
Mahu2021: mucks hand 
mike 162157 collected 340 from pot
*** SUMMARY ***
Total pot 340 | Rake 0 
Board [6h Qs 8c Jc 5h]
Seat 1: Mahu2021 (button) mucked [Ts Kh]
Seat 2: mike 162157 (small blind) showed [Jh 7d] and won (340) with a pair of Jacks
Seat 3: shakhtior (big blind) folded before Flop



PokerStars Hand #245217639266: Tournament #3627193681, $0.92+$0.08 USD Hold'em No Limit - Level I (10/20) - 2023/08/05 17:27:01 CET [2023/08/05 11:27:01 ET]
Table '3627193681 1' 3-max Seat #2 is the button
Seat 1: Mahu2021 (370 in chips) 
Seat 2: mike 162157 (680 in chips) 
Seat 3: shakhtior (450 in chips) 
shakhtior: posts small blind 10
Mahu2021: posts big blind 20
*** HOLE CARDS ***
Dealt to Mahu2021 [6d 8d]
mike 162157: calls 20
shakhtior: calls 10
Mahu2021: checks 
*** FLOP *** [7s 6s 5s]
shakhtior: checks 
Mahu2021: bets 60
mike 162157: calls 60
shakhtior: folds 
*** TURN *** [7s 6s 5s] [9c]
Mahu2021: bets 290 and is all-in
mike 162157: folds [5c 6h]
Uncalled bet (290) returned to Mahu2021
Mahu2021 collected 180 from pot
Mahu2021: doesn't show hand 
*** SUMMARY ***
Total pot 180 | Rake 0 
Board [7s 6s 5s 9c]
Seat 1: Mahu2021 (big blind) collected (180)
Seat 2: mike 162157 (button) folded on the Turn
Seat 3: shakhtior (small blind) folded on the Flop



PokerStars Hand #245217645345: Tournament #3627193681, $0.92+$0.08 USD Hold'em No Limit - Level I (10/20) - 2023/08/05 17:27:24 CET [2023/08/05 11:27:24 ET]
Table '3627193681 1' 3-max Seat #3 is the button
Seat 1: Mahu2021 (470 in chips) 
Seat 2: mike 162157 (600 in chips) 
Seat 3: shakhtior (430 in chips) 
Mahu2021: posts small blind 10
mike 162157: posts big blind 20
*** HOLE CARDS ***
Dealt to Mahu2021 [Qc Ah]
shakhtior: folds 
Mahu2021: raises 20 to 40
mike 162157: calls 20
*** FLOP *** [4c 5d 9c]
Mahu2021: checks 
mike 162157: checks 
*** TURN *** [4c 5d 9c] [8d]
Mahu2021: checks 
mike 162157: bets 20
Mahu2021: calls 20
*** RIVER *** [4c 5d 9c 8d] [6s]
Mahu2021: checks 
mike 162157: bets 20
Mahu2021: folds 
Uncalled bet (20) returned to mike 162157
mike 162157 collected 120 from pot
mike 162157: doesn't show hand 
*** SUMMARY ***
Total pot 120 | Rake 0 
Board [4c 5d 9c 8d 6s]
Seat 1: Mahu2021 (small blind) folded on the River
Seat 2: mike 162157 (big blind) collected (120)
Seat 3: shakhtior (button) folded before Flop (didn't bet)



PokerStars Hand #245217649647: Tournament #3627193681, $0.92+$0.08 USD Hold'em No Limit - Level I (10/20) - 2023/08/05 17:27:39 CET [2023/08/05 11:27:39 ET]
Table '3627193681 1' 3-max Seat #1 is the button
Seat 1: Mahu2021 (410 in chips) 
Seat 2: mike 162157 (660 in chips) 
Seat 3: shakhtior (430 in chips) 
mike 162157: posts small blind 10
shakhtior: posts big blind 20
*** HOLE CARDS ***
Dealt to Mahu2021 [9s Ad]
Mahu2021: raises 20 to 40
mike 162157: calls 30
shakhtior: raises 390 to 430 and is all-in
Mahu2021: calls 370 and is all-in
mike 162157: calls 390
*** FLOP *** [Tc 4h As]
*** TURN *** [Tc 4h As] [5h]
*** RIVER *** [Tc 4h As 5h] [8c]
*** SHOW DOWN ***
mike 162157: shows [9c 9d] (a pair of Nines)
shakhtior: shows [8s 8h] (three of a kind, Eights)
shakhtior collected 40 from side pot
Mahu2021: shows [9s Ad] (a pair of Aces)
shakhtior collected 1230 from main pot
Mahu2021 finished the tournament in 3rd place
*** SUMMARY ***
Total pot 1270 Main pot 1230. Side pot 40. | Rake 0 
Board [Tc 4h As 5h 8c]
Seat 1: Mahu2021 (button) showed [9s Ad] and lost with a pair of Aces
Seat 2: mike 162157 (small blind) showed [9c 9d] and lost with a pair of Nines
Seat 3: shakhtior (big blind) showed [8s 8h] and won (1270) with three of a kind, Eights



