PokerStars Hand #246946617379: Tournament #3668829587, $1.84+$0.16 USD Hold'em No Limit - Level I (10/20) - 2023/11/05 20:50:11 CET [2023/11/05 14:50:11 ET]
Table '3668829587 1' 3-max Seat #1 is the button
Seat 1: Mahu2021 (500 in chips) 
Seat 2: Mia88Cat (500 in chips) 
Seat 3: firefriend (500 in chips) 
Mia88Cat: posts small blind 10
firefriend: posts big blind 20
*** HOLE CARDS ***
Dealt to Mahu2021 [9d 5d]
Mahu2021: folds 
Mia88Cat: raises 20 to 40
firefriend: calls 20
*** FLOP *** [Tc 4s 3c]
Mia88Cat: bets 40
firefriend: calls 40
*** TURN *** [Tc 4s 3c] [4h]
Mia88Cat: bets 80
firefriend: calls 80
*** RIVER *** [Tc 4s 3c 4h] [8h]
Mia88Cat: bets 160
firefriend: calls 160
*** SHOW DOWN ***
Mia88Cat: shows [5h Jh] (a pair of Fours)
firefriend: shows [3s 7s] (two pair, Fours and Threes)
firefriend collected 640 from pot
*** SUMMARY ***
Total pot 640 | Rake 0 
Board [Tc 4s 3c 4h 8h]
Seat 1: Mahu2021 (button) folded before Flop (didn't bet)
Seat 2: Mia88Cat (small blind) showed [5h Jh] and lost with a pair of Fours
Seat 3: firefriend (big blind) showed [3s 7s] and won (640) with two pair, Fours and Threes



PokerStars Hand #246946634328: Tournament #3668829587, $1.84+$0.16 USD Hold'em No Limit - Level I (10/20) - 2023/11/05 20:50:52 CET [2023/11/05 14:50:52 ET]
Table '3668829587 1' 3-max Seat #2 is the button
Seat 1: Mahu2021 (500 in chips) 
Seat 2: Mia88Cat (180 in chips) 
Seat 3: firefriend (820 in chips) 
firefriend: posts small blind 10
Mahu2021: posts big blind 20
*** HOLE CARDS ***
Dealt to Mahu2021 [Td 5s]
Mia88Cat: raises 160 to 180 and is all-in
firefriend: raises 160 to 340
Mahu2021: folds 
Uncalled bet (160) returned to firefriend
*** FLOP *** [Qd 8d Ks]
*** TURN *** [Qd 8d Ks] [8h]
*** RIVER *** [Qd 8d Ks 8h] [3d]
*** SHOW DOWN ***
firefriend: shows [9s Ah] (a pair of Eights)
Mia88Cat: shows [4c 4h] (two pair, Eights and Fours)
Mia88Cat collected 380 from pot
*** SUMMARY ***
Total pot 380 | Rake 0 
Board [Qd 8d Ks 8h 3d]
Seat 1: Mahu2021 (big blind) folded before Flop
Seat 2: Mia88Cat (button) showed [4c 4h] and won (380) with two pair, Eights and Fours
Seat 3: firefriend (small blind) showed [9s Ah] and lost with a pair of Eights



PokerStars Hand #246946640302: Tournament #3668829587, $1.84+$0.16 USD Hold'em No Limit - Level I (10/20) - 2023/11/05 20:51:07 CET [2023/11/05 14:51:07 ET]
Table '3668829587 1' 3-max Seat #3 is the button
Seat 1: Mahu2021 (480 in chips) 
Seat 2: Mia88Cat (380 in chips) 
Seat 3: firefriend (640 in chips) 
Mahu2021: posts small blind 10
Mia88Cat: posts big blind 20
*** HOLE CARDS ***
Dealt to Mahu2021 [Kh As]
firefriend: calls 20
Mahu2021: calls 10
Mia88Cat: raises 60 to 80
firefriend: calls 60
Mahu2021: raises 400 to 480 and is all-in
Mia88Cat: calls 300 and is all-in
firefriend: folds 
Uncalled bet (100) returned to Mahu2021
*** FLOP *** [9s Kc 8s]
*** TURN *** [9s Kc 8s] [2h]
*** RIVER *** [9s Kc 8s 2h] [3c]
*** SHOW DOWN ***
Mahu2021: shows [Kh As] (a pair of Kings)
Mia88Cat: shows [Ad 8d] (a pair of Eights)
Mahu2021 collected 840 from pot
Mia88Cat finished the tournament in 3rd place
*** SUMMARY ***
Total pot 840 | Rake 0 
Board [9s Kc 8s 2h 3c]
Seat 1: Mahu2021 (small blind) showed [Kh As] and won (840) with a pair of Kings
Seat 2: Mia88Cat (big blind) showed [Ad 8d] and lost with a pair of Eights
Seat 3: firefriend (button) folded before Flop



PokerStars Hand #246946649961: Tournament #3668829587, $1.84+$0.16 USD Hold'em No Limit - Level I (10/20) - 2023/11/05 20:51:30 CET [2023/11/05 14:51:30 ET]
Table '3668829587 1' 3-max Seat #1 is the button
Seat 1: Mahu2021 (940 in chips) 
Seat 3: firefriend (560 in chips) 
Mahu2021: posts small blind 10
firefriend: posts big blind 20
*** HOLE CARDS ***
Dealt to Mahu2021 [Jc 7d]
Mahu2021: calls 10
firefriend: checks 
*** FLOP *** [Ah 3d 7s]
firefriend: checks 
Mahu2021: bets 20
firefriend: calls 20
*** TURN *** [Ah 3d 7s] [Qc]
firefriend: checks 
Mahu2021: checks 
*** RIVER *** [Ah 3d 7s Qc] [9d]
firefriend: bets 40
Mahu2021: calls 40
*** SHOW DOWN ***
firefriend: shows [Kc 4c] (high card Ace)
Mahu2021: shows [Jc 7d] (a pair of Sevens)
Mahu2021 collected 160 from pot
*** SUMMARY ***
Total pot 160 | Rake 0 
Board [Ah 3d 7s Qc 9d]
Seat 1: Mahu2021 (button) (small blind) showed [Jc 7d] and won (160) with a pair of Sevens
Seat 3: firefriend (big blind) showed [Kc 4c] and lost with high card Ace



PokerStars Hand #246946656924: Tournament #3668829587, $1.84+$0.16 USD Hold'em No Limit - Level I (10/20) - 2023/11/05 20:51:48 CET [2023/11/05 14:51:48 ET]
Table '3668829587 1' 3-max Seat #3 is the button
Seat 1: Mahu2021 (1020 in chips) 
Seat 3: firefriend (480 in chips) 
firefriend: posts small blind 10
Mahu2021: posts big blind 20
*** HOLE CARDS ***
Dealt to Mahu2021 [Qs 3s]
firefriend: raises 40 to 60
Mahu2021: calls 40
*** FLOP *** [Jd 9c Jc]
Mahu2021: checks 
firefriend: bets 120
Mahu2021: folds 
Uncalled bet (120) returned to firefriend
firefriend collected 120 from pot
*** SUMMARY ***
Total pot 120 | Rake 0 
Board [Jd 9c Jc]
Seat 1: Mahu2021 (big blind) folded on the Flop
Seat 3: firefriend (button) (small blind) collected (120)



PokerStars Hand #246946661860: Tournament #3668829587, $1.84+$0.16 USD Hold'em No Limit - Level I (10/20) - 2023/11/05 20:51:59 CET [2023/11/05 14:51:59 ET]
Table '3668829587 1' 3-max Seat #1 is the button
Seat 1: Mahu2021 (960 in chips) 
Seat 3: firefriend (540 in chips) 
Mahu2021: posts small blind 10
firefriend: posts big blind 20
*** HOLE CARDS ***
Dealt to Mahu2021 [4h Kd]
Mahu2021: calls 10
firefriend: raises 40 to 60
Mahu2021: calls 40
*** FLOP *** [Qd Jh Ks]
firefriend: bets 60
Mahu2021: raises 80 to 140
firefriend: raises 340 to 480 and is all-in
Mahu2021: calls 340
*** TURN *** [Qd Jh Ks] [Kc]
*** RIVER *** [Qd Jh Ks Kc] [5c]
*** SHOW DOWN ***
firefriend: shows [Ac Js] (two pair, Kings and Jacks)
Mahu2021: shows [4h Kd] (three of a kind, Kings)
Mahu2021 collected 1080 from pot
firefriend finished the tournament in 2nd place
Mahu2021 wins the tournament and receives $4.00 - congratulations!
*** SUMMARY ***
Total pot 1080 | Rake 0 
Board [Qd Jh Ks Kc 5c]
Seat 1: Mahu2021 (button) (small blind) showed [4h Kd] and won (1080) with three of a kind, Kings
Seat 3: firefriend (big blind) showed [Ac Js] and lost with two pair, Kings and Jacks



