PokerStars Hand #252892857400: Tournament #3811178456, $1.84+$0.16 USD Hold'em No Limit - Level I (10/20) - 2024/10/12 19:36:04 CET [2024/10/12 13:36:04 ET]
Table '3811178456 1' 3-max Seat #1 is the button
Seat 1: Mahu2021 (500 in chips) 
Seat 2: QuietFrankly (500 in chips) 
Seat 3: Pokerku310 (500 in chips) 
QuietFrankly: posts small blind 10
Pokerku310: posts big blind 20
*** HOLE CARDS ***
Dealt to Mahu2021 [Qd 9c]
Mahu2021: calls 20
QuietFrankly: raises 20 to 40
Pokerku310: raises 40 to 80
Mahu2021: calls 60
QuietFrankly: raises 40 to 120
Pokerku310: calls 40
Mahu2021: calls 40
*** FLOP *** [2d 6s 5d]
QuietFrankly: bets 20
Pokerku310: raises 100 to 120
Mahu2021: folds 
QuietFrankly: raises 100 to 220
Pokerku310: calls 100
*** TURN *** [2d 6s 5d] [4h]
QuietFrankly: bets 20
Pokerku310: raises 140 to 160 and is all-in
QuietFrankly: calls 140 and is all-in
*** RIVER *** [2d 6s 5d 4h] [3h]
*** SHOW DOWN ***
QuietFrankly: shows [Kd Ah] (a straight, Deuce to Six)
Pokerku310: shows [Jd Qs] (a straight, Deuce to Six)
QuietFrankly collected 560 from pot
Pokerku310 collected 560 from pot
*** SUMMARY ***
Total pot 1120 | Rake 0 
Board [2d 6s 5d 4h 3h]
Seat 1: Mahu2021 (button) folded on the Flop
Seat 2: QuietFrankly (small blind) showed [Kd Ah] and won (560) with a straight, Deuce to Six
Seat 3: Pokerku310 (big blind) showed [Jd Qs] and won (560) with a straight, Deuce to Six



PokerStars Hand #252892869547: Tournament #3811178456, $1.84+$0.16 USD Hold'em No Limit - Level I (10/20) - 2024/10/12 19:36:47 CET [2024/10/12 13:36:47 ET]
Table '3811178456 1' 3-max Seat #2 is the button
Seat 1: Mahu2021 (380 in chips) 
Seat 2: QuietFrankly (560 in chips) 
Seat 3: Pokerku310 (560 in chips) 
Pokerku310: posts small blind 10
Mahu2021: posts big blind 20
*** HOLE CARDS ***
Dealt to Mahu2021 [7d Qs]
QuietFrankly has timed out
QuietFrankly: folds 
QuietFrankly is sitting out
Pokerku310: folds 
Uncalled bet (10) returned to Mahu2021
Mahu2021 collected 20 from pot
Mahu2021: doesn't show hand 
*** SUMMARY ***
Total pot 20 | Rake 0 
Seat 1: Mahu2021 (big blind) collected (20)
Seat 2: QuietFrankly (button) folded before Flop (didn't bet)
Seat 3: Pokerku310 (small blind) folded before Flop



PokerStars Hand #252892874606: Tournament #3811178456, $1.84+$0.16 USD Hold'em No Limit - Level I (10/20) - 2024/10/12 19:37:05 CET [2024/10/12 13:37:05 ET]
Table '3811178456 1' 3-max Seat #3 is the button
Seat 1: Mahu2021 (390 in chips) 
Seat 2: QuietFrankly (560 in chips) is sitting out
Seat 3: Pokerku310 (550 in chips) 
Mahu2021: posts small blind 10
QuietFrankly: posts big blind 20
*** HOLE CARDS ***
Dealt to Mahu2021 [3h 6h]
Pokerku310: raises 40 to 60
QuietFrankly has returned
Mahu2021: calls 50
QuietFrankly: calls 40
*** FLOP *** [Kd 2h 8c]
Mahu2021: checks 
QuietFrankly: bets 20
Pokerku310: raises 40 to 60
Mahu2021: folds 
QuietFrankly: calls 40
*** TURN *** [Kd 2h 8c] [9c]
QuietFrankly: checks 
Pokerku310: bets 100
QuietFrankly: calls 100
*** RIVER *** [Kd 2h 8c 9c] [Kh]
QuietFrankly: bets 20
Pokerku310: raises 310 to 330 and is all-in
QuietFrankly: calls 310
*** SHOW DOWN ***
Pokerku310: shows [Qh As] (a pair of Kings)
QuietFrankly: shows [9s Js] (two pair, Kings and Nines)
QuietFrankly collected 1160 from pot
Pokerku310 finished the tournament in 3rd place
*** SUMMARY ***
Total pot 1160 | Rake 0 
Board [Kd 2h 8c 9c Kh]
Seat 1: Mahu2021 (small blind) folded on the Flop
Seat 2: QuietFrankly (big blind) showed [9s Js] and won (1160) with two pair, Kings and Nines
Seat 3: Pokerku310 (button) showed [Qh As] and lost with a pair of Kings



PokerStars Hand #252892883976: Tournament #3811178456, $1.84+$0.16 USD Hold'em No Limit - Level I (10/20) - 2024/10/12 19:37:37 CET [2024/10/12 13:37:37 ET]
Table '3811178456 1' 3-max Seat #2 is the button
Seat 1: Mahu2021 (330 in chips) 
Seat 2: QuietFrankly (1170 in chips) 
QuietFrankly: posts small blind 10
Mahu2021: posts big blind 20
*** HOLE CARDS ***
Dealt to Mahu2021 [9h 5d]
QuietFrankly: calls 10
Mahu2021: checks 
*** FLOP *** [Kh 5h Qc]
Mahu2021: checks 
QuietFrankly: bets 20
Mahu2021: calls 20
*** TURN *** [Kh 5h Qc] [Qh]
Mahu2021: checks 
QuietFrankly: bets 20
Mahu2021: calls 20
*** RIVER *** [Kh 5h Qc Qh] [3s]
Mahu2021: checks 
QuietFrankly: bets 120
Mahu2021: calls 120
*** SHOW DOWN ***
QuietFrankly: shows [Ks 6d] (two pair, Kings and Queens)
Mahu2021: mucks hand 
QuietFrankly collected 360 from pot
*** SUMMARY ***
Total pot 360 | Rake 0 
Board [Kh 5h Qc Qh 3s]
Seat 1: Mahu2021 (big blind) mucked [9h 5d]
Seat 2: QuietFrankly (button) (small blind) showed [Ks 6d] and won (360) with two pair, Kings and Queens



PokerStars Hand #252892888329: Tournament #3811178456, $1.84+$0.16 USD Hold'em No Limit - Level I (10/20) - 2024/10/12 19:37:53 CET [2024/10/12 13:37:53 ET]
Table '3811178456 1' 3-max Seat #1 is the button
Seat 1: Mahu2021 (150 in chips) 
Seat 2: QuietFrankly (1350 in chips) 
Mahu2021: posts small blind 10
QuietFrankly: posts big blind 20
*** HOLE CARDS ***
Dealt to Mahu2021 [Qh 6s]
Mahu2021: raises 130 to 150 and is all-in
QuietFrankly: calls 130
*** FLOP *** [Tc 5d Ts]
*** TURN *** [Tc 5d Ts] [9c]
*** RIVER *** [Tc 5d Ts 9c] [Kc]
*** SHOW DOWN ***
QuietFrankly: shows [8s 8c] (two pair, Tens and Eights)
Mahu2021: shows [Qh 6s] (a pair of Tens)
QuietFrankly collected 300 from pot
Mahu2021 finished the tournament in 2nd place
QuietFrankly wins the tournament and receives $6.00 - congratulations!
*** SUMMARY ***
Total pot 300 | Rake 0 
Board [Tc 5d Ts 9c Kc]
Seat 1: Mahu2021 (button) (small blind) showed [Qh 6s] and lost with a pair of Tens
Seat 2: QuietFrankly (big blind) showed [8s 8c] and won (300) with two pair, Tens and Eights



