PokerStars Hand #249707024214: Tournament #3735585383, $1.84+$0.16 USD Hold'em No Limit - Level I (10/20) - 2024/03/30 18:24:16 CET [2024/03/30 13:24:16 ET]
Table '3735585383 1' 3-max Seat #1 is the button
Seat 1: Mahu2021 (500 in chips) 
Seat 2: BAV48 (500 in chips) 
Seat 3: roland284 (500 in chips) 
BAV48: posts small blind 10
roland284: posts big blind 20
*** HOLE CARDS ***
Dealt to Mahu2021 [9c 8s]
Mahu2021: calls 20
BAV48: calls 10
roland284: checks 
*** FLOP *** [4s 2c 5h]
BAV48: bets 60
roland284: raises 180 to 240
Mahu2021: folds 
BAV48: raises 240 to 480 and is all-in
roland284: calls 240 and is all-in
*** TURN *** [4s 2c 5h] [3c]
*** RIVER *** [4s 2c 5h 3c] [Th]
*** SHOW DOWN ***
BAV48: shows [4c 5c] (two pair, Fives and Fours)
roland284: shows [3s 5d] (two pair, Fives and Threes)
BAV48 collected 1020 from pot
roland284 finished the tournament in 3rd place
*** SUMMARY ***
Total pot 1020 | Rake 0 
Board [4s 2c 5h 3c Th]
Seat 1: Mahu2021 (button) folded on the Flop
Seat 2: BAV48 (small blind) showed [4c 5c] and won (1020) with two pair, Fives and Fours
Seat 3: roland284 (big blind) showed [3s 5d] and lost with two pair, Fives and Threes



PokerStars Hand #249707035491: Tournament #3735585383, $1.84+$0.16 USD Hold'em No Limit - Level I (10/20) - 2024/03/30 18:24:52 CET [2024/03/30 13:24:52 ET]
Table '3735585383 1' 3-max Seat #2 is the button
Seat 1: Mahu2021 (480 in chips) 
Seat 2: BAV48 (1020 in chips) 
BAV48: posts small blind 10
Mahu2021: posts big blind 20
*** HOLE CARDS ***
Dealt to Mahu2021 [6s 8h]
BAV48: raises 40 to 60
Mahu2021: folds 
Uncalled bet (40) returned to BAV48
BAV48 collected 40 from pot
BAV48: doesn't show hand 
*** SUMMARY ***
Total pot 40 | Rake 0 
Seat 1: Mahu2021 (big blind) folded before Flop
Seat 2: BAV48 (button) (small blind) collected (40)



PokerStars Hand #249707037935: Tournament #3735585383, $1.84+$0.16 USD Hold'em No Limit - Level I (10/20) - 2024/03/30 18:25:00 CET [2024/03/30 13:25:00 ET]
Table '3735585383 1' 3-max Seat #1 is the button
Seat 1: Mahu2021 (460 in chips) 
Seat 2: BAV48 (1040 in chips) 
Mahu2021: posts small blind 10
BAV48: posts big blind 20
*** HOLE CARDS ***
Dealt to Mahu2021 [Jd 4d]
Mahu2021: calls 10
BAV48: checks 
*** FLOP *** [9d 5s Kd]
BAV48: checks 
Mahu2021: bets 40
BAV48: folds 
Uncalled bet (40) returned to Mahu2021
Mahu2021 collected 40 from pot
Mahu2021: doesn't show hand 
*** SUMMARY ***
Total pot 40 | Rake 0 
Board [9d 5s Kd]
Seat 1: Mahu2021 (button) (small blind) collected (40)
Seat 2: BAV48 (big blind) folded on the Flop



PokerStars Hand #249707041806: Tournament #3735585383, $1.84+$0.16 USD Hold'em No Limit - Level I (10/20) - 2024/03/30 18:25:13 CET [2024/03/30 13:25:13 ET]
Table '3735585383 1' 3-max Seat #2 is the button
Seat 1: Mahu2021 (480 in chips) 
Seat 2: BAV48 (1020 in chips) 
BAV48: posts small blind 10
Mahu2021: posts big blind 20
*** HOLE CARDS ***
Dealt to Mahu2021 [Ac Jc]
BAV48: raises 40 to 60
Mahu2021: calls 40
*** FLOP *** [8d 7d Kh]
Mahu2021: checks 
BAV48: checks 
*** TURN *** [8d 7d Kh] [Td]
Mahu2021: checks 
BAV48: bets 120
Mahu2021: folds 
Uncalled bet (120) returned to BAV48
BAV48 collected 120 from pot
BAV48: doesn't show hand 
*** SUMMARY ***
Total pot 120 | Rake 0 
Board [8d 7d Kh Td]
Seat 1: Mahu2021 (big blind) folded on the Turn
Seat 2: BAV48 (button) (small blind) collected (120)



PokerStars Hand #249707046003: Tournament #3735585383, $1.84+$0.16 USD Hold'em No Limit - Level I (10/20) - 2024/03/30 18:25:26 CET [2024/03/30 13:25:26 ET]
Table '3735585383 1' 3-max Seat #1 is the button
Seat 1: Mahu2021 (420 in chips) 
Seat 2: BAV48 (1080 in chips) 
Mahu2021: posts small blind 10
BAV48: posts big blind 20
*** HOLE CARDS ***
Dealt to Mahu2021 [3c 5c]
Mahu2021: raises 20 to 40
BAV48: calls 20
*** FLOP *** [Ac As Qs]
BAV48: checks 
Mahu2021: bets 40
BAV48: folds 
Uncalled bet (40) returned to Mahu2021
Mahu2021 collected 80 from pot
Mahu2021: doesn't show hand 
*** SUMMARY ***
Total pot 80 | Rake 0 
Board [Ac As Qs]
Seat 1: Mahu2021 (button) (small blind) collected (80)
Seat 2: BAV48 (big blind) folded on the Flop



PokerStars Hand #249707049245: Tournament #3735585383, $1.84+$0.16 USD Hold'em No Limit - Level I (10/20) - 2024/03/30 18:25:37 CET [2024/03/30 13:25:37 ET]
Table '3735585383 1' 3-max Seat #2 is the button
Seat 1: Mahu2021 (460 in chips) 
Seat 2: BAV48 (1040 in chips) 
BAV48: posts small blind 10
Mahu2021: posts big blind 20
*** HOLE CARDS ***
Dealt to Mahu2021 [Qh Th]
BAV48: raises 20 to 40
Mahu2021: calls 20
*** FLOP *** [4d As 4h]
Mahu2021: checks 
BAV48: checks 
*** TURN *** [4d As 4h] [6s]
Mahu2021: checks 
BAV48: bets 80
Mahu2021: folds 
Uncalled bet (80) returned to BAV48
BAV48 collected 80 from pot
BAV48: doesn't show hand 
*** SUMMARY ***
Total pot 80 | Rake 0 
Board [4d As 4h 6s]
Seat 1: Mahu2021 (big blind) folded on the Turn
Seat 2: BAV48 (button) (small blind) collected (80)



PokerStars Hand #249707053474: Tournament #3735585383, $1.84+$0.16 USD Hold'em No Limit - Level I (10/20) - 2024/03/30 18:25:50 CET [2024/03/30 13:25:50 ET]
Table '3735585383 1' 3-max Seat #1 is the button
Seat 1: Mahu2021 (420 in chips) 
Seat 2: BAV48 (1080 in chips) 
Mahu2021: posts small blind 10
BAV48: posts big blind 20
*** HOLE CARDS ***
Dealt to Mahu2021 [6c 4c]
Mahu2021: calls 10
BAV48: checks 
*** FLOP *** [7s 6h Kd]
BAV48: checks 
Mahu2021: bets 20
BAV48: calls 20
*** TURN *** [7s 6h Kd] [8s]
BAV48: checks 
Mahu2021: checks 
*** RIVER *** [7s 6h Kd 8s] [Tc]
BAV48: checks 
Mahu2021: checks 
*** SHOW DOWN ***
BAV48: shows [4s 8d] (a pair of Eights)
Mahu2021: mucks hand 
BAV48 collected 80 from pot
*** SUMMARY ***
Total pot 80 | Rake 0 
Board [7s 6h Kd 8s Tc]
Seat 1: Mahu2021 (button) (small blind) mucked [6c 4c]
Seat 2: BAV48 (big blind) showed [4s 8d] and won (80) with a pair of Eights



PokerStars Hand #249707058003: Tournament #3735585383, $1.84+$0.16 USD Hold'em No Limit - Level I (10/20) - 2024/03/30 18:26:05 CET [2024/03/30 13:26:05 ET]
Table '3735585383 1' 3-max Seat #2 is the button
Seat 1: Mahu2021 (380 in chips) 
Seat 2: BAV48 (1120 in chips) 
BAV48: posts small blind 10
Mahu2021: posts big blind 20
*** HOLE CARDS ***
Dealt to Mahu2021 [Ac Qd]
BAV48: raises 20 to 40
Mahu2021: raises 60 to 100
BAV48: calls 60
*** FLOP *** [3d Jh 8s]
Mahu2021: bets 280 and is all-in
BAV48: calls 280
*** TURN *** [3d Jh 8s] [6d]
*** RIVER *** [3d Jh 8s 6d] [Kd]
*** SHOW DOWN ***
Mahu2021: shows [Ac Qd] (high card Ace)
BAV48: shows [Js 9s] (a pair of Jacks)
BAV48 collected 760 from pot
Mahu2021 finished the tournament in 2nd place
BAV48 wins the tournament and receives $4.00 - congratulations!
*** SUMMARY ***
Total pot 760 | Rake 0 
Board [3d Jh 8s 6d Kd]
Seat 1: Mahu2021 (big blind) showed [Ac Qd] and lost with high card Ace
Seat 2: BAV48 (button) (small blind) showed [Js 9s] and won (760) with a pair of Jacks



