PokerStars Hand #250598121442: Tournament #3756654783, $0.46+$0.04 USD Hold'em No Limit - Level I (10/20) - 2024/05/20 10:58:12 CET [2024/05/20 4:58:12 ET]
Table '3756654783 1' 3-max Seat #1 is the button
Seat 1: FatherSendMeMor (500 in chips) 
Seat 2: Mahu2021 (500 in chips) 
Seat 3: kge999kge (500 in chips) 
Mahu2021: posts small blind 10
kge999kge: posts big blind 20
*** HOLE CARDS ***
Dealt to Mahu2021 [5c 7d]
FatherSendMeMor: raises 20 to 40
Mahu2021: folds 
kge999kge: calls 20
*** FLOP *** [9s 8d Ts]
kge999kge: checks 
FatherSendMeMor: checks 
*** TURN *** [9s 8d Ts] [Qh]
kge999kge: bets 20
FatherSendMeMor: calls 20
*** RIVER *** [9s 8d Ts Qh] [Qc]
kge999kge: bets 20
FatherSendMeMor: calls 20
*** SHOW DOWN ***
kge999kge: shows [3c Jc] (a straight, Eight to Queen)
FatherSendMeMor: mucks hand 
kge999kge collected 170 from pot
*** SUMMARY ***
Total pot 170 | Rake 0 
Board [9s 8d Ts Qh Qc]
Seat 1: FatherSendMeMor (button) mucked [Ks 3d]
Seat 2: Mahu2021 (small blind) folded before Flop
Seat 3: kge999kge (big blind) showed [3c Jc] and won (170) with a straight, Eight to Queen



PokerStars Hand #250598125007: Tournament #3756654783, $0.46+$0.04 USD Hold'em No Limit - Level I (10/20) - 2024/05/20 10:58:50 CET [2024/05/20 4:58:50 ET]
Table '3756654783 1' 3-max Seat #2 is the button
Seat 1: FatherSendMeMor (420 in chips) 
Seat 2: Mahu2021 (490 in chips) 
Seat 3: kge999kge (590 in chips) 
kge999kge: posts small blind 10
FatherSendMeMor: posts big blind 20
*** HOLE CARDS ***
Dealt to Mahu2021 [Qs Qd]
Mahu2021: raises 20 to 40
kge999kge: calls 30
FatherSendMeMor: calls 20
*** FLOP *** [4h 9d Qc]
kge999kge: checks 
FatherSendMeMor: checks 
Mahu2021: bets 40
kge999kge: folds 
FatherSendMeMor: folds 
Uncalled bet (40) returned to Mahu2021
Mahu2021 collected 120 from pot
Mahu2021: doesn't show hand 
*** SUMMARY ***
Total pot 120 | Rake 0 
Board [4h 9d Qc]
Seat 1: FatherSendMeMor (big blind) folded on the Flop
Seat 2: Mahu2021 (button) collected (120)
Seat 3: kge999kge (small blind) folded on the Flop



PokerStars Hand #250598128141: Tournament #3756654783, $0.46+$0.04 USD Hold'em No Limit - Level I (10/20) - 2024/05/20 10:59:23 CET [2024/05/20 4:59:23 ET]
Table '3756654783 1' 3-max Seat #3 is the button
Seat 1: FatherSendMeMor (380 in chips) 
Seat 2: Mahu2021 (570 in chips) 
Seat 3: kge999kge (550 in chips) 
FatherSendMeMor: posts small blind 10
Mahu2021: posts big blind 20
*** HOLE CARDS ***
Dealt to Mahu2021 [2h Jc]
kge999kge: folds 
FatherSendMeMor: calls 10
Mahu2021: checks 
*** FLOP *** [8h 8c 4d]
FatherSendMeMor: checks 
Mahu2021: checks 
*** TURN *** [8h 8c 4d] [Kd]
FatherSendMeMor: checks 
Mahu2021: checks 
*** RIVER *** [8h 8c 4d Kd] [3d]
FatherSendMeMor: checks 
Mahu2021: bets 80
FatherSendMeMor: folds 
Uncalled bet (80) returned to Mahu2021
Mahu2021 collected 40 from pot
Mahu2021: doesn't show hand 
*** SUMMARY ***
Total pot 40 | Rake 0 
Board [8h 8c 4d Kd 3d]
Seat 1: FatherSendMeMor (small blind) folded on the River
Seat 2: Mahu2021 (big blind) collected (40)
Seat 3: kge999kge (button) folded before Flop (didn't bet)



PokerStars Hand #250598132181: Tournament #3756654783, $0.46+$0.04 USD Hold'em No Limit - Level I (10/20) - 2024/05/20 11:00:05 CET [2024/05/20 5:00:05 ET]
Table '3756654783 1' 3-max Seat #1 is the button
Seat 1: FatherSendMeMor (360 in chips) 
Seat 2: Mahu2021 (590 in chips) 
Seat 3: kge999kge (550 in chips) 
Mahu2021: posts small blind 10
kge999kge: posts big blind 20
*** HOLE CARDS ***
Dealt to Mahu2021 [8h 4h]
FatherSendMeMor: raises 340 to 360 and is all-in
Mahu2021: folds 
kge999kge: folds 
Uncalled bet (340) returned to FatherSendMeMor
FatherSendMeMor collected 50 from pot
*** SUMMARY ***
Total pot 50 | Rake 0 
Seat 1: FatherSendMeMor (button) collected (50)
Seat 2: Mahu2021 (small blind) folded before Flop
Seat 3: kge999kge (big blind) folded before Flop



PokerStars Hand #250598133460: Tournament #3756654783, $0.46+$0.04 USD Hold'em No Limit - Level II (15/30) - 2024/05/20 11:00:18 CET [2024/05/20 5:00:18 ET]
Table '3756654783 1' 3-max Seat #2 is the button
Seat 1: FatherSendMeMor (390 in chips) 
Seat 2: Mahu2021 (580 in chips) 
Seat 3: kge999kge (530 in chips) 
kge999kge: posts small blind 15
FatherSendMeMor: posts big blind 30
*** HOLE CARDS ***
Dealt to Mahu2021 [Kh Qd]
Mahu2021: raises 30 to 60
kge999kge: calls 45
FatherSendMeMor: raises 180 to 240
Mahu2021: folds 
kge999kge: folds 
Uncalled bet (180) returned to FatherSendMeMor
FatherSendMeMor collected 180 from pot
*** SUMMARY ***
Total pot 180 | Rake 0 
Seat 1: FatherSendMeMor (big blind) collected (180)
Seat 2: Mahu2021 (button) folded before Flop
Seat 3: kge999kge (small blind) folded before Flop



PokerStars Hand #250598134438: Tournament #3756654783, $0.46+$0.04 USD Hold'em No Limit - Level II (15/30) - 2024/05/20 11:00:28 CET [2024/05/20 5:00:28 ET]
Table '3756654783 1' 3-max Seat #3 is the button
Seat 1: FatherSendMeMor (510 in chips) 
Seat 2: Mahu2021 (520 in chips) 
Seat 3: kge999kge (470 in chips) 
FatherSendMeMor: posts small blind 15
Mahu2021: posts big blind 30
*** HOLE CARDS ***
Dealt to Mahu2021 [Qs 4d]
kge999kge: calls 30
FatherSendMeMor: folds 
Mahu2021: checks 
*** FLOP *** [Kd 7d Tc]
Mahu2021: checks 
kge999kge: checks 
*** TURN *** [Kd 7d Tc] [5c]
Mahu2021: checks 
kge999kge: checks 
*** RIVER *** [Kd 7d Tc 5c] [Th]
Mahu2021: bets 60
kge999kge: raises 60 to 120
Mahu2021: raises 90 to 210
kge999kge: calls 90
*** SHOW DOWN ***
Mahu2021: shows [Qs 4d] (a pair of Tens)
kge999kge: shows [Ac Td] (three of a kind, Tens)
kge999kge collected 495 from pot
*** SUMMARY ***
Total pot 495 | Rake 0 
Board [Kd 7d Tc 5c Th]
Seat 1: FatherSendMeMor (small blind) folded before Flop
Seat 2: Mahu2021 (big blind) showed [Qs 4d] and lost with a pair of Tens
Seat 3: kge999kge (button) showed [Ac Td] and won (495) with three of a kind, Tens



PokerStars Hand #250598136261: Tournament #3756654783, $0.46+$0.04 USD Hold'em No Limit - Level II (15/30) - 2024/05/20 11:00:46 CET [2024/05/20 5:00:46 ET]
Table '3756654783 1' 3-max Seat #1 is the button
Seat 1: FatherSendMeMor (495 in chips) 
Seat 2: Mahu2021 (280 in chips) 
Seat 3: kge999kge (725 in chips) 
Mahu2021: posts small blind 15
kge999kge: posts big blind 30
*** HOLE CARDS ***
Dealt to Mahu2021 [Kd 3c]
FatherSendMeMor: calls 30
Mahu2021: calls 15
kge999kge: checks 
*** FLOP *** [Jc 8s 4h]
Mahu2021: checks 
kge999kge: checks 
FatherSendMeMor: checks 
*** TURN *** [Jc 8s 4h] [4d]
Mahu2021: checks 
kge999kge: checks 
FatherSendMeMor: checks 
*** RIVER *** [Jc 8s 4h 4d] [Ah]
Mahu2021: checks 
kge999kge: bets 30
FatherSendMeMor: folds 
Mahu2021: folds 
Uncalled bet (30) returned to kge999kge
kge999kge collected 90 from pot
*** SUMMARY ***
Total pot 90 | Rake 0 
Board [Jc 8s 4h 4d Ah]
Seat 1: FatherSendMeMor (button) folded on the River
Seat 2: Mahu2021 (small blind) folded on the River
Seat 3: kge999kge (big blind) collected (90)



PokerStars Hand #250598140762: Tournament #3756654783, $0.46+$0.04 USD Hold'em No Limit - Level II (15/30) - 2024/05/20 11:01:26 CET [2024/05/20 5:01:26 ET]
Table '3756654783 1' 3-max Seat #2 is the button
Seat 1: FatherSendMeMor (465 in chips) 
Seat 2: Mahu2021 (250 in chips) 
Seat 3: kge999kge (785 in chips) 
kge999kge: posts small blind 15
FatherSendMeMor: posts big blind 30
*** HOLE CARDS ***
Dealt to Mahu2021 [4c 3c]
Mahu2021: folds 
kge999kge: calls 15
FatherSendMeMor: checks 
*** FLOP *** [9h Kd Ah]
kge999kge: checks 
FatherSendMeMor: checks 
*** TURN *** [9h Kd Ah] [7s]
kge999kge: checks 
FatherSendMeMor: checks 
*** RIVER *** [9h Kd Ah 7s] [9s]
kge999kge: checks 
FatherSendMeMor: checks 
*** SHOW DOWN ***
kge999kge: shows [4s 5s] (a pair of Nines)
FatherSendMeMor: shows [5d Tc] (a pair of Nines - Ace+King+Ten kicker)
FatherSendMeMor collected 60 from pot
*** SUMMARY ***
Total pot 60 | Rake 0 
Board [9h Kd Ah 7s 9s]
Seat 1: FatherSendMeMor (big blind) showed [5d Tc] and won (60) with a pair of Nines
Seat 2: Mahu2021 (button) folded before Flop (didn't bet)
Seat 3: kge999kge (small blind) showed [4s 5s] and lost with a pair of Nines



PokerStars Hand #250598147757: Tournament #3756654783, $0.46+$0.04 USD Hold'em No Limit - Level III (20/40) - 2024/05/20 11:02:29 CET [2024/05/20 5:02:29 ET]
Table '3756654783 1' 3-max Seat #3 is the button
Seat 1: FatherSendMeMor (495 in chips) 
Seat 2: Mahu2021 (250 in chips) 
Seat 3: kge999kge (755 in chips) 
FatherSendMeMor: posts small blind 20
Mahu2021: posts big blind 40
*** HOLE CARDS ***
Dealt to Mahu2021 [Ks Tc]
kge999kge: calls 40
FatherSendMeMor: calls 20
Mahu2021: raises 210 to 250 and is all-in
kge999kge: folds 
FatherSendMeMor: calls 210
*** FLOP *** [6s 6c 9h]
*** TURN *** [6s 6c 9h] [7h]
*** RIVER *** [6s 6c 9h 7h] [5h]
*** SHOW DOWN ***
FatherSendMeMor: shows [9s 5s] (two pair, Nines and Sixes)
Mahu2021: shows [Ks Tc] (a pair of Sixes)
FatherSendMeMor collected 540 from pot
Mahu2021 finished the tournament in 3rd place
*** SUMMARY ***
Total pot 540 | Rake 0 
Board [6s 6c 9h 7h 5h]
Seat 1: FatherSendMeMor (small blind) showed [9s 5s] and won (540) with two pair, Nines and Sixes
Seat 2: Mahu2021 (big blind) showed [Ks Tc] and lost with a pair of Sixes
Seat 3: kge999kge (button) folded before Flop



