PokerStars Hand #244562303165: Tournament #3611201614, $0.92+$0.08 USD Hold'em No Limit - Level I (10/20) - 2023/07/01 13:53:40 CET [2023/07/01 7:53:40 ET]
Table '3611201614 1' 3-max Seat #1 is the button
Seat 1: BritRelic (500 in chips) 
Seat 2: funchop (500 in chips) 
Seat 3: Mahu2021 (500 in chips) 
funchop: posts small blind 10
Mahu2021: posts big blind 20
*** HOLE CARDS ***
Dealt to Mahu2021 [4c 7d]
BritRelic: raises 20 to 40
funchop: calls 30
Mahu2021: folds 
*** FLOP *** [5c Js 3c]
funchop: checks 
BritRelic: bets 60
funchop: calls 60
*** TURN *** [5c Js 3c] [4s]
funchop: checks 
BritRelic: checks 
*** RIVER *** [5c Js 3c 4s] [9d]
funchop: bets 220
BritRelic: calls 220
*** SHOW DOWN ***
funchop: shows [Kc Kh] (a pair of Kings)
BritRelic: mucks hand 
funchop collected 660 from pot
*** SUMMARY ***
Total pot 660 | Rake 0 
Board [5c Js 3c 4s 9d]
Seat 1: BritRelic (button) mucked [9c Ks]
Seat 2: funchop (small blind) showed [Kc Kh] and won (660) with a pair of Kings
Seat 3: Mahu2021 (big blind) folded before Flop



PokerStars Hand #244562307195: Tournament #3611201614, $0.92+$0.08 USD Hold'em No Limit - Level I (10/20) - 2023/07/01 13:54:03 CET [2023/07/01 7:54:03 ET]
Table '3611201614 1' 3-max Seat #2 is the button
Seat 1: BritRelic (180 in chips) 
Seat 2: funchop (840 in chips) 
Seat 3: Mahu2021 (480 in chips) 
Mahu2021: posts small blind 10
BritRelic: posts big blind 20
*** HOLE CARDS ***
Dealt to Mahu2021 [4d 2s]
funchop: calls 20
Mahu2021: folds 
BritRelic: checks 
*** FLOP *** [Js Th 4h]
BritRelic: bets 160 and is all-in
funchop: calls 160
*** TURN *** [Js Th 4h] [Kc]
*** RIVER *** [Js Th 4h Kc] [9h]
*** SHOW DOWN ***
BritRelic: shows [3h Ts] (a pair of Tens)
funchop: shows [6d 6c] (a pair of Sixes)
BritRelic collected 370 from pot
*** SUMMARY ***
Total pot 370 | Rake 0 
Board [Js Th 4h Kc 9h]
Seat 1: BritRelic (big blind) showed [3h Ts] and won (370) with a pair of Tens
Seat 2: funchop (button) showed [6d 6c] and lost with a pair of Sixes
Seat 3: Mahu2021 (small blind) folded before Flop



PokerStars Hand #244562310000: Tournament #3611201614, $0.92+$0.08 USD Hold'em No Limit - Level I (10/20) - 2023/07/01 13:54:19 CET [2023/07/01 7:54:19 ET]
Table '3611201614 1' 3-max Seat #3 is the button
Seat 1: BritRelic (370 in chips) 
Seat 2: funchop (660 in chips) 
Seat 3: Mahu2021 (470 in chips) 
BritRelic: posts small blind 10
funchop: posts big blind 20
*** HOLE CARDS ***
Dealt to Mahu2021 [Kh 3d]
Mahu2021: folds 
BritRelic: folds 
Uncalled bet (10) returned to funchop
funchop collected 20 from pot
funchop: doesn't show hand 
*** SUMMARY ***
Total pot 20 | Rake 0 
Seat 1: BritRelic (small blind) folded before Flop
Seat 2: funchop (big blind) collected (20)
Seat 3: Mahu2021 (button) folded before Flop (didn't bet)



PokerStars Hand #244562311025: Tournament #3611201614, $0.92+$0.08 USD Hold'em No Limit - Level I (10/20) - 2023/07/01 13:54:25 CET [2023/07/01 7:54:25 ET]
Table '3611201614 1' 3-max Seat #1 is the button
Seat 1: BritRelic (360 in chips) 
Seat 2: funchop (670 in chips) 
Seat 3: Mahu2021 (470 in chips) 
funchop: posts small blind 10
Mahu2021: posts big blind 20
*** HOLE CARDS ***
Dealt to Mahu2021 [7h 5s]
BritRelic: folds 
funchop: folds 
Uncalled bet (10) returned to Mahu2021
Mahu2021 collected 20 from pot
Mahu2021: doesn't show hand 
*** SUMMARY ***
Total pot 20 | Rake 0 
Seat 1: BritRelic (button) folded before Flop (didn't bet)
Seat 2: funchop (small blind) folded before Flop
Seat 3: Mahu2021 (big blind) collected (20)



PokerStars Hand #244562311852: Tournament #3611201614, $0.92+$0.08 USD Hold'em No Limit - Level I (10/20) - 2023/07/01 13:54:30 CET [2023/07/01 7:54:30 ET]
Table '3611201614 1' 3-max Seat #2 is the button
Seat 1: BritRelic (360 in chips) 
Seat 2: funchop (660 in chips) 
Seat 3: Mahu2021 (480 in chips) 
Mahu2021: posts small blind 10
BritRelic: posts big blind 20
*** HOLE CARDS ***
Dealt to Mahu2021 [Ad Ts]
funchop: calls 20
Mahu2021: calls 10
BritRelic: raises 340 to 360 and is all-in
funchop: calls 340
Mahu2021: calls 340
*** FLOP *** [5d 6s 9d]
Mahu2021: checks 
funchop: bets 300 and is all-in
Mahu2021: folds 
Uncalled bet (300) returned to funchop
*** TURN *** [5d 6s 9d] [4h]
*** RIVER *** [5d 6s 9d 4h] [Td]
*** SHOW DOWN ***
BritRelic: shows [As 3h] (high card Ace)
funchop: shows [9c Qh] (a pair of Nines)
funchop collected 1080 from pot
BritRelic finished the tournament in 3rd place
*** SUMMARY ***
Total pot 1080 | Rake 0 
Board [5d 6s 9d 4h Td]
Seat 1: BritRelic (big blind) showed [As 3h] and lost with high card Ace
Seat 2: funchop (button) showed [9c Qh] and won (1080) with a pair of Nines
Seat 3: Mahu2021 (small blind) folded on the Flop



PokerStars Hand #244562317466: Tournament #3611201614, $0.92+$0.08 USD Hold'em No Limit - Level I (10/20) - 2023/07/01 13:55:02 CET [2023/07/01 7:55:02 ET]
Table '3611201614 1' 3-max Seat #3 is the button
Seat 2: funchop (1380 in chips) 
Seat 3: Mahu2021 (120 in chips) 
Mahu2021: posts small blind 10
funchop: posts big blind 20
*** HOLE CARDS ***
Dealt to Mahu2021 [8c 8s]
Mahu2021: raises 100 to 120 and is all-in
funchop: calls 100
*** FLOP *** [7s As 5c]
*** TURN *** [7s As 5c] [9c]
*** RIVER *** [7s As 5c 9c] [3c]
*** SHOW DOWN ***
funchop: shows [Qh 9s] (a pair of Nines)
Mahu2021: shows [8c 8s] (a pair of Eights)
funchop collected 240 from pot
Mahu2021 finished the tournament in 2nd place
funchop wins the tournament and receives $3.00 - congratulations!
*** SUMMARY ***
Total pot 240 | Rake 0 
Board [7s As 5c 9c 3c]
Seat 2: funchop (big blind) showed [Qh 9s] and won (240) with a pair of Nines
Seat 3: Mahu2021 (button) (small blind) showed [8c 8s] and lost with a pair of Eights



