PokerStars Hand #242942505912: Tournament #3573589142, $0.92+$0.08 USD Hold'em No Limit - Level I (10/20) - 2023/04/07 17:04:54 CET [2023/04/07 11:04:54 ET]
Table '3573589142 1' 3-max Seat #1 is the button
Seat 1: KongInTheNorth (500 in chips) 
Seat 2: Mahu2021 (500 in chips) 
Seat 3: Milena400 (500 in chips) 
Mahu2021: posts small blind 10
Milena400: posts big blind 20
*** HOLE CARDS ***
Dealt to Mahu2021 [Qd 9h]
KongInTheNorth: raises 40 to 60
Mahu2021: calls 50
Milena400: folds 
*** FLOP *** [6d 2s Jh]
Mahu2021: checks 
KongInTheNorth: bets 440 and is all-in
Mahu2021: folds 
Uncalled bet (440) returned to KongInTheNorth
KongInTheNorth collected 140 from pot
*** SUMMARY ***
Total pot 140 | Rake 0 
Board [6d 2s Jh]
Seat 1: KongInTheNorth (button) collected (140)
Seat 2: Mahu2021 (small blind) folded on the Flop
Seat 3: Milena400 (big blind) folded before Flop



PokerStars Hand #242942510861: Tournament #3573589142, $0.92+$0.08 USD Hold'em No Limit - Level I (10/20) - 2023/04/07 17:05:11 CET [2023/04/07 11:05:11 ET]
Table '3573589142 1' 3-max Seat #2 is the button
Seat 1: KongInTheNorth (580 in chips) 
Seat 2: Mahu2021 (440 in chips) 
Seat 3: Milena400 (480 in chips) 
Milena400: posts small blind 10
KongInTheNorth: posts big blind 20
*** HOLE CARDS ***
Dealt to Mahu2021 [2c 7s]
Mahu2021: folds 
Milena400: calls 10
KongInTheNorth: checks 
*** FLOP *** [3c 3s Ad]
Milena400: bets 20
KongInTheNorth: folds 
Uncalled bet (20) returned to Milena400
Milena400 collected 40 from pot
Milena400: doesn't show hand 
*** SUMMARY ***
Total pot 40 | Rake 0 
Board [3c 3s Ad]
Seat 1: KongInTheNorth (big blind) folded on the Flop
Seat 2: Mahu2021 (button) folded before Flop (didn't bet)
Seat 3: Milena400 (small blind) collected (40)



PokerStars Hand #242942513358: Tournament #3573589142, $0.92+$0.08 USD Hold'em No Limit - Level I (10/20) - 2023/04/07 17:05:20 CET [2023/04/07 11:05:20 ET]
Table '3573589142 1' 3-max Seat #3 is the button
Seat 1: KongInTheNorth (560 in chips) 
Seat 2: Mahu2021 (440 in chips) 
Seat 3: Milena400 (500 in chips) 
KongInTheNorth: posts small blind 10
Mahu2021: posts big blind 20
*** HOLE CARDS ***
Dealt to Mahu2021 [3s 6d]
Milena400: calls 20
KongInTheNorth: calls 10
Mahu2021: checks 
*** FLOP *** [2s Ks Ts]
KongInTheNorth: bets 60
Mahu2021: folds 
Milena400: folds 
Uncalled bet (60) returned to KongInTheNorth
KongInTheNorth collected 60 from pot
*** SUMMARY ***
Total pot 60 | Rake 0 
Board [2s Ks Ts]
Seat 1: KongInTheNorth (small blind) collected (60)
Seat 2: Mahu2021 (big blind) folded on the Flop
Seat 3: Milena400 (button) folded on the Flop



PokerStars Hand #242942516629: Tournament #3573589142, $0.92+$0.08 USD Hold'em No Limit - Level I (10/20) - 2023/04/07 17:05:31 CET [2023/04/07 11:05:31 ET]
Table '3573589142 1' 3-max Seat #1 is the button
Seat 1: KongInTheNorth (600 in chips) 
Seat 2: Mahu2021 (420 in chips) 
Seat 3: Milena400 (480 in chips) 
Mahu2021: posts small blind 10
Milena400: posts big blind 20
*** HOLE CARDS ***
Dealt to Mahu2021 [Ah 3s]
KongInTheNorth: folds 
Mahu2021: calls 10
Milena400: checks 
*** FLOP *** [Kd 9h Ad]
Mahu2021: bets 20
Milena400: calls 20
*** TURN *** [Kd 9h Ad] [Qh]
Mahu2021: bets 20
Milena400: raises 100 to 120
Mahu2021: folds 
Uncalled bet (100) returned to Milena400
Milena400 collected 120 from pot
Milena400: doesn't show hand 
*** SUMMARY ***
Total pot 120 | Rake 0 
Board [Kd 9h Ad Qh]
Seat 1: KongInTheNorth (button) folded before Flop (didn't bet)
Seat 2: Mahu2021 (small blind) folded on the Turn
Seat 3: Milena400 (big blind) collected (120)



PokerStars Hand #242942523971: Tournament #3573589142, $0.92+$0.08 USD Hold'em No Limit - Level I (10/20) - 2023/04/07 17:05:56 CET [2023/04/07 11:05:56 ET]
Table '3573589142 1' 3-max Seat #2 is the button
Seat 1: KongInTheNorth (600 in chips) 
Seat 2: Mahu2021 (360 in chips) 
Seat 3: Milena400 (540 in chips) 
Milena400: posts small blind 10
KongInTheNorth: posts big blind 20
*** HOLE CARDS ***
Dealt to Mahu2021 [5d Jh]
Mahu2021: folds 
Milena400: calls 10
KongInTheNorth: checks 
*** FLOP *** [7h Ad 4h]
Milena400: bets 20
KongInTheNorth: folds 
Uncalled bet (20) returned to Milena400
Milena400 collected 40 from pot
Milena400: doesn't show hand 
*** SUMMARY ***
Total pot 40 | Rake 0 
Board [7h Ad 4h]
Seat 1: KongInTheNorth (big blind) folded on the Flop
Seat 2: Mahu2021 (button) folded before Flop (didn't bet)
Seat 3: Milena400 (small blind) collected (40)



PokerStars Hand #242942527479: Tournament #3573589142, $0.92+$0.08 USD Hold'em No Limit - Level I (10/20) - 2023/04/07 17:06:08 CET [2023/04/07 11:06:08 ET]
Table '3573589142 1' 3-max Seat #3 is the button
Seat 1: KongInTheNorth (580 in chips) 
Seat 2: Mahu2021 (360 in chips) 
Seat 3: Milena400 (560 in chips) 
KongInTheNorth: posts small blind 10
Mahu2021: posts big blind 20
*** HOLE CARDS ***
Dealt to Mahu2021 [9h 4d]
Milena400: raises 20 to 40
KongInTheNorth: calls 30
Mahu2021: folds 
*** FLOP *** [7c 2d 2h]
KongInTheNorth: checks 
Milena400: bets 50
KongInTheNorth: folds 
Uncalled bet (50) returned to Milena400
Milena400 collected 100 from pot
Milena400: doesn't show hand 
*** SUMMARY ***
Total pot 100 | Rake 0 
Board [7c 2d 2h]
Seat 1: KongInTheNorth (small blind) folded on the Flop
Seat 2: Mahu2021 (big blind) folded before Flop
Seat 3: Milena400 (button) collected (100)



PokerStars Hand #242942531430: Tournament #3573589142, $0.92+$0.08 USD Hold'em No Limit - Level I (10/20) - 2023/04/07 17:06:21 CET [2023/04/07 11:06:21 ET]
Table '3573589142 1' 3-max Seat #1 is the button
Seat 1: KongInTheNorth (540 in chips) 
Seat 2: Mahu2021 (340 in chips) 
Seat 3: Milena400 (620 in chips) 
Mahu2021: posts small blind 10
Milena400: posts big blind 20
*** HOLE CARDS ***
Dealt to Mahu2021 [Js 5c]
KongInTheNorth: folds 
Mahu2021: calls 10
Milena400: raises 40 to 60
Mahu2021: folds 
Uncalled bet (40) returned to Milena400
Milena400 collected 40 from pot
Milena400: doesn't show hand 
*** SUMMARY ***
Total pot 40 | Rake 0 
Seat 1: KongInTheNorth (button) folded before Flop (didn't bet)
Seat 2: Mahu2021 (small blind) folded before Flop
Seat 3: Milena400 (big blind) collected (40)



PokerStars Hand #242942534433: Tournament #3573589142, $0.92+$0.08 USD Hold'em No Limit - Level I (10/20) - 2023/04/07 17:06:31 CET [2023/04/07 11:06:31 ET]
Table '3573589142 1' 3-max Seat #2 is the button
Seat 1: KongInTheNorth (540 in chips) 
Seat 2: Mahu2021 (320 in chips) 
Seat 3: Milena400 (640 in chips) 
Milena400: posts small blind 10
KongInTheNorth: posts big blind 20
*** HOLE CARDS ***
Dealt to Mahu2021 [Ts 8h]
Mahu2021: folds 
Milena400: calls 10
KongInTheNorth: checks 
*** FLOP *** [Kc 7c 2c]
Milena400: checks 
KongInTheNorth: bets 40
Milena400: folds 
Uncalled bet (40) returned to KongInTheNorth
KongInTheNorth collected 40 from pot
*** SUMMARY ***
Total pot 40 | Rake 0 
Board [Kc 7c 2c]
Seat 1: KongInTheNorth (big blind) collected (40)
Seat 2: Mahu2021 (button) folded before Flop (didn't bet)
Seat 3: Milena400 (small blind) folded on the Flop



PokerStars Hand #242942538170: Tournament #3573589142, $0.92+$0.08 USD Hold'em No Limit - Level I (10/20) - 2023/04/07 17:06:43 CET [2023/04/07 11:06:43 ET]
Table '3573589142 1' 3-max Seat #3 is the button
Seat 1: KongInTheNorth (560 in chips) 
Seat 2: Mahu2021 (320 in chips) 
Seat 3: Milena400 (620 in chips) 
KongInTheNorth: posts small blind 10
Mahu2021: posts big blind 20
*** HOLE CARDS ***
Dealt to Mahu2021 [Qc Kh]
Milena400: folds 
KongInTheNorth: raises 40 to 60
Mahu2021: raises 260 to 320 and is all-in
KongInTheNorth: calls 260
*** FLOP *** [Js 8c 4h]
*** TURN *** [Js 8c 4h] [7s]
*** RIVER *** [Js 8c 4h 7s] [Td]
*** SHOW DOWN ***
KongInTheNorth: shows [Ad Qh] (high card Ace)
Mahu2021: shows [Qc Kh] (high card King)
KongInTheNorth collected 640 from pot
Mahu2021 finished the tournament in 3rd place
*** SUMMARY ***
Total pot 640 | Rake 0 
Board [Js 8c 4h 7s Td]
Seat 1: KongInTheNorth (small blind) showed [Ad Qh] and won (640) with high card Ace
Seat 2: Mahu2021 (big blind) showed [Qc Kh] and lost with high card King
Seat 3: Milena400 (button) folded before Flop (didn't bet)



