PokerStars Hand #245120491628: Tournament #3624783322, $0.92+$0.08 USD Hold'em No Limit - Level I (10/20) - 2023/07/31 12:19:32 CET [2023/07/31 6:19:32 ET]
Table '3624783322 1' 3-max Seat #1 is the button
Seat 1: makhu995 (500 in chips) 
Seat 2: Mahu2021 (500 in chips) 
Seat 3: parsun69 (500 in chips) 
Mahu2021: posts small blind 10
parsun69: posts big blind 20
*** HOLE CARDS ***
Dealt to Mahu2021 [7c Jc]
makhu995: raises 60 to 80
Mahu2021: folds 
parsun69: calls 60
*** FLOP *** [5s Ks Tc]
parsun69: checks 
makhu995: bets 140
parsun69: folds 
Uncalled bet (140) returned to makhu995
makhu995 collected 170 from pot
*** SUMMARY ***
Total pot 170 | Rake 0 
Board [5s Ks Tc]
Seat 1: makhu995 (button) collected (170)
Seat 2: Mahu2021 (small blind) folded before Flop
Seat 3: parsun69 (big blind) folded on the Flop



PokerStars Hand #245120494027: Tournament #3624783322, $0.92+$0.08 USD Hold'em No Limit - Level I (10/20) - 2023/07/31 12:19:50 CET [2023/07/31 6:19:50 ET]
Table '3624783322 1' 3-max Seat #2 is the button
Seat 1: makhu995 (590 in chips) 
Seat 2: Mahu2021 (490 in chips) 
Seat 3: parsun69 (420 in chips) 
parsun69: posts small blind 10
makhu995: posts big blind 20
*** HOLE CARDS ***
Dealt to Mahu2021 [8h 7h]
Mahu2021: raises 20 to 40
parsun69: folds 
makhu995: calls 20
*** FLOP *** [7c Qh 8d]
makhu995: bets 80
Mahu2021: raises 80 to 160
makhu995: calls 80
*** TURN *** [7c Qh 8d] [7s]
makhu995: bets 390 and is all-in
Mahu2021: calls 290 and is all-in
Uncalled bet (100) returned to makhu995
*** RIVER *** [7c Qh 8d 7s] [6s]
*** SHOW DOWN ***
makhu995: shows [Qd 6h] (two pair, Queens and Sevens)
Mahu2021: shows [8h 7h] (a full house, Sevens full of Eights)
Mahu2021 collected 990 from pot
*** SUMMARY ***
Total pot 990 | Rake 0 
Board [7c Qh 8d 7s 6s]
Seat 1: makhu995 (big blind) showed [Qd 6h] and lost with two pair, Queens and Sevens
Seat 2: Mahu2021 (button) showed [8h 7h] and won (990) with a full house, Sevens full of Eights
Seat 3: parsun69 (small blind) folded before Flop



PokerStars Hand #245120497368: Tournament #3624783322, $0.92+$0.08 USD Hold'em No Limit - Level I (10/20) - 2023/07/31 12:20:15 CET [2023/07/31 6:20:15 ET]
Table '3624783322 1' 3-max Seat #3 is the button
Seat 1: makhu995 (100 in chips) 
Seat 2: Mahu2021 (990 in chips) 
Seat 3: parsun69 (410 in chips) 
makhu995: posts small blind 10
Mahu2021: posts big blind 20
*** HOLE CARDS ***
Dealt to Mahu2021 [Td 6d]
parsun69: folds 
makhu995: folds 
Uncalled bet (10) returned to Mahu2021
Mahu2021 collected 20 from pot
Mahu2021: doesn't show hand 
*** SUMMARY ***
Total pot 20 | Rake 0 
Seat 1: makhu995 (small blind) folded before Flop
Seat 2: Mahu2021 (big blind) collected (20)
Seat 3: parsun69 (button) folded before Flop (didn't bet)



PokerStars Hand #245120498017: Tournament #3624783322, $0.92+$0.08 USD Hold'em No Limit - Level I (10/20) - 2023/07/31 12:20:20 CET [2023/07/31 6:20:20 ET]
Table '3624783322 1' 3-max Seat #1 is the button
Seat 1: makhu995 (90 in chips) 
Seat 2: Mahu2021 (1000 in chips) 
Seat 3: parsun69 (410 in chips) 
Mahu2021: posts small blind 10
parsun69: posts big blind 20
*** HOLE CARDS ***
Dealt to Mahu2021 [5h 6d]
makhu995: raises 70 to 90 and is all-in
Mahu2021: folds 
parsun69: folds 
Uncalled bet (70) returned to makhu995
makhu995 collected 50 from pot
*** SUMMARY ***
Total pot 50 | Rake 0 
Seat 1: makhu995 (button) collected (50)
Seat 2: Mahu2021 (small blind) folded before Flop
Seat 3: parsun69 (big blind) folded before Flop



PokerStars Hand #245120499346: Tournament #3624783322, $0.92+$0.08 USD Hold'em No Limit - Level I (10/20) - 2023/07/31 12:20:29 CET [2023/07/31 6:20:29 ET]
Table '3624783322 1' 3-max Seat #2 is the button
Seat 1: makhu995 (120 in chips) 
Seat 2: Mahu2021 (990 in chips) 
Seat 3: parsun69 (390 in chips) 
parsun69: posts small blind 10
makhu995: posts big blind 20
*** HOLE CARDS ***
Dealt to Mahu2021 [2d Qd]
Mahu2021: folds 
parsun69: calls 10
makhu995: raises 100 to 120 and is all-in
parsun69: calls 100
*** FLOP *** [Kd Jh 5h]
*** TURN *** [Kd Jh 5h] [8c]
*** RIVER *** [Kd Jh 5h 8c] [8s]
*** SHOW DOWN ***
parsun69: shows [Js 5d] (two pair, Jacks and Eights)
makhu995: shows [4h 2h] (a pair of Eights)
parsun69 collected 240 from pot
makhu995 finished the tournament in 3rd place
*** SUMMARY ***
Total pot 240 | Rake 0 
Board [Kd Jh 5h 8c 8s]
Seat 1: makhu995 (big blind) showed [4h 2h] and lost with a pair of Eights
Seat 2: Mahu2021 (button) folded before Flop (didn't bet)
Seat 3: parsun69 (small blind) showed [Js 5d] and won (240) with two pair, Jacks and Eights



PokerStars Hand #245120502148: Tournament #3624783322, $0.92+$0.08 USD Hold'em No Limit - Level I (10/20) - 2023/07/31 12:20:50 CET [2023/07/31 6:20:50 ET]
Table '3624783322 1' 3-max Seat #3 is the button
Seat 2: Mahu2021 (990 in chips) 
Seat 3: parsun69 (510 in chips) 
parsun69: posts small blind 10
Mahu2021: posts big blind 20
*** HOLE CARDS ***
Dealt to Mahu2021 [Kh 8c]
parsun69: folds 
Uncalled bet (10) returned to Mahu2021
Mahu2021 collected 20 from pot
Mahu2021: doesn't show hand 
*** SUMMARY ***
Total pot 20 | Rake 0 
Seat 2: Mahu2021 (big blind) collected (20)
Seat 3: parsun69 (button) (small blind) folded before Flop



PokerStars Hand #245120502815: Tournament #3624783322, $0.92+$0.08 USD Hold'em No Limit - Level I (10/20) - 2023/07/31 12:20:55 CET [2023/07/31 6:20:55 ET]
Table '3624783322 1' 3-max Seat #2 is the button
Seat 2: Mahu2021 (1000 in chips) 
Seat 3: parsun69 (500 in chips) 
Mahu2021: posts small blind 10
parsun69: posts big blind 20
*** HOLE CARDS ***
Dealt to Mahu2021 [Js 2h]
Mahu2021: calls 10
parsun69: checks 
*** FLOP *** [8s Td 9d]
parsun69: checks 
Mahu2021: bets 40
parsun69: calls 40
*** TURN *** [8s Td 9d] [Jd]
parsun69: checks 
Mahu2021: checks 
*** RIVER *** [8s Td 9d Jd] [2d]
parsun69: bets 20
Mahu2021: folds 
Uncalled bet (20) returned to parsun69
parsun69 collected 120 from pot
*** SUMMARY ***
Total pot 120 | Rake 0 
Board [8s Td 9d Jd 2d]
Seat 2: Mahu2021 (button) (small blind) folded on the River
Seat 3: parsun69 (big blind) collected (120)



PokerStars Hand #245120507146: Tournament #3624783322, $0.92+$0.08 USD Hold'em No Limit - Level I (10/20) - 2023/07/31 12:21:27 CET [2023/07/31 6:21:27 ET]
Table '3624783322 1' 3-max Seat #3 is the button
Seat 2: Mahu2021 (940 in chips) 
Seat 3: parsun69 (560 in chips) 
parsun69: posts small blind 10
Mahu2021: posts big blind 20
*** HOLE CARDS ***
Dealt to Mahu2021 [Jh 7c]
parsun69: calls 10
Mahu2021: checks 
*** FLOP *** [3s Td Kh]
Mahu2021: checks 
parsun69: checks 
*** TURN *** [3s Td Kh] [2d]
Mahu2021: bets 20
parsun69: raises 20 to 40
Mahu2021: folds 
Uncalled bet (20) returned to parsun69
parsun69 collected 80 from pot
*** SUMMARY ***
Total pot 80 | Rake 0 
Board [3s Td Kh 2d]
Seat 2: Mahu2021 (big blind) folded on the Turn
Seat 3: parsun69 (button) (small blind) collected (80)



PokerStars Hand #245120509481: Tournament #3624783322, $0.92+$0.08 USD Hold'em No Limit - Level II (15/30) - 2023/07/31 12:21:44 CET [2023/07/31 6:21:44 ET]
Table '3624783322 1' 3-max Seat #2 is the button
Seat 2: Mahu2021 (900 in chips) 
Seat 3: parsun69 (600 in chips) 
Mahu2021: posts small blind 15
parsun69: posts big blind 30
*** HOLE CARDS ***
Dealt to Mahu2021 [As 7h]
Mahu2021: raises 30 to 60
parsun69: raises 30 to 90
Mahu2021: calls 30
*** FLOP *** [6h 3h 5d]
parsun69: bets 30
Mahu2021: calls 30
*** TURN *** [6h 3h 5d] [4c]
parsun69: bets 30
Mahu2021: calls 30
*** RIVER *** [6h 3h 5d 4c] [9s]
parsun69: bets 450 and is all-in
Mahu2021: calls 450
*** SHOW DOWN ***
parsun69: shows [Ah Ts] (high card Ace)
Mahu2021: shows [As 7h] (a straight, Three to Seven)
Mahu2021 collected 1200 from pot
parsun69 finished the tournament in 2nd place
Mahu2021 wins the tournament and receives $2.00 - congratulations!
*** SUMMARY ***
Total pot 1200 | Rake 0 
Board [6h 3h 5d 4c 9s]
Seat 2: Mahu2021 (button) (small blind) showed [As 7h] and won (1200) with a straight, Three to Seven
Seat 3: parsun69 (big blind) showed [Ah Ts] and lost with high card Ace



