PokerStars Hand #253442922210: Tournament #3824451302, $1.84+$0.16 USD Hold'em No Limit - Level I (10/20) - 2024/11/17 12:34:51 CET [2024/11/17 6:34:51 ET]
Table '3824451302 1' 3-max Seat #1 is the button
Seat 1: LAMGOZZZZ (500 in chips) 
Seat 2: Mahu2021 (500 in chips) 
Seat 3: ryT6ou (500 in chips) 
Mahu2021: posts small blind 10
ryT6ou: posts big blind 20
*** HOLE CARDS ***
Dealt to Mahu2021 [6s Qs]
LAMGOZZZZ: raises 20 to 40
Mahu2021: calls 30
ryT6ou: calls 20
*** FLOP *** [9c 5c Kc]
Mahu2021: checks 
ryT6ou: checks 
LAMGOZZZZ: checks 
*** TURN *** [9c 5c Kc] [Tc]
Mahu2021: checks 
ryT6ou: checks 
LAMGOZZZZ: checks 
*** RIVER *** [9c 5c Kc Tc] [8d]
Mahu2021: checks 
ryT6ou: checks 
LAMGOZZZZ: checks 
*** SHOW DOWN ***
Mahu2021: shows [6s Qs] (high card King)
ryT6ou: shows [Ts 9d] (two pair, Tens and Nines)
LAMGOZZZZ: shows [Td Kh] (two pair, Kings and Tens)
LAMGOZZZZ collected 120 from pot
*** SUMMARY ***
Total pot 120 | Rake 0 
Board [9c 5c Kc Tc 8d]
Seat 1: LAMGOZZZZ (button) showed [Td Kh] and won (120) with two pair, Kings and Tens
Seat 2: Mahu2021 (small blind) showed [6s Qs] and lost with high card King
Seat 3: ryT6ou (big blind) showed [Ts 9d] and lost with two pair, Tens and Nines



PokerStars Hand #253442924693: Tournament #3824451302, $1.84+$0.16 USD Hold'em No Limit - Level I (10/20) - 2024/11/17 12:35:10 CET [2024/11/17 6:35:10 ET]
Table '3824451302 1' 3-max Seat #2 is the button
Seat 1: LAMGOZZZZ (580 in chips) 
Seat 2: Mahu2021 (460 in chips) 
Seat 3: ryT6ou (460 in chips) 
ryT6ou: posts small blind 10
LAMGOZZZZ: posts big blind 20
*** HOLE CARDS ***
Dealt to Mahu2021 [Kd 8d]
Mahu2021: raises 20 to 40
ryT6ou: folds 
LAMGOZZZZ: raises 20 to 60
Mahu2021: calls 20
*** FLOP *** [6c Ac 9h]
LAMGOZZZZ: checks 
Mahu2021: checks 
*** TURN *** [6c Ac 9h] [3s]
LAMGOZZZZ: bets 130
Mahu2021: folds 
Uncalled bet (130) returned to LAMGOZZZZ
LAMGOZZZZ collected 130 from pot
*** SUMMARY ***
Total pot 130 | Rake 0 
Board [6c Ac 9h 3s]
Seat 1: LAMGOZZZZ (big blind) collected (130)
Seat 2: Mahu2021 (button) folded on the Turn
Seat 3: ryT6ou (small blind) folded before Flop



PokerStars Hand #253442926799: Tournament #3824451302, $1.84+$0.16 USD Hold'em No Limit - Level I (10/20) - 2024/11/17 12:35:25 CET [2024/11/17 6:35:25 ET]
Table '3824451302 1' 3-max Seat #3 is the button
Seat 1: LAMGOZZZZ (650 in chips) 
Seat 2: Mahu2021 (400 in chips) 
Seat 3: ryT6ou (450 in chips) 
LAMGOZZZZ: posts small blind 10
Mahu2021: posts big blind 20
*** HOLE CARDS ***
Dealt to Mahu2021 [6h Ks]
ryT6ou: calls 20
LAMGOZZZZ: raises 20 to 40
Mahu2021: calls 20
ryT6ou: calls 20
*** FLOP *** [Kc 2h Kd]
LAMGOZZZZ: checks 
Mahu2021: checks 
ryT6ou: checks 
*** TURN *** [Kc 2h Kd] [4d]
LAMGOZZZZ: bets 20
Mahu2021: calls 20
ryT6ou: raises 110 to 130
LAMGOZZZZ: calls 110
Mahu2021: raises 230 to 360 and is all-in
ryT6ou: raises 50 to 410 and is all-in
LAMGOZZZZ: folds 
Uncalled bet (50) returned to ryT6ou
*** RIVER *** [Kc 2h Kd 4d] [9c]
*** SHOW DOWN ***
Mahu2021: shows [6h Ks] (three of a kind, Kings)
ryT6ou: shows [6d 3d] (a pair of Kings)
Mahu2021 collected 970 from pot
*** SUMMARY ***
Total pot 970 | Rake 0 
Board [Kc 2h Kd 4d 9c]
Seat 1: LAMGOZZZZ (small blind) folded on the Turn
Seat 2: Mahu2021 (big blind) showed [6h Ks] and won (970) with three of a kind, Kings
Seat 3: ryT6ou (button) showed [6d 3d] and lost with a pair of Kings



PokerStars Hand #253442931603: Tournament #3824451302, $1.84+$0.16 USD Hold'em No Limit - Level I (10/20) - 2024/11/17 12:36:00 CET [2024/11/17 6:36:00 ET]
Table '3824451302 1' 3-max Seat #1 is the button
Seat 1: LAMGOZZZZ (480 in chips) 
Seat 2: Mahu2021 (970 in chips) 
Seat 3: ryT6ou (50 in chips) 
Mahu2021: posts small blind 10
ryT6ou: posts big blind 20
*** HOLE CARDS ***
Dealt to Mahu2021 [6d 9h]
LAMGOZZZZ: folds 
Mahu2021: folds 
Uncalled bet (10) returned to ryT6ou
ryT6ou collected 20 from pot
ryT6ou: doesn't show hand 
*** SUMMARY ***
Total pot 20 | Rake 0 
Seat 1: LAMGOZZZZ (button) folded before Flop (didn't bet)
Seat 2: Mahu2021 (small blind) folded before Flop
Seat 3: ryT6ou (big blind) collected (20)



PokerStars Hand #253442932276: Tournament #3824451302, $1.84+$0.16 USD Hold'em No Limit - Level I (10/20) - 2024/11/17 12:36:05 CET [2024/11/17 6:36:05 ET]
Table '3824451302 1' 3-max Seat #2 is the button
Seat 1: LAMGOZZZZ (480 in chips) 
Seat 2: Mahu2021 (960 in chips) 
Seat 3: ryT6ou (60 in chips) 
ryT6ou: posts small blind 10
LAMGOZZZZ: posts big blind 20
*** HOLE CARDS ***
Dealt to Mahu2021 [9s Qh]
Mahu2021: calls 20
ryT6ou: raises 40 to 60 and is all-in
LAMGOZZZZ: folds 
Mahu2021: calls 40
*** FLOP *** [2d Tc 4h]
*** TURN *** [2d Tc 4h] [3c]
*** RIVER *** [2d Tc 4h 3c] [Kc]
*** SHOW DOWN ***
ryT6ou: shows [2s Jh] (a pair of Deuces)
Mahu2021: shows [9s Qh] (high card King)
ryT6ou collected 140 from pot
*** SUMMARY ***
Total pot 140 | Rake 0 
Board [2d Tc 4h 3c Kc]
Seat 1: LAMGOZZZZ (big blind) folded before Flop
Seat 2: Mahu2021 (button) showed [9s Qh] and lost with high card King
Seat 3: ryT6ou (small blind) showed [2s Jh] and won (140) with a pair of Deuces



PokerStars Hand #253442934313: Tournament #3824451302, $1.84+$0.16 USD Hold'em No Limit - Level I (10/20) - 2024/11/17 12:36:19 CET [2024/11/17 6:36:19 ET]
Table '3824451302 1' 3-max Seat #3 is the button
Seat 1: LAMGOZZZZ (460 in chips) 
Seat 2: Mahu2021 (900 in chips) 
Seat 3: ryT6ou (140 in chips) 
LAMGOZZZZ: posts small blind 10
Mahu2021: posts big blind 20
*** HOLE CARDS ***
Dealt to Mahu2021 [Ks Kh]
ryT6ou: raises 120 to 140 and is all-in
LAMGOZZZZ: calls 130
Mahu2021: raises 760 to 900 and is all-in
LAMGOZZZZ: calls 320 and is all-in
Uncalled bet (440) returned to Mahu2021
*** FLOP *** [Kd Ad 8h]
*** TURN *** [Kd Ad 8h] [Js]
*** RIVER *** [Kd Ad 8h Js] [Th]
*** SHOW DOWN ***
LAMGOZZZZ: shows [Kc 9h] (a pair of Kings)
Mahu2021: shows [Ks Kh] (three of a kind, Kings)
Mahu2021 collected 640 from side pot
ryT6ou: shows [Ts 8s] (two pair, Tens and Eights)
Mahu2021 collected 420 from main pot
LAMGOZZZZ finished the tournament in 2nd place
ryT6ou finished the tournament in 3rd place
Mahu2021 wins the tournament and receives $4.00 - congratulations!
*** SUMMARY ***
Total pot 1060 Main pot 420. Side pot 640. | Rake 0 
Board [Kd Ad 8h Js Th]
Seat 1: LAMGOZZZZ (small blind) showed [Kc 9h] and lost with a pair of Kings
Seat 2: Mahu2021 (big blind) showed [Ks Kh] and won (1060) with three of a kind, Kings
Seat 3: ryT6ou (button) showed [Ts 8s] and lost with two pair, Tens and Eights



