PokerStars Hand #247515038737: Tournament #3682933904, $1.84+$0.16 USD Hold'em No Limit - Level I (10/20) - 2023/12/06 21:40:50 CET [2023/12/06 15:40:50 ET]
Table '3682933904 1' 3-max Seat #1 is the button
Seat 1: turnier_fun (500 in chips) 
Seat 2: lilleman_1 (500 in chips) 
Seat 3: Mahu2021 (500 in chips) 
lilleman_1: posts small blind 10
Mahu2021: posts big blind 20
*** HOLE CARDS ***
Dealt to Mahu2021 [Kd 6h]
turnier_fun: folds 
lilleman_1: raises 40 to 60
Mahu2021: folds 
Uncalled bet (40) returned to lilleman_1
lilleman_1 collected 40 from pot
lilleman_1: doesn't show hand 
*** SUMMARY ***
Total pot 40 | Rake 0 
Seat 1: turnier_fun (button) folded before Flop (didn't bet)
Seat 2: lilleman_1 (small blind) collected (40)
Seat 3: Mahu2021 (big blind) folded before Flop



PokerStars Hand #247515042991: Tournament #3682933904, $1.84+$0.16 USD Hold'em No Limit - Level I (10/20) - 2023/12/06 21:41:03 CET [2023/12/06 15:41:03 ET]
Table '3682933904 1' 3-max Seat #2 is the button
Seat 1: turnier_fun (500 in chips) 
Seat 2: lilleman_1 (520 in chips) 
Seat 3: Mahu2021 (480 in chips) 
Mahu2021: posts small blind 10
turnier_fun: posts big blind 20
*** HOLE CARDS ***
Dealt to Mahu2021 [8s Jd]
lilleman_1: calls 20
Mahu2021: calls 10
turnier_fun: checks 
*** FLOP *** [7c Qs Ah]
Mahu2021: checks 
turnier_fun: checks 
lilleman_1: bets 20
Mahu2021: folds 
turnier_fun: folds 
Uncalled bet (20) returned to lilleman_1
lilleman_1 collected 60 from pot
lilleman_1: doesn't show hand 
*** SUMMARY ***
Total pot 60 | Rake 0 
Board [7c Qs Ah]
Seat 1: turnier_fun (big blind) folded on the Flop
Seat 2: lilleman_1 (button) collected (60)
Seat 3: Mahu2021 (small blind) folded on the Flop



PokerStars Hand #247515049281: Tournament #3682933904, $1.84+$0.16 USD Hold'em No Limit - Level I (10/20) - 2023/12/06 21:41:21 CET [2023/12/06 15:41:21 ET]
Table '3682933904 1' 3-max Seat #3 is the button
Seat 1: turnier_fun (480 in chips) 
Seat 2: lilleman_1 (560 in chips) 
Seat 3: Mahu2021 (460 in chips) 
turnier_fun: posts small blind 10
lilleman_1: posts big blind 20
*** HOLE CARDS ***
Dealt to Mahu2021 [Qc 4s]
Mahu2021: folds 
turnier_fun: calls 10
lilleman_1: raises 40 to 60
turnier_fun: calls 40
*** FLOP *** [Ac 9s 7s]
turnier_fun: checks 
lilleman_1: bets 120
turnier_fun: raises 300 to 420 and is all-in
lilleman_1: calls 300
*** TURN *** [Ac 9s 7s] [Js]
*** RIVER *** [Ac 9s 7s Js] [3c]
*** SHOW DOWN ***
turnier_fun: shows [9d 6h] (a pair of Nines)
lilleman_1: shows [Ad Kc] (a pair of Aces)
lilleman_1 collected 960 from pot
turnier_fun finished the tournament in 3rd place
*** SUMMARY ***
Total pot 960 | Rake 0 
Board [Ac 9s 7s Js 3c]
Seat 1: turnier_fun (small blind) showed [9d 6h] and lost with a pair of Nines
Seat 2: lilleman_1 (big blind) showed [Ad Kc] and won (960) with a pair of Aces
Seat 3: Mahu2021 (button) folded before Flop (didn't bet)



PokerStars Hand #247515058546: Tournament #3682933904, $1.84+$0.16 USD Hold'em No Limit - Level I (10/20) - 2023/12/06 21:41:48 CET [2023/12/06 15:41:48 ET]
Table '3682933904 1' 3-max Seat #2 is the button
Seat 2: lilleman_1 (1040 in chips) 
Seat 3: Mahu2021 (460 in chips) 
lilleman_1: posts small blind 10
Mahu2021: posts big blind 20
*** HOLE CARDS ***
Dealt to Mahu2021 [3h Ac]
lilleman_1: calls 10
Mahu2021: checks 
*** FLOP *** [Tc 5d Jc]
Mahu2021: checks 
lilleman_1: checks 
*** TURN *** [Tc 5d Jc] [Ad]
Mahu2021: bets 20
lilleman_1: calls 20
*** RIVER *** [Tc 5d Jc Ad] [9s]
Mahu2021: bets 40
lilleman_1: folds 
Uncalled bet (40) returned to Mahu2021
Mahu2021 collected 80 from pot
Mahu2021: doesn't show hand 
*** SUMMARY ***
Total pot 80 | Rake 0 
Board [Tc 5d Jc Ad 9s]
Seat 2: lilleman_1 (button) (small blind) folded on the River
Seat 3: Mahu2021 (big blind) collected (80)



PokerStars Hand #247515063523: Tournament #3682933904, $1.84+$0.16 USD Hold'em No Limit - Level I (10/20) - 2023/12/06 21:42:02 CET [2023/12/06 15:42:02 ET]
Table '3682933904 1' 3-max Seat #3 is the button
Seat 2: lilleman_1 (1000 in chips) 
Seat 3: Mahu2021 (500 in chips) 
Mahu2021: posts small blind 10
lilleman_1: posts big blind 20
*** HOLE CARDS ***
Dealt to Mahu2021 [8h 9h]
Mahu2021: raises 20 to 40
lilleman_1: calls 20
*** FLOP *** [Qs Qd Kd]
lilleman_1: checks 
Mahu2021: checks 
*** TURN *** [Qs Qd Kd] [Ac]
lilleman_1: bets 20
Mahu2021: folds 
Uncalled bet (20) returned to lilleman_1
lilleman_1 collected 80 from pot
lilleman_1: doesn't show hand 
*** SUMMARY ***
Total pot 80 | Rake 0 
Board [Qs Qd Kd Ac]
Seat 2: lilleman_1 (big blind) collected (80)
Seat 3: Mahu2021 (button) (small blind) folded on the Turn



PokerStars Hand #247515067569: Tournament #3682933904, $1.84+$0.16 USD Hold'em No Limit - Level I (10/20) - 2023/12/06 21:42:13 CET [2023/12/06 15:42:13 ET]
Table '3682933904 1' 3-max Seat #2 is the button
Seat 2: lilleman_1 (1040 in chips) 
Seat 3: Mahu2021 (460 in chips) 
lilleman_1: posts small blind 10
Mahu2021: posts big blind 20
*** HOLE CARDS ***
Dealt to Mahu2021 [Kc 2h]
lilleman_1: calls 10
Mahu2021: checks 
*** FLOP *** [Jc 8h Kh]
Mahu2021: bets 20
lilleman_1: calls 20
*** TURN *** [Jc 8h Kh] [8d]
Mahu2021: bets 20
lilleman_1: folds 
Uncalled bet (20) returned to Mahu2021
Mahu2021 collected 80 from pot
Mahu2021: doesn't show hand 
*** SUMMARY ***
Total pot 80 | Rake 0 
Board [Jc 8h Kh 8d]
Seat 2: lilleman_1 (button) (small blind) folded on the Turn
Seat 3: Mahu2021 (big blind) collected (80)



PokerStars Hand #247515071807: Tournament #3682933904, $1.84+$0.16 USD Hold'em No Limit - Level I (10/20) - 2023/12/06 21:42:25 CET [2023/12/06 15:42:25 ET]
Table '3682933904 1' 3-max Seat #3 is the button
Seat 2: lilleman_1 (1000 in chips) 
Seat 3: Mahu2021 (500 in chips) 
Mahu2021: posts small blind 10
lilleman_1: posts big blind 20
*** HOLE CARDS ***
Dealt to Mahu2021 [2h Ac]
Mahu2021: raises 20 to 40
lilleman_1: calls 20
*** FLOP *** [Qd 5h 9c]
lilleman_1: bets 20
Mahu2021: raises 40 to 60
lilleman_1: raises 200 to 260
Mahu2021: folds 
Uncalled bet (200) returned to lilleman_1
lilleman_1 collected 200 from pot
lilleman_1: doesn't show hand 
*** SUMMARY ***
Total pot 200 | Rake 0 
Board [Qd 5h 9c]
Seat 2: lilleman_1 (big blind) collected (200)
Seat 3: Mahu2021 (button) (small blind) folded on the Flop



PokerStars Hand #247515076757: Tournament #3682933904, $1.84+$0.16 USD Hold'em No Limit - Level I (10/20) - 2023/12/06 21:42:39 CET [2023/12/06 15:42:39 ET]
Table '3682933904 1' 3-max Seat #2 is the button
Seat 2: lilleman_1 (1100 in chips) 
Seat 3: Mahu2021 (400 in chips) 
lilleman_1: posts small blind 10
Mahu2021: posts big blind 20
*** HOLE CARDS ***
Dealt to Mahu2021 [Ad 9d]
lilleman_1: calls 10
Mahu2021: raises 40 to 60
lilleman_1: calls 40
*** FLOP *** [8h 2d 7s]
Mahu2021: bets 60
lilleman_1: raises 240 to 300
Mahu2021: raises 40 to 340 and is all-in
lilleman_1: calls 40
*** TURN *** [8h 2d 7s] [As]
*** RIVER *** [8h 2d 7s As] [7c]
*** SHOW DOWN ***
Mahu2021: shows [Ad 9d] (two pair, Aces and Sevens)
lilleman_1: shows [7h Qs] (three of a kind, Sevens)
lilleman_1 collected 800 from pot
Mahu2021 finished the tournament in 2nd place
lilleman_1 wins the tournament and receives $4.00 - congratulations!
*** SUMMARY ***
Total pot 800 | Rake 0 
Board [8h 2d 7s As 7c]
Seat 2: lilleman_1 (button) (small blind) showed [7h Qs] and won (800) with three of a kind, Sevens
Seat 3: Mahu2021 (big blind) showed [Ad 9d] and lost with two pair, Aces and Sevens



