PokerStars Hand #248317974876: Tournament #3702083586, $1.84+$0.16 USD Hold'em No Limit - Level I (10/20) - 2024/01/16 22:05:36 CET [2024/01/16 16:05:36 ET]
Table '3702083586 1' 3-max Seat #1 is the button
Seat 1: tunanmayo (500 in chips) 
Seat 2: Mahu2021 (500 in chips) 
Seat 3: Poweramper (500 in chips) 
Mahu2021: posts small blind 10
Poweramper: posts big blind 20
*** HOLE CARDS ***
Dealt to Mahu2021 [Tc 4c]
tunanmayo: raises 20 to 40
Mahu2021: folds 
Poweramper: folds 
Uncalled bet (20) returned to tunanmayo
tunanmayo collected 50 from pot
*** SUMMARY ***
Total pot 50 | Rake 0 
Seat 1: tunanmayo (button) collected (50)
Seat 2: Mahu2021 (small blind) folded before Flop
Seat 3: Poweramper (big blind) folded before Flop



PokerStars Hand #248317978536: Tournament #3702083586, $1.84+$0.16 USD Hold'em No Limit - Level I (10/20) - 2024/01/16 22:05:45 CET [2024/01/16 16:05:45 ET]
Table '3702083586 1' 3-max Seat #2 is the button
Seat 1: tunanmayo (530 in chips) 
Seat 2: Mahu2021 (490 in chips) 
Seat 3: Poweramper (480 in chips) 
Poweramper: posts small blind 10
tunanmayo: posts big blind 20
*** HOLE CARDS ***
Dealt to Mahu2021 [Ah 9c]
Mahu2021: folds 
Poweramper: calls 10
tunanmayo: checks 
*** FLOP *** [7h Td 2h]
Poweramper: checks 
tunanmayo: checks 
*** TURN *** [7h Td 2h] [3c]
Poweramper: checks 
tunanmayo: bets 40
Poweramper: folds 
Uncalled bet (40) returned to tunanmayo
tunanmayo collected 40 from pot
*** SUMMARY ***
Total pot 40 | Rake 0 
Board [7h Td 2h 3c]
Seat 1: tunanmayo (big blind) collected (40)
Seat 2: Mahu2021 (button) folded before Flop (didn't bet)
Seat 3: Poweramper (small blind) folded on the Turn



PokerStars Hand #248317990460: Tournament #3702083586, $1.84+$0.16 USD Hold'em No Limit - Level I (10/20) - 2024/01/16 22:06:15 CET [2024/01/16 16:06:15 ET]
Table '3702083586 1' 3-max Seat #3 is the button
Seat 1: tunanmayo (550 in chips) 
Seat 2: Mahu2021 (490 in chips) 
Seat 3: Poweramper (460 in chips) 
tunanmayo: posts small blind 10
Mahu2021: posts big blind 20
*** HOLE CARDS ***
Dealt to Mahu2021 [As 5c]
Poweramper: raises 20 to 40
tunanmayo: calls 30
Mahu2021: calls 20
*** FLOP *** [Ts Kd Kc]
tunanmayo: bets 20
Mahu2021: folds 
Poweramper: calls 20
*** TURN *** [Ts Kd Kc] [5d]
tunanmayo: bets 20
Poweramper: calls 20
*** RIVER *** [Ts Kd Kc 5d] [Jd]
tunanmayo: checks 
Poweramper: checks 
*** SHOW DOWN ***
tunanmayo: shows [Qd Th] (two pair, Kings and Tens)
Poweramper: mucks hand 
tunanmayo collected 200 from pot
*** SUMMARY ***
Total pot 200 | Rake 0 
Board [Ts Kd Kc 5d Jd]
Seat 1: tunanmayo (small blind) showed [Qd Th] and won (200) with two pair, Kings and Tens
Seat 2: Mahu2021 (big blind) folded on the Flop
Seat 3: Poweramper (button) mucked [6c 6h]



PokerStars Hand #248318004351: Tournament #3702083586, $1.84+$0.16 USD Hold'em No Limit - Level I (10/20) - 2024/01/16 22:06:50 CET [2024/01/16 16:06:50 ET]
Table '3702083586 1' 3-max Seat #1 is the button
Seat 1: tunanmayo (670 in chips) 
Seat 2: Mahu2021 (450 in chips) 
Seat 3: Poweramper (380 in chips) 
Mahu2021: posts small blind 10
Poweramper: posts big blind 20
*** HOLE CARDS ***
Dealt to Mahu2021 [6d 2d]
tunanmayo: folds 
Mahu2021: calls 10
Poweramper: raises 40 to 60
Mahu2021: folds 
Uncalled bet (40) returned to Poweramper
Poweramper collected 40 from pot
Poweramper: doesn't show hand 
*** SUMMARY ***
Total pot 40 | Rake 0 
Seat 1: tunanmayo (button) folded before Flop (didn't bet)
Seat 2: Mahu2021 (small blind) folded before Flop
Seat 3: Poweramper (big blind) collected (40)



PokerStars Hand #248318010167: Tournament #3702083586, $1.84+$0.16 USD Hold'em No Limit - Level I (10/20) - 2024/01/16 22:07:05 CET [2024/01/16 16:07:05 ET]
Table '3702083586 1' 3-max Seat #2 is the button
Seat 1: tunanmayo (670 in chips) 
Seat 2: Mahu2021 (430 in chips) 
Seat 3: Poweramper (400 in chips) 
Poweramper: posts small blind 10
tunanmayo: posts big blind 20
*** HOLE CARDS ***
Dealt to Mahu2021 [Kh 9s]
Mahu2021: raises 20 to 40
Poweramper: calls 30
tunanmayo: folds 
*** FLOP *** [2h 9h 4h]
Poweramper: bets 30
Mahu2021: calls 30
*** TURN *** [2h 9h 4h] [7d]
Poweramper: bets 160
Mahu2021: calls 160
*** RIVER *** [2h 9h 4h 7d] [8s]
Poweramper: bets 170 and is all-in
Mahu2021: calls 170
*** SHOW DOWN ***
Poweramper: shows [6h 5h] (a flush, Nine high)
Mahu2021: shows [Kh 9s] (a pair of Nines)
Poweramper collected 820 from pot
*** SUMMARY ***
Total pot 820 | Rake 0 
Board [2h 9h 4h 7d 8s]
Seat 1: tunanmayo (big blind) folded before Flop
Seat 2: Mahu2021 (button) showed [Kh 9s] and lost with a pair of Nines
Seat 3: Poweramper (small blind) showed [6h 5h] and won (820) with a flush, Nine high



PokerStars Hand #248318024526: Tournament #3702083586, $1.84+$0.16 USD Hold'em No Limit - Level I (10/20) - 2024/01/16 22:07:42 CET [2024/01/16 16:07:42 ET]
Table '3702083586 1' 3-max Seat #3 is the button
Seat 1: tunanmayo (650 in chips) 
Seat 2: Mahu2021 (30 in chips) 
Seat 3: Poweramper (820 in chips) 
tunanmayo: posts small blind 10
Mahu2021: posts big blind 20
*** HOLE CARDS ***
Dealt to Mahu2021 [6c 9c]
Poweramper: raises 20 to 40
tunanmayo: folds 
Mahu2021: calls 10 and is all-in
Uncalled bet (10) returned to Poweramper
*** FLOP *** [5d Kd Qd]
*** TURN *** [5d Kd Qd] [8s]
*** RIVER *** [5d Kd Qd 8s] [7h]
*** SHOW DOWN ***
Mahu2021: shows [6c 9c] (a straight, Five to Nine)
Poweramper: shows [As 4d] (high card Ace)
Mahu2021 collected 70 from pot
*** SUMMARY ***
Total pot 70 | Rake 0 
Board [5d Kd Qd 8s 7h]
Seat 1: tunanmayo (small blind) folded before Flop
Seat 2: Mahu2021 (big blind) showed [6c 9c] and won (70) with a straight, Five to Nine
Seat 3: Poweramper (button) showed [As 4d] and lost with high card Ace



PokerStars Hand #248318031235: Tournament #3702083586, $1.84+$0.16 USD Hold'em No Limit - Level I (10/20) - 2024/01/16 22:07:59 CET [2024/01/16 16:07:59 ET]
Table '3702083586 1' 3-max Seat #1 is the button
Seat 1: tunanmayo (640 in chips) 
Seat 2: Mahu2021 (70 in chips) 
Seat 3: Poweramper (790 in chips) 
Mahu2021: posts small blind 10
Poweramper: posts big blind 20
*** HOLE CARDS ***
Dealt to Mahu2021 [Qh 2d]
tunanmayo: calls 20
Mahu2021: folds 
Poweramper: checks 
*** FLOP *** [Jd Kh Td]
Poweramper: checks 
tunanmayo: bets 20
Poweramper: folds 
Uncalled bet (20) returned to tunanmayo
tunanmayo collected 50 from pot
*** SUMMARY ***
Total pot 50 | Rake 0 
Board [Jd Kh Td]
Seat 1: tunanmayo (button) collected (50)
Seat 2: Mahu2021 (small blind) folded before Flop
Seat 3: Poweramper (big blind) folded on the Flop



PokerStars Hand #248318039185: Tournament #3702083586, $1.84+$0.16 USD Hold'em No Limit - Level I (10/20) - 2024/01/16 22:08:19 CET [2024/01/16 16:08:19 ET]
Table '3702083586 1' 3-max Seat #2 is the button
Seat 1: tunanmayo (670 in chips) 
Seat 2: Mahu2021 (60 in chips) 
Seat 3: Poweramper (770 in chips) 
Poweramper: posts small blind 10
tunanmayo: posts big blind 20
*** HOLE CARDS ***
Dealt to Mahu2021 [5s Kc]
Mahu2021: raises 40 to 60 and is all-in
Poweramper: raises 710 to 770 and is all-in
tunanmayo: folds 
Uncalled bet (710) returned to Poweramper
*** FLOP *** [2s 6s 4c]
*** TURN *** [2s 6s 4c] [8s]
*** RIVER *** [2s 6s 4c 8s] [Kh]
*** SHOW DOWN ***
Poweramper: shows [Kd Ad] (a pair of Kings)
Mahu2021: shows [5s Kc] (a pair of Kings - lower kicker)
Poweramper collected 140 from pot
Mahu2021 finished the tournament in 3rd place
*** SUMMARY ***
Total pot 140 | Rake 0 
Board [2s 6s 4c 8s Kh]
Seat 1: tunanmayo (big blind) folded before Flop
Seat 2: Mahu2021 (button) showed [5s Kc] and lost with a pair of Kings
Seat 3: Poweramper (small blind) showed [Kd Ad] and won (140) with a pair of Kings



