PokerStars Hand #250438654203: Tournament #3753122710, $1.84+$0.16 USD Hold'em No Limit - Level I (10/20) - 2024/05/11 13:15:31 CET [2024/05/11 7:15:31 ET]
Table '3753122710 1' 3-max Seat #1 is the button
Seat 1: Mahu2021 (500 in chips) 
Seat 2: jrcamilo (500 in chips) 
Seat 3: Cjohan0711 (500 in chips) 
jrcamilo: posts small blind 10
Cjohan0711: posts big blind 20
*** HOLE CARDS ***
Dealt to Mahu2021 [Ts 8h]
Mahu2021: folds 
jrcamilo: calls 10
Cjohan0711: checks 
*** FLOP *** [Ks 2d 6s]
jrcamilo: checks 
Cjohan0711: checks 
*** TURN *** [Ks 2d 6s] [4d]
jrcamilo: checks 
Cjohan0711: checks 
*** RIVER *** [Ks 2d 6s 4d] [Ac]
jrcamilo: bets 20
Cjohan0711: folds 
Uncalled bet (20) returned to jrcamilo
jrcamilo collected 40 from pot
jrcamilo: doesn't show hand 
*** SUMMARY ***
Total pot 40 | Rake 0 
Board [Ks 2d 6s 4d Ac]
Seat 1: Mahu2021 (button) folded before Flop (didn't bet)
Seat 2: jrcamilo (small blind) collected (40)
Seat 3: Cjohan0711 (big blind) folded on the River



PokerStars Hand #250438658702: Tournament #3753122710, $1.84+$0.16 USD Hold'em No Limit - Level I (10/20) - 2024/05/11 13:16:01 CET [2024/05/11 7:16:01 ET]
Table '3753122710 1' 3-max Seat #2 is the button
Seat 1: Mahu2021 (500 in chips) 
Seat 2: jrcamilo (520 in chips) 
Seat 3: Cjohan0711 (480 in chips) 
Cjohan0711: posts small blind 10
Mahu2021: posts big blind 20
*** HOLE CARDS ***
Dealt to Mahu2021 [3c Kh]
jrcamilo: folds 
Cjohan0711: folds 
Uncalled bet (10) returned to Mahu2021
Mahu2021 collected 20 from pot
Mahu2021: doesn't show hand 
*** SUMMARY ***
Total pot 20 | Rake 0 
Seat 1: Mahu2021 (big blind) collected (20)
Seat 2: jrcamilo (button) folded before Flop (didn't bet)
Seat 3: Cjohan0711 (small blind) folded before Flop



PokerStars Hand #250438659802: Tournament #3753122710, $1.84+$0.16 USD Hold'em No Limit - Level I (10/20) - 2024/05/11 13:16:08 CET [2024/05/11 7:16:08 ET]
Table '3753122710 1' 3-max Seat #3 is the button
Seat 1: Mahu2021 (510 in chips) 
Seat 2: jrcamilo (520 in chips) 
Seat 3: Cjohan0711 (470 in chips) 
Mahu2021: posts small blind 10
jrcamilo: posts big blind 20
*** HOLE CARDS ***
Dealt to Mahu2021 [Qd 4s]
Cjohan0711: folds 
Mahu2021: folds 
Uncalled bet (10) returned to jrcamilo
jrcamilo collected 20 from pot
jrcamilo: doesn't show hand 
*** SUMMARY ***
Total pot 20 | Rake 0 
Seat 1: Mahu2021 (small blind) folded before Flop
Seat 2: jrcamilo (big blind) collected (20)
Seat 3: Cjohan0711 (button) folded before Flop (didn't bet)



PokerStars Hand #250438662388: Tournament #3753122710, $1.84+$0.16 USD Hold'em No Limit - Level I (10/20) - 2024/05/11 13:16:25 CET [2024/05/11 7:16:25 ET]
Table '3753122710 1' 3-max Seat #1 is the button
Seat 1: Mahu2021 (500 in chips) 
Seat 2: jrcamilo (530 in chips) 
Seat 3: Cjohan0711 (470 in chips) 
jrcamilo: posts small blind 10
Cjohan0711: posts big blind 20
*** HOLE CARDS ***
Dealt to Mahu2021 [Ad 3h]
Mahu2021: raises 20 to 40
jrcamilo: folds 
Cjohan0711: calls 20
*** FLOP *** [Td Ah 5h]
Cjohan0711: checks 
Mahu2021: bets 40
Cjohan0711: folds 
Uncalled bet (40) returned to Mahu2021
Mahu2021 collected 90 from pot
Mahu2021: doesn't show hand 
*** SUMMARY ***
Total pot 90 | Rake 0 
Board [Td Ah 5h]
Seat 1: Mahu2021 (button) collected (90)
Seat 2: jrcamilo (small blind) folded before Flop
Seat 3: Cjohan0711 (big blind) folded on the Flop



PokerStars Hand #250438664704: Tournament #3753122710, $1.84+$0.16 USD Hold'em No Limit - Level I (10/20) - 2024/05/11 13:16:40 CET [2024/05/11 7:16:40 ET]
Table '3753122710 1' 3-max Seat #2 is the button
Seat 1: Mahu2021 (550 in chips) 
Seat 2: jrcamilo (520 in chips) 
Seat 3: Cjohan0711 (430 in chips) 
Cjohan0711: posts small blind 10
Mahu2021: posts big blind 20
*** HOLE CARDS ***
Dealt to Mahu2021 [3d Ks]
jrcamilo: raises 20 to 40
Cjohan0711: calls 30
Mahu2021: folds 
*** FLOP *** [9h Td 8c]
Cjohan0711: checks 
jrcamilo: checks 
*** TURN *** [9h Td 8c] [Kc]
Cjohan0711: bets 100
jrcamilo: folds 
Uncalled bet (100) returned to Cjohan0711
Cjohan0711 collected 100 from pot
*** SUMMARY ***
Total pot 100 | Rake 0 
Board [9h Td 8c Kc]
Seat 1: Mahu2021 (big blind) folded before Flop
Seat 2: jrcamilo (button) folded on the Turn
Seat 3: Cjohan0711 (small blind) collected (100)



PokerStars Hand #250438668275: Tournament #3753122710, $1.84+$0.16 USD Hold'em No Limit - Level I (10/20) - 2024/05/11 13:17:04 CET [2024/05/11 7:17:04 ET]
Table '3753122710 1' 3-max Seat #3 is the button
Seat 1: Mahu2021 (530 in chips) 
Seat 2: jrcamilo (480 in chips) 
Seat 3: Cjohan0711 (490 in chips) 
Mahu2021: posts small blind 10
jrcamilo: posts big blind 20
*** HOLE CARDS ***
Dealt to Mahu2021 [As 6h]
Cjohan0711: folds 
Mahu2021: raises 20 to 40
jrcamilo: raises 40 to 80
Mahu2021: calls 40
*** FLOP *** [4s Kc 9d]
Mahu2021: checks 
jrcamilo: bets 40
Mahu2021: calls 40
*** TURN *** [4s Kc 9d] [9h]
Mahu2021: checks 
jrcamilo: bets 40
Mahu2021: raises 100 to 140
jrcamilo: calls 100
*** RIVER *** [4s Kc 9d 9h] [9c]
Mahu2021: bets 270 and is all-in
jrcamilo: calls 220 and is all-in
Uncalled bet (50) returned to Mahu2021
*** SHOW DOWN ***
Mahu2021: shows [As 6h] (three of a kind, Nines)
jrcamilo: shows [8h 8d] (a full house, Nines full of Eights)
jrcamilo collected 960 from pot
*** SUMMARY ***
Total pot 960 | Rake 0 
Board [4s Kc 9d 9h 9c]
Seat 1: Mahu2021 (small blind) showed [As 6h] and lost with three of a kind, Nines
Seat 2: jrcamilo (big blind) showed [8h 8d] and won (960) with a full house, Nines full of Eights
Seat 3: Cjohan0711 (button) folded before Flop (didn't bet)



PokerStars Hand #250438673176: Tournament #3753122710, $1.84+$0.16 USD Hold'em No Limit - Level II (15/30) - 2024/05/11 13:17:37 CET [2024/05/11 7:17:37 ET]
Table '3753122710 1' 3-max Seat #1 is the button
Seat 1: Mahu2021 (50 in chips) 
Seat 2: jrcamilo (960 in chips) 
Seat 3: Cjohan0711 (490 in chips) 
jrcamilo: posts small blind 15
Cjohan0711: posts big blind 30
*** HOLE CARDS ***
Dealt to Mahu2021 [Jc 9d]
Mahu2021: raises 20 to 50 and is all-in
jrcamilo: calls 35
Cjohan0711: calls 20
*** FLOP *** [Th 4d Qs]
jrcamilo: bets 150
Cjohan0711: folds 
Uncalled bet (150) returned to jrcamilo
*** TURN *** [Th 4d Qs] [5d]
*** RIVER *** [Th 4d Qs 5d] [Jd]
*** SHOW DOWN ***
jrcamilo: shows [8c Qc] (a pair of Queens)
Mahu2021: shows [Jc 9d] (a pair of Jacks)
jrcamilo collected 150 from pot
Mahu2021 finished the tournament in 3rd place
*** SUMMARY ***
Total pot 150 | Rake 0 
Board [Th 4d Qs 5d Jd]
Seat 1: Mahu2021 (button) showed [Jc 9d] and lost with a pair of Jacks
Seat 2: jrcamilo (small blind) showed [8c Qc] and won (150) with a pair of Queens
Seat 3: Cjohan0711 (big blind) folded on the Flop



