PokerStars Hand #244662612223: Tournament #3613478797, $0.92+$0.08 USD Hold'em No Limit - Level I (10/20) - 2023/07/06 21:06:11 CET [2023/07/06 15:06:11 ET]
Table '3613478797 1' 3-max Seat #1 is the button
Seat 1: MindOverMoney (500 in chips) 
Seat 2: havermarc (500 in chips) 
Seat 3: Mahu2021 (500 in chips) 
havermarc: posts small blind 10
Mahu2021: posts big blind 20
*** HOLE CARDS ***
Dealt to Mahu2021 [Ts Qh]
MindOverMoney: folds 
havermarc: calls 10
Mahu2021: checks 
*** FLOP *** [7h 6s 8c]
havermarc: checks 
Mahu2021: bets 20
havermarc: calls 20
*** TURN *** [7h 6s 8c] [Js]
havermarc: checks 
Mahu2021: checks 
*** RIVER *** [7h 6s 8c Js] [2s]
havermarc: checks 
Mahu2021: checks 
*** SHOW DOWN ***
havermarc: shows [6h 9s] (a pair of Sixes)
Mahu2021: mucks hand 
havermarc collected 80 from pot
*** SUMMARY ***
Total pot 80 | Rake 0 
Board [7h 6s 8c Js 2s]
Seat 1: MindOverMoney (button) folded before Flop (didn't bet)
Seat 2: havermarc (small blind) showed [6h 9s] and won (80) with a pair of Sixes
Seat 3: Mahu2021 (big blind) mucked [Ts Qh]



PokerStars Hand #244662619528: Tournament #3613478797, $0.92+$0.08 USD Hold'em No Limit - Level I (10/20) - 2023/07/06 21:06:32 CET [2023/07/06 15:06:32 ET]
Table '3613478797 1' 3-max Seat #2 is the button
Seat 1: MindOverMoney (500 in chips) 
Seat 2: havermarc (540 in chips) 
Seat 3: Mahu2021 (460 in chips) 
Mahu2021: posts small blind 10
MindOverMoney: posts big blind 20
*** HOLE CARDS ***
Dealt to Mahu2021 [Th 9d]
havermarc: folds 
Mahu2021: calls 10
MindOverMoney: checks 
*** FLOP *** [9s Ac 7c]
Mahu2021: checks 
MindOverMoney: bets 20
Mahu2021: calls 20
*** TURN *** [9s Ac 7c] [5d]
Mahu2021: checks 
MindOverMoney: checks 
*** RIVER *** [9s Ac 7c 5d] [Td]
Mahu2021: bets 80
MindOverMoney: folds 
Uncalled bet (80) returned to Mahu2021
Mahu2021 collected 80 from pot
Mahu2021: doesn't show hand 
*** SUMMARY ***
Total pot 80 | Rake 0 
Board [9s Ac 7c 5d Td]
Seat 1: MindOverMoney (big blind) folded on the River
Seat 2: havermarc (button) folded before Flop (didn't bet)
Seat 3: Mahu2021 (small blind) collected (80)



PokerStars Hand #244662631709: Tournament #3613478797, $0.92+$0.08 USD Hold'em No Limit - Level I (10/20) - 2023/07/06 21:07:06 CET [2023/07/06 15:07:06 ET]
Table '3613478797 1' 3-max Seat #3 is the button
Seat 1: MindOverMoney (460 in chips) 
Seat 2: havermarc (540 in chips) 
Seat 3: Mahu2021 (500 in chips) 
MindOverMoney: posts small blind 10
havermarc: posts big blind 20
*** HOLE CARDS ***
Dealt to Mahu2021 [5s 8s]
Mahu2021: folds 
MindOverMoney: calls 10
havermarc: checks 
*** FLOP *** [Kh 6d 4s]
MindOverMoney: checks 
havermarc: checks 
*** TURN *** [Kh 6d 4s] [Th]
MindOverMoney: checks 
havermarc: bets 20
MindOverMoney: folds 
Uncalled bet (20) returned to havermarc
havermarc collected 40 from pot
*** SUMMARY ***
Total pot 40 | Rake 0 
Board [Kh 6d 4s Th]
Seat 1: MindOverMoney (small blind) folded on the Turn
Seat 2: havermarc (big blind) collected (40)
Seat 3: Mahu2021 (button) folded before Flop (didn't bet)



PokerStars Hand #244662639107: Tournament #3613478797, $0.92+$0.08 USD Hold'em No Limit - Level I (10/20) - 2023/07/06 21:07:28 CET [2023/07/06 15:07:28 ET]
Table '3613478797 1' 3-max Seat #1 is the button
Seat 1: MindOverMoney (440 in chips) 
Seat 2: havermarc (560 in chips) 
Seat 3: Mahu2021 (500 in chips) 
havermarc: posts small blind 10
Mahu2021: posts big blind 20
*** HOLE CARDS ***
Dealt to Mahu2021 [7s 7c]
MindOverMoney: folds 
havermarc: calls 10
Mahu2021: raises 40 to 60
havermarc: calls 40
*** FLOP *** [Ac 8s Kc]
havermarc: checks 
Mahu2021: bets 60
havermarc: calls 60
*** TURN *** [Ac 8s Kc] [Qs]
havermarc: checks 
Mahu2021: checks 
*** RIVER *** [Ac 8s Kc Qs] [Th]
havermarc: bets 80
Mahu2021: folds 
Uncalled bet (80) returned to havermarc
havermarc collected 240 from pot
*** SUMMARY ***
Total pot 240 | Rake 0 
Board [Ac 8s Kc Qs Th]
Seat 1: MindOverMoney (button) folded before Flop (didn't bet)
Seat 2: havermarc (small blind) collected (240)
Seat 3: Mahu2021 (big blind) folded on the River



PokerStars Hand #244662648269: Tournament #3613478797, $0.92+$0.08 USD Hold'em No Limit - Level I (10/20) - 2023/07/06 21:07:54 CET [2023/07/06 15:07:54 ET]
Table '3613478797 1' 3-max Seat #2 is the button
Seat 1: MindOverMoney (440 in chips) 
Seat 2: havermarc (680 in chips) 
Seat 3: Mahu2021 (380 in chips) 
Mahu2021: posts small blind 10
MindOverMoney: posts big blind 20
*** HOLE CARDS ***
Dealt to Mahu2021 [5d 9c]
havermarc: folds 
Mahu2021: folds 
Uncalled bet (10) returned to MindOverMoney
MindOverMoney collected 20 from pot
MindOverMoney: doesn't show hand 
*** SUMMARY ***
Total pot 20 | Rake 0 
Seat 1: MindOverMoney (big blind) collected (20)
Seat 2: havermarc (button) folded before Flop (didn't bet)
Seat 3: Mahu2021 (small blind) folded before Flop



PokerStars Hand #244662650257: Tournament #3613478797, $0.92+$0.08 USD Hold'em No Limit - Level I (10/20) - 2023/07/06 21:07:59 CET [2023/07/06 15:07:59 ET]
Table '3613478797 1' 3-max Seat #3 is the button
Seat 1: MindOverMoney (450 in chips) 
Seat 2: havermarc (680 in chips) 
Seat 3: Mahu2021 (370 in chips) 
MindOverMoney: posts small blind 10
havermarc: posts big blind 20
*** HOLE CARDS ***
Dealt to Mahu2021 [9d 7d]
Mahu2021: raises 20 to 40
MindOverMoney: folds 
havermarc: calls 20
*** FLOP *** [8s 5h 2d]
havermarc: checks 
Mahu2021: checks 
*** TURN *** [8s 5h 2d] [Jc]
havermarc: bets 60
Mahu2021: calls 60
*** RIVER *** [8s 5h 2d Jc] [9h]
havermarc: bets 60
Mahu2021: raises 210 to 270 and is all-in
havermarc: calls 210
*** SHOW DOWN ***
Mahu2021: shows [9d 7d] (a pair of Nines)
havermarc: shows [8c 5s] (two pair, Eights and Fives)
havermarc collected 750 from pot
Mahu2021 finished the tournament in 3rd place
*** SUMMARY ***
Total pot 750 | Rake 0 
Board [8s 5h 2d Jc 9h]
Seat 1: MindOverMoney (small blind) folded before Flop
Seat 2: havermarc (big blind) showed [8c 5s] and won (750) with two pair, Eights and Fives
Seat 3: Mahu2021 (button) showed [9d 7d] and lost with a pair of Nines



