PokerStars Hand #246978106789: Tournament #3669579251, $4.60+$0.40 USD Hold'em No Limit - Level I (10/20) - 2023/11/07 15:48:42 CET [2023/11/07 9:48:42 ET]
Table '3669579251 1' 3-max Seat #1 is the button
Seat 1: 1gofa (500 in chips) 
Seat 2: estee15 (500 in chips) 
Seat 3: Mahu2021 (500 in chips) 
estee15: posts small blind 10
Mahu2021: posts big blind 20
*** HOLE CARDS ***
Dealt to Mahu2021 [9s 3h]
1gofa: raises 20 to 40
estee15: folds 
Mahu2021: folds 
Uncalled bet (20) returned to 1gofa
1gofa collected 50 from pot
1gofa: doesn't show hand 
*** SUMMARY ***
Total pot 50 | Rake 0 
Seat 1: 1gofa (button) collected (50)
Seat 2: estee15 (small blind) folded before Flop
Seat 3: Mahu2021 (big blind) folded before Flop



PokerStars Hand #246978108696: Tournament #3669579251, $4.60+$0.40 USD Hold'em No Limit - Level I (10/20) - 2023/11/07 15:48:51 CET [2023/11/07 9:48:51 ET]
Table '3669579251 1' 3-max Seat #2 is the button
Seat 1: 1gofa (530 in chips) 
Seat 2: estee15 (490 in chips) 
Seat 3: Mahu2021 (480 in chips) 
Mahu2021: posts small blind 10
1gofa: posts big blind 20
*** HOLE CARDS ***
Dealt to Mahu2021 [7h Ad]
estee15: folds 
Mahu2021: raises 40 to 60
1gofa: folds 
Uncalled bet (40) returned to Mahu2021
Mahu2021 collected 40 from pot
Mahu2021: doesn't show hand 
*** SUMMARY ***
Total pot 40 | Rake 0 
Seat 1: 1gofa (big blind) folded before Flop
Seat 2: estee15 (button) folded before Flop (didn't bet)
Seat 3: Mahu2021 (small blind) collected (40)



PokerStars Hand #246978110386: Tournament #3669579251, $4.60+$0.40 USD Hold'em No Limit - Level I (10/20) - 2023/11/07 15:48:59 CET [2023/11/07 9:48:59 ET]
Table '3669579251 1' 3-max Seat #3 is the button
Seat 1: 1gofa (510 in chips) 
Seat 2: estee15 (490 in chips) 
Seat 3: Mahu2021 (500 in chips) 
1gofa: posts small blind 10
estee15: posts big blind 20
*** HOLE CARDS ***
Dealt to Mahu2021 [3s 7d]
Mahu2021: folds 
1gofa: raises 30 to 50
estee15: calls 30
*** FLOP *** [Ts 4h 9d]
1gofa: bets 25
estee15: raises 415 to 440 and is all-in
1gofa: calls 415
*** TURN *** [Ts 4h 9d] [5d]
*** RIVER *** [Ts 4h 9d 5d] [Ah]
*** SHOW DOWN ***
1gofa: shows [Jc Qh] (high card Ace)
estee15: shows [Th Js] (a pair of Tens)
estee15 collected 980 from pot
*** SUMMARY ***
Total pot 980 | Rake 0 
Board [Ts 4h 9d 5d Ah]
Seat 1: 1gofa (small blind) showed [Jc Qh] and lost with high card Ace
Seat 2: estee15 (big blind) showed [Th Js] and won (980) with a pair of Tens
Seat 3: Mahu2021 (button) folded before Flop (didn't bet)



PokerStars Hand #246978115579: Tournament #3669579251, $4.60+$0.40 USD Hold'em No Limit - Level I (10/20) - 2023/11/07 15:49:23 CET [2023/11/07 9:49:23 ET]
Table '3669579251 1' 3-max Seat #1 is the button
Seat 1: 1gofa (20 in chips) 
Seat 2: estee15 (980 in chips) 
Seat 3: Mahu2021 (500 in chips) 
estee15: posts small blind 10
Mahu2021: posts big blind 20
*** HOLE CARDS ***
Dealt to Mahu2021 [Kh 5h]
1gofa: folds 
estee15: calls 10
Mahu2021: checks 
*** FLOP *** [Qc Ad 7h]
estee15: checks 
Mahu2021: bets 20
estee15: calls 20
*** TURN *** [Qc Ad 7h] [6h]
estee15: checks 
Mahu2021: bets 80
estee15: folds 
Uncalled bet (80) returned to Mahu2021
Mahu2021 collected 80 from pot
Mahu2021: doesn't show hand 
*** SUMMARY ***
Total pot 80 | Rake 0 
Board [Qc Ad 7h 6h]
Seat 1: 1gofa (button) folded before Flop (didn't bet)
Seat 2: estee15 (small blind) folded on the Turn
Seat 3: Mahu2021 (big blind) collected (80)



PokerStars Hand #246978123611: Tournament #3669579251, $4.60+$0.40 USD Hold'em No Limit - Level I (10/20) - 2023/11/07 15:50:00 CET [2023/11/07 9:50:00 ET]
Table '3669579251 1' 3-max Seat #2 is the button
Seat 1: 1gofa (20 in chips) 
Seat 2: estee15 (940 in chips) 
Seat 3: Mahu2021 (540 in chips) 
Mahu2021: posts small blind 10
1gofa: posts big blind 20 and is all-in
*** HOLE CARDS ***
Dealt to Mahu2021 [Ac 8c]
estee15: calls 20
Mahu2021: calls 10
*** FLOP *** [3c 6c 4c]
Mahu2021: checks 
estee15: checks 
*** TURN *** [3c 6c 4c] [Kd]
Mahu2021: checks 
estee15: checks 
*** RIVER *** [3c 6c 4c Kd] [2h]
Mahu2021: bets 60
estee15: folds 
Uncalled bet (60) returned to Mahu2021
*** SHOW DOWN ***
Mahu2021: shows [Ac 8c] (a flush, Ace high)
1gofa: shows [5d Qc] (a straight, Deuce to Six)
Mahu2021 collected 60 from pot
1gofa finished the tournament in 3rd place
*** SUMMARY ***
Total pot 60 | Rake 0 
Board [3c 6c 4c Kd 2h]
Seat 1: 1gofa (big blind) showed [5d Qc] and lost with a straight, Deuce to Six
Seat 2: estee15 (button) folded on the River
Seat 3: Mahu2021 (small blind) showed [Ac 8c] and won (60) with a flush, Ace high



PokerStars Hand #246978128365: Tournament #3669579251, $4.60+$0.40 USD Hold'em No Limit - Level I (10/20) - 2023/11/07 15:50:21 CET [2023/11/07 9:50:21 ET]
Table '3669579251 1' 3-max Seat #3 is the button
Seat 2: estee15 (920 in chips) 
Seat 3: Mahu2021 (580 in chips) 
Mahu2021: posts small blind 10
estee15: posts big blind 20
*** HOLE CARDS ***
Dealt to Mahu2021 [5c Jc]
Mahu2021: raises 20 to 40
estee15: raises 100 to 140
Mahu2021: calls 100
*** FLOP *** [8h Tc Jh]
estee15: checks 
Mahu2021: bets 440 and is all-in
estee15: calls 440
*** TURN *** [8h Tc Jh] [Qd]
*** RIVER *** [8h Tc Jh Qd] [8s]
*** SHOW DOWN ***
estee15: shows [Qs Ah] (two pair, Queens and Eights)
Mahu2021: shows [5c Jc] (two pair, Jacks and Eights)
estee15 collected 1160 from pot
Mahu2021 finished the tournament in 2nd place
estee15 wins the tournament and receives $10.00 - congratulations!
*** SUMMARY ***
Total pot 1160 | Rake 0 
Board [8h Tc Jh Qd 8s]
Seat 2: estee15 (big blind) showed [Qs Ah] and won (1160) with two pair, Queens and Eights
Seat 3: Mahu2021 (button) (small blind) showed [5c Jc] and lost with two pair, Jacks and Eights



