PokerStars Hand #243233002643: Tournament #3580764378, $0.92+$0.08 USD Hold'em No Limit - Level I (10/20) - 2023/04/21 21:41:33 CET [2023/04/21 15:41:33 ET]
Table '3580764378 1' 3-max Seat #1 is the button
Seat 1: Mahu2021 (500 in chips) 
Seat 2: MarcaoDaFiel (500 in chips) 
Seat 3: jack1asc (500 in chips) 
MarcaoDaFiel: posts small blind 10
jack1asc: posts big blind 20
*** HOLE CARDS ***
Dealt to Mahu2021 [5s Kh]
Mahu2021: folds 
MarcaoDaFiel: calls 10
jack1asc: checks 
*** FLOP *** [Th 6s 6c]
MarcaoDaFiel: bets 40
jack1asc: calls 40
*** TURN *** [Th 6s 6c] [Kc]
MarcaoDaFiel: checks 
jack1asc: checks 
*** RIVER *** [Th 6s 6c Kc] [8c]
MarcaoDaFiel: checks 
jack1asc: bets 20
MarcaoDaFiel: folds 
Uncalled bet (20) returned to jack1asc
jack1asc collected 120 from pot
*** SUMMARY ***
Total pot 120 | Rake 0 
Board [Th 6s 6c Kc 8c]
Seat 1: Mahu2021 (button) folded before Flop (didn't bet)
Seat 2: MarcaoDaFiel (small blind) folded on the River
Seat 3: jack1asc (big blind) collected (120)



PokerStars Hand #243233010145: Tournament #3580764378, $0.92+$0.08 USD Hold'em No Limit - Level I (10/20) - 2023/04/21 21:41:52 CET [2023/04/21 15:41:52 ET]
Table '3580764378 1' 3-max Seat #2 is the button
Seat 1: Mahu2021 (500 in chips) 
Seat 2: MarcaoDaFiel (440 in chips) 
Seat 3: jack1asc (560 in chips) 
jack1asc: posts small blind 10
Mahu2021: posts big blind 20
*** HOLE CARDS ***
Dealt to Mahu2021 [Jh 3d]
MarcaoDaFiel: raises 50 to 70
jack1asc: folds 
Mahu2021: folds 
Uncalled bet (50) returned to MarcaoDaFiel
MarcaoDaFiel collected 50 from pot
MarcaoDaFiel: doesn't show hand 
*** SUMMARY ***
Total pot 50 | Rake 0 
Seat 1: Mahu2021 (big blind) folded before Flop
Seat 2: MarcaoDaFiel (button) collected (50)
Seat 3: jack1asc (small blind) folded before Flop



PokerStars Hand #243233012968: Tournament #3580764378, $0.92+$0.08 USD Hold'em No Limit - Level I (10/20) - 2023/04/21 21:41:59 CET [2023/04/21 15:41:59 ET]
Table '3580764378 1' 3-max Seat #3 is the button
Seat 1: Mahu2021 (480 in chips) 
Seat 2: MarcaoDaFiel (470 in chips) 
Seat 3: jack1asc (550 in chips) 
Mahu2021: posts small blind 10
MarcaoDaFiel: posts big blind 20
*** HOLE CARDS ***
Dealt to Mahu2021 [2d 7d]
jack1asc: raises 20 to 40
Mahu2021: folds 
MarcaoDaFiel: raises 90 to 130
jack1asc: calls 90
*** FLOP *** [2s 6d 9s]
MarcaoDaFiel: bets 340 and is all-in
jack1asc: calls 340
*** TURN *** [2s 6d 9s] [7h]
*** RIVER *** [2s 6d 9s 7h] [Js]
*** SHOW DOWN ***
MarcaoDaFiel: shows [9h Ac] (a pair of Nines)
jack1asc: shows [Kh Qc] (high card King)
MarcaoDaFiel collected 950 from pot
*** SUMMARY ***
Total pot 950 | Rake 0 
Board [2s 6d 9s 7h Js]
Seat 1: Mahu2021 (small blind) folded before Flop
Seat 2: MarcaoDaFiel (big blind) showed [9h Ac] and won (950) with a pair of Nines
Seat 3: jack1asc (button) showed [Kh Qc] and lost with high card King



PokerStars Hand #243233020478: Tournament #3580764378, $0.92+$0.08 USD Hold'em No Limit - Level I (10/20) - 2023/04/21 21:42:18 CET [2023/04/21 15:42:18 ET]
Table '3580764378 1' 3-max Seat #1 is the button
Seat 1: Mahu2021 (470 in chips) 
Seat 2: MarcaoDaFiel (950 in chips) 
Seat 3: jack1asc (80 in chips) 
MarcaoDaFiel: posts small blind 10
jack1asc: posts big blind 20
*** HOLE CARDS ***
Dealt to Mahu2021 [Th 3h]
Mahu2021: folds 
MarcaoDaFiel: raises 40 to 60
jack1asc: raises 20 to 80 and is all-in
MarcaoDaFiel: calls 20
*** FLOP *** [Qc Td 3c]
*** TURN *** [Qc Td 3c] [4s]
*** RIVER *** [Qc Td 3c 4s] [Qd]
*** SHOW DOWN ***
MarcaoDaFiel: shows [8h 7h] (a pair of Queens)
jack1asc: shows [9d 4h] (two pair, Queens and Fours)
jack1asc collected 160 from pot
*** SUMMARY ***
Total pot 160 | Rake 0 
Board [Qc Td 3c 4s Qd]
Seat 1: Mahu2021 (button) folded before Flop (didn't bet)
Seat 2: MarcaoDaFiel (small blind) showed [8h 7h] and lost with a pair of Queens
Seat 3: jack1asc (big blind) showed [9d 4h] and won (160) with two pair, Queens and Fours



PokerStars Hand #243233026970: Tournament #3580764378, $0.92+$0.08 USD Hold'em No Limit - Level I (10/20) - 2023/04/21 21:42:33 CET [2023/04/21 15:42:33 ET]
Table '3580764378 1' 3-max Seat #2 is the button
Seat 1: Mahu2021 (470 in chips) 
Seat 2: MarcaoDaFiel (870 in chips) 
Seat 3: jack1asc (160 in chips) 
jack1asc: posts small blind 10
Mahu2021: posts big blind 20
*** HOLE CARDS ***
Dealt to Mahu2021 [9d Ks]
MarcaoDaFiel: folds 
jack1asc: raises 20 to 40
Mahu2021: calls 20
*** FLOP *** [8d 9c Jc]
jack1asc: bets 20
Mahu2021: raises 410 to 430 and is all-in
jack1asc: calls 100 and is all-in
Uncalled bet (310) returned to Mahu2021
*** TURN *** [8d 9c Jc] [Kc]
*** RIVER *** [8d 9c Jc Kc] [As]
*** SHOW DOWN ***
jack1asc: shows [Ah Qh] (a pair of Aces)
Mahu2021: shows [9d Ks] (two pair, Kings and Nines)
Mahu2021 collected 320 from pot
jack1asc finished the tournament in 3rd place
*** SUMMARY ***
Total pot 320 | Rake 0 
Board [8d 9c Jc Kc As]
Seat 1: Mahu2021 (big blind) showed [9d Ks] and won (320) with two pair, Kings and Nines
Seat 2: MarcaoDaFiel (button) folded before Flop (didn't bet)
Seat 3: jack1asc (small blind) showed [Ah Qh] and lost with a pair of Aces



PokerStars Hand #243233035858: Tournament #3580764378, $0.92+$0.08 USD Hold'em No Limit - Level I (10/20) - 2023/04/21 21:42:56 CET [2023/04/21 15:42:56 ET]
Table '3580764378 1' 3-max Seat #1 is the button
Seat 1: Mahu2021 (630 in chips) 
Seat 2: MarcaoDaFiel (870 in chips) 
Mahu2021: posts small blind 10
MarcaoDaFiel: posts big blind 20
*** HOLE CARDS ***
Dealt to Mahu2021 [4d Qd]
Mahu2021: calls 10
MarcaoDaFiel: raises 60 to 80
Mahu2021: folds 
Uncalled bet (60) returned to MarcaoDaFiel
MarcaoDaFiel collected 40 from pot
MarcaoDaFiel: doesn't show hand 
*** SUMMARY ***
Total pot 40 | Rake 0 
Seat 1: Mahu2021 (button) (small blind) folded before Flop
Seat 2: MarcaoDaFiel (big blind) collected (40)



PokerStars Hand #243233039772: Tournament #3580764378, $0.92+$0.08 USD Hold'em No Limit - Level I (10/20) - 2023/04/21 21:43:05 CET [2023/04/21 15:43:05 ET]
Table '3580764378 1' 3-max Seat #2 is the button
Seat 1: Mahu2021 (610 in chips) 
Seat 2: MarcaoDaFiel (890 in chips) 
MarcaoDaFiel: posts small blind 10
Mahu2021: posts big blind 20
*** HOLE CARDS ***
Dealt to Mahu2021 [Qc 8s]
MarcaoDaFiel: calls 10
Mahu2021: checks 
*** FLOP *** [Ts 8h 2d]
Mahu2021: checks 
MarcaoDaFiel: checks 
*** TURN *** [Ts 8h 2d] [4s]
Mahu2021: checks 
MarcaoDaFiel: checks 
*** RIVER *** [Ts 8h 2d 4s] [6h]
Mahu2021: checks 
MarcaoDaFiel: bets 120
Mahu2021: calls 120
*** SHOW DOWN ***
MarcaoDaFiel: shows [8d Tc] (two pair, Tens and Eights)
Mahu2021: mucks hand 
MarcaoDaFiel collected 280 from pot
*** SUMMARY ***
Total pot 280 | Rake 0 
Board [Ts 8h 2d 4s 6h]
Seat 1: Mahu2021 (big blind) mucked [Qc 8s]
Seat 2: MarcaoDaFiel (button) (small blind) showed [8d Tc] and won (280) with two pair, Tens and Eights



PokerStars Hand #243233047083: Tournament #3580764378, $0.92+$0.08 USD Hold'em No Limit - Level I (10/20) - 2023/04/21 21:43:23 CET [2023/04/21 15:43:23 ET]
Table '3580764378 1' 3-max Seat #1 is the button
Seat 1: Mahu2021 (470 in chips) 
Seat 2: MarcaoDaFiel (1030 in chips) 
Mahu2021: posts small blind 10
MarcaoDaFiel: posts big blind 20
*** HOLE CARDS ***
Dealt to Mahu2021 [6d Ad]
Mahu2021: raises 40 to 60
MarcaoDaFiel: raises 970 to 1030 and is all-in
Mahu2021: calls 410 and is all-in
Uncalled bet (560) returned to MarcaoDaFiel
*** FLOP *** [8h 4s Ks]
*** TURN *** [8h 4s Ks] [4d]
*** RIVER *** [8h 4s Ks 4d] [3d]
*** SHOW DOWN ***
MarcaoDaFiel: shows [Qc Ah] (a pair of Fours)
Mahu2021: shows [6d Ad] (a pair of Fours - lower kicker)
MarcaoDaFiel collected 940 from pot
Mahu2021 finished the tournament in 2nd place
MarcaoDaFiel wins the tournament and receives $3.00 - congratulations!
*** SUMMARY ***
Total pot 940 | Rake 0 
Board [8h 4s Ks 4d 3d]
Seat 1: Mahu2021 (button) (small blind) showed [6d Ad] and lost with a pair of Fours
Seat 2: MarcaoDaFiel (big blind) showed [Qc Ah] and won (940) with a pair of Fours



