PokerStars Hand #246977516821: Tournament #3669561558, $4.60+$0.40 USD Hold'em No Limit - Level I (10/20) - 2023/11/07 15:01:39 CET [2023/11/07 9:01:39 ET]
Table '3669561558 1' 3-max Seat #1 is the button
Seat 1: Mahu2021 (500 in chips) 
Seat 2: Riddler1988 (500 in chips) 
Seat 3: ayjay62 (500 in chips) 
Riddler1988: posts small blind 10
ayjay62: posts big blind 20
*** HOLE CARDS ***
Dealt to Mahu2021 [3c 2d]
Mahu2021: folds 
Riddler1988: raises 30 to 50
ayjay62: folds 
Uncalled bet (30) returned to Riddler1988
Riddler1988 collected 40 from pot
Riddler1988: doesn't show hand 
*** SUMMARY ***
Total pot 40 | Rake 0 
Seat 1: Mahu2021 (button) folded before Flop (didn't bet)
Seat 2: Riddler1988 (small blind) collected (40)
Seat 3: ayjay62 (big blind) folded before Flop



PokerStars Hand #246977519425: Tournament #3669561558, $4.60+$0.40 USD Hold'em No Limit - Level I (10/20) - 2023/11/07 15:01:53 CET [2023/11/07 9:01:53 ET]
Table '3669561558 1' 3-max Seat #2 is the button
Seat 1: Mahu2021 (500 in chips) 
Seat 2: Riddler1988 (520 in chips) 
Seat 3: ayjay62 (480 in chips) 
ayjay62: posts small blind 10
Mahu2021: posts big blind 20
*** HOLE CARDS ***
Dealt to Mahu2021 [3d 5c]
Riddler1988: raises 20 to 40
ayjay62: folds 
Mahu2021: folds 
Uncalled bet (20) returned to Riddler1988
Riddler1988 collected 50 from pot
Riddler1988: doesn't show hand 
*** SUMMARY ***
Total pot 50 | Rake 0 
Seat 1: Mahu2021 (big blind) folded before Flop
Seat 2: Riddler1988 (button) collected (50)
Seat 3: ayjay62 (small blind) folded before Flop



PokerStars Hand #246977520822: Tournament #3669561558, $4.60+$0.40 USD Hold'em No Limit - Level I (10/20) - 2023/11/07 15:01:59 CET [2023/11/07 9:01:59 ET]
Table '3669561558 1' 3-max Seat #3 is the button
Seat 1: Mahu2021 (480 in chips) 
Seat 2: Riddler1988 (550 in chips) 
Seat 3: ayjay62 (470 in chips) 
Mahu2021: posts small blind 10
Riddler1988: posts big blind 20
*** HOLE CARDS ***
Dealt to Mahu2021 [As 9d]
ayjay62: folds 
Mahu2021: raises 20 to 40
Riddler1988: calls 20
*** FLOP *** [Th Js 6d]
Mahu2021: checks 
Riddler1988: checks 
*** TURN *** [Th Js 6d] [5h]
Mahu2021: checks 
Riddler1988: bets 20
Mahu2021: calls 20
*** RIVER *** [Th Js 6d 5h] [Qc]
Mahu2021: checks 
Riddler1988: checks 
*** SHOW DOWN ***
Mahu2021: shows [As 9d] (high card Ace)
Riddler1988: mucks hand 
Mahu2021 collected 120 from pot
*** SUMMARY ***
Total pot 120 | Rake 0 
Board [Th Js 6d 5h Qc]
Seat 1: Mahu2021 (small blind) showed [As 9d] and won (120) with high card Ace
Seat 2: Riddler1988 (big blind) mucked [3d Ad]
Seat 3: ayjay62 (button) folded before Flop (didn't bet)



PokerStars Hand #246977527640: Tournament #3669561558, $4.60+$0.40 USD Hold'em No Limit - Level I (10/20) - 2023/11/07 15:02:33 CET [2023/11/07 9:02:33 ET]
Table '3669561558 1' 3-max Seat #1 is the button
Seat 1: Mahu2021 (540 in chips) 
Seat 2: Riddler1988 (490 in chips) 
Seat 3: ayjay62 (470 in chips) 
Riddler1988: posts small blind 10
ayjay62: posts big blind 20
*** HOLE CARDS ***
Dealt to Mahu2021 [7d Th]
Mahu2021: folds 
Riddler1988: calls 10
ayjay62: checks 
*** FLOP *** [9c 8d Jd]
Riddler1988: checks 
ayjay62: checks 
*** TURN *** [9c 8d Jd] [Ah]
Riddler1988: bets 20
ayjay62: calls 20
*** RIVER *** [9c 8d Jd Ah] [3h]
Riddler1988: bets 40
ayjay62: calls 40
*** SHOW DOWN ***
Riddler1988: shows [2d Ts] (high card Ace)
ayjay62: shows [Ac 7h] (a pair of Aces)
ayjay62 collected 160 from pot
*** SUMMARY ***
Total pot 160 | Rake 0 
Board [9c 8d Jd Ah 3h]
Seat 1: Mahu2021 (button) folded before Flop (didn't bet)
Seat 2: Riddler1988 (small blind) showed [2d Ts] and lost with high card Ace
Seat 3: ayjay62 (big blind) showed [Ac 7h] and won (160) with a pair of Aces



PokerStars Hand #246977537233: Tournament #3669561558, $4.60+$0.40 USD Hold'em No Limit - Level I (10/20) - 2023/11/07 15:03:21 CET [2023/11/07 9:03:21 ET]
Table '3669561558 1' 3-max Seat #2 is the button
Seat 1: Mahu2021 (540 in chips) 
Seat 2: Riddler1988 (410 in chips) 
Seat 3: ayjay62 (550 in chips) 
ayjay62: posts small blind 10
Mahu2021: posts big blind 20
*** HOLE CARDS ***
Dealt to Mahu2021 [Qc 7s]
Riddler1988: raises 20 to 40
ayjay62: calls 30
Mahu2021: calls 20
*** FLOP *** [Ad 6h 5d]
ayjay62: checks 
Mahu2021: checks 
Riddler1988: bets 60
ayjay62: calls 60
Mahu2021: folds 
*** TURN *** [Ad 6h 5d] [Js]
ayjay62: checks 
Riddler1988: bets 120
ayjay62: folds 
Uncalled bet (120) returned to Riddler1988
Riddler1988 collected 240 from pot
Riddler1988: doesn't show hand 
*** SUMMARY ***
Total pot 240 | Rake 0 
Board [Ad 6h 5d Js]
Seat 1: Mahu2021 (big blind) folded on the Flop
Seat 2: Riddler1988 (button) collected (240)
Seat 3: ayjay62 (small blind) folded on the Turn



PokerStars Hand #246977542802: Tournament #3669561558, $4.60+$0.40 USD Hold'em No Limit - Level I (10/20) - 2023/11/07 15:03:48 CET [2023/11/07 9:03:48 ET]
Table '3669561558 1' 3-max Seat #3 is the button
Seat 1: Mahu2021 (500 in chips) 
Seat 2: Riddler1988 (550 in chips) 
Seat 3: ayjay62 (450 in chips) 
Mahu2021: posts small blind 10
Riddler1988: posts big blind 20
*** HOLE CARDS ***
Dealt to Mahu2021 [6h 5d]
ayjay62: calls 20
Mahu2021: calls 10
Riddler1988: checks 
*** FLOP *** [Th 9s 2s]
Mahu2021: checks 
Riddler1988: checks 
ayjay62: bets 20
Mahu2021: folds 
Riddler1988: folds 
Uncalled bet (20) returned to ayjay62
ayjay62 collected 60 from pot
ayjay62: doesn't show hand 
*** SUMMARY ***
Total pot 60 | Rake 0 
Board [Th 9s 2s]
Seat 1: Mahu2021 (small blind) folded on the Flop
Seat 2: Riddler1988 (big blind) folded on the Flop
Seat 3: ayjay62 (button) collected (60)



PokerStars Hand #246977548733: Tournament #3669561558, $4.60+$0.40 USD Hold'em No Limit - Level I (10/20) - 2023/11/07 15:04:18 CET [2023/11/07 9:04:18 ET]
Table '3669561558 1' 3-max Seat #1 is the button
Seat 1: Mahu2021 (480 in chips) 
Seat 2: Riddler1988 (530 in chips) 
Seat 3: ayjay62 (490 in chips) 
Riddler1988: posts small blind 10
ayjay62: posts big blind 20
*** HOLE CARDS ***
Dealt to Mahu2021 [Td Kd]
Mahu2021: raises 20 to 40
Riddler1988: raises 490 to 530 and is all-in
ayjay62: folds 
Mahu2021: calls 440 and is all-in
Uncalled bet (50) returned to Riddler1988
*** FLOP *** [6h 9h Kh]
*** TURN *** [6h 9h Kh] [Qd]
*** RIVER *** [6h 9h Kh Qd] [Qc]
*** SHOW DOWN ***
Riddler1988: shows [9c 9d] (a full house, Nines full of Queens)
Mahu2021: shows [Td Kd] (two pair, Kings and Queens)
Riddler1988 collected 980 from pot
Mahu2021 finished the tournament in 3rd place
*** SUMMARY ***
Total pot 980 | Rake 0 
Board [6h 9h Kh Qd Qc]
Seat 1: Mahu2021 (button) showed [Td Kd] and lost with two pair, Kings and Queens
Seat 2: Riddler1988 (small blind) showed [9c 9d] and won (980) with a full house, Nines full of Queens
Seat 3: ayjay62 (big blind) folded before Flop



