PokerStars Hand #243184002550: Tournament #3579634691, $0.92+$0.08 USD Hold'em No Limit - Level I (10/20) - 2023/04/19 10:34:51 CET [2023/04/19 4:34:51 ET]
Table '3579634691 1' 3-max Seat #1 is the button
Seat 1: Sifnosfos (500 in chips) 
Seat 2: gabrielleemma (500 in chips) 
Seat 3: Mahu2021 (500 in chips) 
gabrielleemma: posts small blind 10
Mahu2021: posts big blind 20
*** HOLE CARDS ***
Dealt to Mahu2021 [Ad 8c]
Sifnosfos: folds 
gabrielleemma: folds 
Uncalled bet (10) returned to Mahu2021
Mahu2021 collected 20 from pot
Mahu2021: doesn't show hand 
*** SUMMARY ***
Total pot 20 | Rake 0 
Seat 1: Sifnosfos (button) folded before Flop (didn't bet)
Seat 2: gabrielleemma (small blind) folded before Flop
Seat 3: Mahu2021 (big blind) collected (20)



PokerStars Hand #243184003542: Tournament #3579634691, $0.92+$0.08 USD Hold'em No Limit - Level I (10/20) - 2023/04/19 10:35:00 CET [2023/04/19 4:35:00 ET]
Table '3579634691 1' 3-max Seat #2 is the button
Seat 1: Sifnosfos (500 in chips) 
Seat 2: gabrielleemma (490 in chips) 
Seat 3: Mahu2021 (510 in chips) 
Mahu2021: posts small blind 10
Sifnosfos: posts big blind 20
*** HOLE CARDS ***
Dealt to Mahu2021 [5c 2d]
gabrielleemma: calls 20
Mahu2021: folds 
Sifnosfos: checks 
*** FLOP *** [6s Kd 6d]
Sifnosfos: checks 
gabrielleemma: bets 20
Sifnosfos: folds 
Uncalled bet (20) returned to gabrielleemma
gabrielleemma collected 50 from pot
*** SUMMARY ***
Total pot 50 | Rake 0 
Board [6s Kd 6d]
Seat 1: Sifnosfos (big blind) folded on the Flop
Seat 2: gabrielleemma (button) collected (50)
Seat 3: Mahu2021 (small blind) folded before Flop



PokerStars Hand #243184005187: Tournament #3579634691, $0.92+$0.08 USD Hold'em No Limit - Level I (10/20) - 2023/04/19 10:35:12 CET [2023/04/19 4:35:12 ET]
Table '3579634691 1' 3-max Seat #3 is the button
Seat 1: Sifnosfos (480 in chips) 
Seat 2: gabrielleemma (520 in chips) 
Seat 3: Mahu2021 (500 in chips) 
Sifnosfos: posts small blind 10
gabrielleemma: posts big blind 20
*** HOLE CARDS ***
Dealt to Mahu2021 [3d Jh]
Mahu2021: folds 
Sifnosfos: folds 
Uncalled bet (10) returned to gabrielleemma
gabrielleemma collected 20 from pot
*** SUMMARY ***
Total pot 20 | Rake 0 
Seat 1: Sifnosfos (small blind) folded before Flop
Seat 2: gabrielleemma (big blind) collected (20)
Seat 3: Mahu2021 (button) folded before Flop (didn't bet)



PokerStars Hand #243184005942: Tournament #3579634691, $0.92+$0.08 USD Hold'em No Limit - Level I (10/20) - 2023/04/19 10:35:18 CET [2023/04/19 4:35:18 ET]
Table '3579634691 1' 3-max Seat #1 is the button
Seat 1: Sifnosfos (470 in chips) 
Seat 2: gabrielleemma (530 in chips) 
Seat 3: Mahu2021 (500 in chips) 
gabrielleemma: posts small blind 10
Mahu2021: posts big blind 20
*** HOLE CARDS ***
Dealt to Mahu2021 [7s 3d]
Sifnosfos: raises 20 to 40
gabrielleemma: calls 30
Mahu2021: folds 
*** FLOP *** [8h Kh 3s]
gabrielleemma: bets 20
Sifnosfos: calls 20
*** TURN *** [8h Kh 3s] [9h]
gabrielleemma: checks 
Sifnosfos: checks 
*** RIVER *** [8h Kh 3s 9h] [9c]
gabrielleemma: checks 
Sifnosfos: bets 60
gabrielleemma: folds 
Uncalled bet (60) returned to Sifnosfos
Sifnosfos collected 140 from pot
*** SUMMARY ***
Total pot 140 | Rake 0 
Board [8h Kh 3s 9h 9c]
Seat 1: Sifnosfos (button) collected (140)
Seat 2: gabrielleemma (small blind) folded on the River
Seat 3: Mahu2021 (big blind) folded before Flop



PokerStars Hand #243184009542: Tournament #3579634691, $0.92+$0.08 USD Hold'em No Limit - Level I (10/20) - 2023/04/19 10:35:46 CET [2023/04/19 4:35:46 ET]
Table '3579634691 1' 3-max Seat #2 is the button
Seat 1: Sifnosfos (550 in chips) 
Seat 2: gabrielleemma (470 in chips) 
Seat 3: Mahu2021 (480 in chips) 
Mahu2021: posts small blind 10
Sifnosfos: posts big blind 20
*** HOLE CARDS ***
Dealt to Mahu2021 [Js 7d]
gabrielleemma: calls 20
Mahu2021: calls 10
Sifnosfos: checks 
*** FLOP *** [Ks Qc 5h]
Mahu2021: checks 
Sifnosfos: checks 
gabrielleemma: bets 20
Mahu2021: folds 
Sifnosfos: folds 
Uncalled bet (20) returned to gabrielleemma
gabrielleemma collected 60 from pot
*** SUMMARY ***
Total pot 60 | Rake 0 
Board [Ks Qc 5h]
Seat 1: Sifnosfos (big blind) folded on the Flop
Seat 2: gabrielleemma (button) collected (60)
Seat 3: Mahu2021 (small blind) folded on the Flop



PokerStars Hand #243184012978: Tournament #3579634691, $0.92+$0.08 USD Hold'em No Limit - Level I (10/20) - 2023/04/19 10:36:14 CET [2023/04/19 4:36:14 ET]
Table '3579634691 1' 3-max Seat #3 is the button
Seat 1: Sifnosfos (530 in chips) 
Seat 2: gabrielleemma (510 in chips) 
Seat 3: Mahu2021 (460 in chips) 
Sifnosfos: posts small blind 10
gabrielleemma: posts big blind 20
*** HOLE CARDS ***
Dealt to Mahu2021 [9s 6s]
Mahu2021: raises 20 to 40
Sifnosfos: calls 30
gabrielleemma: calls 20
*** FLOP *** [2c 4h Qs]
Sifnosfos: checks 
gabrielleemma: checks 
Mahu2021: checks 
*** TURN *** [2c 4h Qs] [5h]
Sifnosfos: bets 20
gabrielleemma: folds 
Mahu2021: calls 20
*** RIVER *** [2c 4h Qs 5h] [2d]
Sifnosfos: bets 60
Mahu2021: folds 
Uncalled bet (60) returned to Sifnosfos
Sifnosfos collected 160 from pot
*** SUMMARY ***
Total pot 160 | Rake 0 
Board [2c 4h Qs 5h 2d]
Seat 1: Sifnosfos (small blind) collected (160)
Seat 2: gabrielleemma (big blind) folded on the Turn
Seat 3: Mahu2021 (button) folded on the River



PokerStars Hand #243184016766: Tournament #3579634691, $0.92+$0.08 USD Hold'em No Limit - Level I (10/20) - 2023/04/19 10:36:44 CET [2023/04/19 4:36:44 ET]
Table '3579634691 1' 3-max Seat #1 is the button
Seat 1: Sifnosfos (630 in chips) 
Seat 2: gabrielleemma (470 in chips) 
Seat 3: Mahu2021 (400 in chips) 
gabrielleemma: posts small blind 10
Mahu2021: posts big blind 20
*** HOLE CARDS ***
Dealt to Mahu2021 [6d 6h]
Sifnosfos: calls 20
gabrielleemma: calls 10
Mahu2021: raises 40 to 60
Sifnosfos: raises 40 to 100
gabrielleemma: calls 80
Mahu2021: raises 300 to 400 and is all-in
Sifnosfos: raises 230 to 630 and is all-in
gabrielleemma: calls 370 and is all-in
Uncalled bet (160) returned to Sifnosfos
*** FLOP *** [Kh Td 9s]
*** TURN *** [Kh Td 9s] [Qc]
*** RIVER *** [Kh Td 9s Qc] [9c]
*** SHOW DOWN ***
gabrielleemma: shows [3c 5s] (a pair of Nines)
Sifnosfos: shows [Ad As] (two pair, Aces and Nines)
Sifnosfos collected 140 from side pot
Mahu2021: shows [6d 6h] (two pair, Nines and Sixes)
Sifnosfos collected 1200 from main pot
gabrielleemma finished the tournament in 2nd place
Mahu2021 finished the tournament in 3rd place
Sifnosfos wins the tournament and receives $2.00 - congratulations!
*** SUMMARY ***
Total pot 1340 Main pot 1200. Side pot 140. | Rake 0 
Board [Kh Td 9s Qc 9c]
Seat 1: Sifnosfos (button) showed [Ad As] and won (1340) with two pair, Aces and Nines
Seat 2: gabrielleemma (small blind) showed [3c 5s] and lost with a pair of Nines
Seat 3: Mahu2021 (big blind) showed [6d 6h] and lost with two pair, Nines and Sixes



