PokerStars Hand #251455766297: Tournament #3777135111, $1.84+$0.16 USD Hold'em No Limit - Level I (10/20) - 2024/07/12 21:25:30 CET [2024/07/12 15:25:30 ET]
Table '3777135111 1' 3-max Seat #1 is the button
Seat 1: Torianius (500 in chips) 
Seat 2: Mahu2021 (500 in chips) 
Seat 3: gcelada1969 (500 in chips) 
Mahu2021: posts small blind 10
gcelada1969: posts big blind 20
*** HOLE CARDS ***
Dealt to Mahu2021 [4d 7c]
Torianius: raises 20 to 40
Mahu2021: folds 
gcelada1969: raises 460 to 500 and is all-in
Torianius: calls 460 and is all-in
*** FLOP *** [5h 8d 7s]
*** TURN *** [5h 8d 7s] [2d]
*** RIVER *** [5h 8d 7s 2d] [4s]
*** SHOW DOWN ***
gcelada1969: shows [Ah 3h] (a straight, Ace to Five)
Torianius: shows [Jd Qc] (high card Queen)
gcelada1969 collected 1010 from pot
Torianius finished the tournament in 3rd place
*** SUMMARY ***
Total pot 1010 | Rake 0 
Board [5h 8d 7s 2d 4s]
Seat 1: Torianius (button) showed [Jd Qc] and lost with high card Queen
Seat 2: Mahu2021 (small blind) folded before Flop
Seat 3: gcelada1969 (big blind) showed [Ah 3h] and won (1010) with a straight, Ace to Five



PokerStars Hand #251455772366: Tournament #3777135111, $1.84+$0.16 USD Hold'em No Limit - Level I (10/20) - 2024/07/12 21:25:49 CET [2024/07/12 15:25:49 ET]
Table '3777135111 1' 3-max Seat #3 is the button
Seat 2: Mahu2021 (490 in chips) 
Seat 3: gcelada1969 (1010 in chips) 
gcelada1969: posts small blind 10
Mahu2021: posts big blind 20
*** HOLE CARDS ***
Dealt to Mahu2021 [9d Ks]
gcelada1969: raises 20 to 40
Mahu2021: calls 20
*** FLOP *** [6c Qc 8s]
Mahu2021: checks 
gcelada1969: bets 40
Mahu2021: folds 
Uncalled bet (40) returned to gcelada1969
gcelada1969 collected 80 from pot
*** SUMMARY ***
Total pot 80 | Rake 0 
Board [6c Qc 8s]
Seat 2: Mahu2021 (big blind) folded on the Flop
Seat 3: gcelada1969 (button) (small blind) collected (80)



PokerStars Hand #251455776064: Tournament #3777135111, $1.84+$0.16 USD Hold'em No Limit - Level I (10/20) - 2024/07/12 21:26:00 CET [2024/07/12 15:26:00 ET]
Table '3777135111 1' 3-max Seat #2 is the button
Seat 2: Mahu2021 (450 in chips) 
Seat 3: gcelada1969 (1050 in chips) 
Mahu2021: posts small blind 10
gcelada1969: posts big blind 20
*** HOLE CARDS ***
Dealt to Mahu2021 [9d Js]
Mahu2021: raises 20 to 40
gcelada1969: folds 
Uncalled bet (20) returned to Mahu2021
Mahu2021 collected 40 from pot
Mahu2021: doesn't show hand 
*** SUMMARY ***
Total pot 40 | Rake 0 
Seat 2: Mahu2021 (button) (small blind) collected (40)
Seat 3: gcelada1969 (big blind) folded before Flop



PokerStars Hand #251455778079: Tournament #3777135111, $1.84+$0.16 USD Hold'em No Limit - Level I (10/20) - 2024/07/12 21:26:06 CET [2024/07/12 15:26:06 ET]
Table '3777135111 1' 3-max Seat #3 is the button
Seat 2: Mahu2021 (470 in chips) 
Seat 3: gcelada1969 (1030 in chips) 
gcelada1969: posts small blind 10
Mahu2021: posts big blind 20
*** HOLE CARDS ***
Dealt to Mahu2021 [7s 2h]
gcelada1969: raises 20 to 40
Mahu2021: folds 
Uncalled bet (20) returned to gcelada1969
gcelada1969 collected 40 from pot
*** SUMMARY ***
Total pot 40 | Rake 0 
Seat 2: Mahu2021 (big blind) folded before Flop
Seat 3: gcelada1969 (button) (small blind) collected (40)



PokerStars Hand #251455779618: Tournament #3777135111, $1.84+$0.16 USD Hold'em No Limit - Level I (10/20) - 2024/07/12 21:26:11 CET [2024/07/12 15:26:11 ET]
Table '3777135111 1' 3-max Seat #2 is the button
Seat 2: Mahu2021 (450 in chips) 
Seat 3: gcelada1969 (1050 in chips) 
Mahu2021: posts small blind 10
gcelada1969: posts big blind 20
*** HOLE CARDS ***
Dealt to Mahu2021 [Tc Kh]
Mahu2021: raises 20 to 40
gcelada1969: calls 20
*** FLOP *** [2c 2s Ac]
gcelada1969: bets 80
Mahu2021: folds 
Uncalled bet (80) returned to gcelada1969
gcelada1969 collected 80 from pot
*** SUMMARY ***
Total pot 80 | Rake 0 
Board [2c 2s Ac]
Seat 2: Mahu2021 (button) (small blind) folded on the Flop
Seat 3: gcelada1969 (big blind) collected (80)



PokerStars Hand #251455783324: Tournament #3777135111, $1.84+$0.16 USD Hold'em No Limit - Level I (10/20) - 2024/07/12 21:26:22 CET [2024/07/12 15:26:22 ET]
Table '3777135111 1' 3-max Seat #3 is the button
Seat 2: Mahu2021 (410 in chips) 
Seat 3: gcelada1969 (1090 in chips) 
gcelada1969: posts small blind 10
Mahu2021: posts big blind 20
*** HOLE CARDS ***
Dealt to Mahu2021 [5s Tc]
gcelada1969: raises 20 to 40
Mahu2021: calls 20
*** FLOP *** [3d 8d 5c]
Mahu2021: bets 80
gcelada1969: raises 240 to 320
Mahu2021: raises 50 to 370 and is all-in
gcelada1969: calls 50
*** TURN *** [3d 8d 5c] [6d]
*** RIVER *** [3d 8d 5c 6d] [Ad]
*** SHOW DOWN ***
Mahu2021: shows [5s Tc] (a pair of Fives)
gcelada1969: shows [8s Qs] (a pair of Eights)
gcelada1969 collected 820 from pot
Mahu2021 finished the tournament in 2nd place
gcelada1969 wins the tournament and receives $4.00 - congratulations!
*** SUMMARY ***
Total pot 820 | Rake 0 
Board [3d 8d 5c 6d Ad]
Seat 2: Mahu2021 (big blind) showed [5s Tc] and lost with a pair of Fives
Seat 3: gcelada1969 (button) (small blind) showed [8s Qs] and won (820) with a pair of Eights



