PokerStars Hand #252351734370: Tournament #3798208875, $1.84+$0.16 USD Hold'em No Limit - Level I (10/20) - 2024/09/08 20:27:11 CET [2024/09/08 14:27:11 ET]
Table '3798208875 1' 3-max Seat #1 is the button
Seat 1: manas (500 in chips) 
Seat 2: Diogo Ker (500 in chips) 
Seat 3: Mahu2021 (500 in chips) 
Diogo Ker: posts small blind 10
Mahu2021: posts big blind 20
*** HOLE CARDS ***
Dealt to Mahu2021 [4c 6c]
manas: calls 20
Diogo Ker: folds 
Mahu2021: checks 
*** FLOP *** [Ts 2h 2s]
Mahu2021: checks 
manas: bets 20
Mahu2021: folds 
Uncalled bet (20) returned to manas
manas collected 50 from pot
manas: doesn't show hand 
*** SUMMARY ***
Total pot 50 | Rake 0 
Board [Ts 2h 2s]
Seat 1: manas (button) collected (50)
Seat 2: Diogo Ker (small blind) folded before Flop
Seat 3: Mahu2021 (big blind) folded on the Flop



PokerStars Hand #252351740509: Tournament #3798208875, $1.84+$0.16 USD Hold'em No Limit - Level I (10/20) - 2024/09/08 20:27:27 CET [2024/09/08 14:27:27 ET]
Table '3798208875 1' 3-max Seat #2 is the button
Seat 1: manas (530 in chips) 
Seat 2: Diogo Ker (490 in chips) 
Seat 3: Mahu2021 (480 in chips) 
Mahu2021: posts small blind 10
manas: posts big blind 20
*** HOLE CARDS ***
Dealt to Mahu2021 [Js Qc]
Diogo Ker: calls 20
Mahu2021: calls 10
manas: checks 
*** FLOP *** [Jc Jh 6h]
Mahu2021: checks 
manas: checks 
Diogo Ker: checks 
*** TURN *** [Jc Jh 6h] [2s]
Mahu2021: bets 60
manas: folds 
Diogo Ker: folds 
Uncalled bet (60) returned to Mahu2021
Mahu2021 collected 60 from pot
Mahu2021: doesn't show hand 
*** SUMMARY ***
Total pot 60 | Rake 0 
Board [Jc Jh 6h 2s]
Seat 1: manas (big blind) folded on the Turn
Seat 2: Diogo Ker (button) folded on the Turn
Seat 3: Mahu2021 (small blind) collected (60)



PokerStars Hand #252351751652: Tournament #3798208875, $1.84+$0.16 USD Hold'em No Limit - Level I (10/20) - 2024/09/08 20:27:58 CET [2024/09/08 14:27:58 ET]
Table '3798208875 1' 3-max Seat #3 is the button
Seat 1: manas (510 in chips) 
Seat 2: Diogo Ker (470 in chips) 
Seat 3: Mahu2021 (520 in chips) 
manas: posts small blind 10
Diogo Ker: posts big blind 20
*** HOLE CARDS ***
Dealt to Mahu2021 [7c Jd]
Mahu2021: folds 
manas: calls 10
Diogo Ker: checks 
*** FLOP *** [Qc 5s Jh]
manas: checks 
Diogo Ker: checks 
*** TURN *** [Qc 5s Jh] [3c]
manas: bets 20
Diogo Ker: calls 20
*** RIVER *** [Qc 5s Jh 3c] [Ah]
manas: bets 40
Diogo Ker: folds 
Uncalled bet (40) returned to manas
manas collected 80 from pot
manas: doesn't show hand 
*** SUMMARY ***
Total pot 80 | Rake 0 
Board [Qc 5s Jh 3c Ah]
Seat 1: manas (small blind) collected (80)
Seat 2: Diogo Ker (big blind) folded on the River
Seat 3: Mahu2021 (button) folded before Flop (didn't bet)



PokerStars Hand #252351766971: Tournament #3798208875, $1.84+$0.16 USD Hold'em No Limit - Level I (10/20) - 2024/09/08 20:28:39 CET [2024/09/08 14:28:39 ET]
Table '3798208875 1' 3-max Seat #1 is the button
Seat 1: manas (550 in chips) 
Seat 2: Diogo Ker (430 in chips) 
Seat 3: Mahu2021 (520 in chips) 
Diogo Ker: posts small blind 10
Mahu2021: posts big blind 20
*** HOLE CARDS ***
Dealt to Mahu2021 [Qs 3d]
manas: folds 
Diogo Ker: raises 20 to 40
Mahu2021: folds 
Uncalled bet (20) returned to Diogo Ker
Diogo Ker collected 40 from pot
Diogo Ker: doesn't show hand 
*** SUMMARY ***
Total pot 40 | Rake 0 
Seat 1: manas (button) folded before Flop (didn't bet)
Seat 2: Diogo Ker (small blind) collected (40)
Seat 3: Mahu2021 (big blind) folded before Flop



PokerStars Hand #252351774528: Tournament #3798208875, $1.84+$0.16 USD Hold'em No Limit - Level I (10/20) - 2024/09/08 20:29:00 CET [2024/09/08 14:29:00 ET]
Table '3798208875 1' 3-max Seat #2 is the button
Seat 1: manas (550 in chips) 
Seat 2: Diogo Ker (450 in chips) 
Seat 3: Mahu2021 (500 in chips) 
Mahu2021: posts small blind 10
manas: posts big blind 20
*** HOLE CARDS ***
Dealt to Mahu2021 [Td 3d]
Diogo Ker: raises 20 to 40
Mahu2021: calls 30
manas: calls 20
*** FLOP *** [8h 3s Qd]
Mahu2021: checks 
manas: checks 
Diogo Ker: bets 60
Mahu2021: folds 
manas: folds 
Uncalled bet (60) returned to Diogo Ker
Diogo Ker collected 120 from pot
Diogo Ker: doesn't show hand 
*** SUMMARY ***
Total pot 120 | Rake 0 
Board [8h 3s Qd]
Seat 1: manas (big blind) folded on the Flop
Seat 2: Diogo Ker (button) collected (120)
Seat 3: Mahu2021 (small blind) folded on the Flop



PokerStars Hand #252351784765: Tournament #3798208875, $1.84+$0.16 USD Hold'em No Limit - Level II (15/30) - 2024/09/08 20:29:29 CET [2024/09/08 14:29:29 ET]
Table '3798208875 1' 3-max Seat #3 is the button
Seat 1: manas (510 in chips) 
Seat 2: Diogo Ker (530 in chips) 
Seat 3: Mahu2021 (460 in chips) 
manas: posts small blind 15
Diogo Ker: posts big blind 30
*** HOLE CARDS ***
Dealt to Mahu2021 [As Ts]
Mahu2021: raises 60 to 90
manas: folds 
Diogo Ker: raises 440 to 530 and is all-in
Mahu2021: calls 370 and is all-in
Uncalled bet (70) returned to Diogo Ker
*** FLOP *** [Qc 3h 5h]
*** TURN *** [Qc 3h 5h] [5d]
*** RIVER *** [Qc 3h 5h 5d] [7h]
*** SHOW DOWN ***
Diogo Ker: shows [Ah Js] (a pair of Fives)
Mahu2021: shows [As Ts] (a pair of Fives - lower kicker)
Diogo Ker collected 935 from pot
Mahu2021 finished the tournament in 3rd place
*** SUMMARY ***
Total pot 935 | Rake 0 
Board [Qc 3h 5h 5d 7h]
Seat 1: manas (small blind) folded before Flop
Seat 2: Diogo Ker (big blind) showed [Ah Js] and won (935) with a pair of Fives
Seat 3: Mahu2021 (button) showed [As Ts] and lost with a pair of Fives



