PokerStars Hand #249087993551: Tournament #3721099082, $1.84+$0.16 USD Hold'em No Limit - Level I (10/20) - 2024/02/25 18:39:01 CET [2024/02/25 12:39:01 ET]
Table '3721099082 1' 3-max Seat #1 is the button
Seat 1: Mahu2021 (500 in chips) 
Seat 2: Massi21_791 (500 in chips) 
Seat 3: LotusDale83 (500 in chips) 
Massi21_791: posts small blind 10
LotusDale83: posts big blind 20
*** HOLE CARDS ***
Dealt to Mahu2021 [Qd Tc]
Mahu2021: raises 20 to 40
Massi21_791: folds 
LotusDale83: raises 20 to 60
Mahu2021: calls 20
*** FLOP *** [3s Js 4h]
LotusDale83: bets 130
Mahu2021: folds 
Uncalled bet (130) returned to LotusDale83
LotusDale83 collected 130 from pot
*** SUMMARY ***
Total pot 130 | Rake 0 
Board [3s Js 4h]
Seat 1: Mahu2021 (button) folded on the Flop
Seat 2: Massi21_791 (small blind) folded before Flop
Seat 3: LotusDale83 (big blind) collected (130)



PokerStars Hand #249087998342: Tournament #3721099082, $1.84+$0.16 USD Hold'em No Limit - Level I (10/20) - 2024/02/25 18:39:14 CET [2024/02/25 12:39:14 ET]
Table '3721099082 1' 3-max Seat #2 is the button
Seat 1: Mahu2021 (440 in chips) 
Seat 2: Massi21_791 (490 in chips) 
Seat 3: LotusDale83 (570 in chips) 
LotusDale83: posts small blind 10
Mahu2021: posts big blind 20
*** HOLE CARDS ***
Dealt to Mahu2021 [5h 3s]
Massi21_791: raises 20 to 40
LotusDale83: calls 30
Mahu2021: calls 20
*** FLOP *** [2h 2s Kh]
LotusDale83: checks 
Mahu2021: checks 
Massi21_791: checks 
*** TURN *** [2h 2s Kh] [Qd]
LotusDale83: bets 20
Mahu2021: folds 
Massi21_791: calls 20
*** RIVER *** [2h 2s Kh Qd] [6c]
LotusDale83: checks 
Massi21_791: checks 
*** SHOW DOWN ***
LotusDale83: shows [9s Td] (a pair of Deuces)
Massi21_791: shows [Qh 8c] (two pair, Queens and Deuces)
Massi21_791 collected 160 from pot
*** SUMMARY ***
Total pot 160 | Rake 0 
Board [2h 2s Kh Qd 6c]
Seat 1: Mahu2021 (big blind) folded on the Turn
Seat 2: Massi21_791 (button) showed [Qh 8c] and won (160) with two pair, Queens and Deuces
Seat 3: LotusDale83 (small blind) showed [9s Td] and lost with a pair of Deuces



PokerStars Hand #249088007111: Tournament #3721099082, $1.84+$0.16 USD Hold'em No Limit - Level I (10/20) - 2024/02/25 18:39:39 CET [2024/02/25 12:39:39 ET]
Table '3721099082 1' 3-max Seat #3 is the button
Seat 1: Mahu2021 (400 in chips) 
Seat 2: Massi21_791 (590 in chips) 
Seat 3: LotusDale83 (510 in chips) 
Mahu2021: posts small blind 10
Massi21_791: posts big blind 20
*** HOLE CARDS ***
Dealt to Mahu2021 [2c 4c]
LotusDale83: calls 20
Mahu2021: folds 
Massi21_791: raises 40 to 60
LotusDale83: calls 40
*** FLOP *** [2s Ad 6d]
Massi21_791: checks 
LotusDale83: checks 
*** TURN *** [2s Ad 6d] [2d]
Massi21_791: bets 110
LotusDale83: folds 
Uncalled bet (110) returned to Massi21_791
Massi21_791 collected 130 from pot
Massi21_791: doesn't show hand 
*** SUMMARY ***
Total pot 130 | Rake 0 
Board [2s Ad 6d 2d]
Seat 1: Mahu2021 (small blind) folded before Flop
Seat 2: Massi21_791 (big blind) collected (130)
Seat 3: LotusDale83 (button) folded on the Turn



PokerStars Hand #249088014794: Tournament #3721099082, $1.84+$0.16 USD Hold'em No Limit - Level I (10/20) - 2024/02/25 18:40:00 CET [2024/02/25 12:40:00 ET]
Table '3721099082 1' 3-max Seat #1 is the button
Seat 1: Mahu2021 (390 in chips) 
Seat 2: Massi21_791 (660 in chips) 
Seat 3: LotusDale83 (450 in chips) 
Massi21_791: posts small blind 10
LotusDale83: posts big blind 20
*** HOLE CARDS ***
Dealt to Mahu2021 [9s Kc]
Mahu2021: raises 20 to 40
Massi21_791: folds 
LotusDale83: calls 20
*** FLOP *** [7d Qs Ac]
LotusDale83: bets 20
Mahu2021: raises 60 to 80
LotusDale83: folds 
Uncalled bet (60) returned to Mahu2021
Mahu2021 collected 130 from pot
Mahu2021: doesn't show hand 
*** SUMMARY ***
Total pot 130 | Rake 0 
Board [7d Qs Ac]
Seat 1: Mahu2021 (button) collected (130)
Seat 2: Massi21_791 (small blind) folded before Flop
Seat 3: LotusDale83 (big blind) folded on the Flop



PokerStars Hand #249088021676: Tournament #3721099082, $1.84+$0.16 USD Hold'em No Limit - Level I (10/20) - 2024/02/25 18:40:18 CET [2024/02/25 12:40:18 ET]
Table '3721099082 1' 3-max Seat #2 is the button
Seat 1: Mahu2021 (460 in chips) 
Seat 2: Massi21_791 (650 in chips) 
Seat 3: LotusDale83 (390 in chips) 
LotusDale83: posts small blind 10
Mahu2021: posts big blind 20
*** HOLE CARDS ***
Dealt to Mahu2021 [Qs 2d]
Massi21_791: folds 
LotusDale83: calls 10
Mahu2021: checks 
*** FLOP *** [9s 4c Th]
LotusDale83: checks 
Mahu2021: checks 
*** TURN *** [9s 4c Th] [7s]
LotusDale83: checks 
Mahu2021: checks 
*** RIVER *** [9s 4c Th 7s] [Js]
LotusDale83: bets 80
Mahu2021: folds 
Uncalled bet (80) returned to LotusDale83
LotusDale83 collected 40 from pot
*** SUMMARY ***
Total pot 40 | Rake 0 
Board [9s 4c Th 7s Js]
Seat 1: Mahu2021 (big blind) folded on the River
Seat 2: Massi21_791 (button) folded before Flop (didn't bet)
Seat 3: LotusDale83 (small blind) collected (40)



PokerStars Hand #249088032698: Tournament #3721099082, $1.84+$0.16 USD Hold'em No Limit - Level I (10/20) - 2024/02/25 18:40:49 CET [2024/02/25 12:40:49 ET]
Table '3721099082 1' 3-max Seat #3 is the button
Seat 1: Mahu2021 (440 in chips) 
Seat 2: Massi21_791 (650 in chips) 
Seat 3: LotusDale83 (410 in chips) 
Mahu2021: posts small blind 10
Massi21_791: posts big blind 20
*** HOLE CARDS ***
Dealt to Mahu2021 [8s 9c]
LotusDale83: calls 20
Mahu2021: calls 10
Massi21_791: checks 
*** FLOP *** [Kd Kh Th]
Mahu2021: checks 
Massi21_791: checks 
LotusDale83: bets 20
Mahu2021: folds 
Massi21_791: folds 
Uncalled bet (20) returned to LotusDale83
LotusDale83 collected 60 from pot
*** SUMMARY ***
Total pot 60 | Rake 0 
Board [Kd Kh Th]
Seat 1: Mahu2021 (small blind) folded on the Flop
Seat 2: Massi21_791 (big blind) folded on the Flop
Seat 3: LotusDale83 (button) collected (60)



PokerStars Hand #249088042052: Tournament #3721099082, $1.84+$0.16 USD Hold'em No Limit - Level I (10/20) - 2024/02/25 18:41:14 CET [2024/02/25 12:41:14 ET]
Table '3721099082 1' 3-max Seat #1 is the button
Seat 1: Mahu2021 (420 in chips) 
Seat 2: Massi21_791 (630 in chips) 
Seat 3: LotusDale83 (450 in chips) 
Massi21_791: posts small blind 10
LotusDale83: posts big blind 20
*** HOLE CARDS ***
Dealt to Mahu2021 [6s 4d]
Mahu2021: folds 
Massi21_791: raises 20 to 40
LotusDale83: calls 20
*** FLOP *** [7c Kc 9d]
Massi21_791: bets 40
LotusDale83: calls 40
*** TURN *** [7c Kc 9d] [8s]
Massi21_791: bets 120
LotusDale83: folds 
Uncalled bet (120) returned to Massi21_791
Massi21_791 collected 160 from pot
Massi21_791: doesn't show hand 
*** SUMMARY ***
Total pot 160 | Rake 0 
Board [7c Kc 9d 8s]
Seat 1: Mahu2021 (button) folded before Flop (didn't bet)
Seat 2: Massi21_791 (small blind) collected (160)
Seat 3: LotusDale83 (big blind) folded on the Turn



PokerStars Hand #249088051515: Tournament #3721099082, $1.84+$0.16 USD Hold'em No Limit - Level I (10/20) - 2024/02/25 18:41:41 CET [2024/02/25 12:41:41 ET]
Table '3721099082 1' 3-max Seat #2 is the button
Seat 1: Mahu2021 (420 in chips) 
Seat 2: Massi21_791 (710 in chips) 
Seat 3: LotusDale83 (370 in chips) 
LotusDale83: posts small blind 10
Mahu2021: posts big blind 20
*** HOLE CARDS ***
Dealt to Mahu2021 [Kh 6d]
Massi21_791: raises 20 to 40
LotusDale83: calls 30
Mahu2021: calls 20
*** FLOP *** [Kc Qd 8d]
LotusDale83: checks 
Mahu2021: bets 120
Massi21_791: calls 120
LotusDale83: folds 
*** TURN *** [Kc Qd 8d] [5s]
Mahu2021: bets 260 and is all-in
Massi21_791: calls 260
*** RIVER *** [Kc Qd 8d 5s] [2h]
*** SHOW DOWN ***
Mahu2021: shows [Kh 6d] (a pair of Kings)
Massi21_791: shows [7s Kd] (a pair of Kings - Queen+Eight+Seven kicker)
Massi21_791 collected 880 from pot
Mahu2021 finished the tournament in 3rd place
*** SUMMARY ***
Total pot 880 | Rake 0 
Board [Kc Qd 8d 5s 2h]
Seat 1: Mahu2021 (big blind) showed [Kh 6d] and lost with a pair of Kings
Seat 2: Massi21_791 (button) showed [7s Kd] and won (880) with a pair of Kings
Seat 3: LotusDale83 (small blind) folded on the Flop



