PokerStars Hand #243123126439: Tournament #3578271300, $0.92+$0.08 USD Hold'em No Limit - Level I (10/20) - 2023/04/16 11:14:07 CET [2023/04/16 5:14:07 ET]
Table '3578271300 1' 3-max Seat #1 is the button
Seat 1: Rikis1969 (500 in chips) 
Seat 2: Mahu2021 (500 in chips) 
Seat 3: WOLF19830 (500 in chips) 
Mahu2021: posts small blind 10
WOLF19830: posts big blind 20
*** HOLE CARDS ***
Dealt to Mahu2021 [8s 2c]
Rikis1969: calls 20
Mahu2021: folds 
WOLF19830: raises 20 to 40
Rikis1969: calls 20
*** FLOP *** [6d Jc 4d]
WOLF19830: checks 
Rikis1969: bets 45
WOLF19830: folds 
Uncalled bet (45) returned to Rikis1969
Rikis1969 collected 90 from pot
Rikis1969: doesn't show hand 
*** SUMMARY ***
Total pot 90 | Rake 0 
Board [6d Jc 4d]
Seat 1: Rikis1969 (button) collected (90)
Seat 2: Mahu2021 (small blind) folded before Flop
Seat 3: WOLF19830 (big blind) folded on the Flop



PokerStars Hand #243123131081: Tournament #3578271300, $0.92+$0.08 USD Hold'em No Limit - Level I (10/20) - 2023/04/16 11:14:36 CET [2023/04/16 5:14:36 ET]
Table '3578271300 1' 3-max Seat #2 is the button
Seat 1: Rikis1969 (550 in chips) 
Seat 2: Mahu2021 (490 in chips) 
Seat 3: WOLF19830 (460 in chips) 
WOLF19830: posts small blind 10
Rikis1969: posts big blind 20
*** HOLE CARDS ***
Dealt to Mahu2021 [3s 5h]
Mahu2021: folds 
WOLF19830: folds 
Uncalled bet (10) returned to Rikis1969
Rikis1969 collected 20 from pot
Rikis1969: doesn't show hand 
*** SUMMARY ***
Total pot 20 | Rake 0 
Seat 1: Rikis1969 (big blind) collected (20)
Seat 2: Mahu2021 (button) folded before Flop (didn't bet)
Seat 3: WOLF19830 (small blind) folded before Flop



PokerStars Hand #243123132445: Tournament #3578271300, $0.92+$0.08 USD Hold'em No Limit - Level I (10/20) - 2023/04/16 11:14:45 CET [2023/04/16 5:14:45 ET]
Table '3578271300 1' 3-max Seat #3 is the button
Seat 1: Rikis1969 (560 in chips) 
Seat 2: Mahu2021 (490 in chips) 
Seat 3: WOLF19830 (450 in chips) 
Rikis1969: posts small blind 10
Mahu2021: posts big blind 20
*** HOLE CARDS ***
Dealt to Mahu2021 [Kd Qd]
WOLF19830: calls 20
Rikis1969: calls 10
Mahu2021: raises 40 to 60
WOLF19830: calls 40
Rikis1969: calls 40
*** FLOP *** [Jc 8d 5d]
Rikis1969: bets 90
Mahu2021: calls 90
WOLF19830: folds 
*** TURN *** [Jc 8d 5d] [7c]
Rikis1969: bets 200
Mahu2021: calls 200
*** RIVER *** [Jc 8d 5d 7c] [6h]
Rikis1969: bets 210 and is all-in
Mahu2021: folds 
Uncalled bet (210) returned to Rikis1969
Rikis1969 collected 760 from pot
Rikis1969: doesn't show hand 
*** SUMMARY ***
Total pot 760 | Rake 0 
Board [Jc 8d 5d 7c 6h]
Seat 1: Rikis1969 (small blind) collected (760)
Seat 2: Mahu2021 (big blind) folded on the River
Seat 3: WOLF19830 (button) folded on the Flop



PokerStars Hand #243123139006: Tournament #3578271300, $0.92+$0.08 USD Hold'em No Limit - Level I (10/20) - 2023/04/16 11:15:27 CET [2023/04/16 5:15:27 ET]
Table '3578271300 1' 3-max Seat #1 is the button
Seat 1: Rikis1969 (970 in chips) 
Seat 2: Mahu2021 (140 in chips) 
Seat 3: WOLF19830 (390 in chips) 
Mahu2021: posts small blind 10
WOLF19830: posts big blind 20
*** HOLE CARDS ***
Dealt to Mahu2021 [9s Td]
Rikis1969: calls 20
Mahu2021: folds 
WOLF19830: checks 
*** FLOP *** [4h 5c 2d]
WOLF19830: checks 
Rikis1969: bets 25
WOLF19830: calls 25
*** TURN *** [4h 5c 2d] [8s]
WOLF19830: checks 
Rikis1969: bets 50
WOLF19830: calls 50
*** RIVER *** [4h 5c 2d 8s] [Qd]
WOLF19830: checks 
Rikis1969: checks 
*** SHOW DOWN ***
WOLF19830: shows [Tc 2s] (a pair of Deuces)
Rikis1969: mucks hand 
WOLF19830 collected 200 from pot
*** SUMMARY ***
Total pot 200 | Rake 0 
Board [4h 5c 2d 8s Qd]
Seat 1: Rikis1969 (button) mucked [Jc 3s]
Seat 2: Mahu2021 (small blind) folded before Flop
Seat 3: WOLF19830 (big blind) showed [Tc 2s] and won (200) with a pair of Deuces



PokerStars Hand #243123144135: Tournament #3578271300, $0.92+$0.08 USD Hold'em No Limit - Level I (10/20) - 2023/04/16 11:15:59 CET [2023/04/16 5:15:59 ET]
Table '3578271300 1' 3-max Seat #2 is the button
Seat 1: Rikis1969 (875 in chips) 
Seat 2: Mahu2021 (130 in chips) 
Seat 3: WOLF19830 (495 in chips) 
WOLF19830: posts small blind 10
Rikis1969: posts big blind 20
*** HOLE CARDS ***
Dealt to Mahu2021 [Qs 5h]
Mahu2021: folds 
WOLF19830: calls 10
Rikis1969: checks 
*** FLOP *** [8c 7s Kd]
WOLF19830: bets 20
Rikis1969: calls 20
*** TURN *** [8c 7s Kd] [2h]
WOLF19830: bets 20
Rikis1969: calls 20
*** RIVER *** [8c 7s Kd 2h] [6d]
WOLF19830: checks 
Rikis1969: checks 
*** SHOW DOWN ***
WOLF19830: shows [Ah 9d] (high card Ace)
Rikis1969: shows [Th 6c] (a pair of Sixes)
Rikis1969 collected 120 from pot
*** SUMMARY ***
Total pot 120 | Rake 0 
Board [8c 7s Kd 2h 6d]
Seat 1: Rikis1969 (big blind) showed [Th 6c] and won (120) with a pair of Sixes
Seat 2: Mahu2021 (button) folded before Flop (didn't bet)
Seat 3: WOLF19830 (small blind) showed [Ah 9d] and lost with high card Ace



PokerStars Hand #243123147449: Tournament #3578271300, $0.92+$0.08 USD Hold'em No Limit - Level I (10/20) - 2023/04/16 11:16:20 CET [2023/04/16 5:16:20 ET]
Table '3578271300 1' 3-max Seat #3 is the button
Seat 1: Rikis1969 (935 in chips) 
Seat 2: Mahu2021 (130 in chips) 
Seat 3: WOLF19830 (435 in chips) 
Rikis1969: posts small blind 10
Mahu2021: posts big blind 20
*** HOLE CARDS ***
Dealt to Mahu2021 [4h 2c]
WOLF19830: calls 20
Rikis1969: calls 10
Mahu2021: checks 
*** FLOP *** [3d 5c 6d]
Rikis1969: bets 20
Mahu2021: calls 20
WOLF19830: calls 20
*** TURN *** [3d 5c 6d] [Ah]
Rikis1969: checks 
Mahu2021: bets 40
WOLF19830: calls 40
Rikis1969: calls 40
*** RIVER *** [3d 5c 6d Ah] [Jd]
Rikis1969: bets 120
Mahu2021: calls 50 and is all-in
WOLF19830: calls 120
*** SHOW DOWN ***
Rikis1969: shows [2d Qd] (a flush, Queen high)
WOLF19830: mucks hand 
Rikis1969 collected 140 from side pot
Mahu2021: mucks hand 
Rikis1969 collected 390 from main pot
Mahu2021 finished the tournament in 3rd place
*** SUMMARY ***
Total pot 530 Main pot 390. Side pot 140. | Rake 0 
Board [3d 5c 6d Ah Jd]
Seat 1: Rikis1969 (small blind) showed [2d Qd] and won (530) with a flush, Queen high
Seat 2: Mahu2021 (big blind) mucked [4h 2c]
Seat 3: WOLF19830 (button) mucked [Ac 7h]



