PokerStars Hand #255742622118: Tournament #3879459221, $0.46+$0.04 USD Hold'em No Limit - Level I (10/20) - 2025/04/15 10:44:22 CET [2025/04/15 4:44:22 ET]
Table '3879459221 1' 3-max Seat #1 is the button
Seat 1: Mahu2021 (500 in chips) 
Seat 2: M@FFI87 (500 in chips) 
Seat 3: Corruptable1 (500 in chips) 
M@FFI87: posts small blind 10
Corruptable1: posts big blind 20
*** HOLE CARDS ***
Dealt to Mahu2021 [7h 6h]
Mahu2021: raises 20 to 40
M@FFI87: folds 
Corruptable1: folds 
Uncalled bet (20) returned to Mahu2021
Mahu2021 collected 50 from pot
Mahu2021: doesn't show hand 
*** SUMMARY ***
Total pot 50 | Rake 0 
Seat 1: Mahu2021 (button) collected (50)
Seat 2: M@FFI87 (small blind) folded before Flop
Seat 3: Corruptable1 (big blind) folded before Flop



PokerStars Hand #255742622852: Tournament #3879459221, $0.46+$0.04 USD Hold'em No Limit - Level I (10/20) - 2025/04/15 10:44:30 CET [2025/04/15 4:44:30 ET]
Table '3879459221 1' 3-max Seat #2 is the button
Seat 1: Mahu2021 (530 in chips) 
Seat 2: M@FFI87 (490 in chips) 
Seat 3: Corruptable1 (480 in chips) 
Corruptable1: posts small blind 10
Mahu2021: posts big blind 20
*** HOLE CARDS ***
Dealt to Mahu2021 [7s Ah]
M@FFI87: raises 20 to 40
Corruptable1: raises 100 to 140
Mahu2021: folds 
M@FFI87: folds 
Uncalled bet (100) returned to Corruptable1
Corruptable1 collected 100 from pot
*** SUMMARY ***
Total pot 100 | Rake 0 
Seat 1: Mahu2021 (big blind) folded before Flop
Seat 2: M@FFI87 (button) folded before Flop
Seat 3: Corruptable1 (small blind) collected (100)



PokerStars Hand #255742624116: Tournament #3879459221, $0.46+$0.04 USD Hold'em No Limit - Level I (10/20) - 2025/04/15 10:44:46 CET [2025/04/15 4:44:46 ET]
Table '3879459221 1' 3-max Seat #3 is the button
Seat 1: Mahu2021 (510 in chips) 
Seat 2: M@FFI87 (450 in chips) 
Seat 3: Corruptable1 (540 in chips) 
Mahu2021: posts small blind 10
M@FFI87: posts big blind 20
*** HOLE CARDS ***
Dealt to Mahu2021 [2c 3s]
Corruptable1: raises 20 to 40
Mahu2021: folds 
M@FFI87: folds 
Uncalled bet (20) returned to Corruptable1
Corruptable1 collected 50 from pot
*** SUMMARY ***
Total pot 50 | Rake 0 
Seat 1: Mahu2021 (small blind) folded before Flop
Seat 2: M@FFI87 (big blind) folded before Flop
Seat 3: Corruptable1 (button) collected (50)



PokerStars Hand #255742625125: Tournament #3879459221, $0.46+$0.04 USD Hold'em No Limit - Level I (10/20) - 2025/04/15 10:44:57 CET [2025/04/15 4:44:57 ET]
Table '3879459221 1' 3-max Seat #1 is the button
Seat 1: Mahu2021 (500 in chips) 
Seat 2: M@FFI87 (430 in chips) 
Seat 3: Corruptable1 (570 in chips) 
M@FFI87: posts small blind 10
Corruptable1: posts big blind 20
*** HOLE CARDS ***
Dealt to Mahu2021 [7d 3c]
Mahu2021: folds 
M@FFI87: raises 410 to 430 and is all-in
Corruptable1: folds 
Uncalled bet (410) returned to M@FFI87
M@FFI87 collected 40 from pot
M@FFI87: doesn't show hand 
*** SUMMARY ***
Total pot 40 | Rake 0 
Seat 1: Mahu2021 (button) folded before Flop (didn't bet)
Seat 2: M@FFI87 (small blind) collected (40)
Seat 3: Corruptable1 (big blind) folded before Flop



PokerStars Hand #255742626015: Tournament #3879459221, $0.46+$0.04 USD Hold'em No Limit - Level I (10/20) - 2025/04/15 10:45:07 CET [2025/04/15 4:45:07 ET]
Table '3879459221 1' 3-max Seat #2 is the button
Seat 1: Mahu2021 (500 in chips) 
Seat 2: M@FFI87 (450 in chips) 
Seat 3: Corruptable1 (550 in chips) 
Corruptable1: posts small blind 10
Mahu2021: posts big blind 20
*** HOLE CARDS ***
Dealt to Mahu2021 [6s 4c]
M@FFI87: folds 
Corruptable1: raises 40 to 60
Mahu2021: folds 
Uncalled bet (40) returned to Corruptable1
Corruptable1 collected 40 from pot
*** SUMMARY ***
Total pot 40 | Rake 0 
Seat 1: Mahu2021 (big blind) folded before Flop
Seat 2: M@FFI87 (button) folded before Flop (didn't bet)
Seat 3: Corruptable1 (small blind) collected (40)



PokerStars Hand #255742626998: Tournament #3879459221, $0.46+$0.04 USD Hold'em No Limit - Level I (10/20) - 2025/04/15 10:45:19 CET [2025/04/15 4:45:19 ET]
Table '3879459221 1' 3-max Seat #3 is the button
Seat 1: Mahu2021 (480 in chips) 
Seat 2: M@FFI87 (450 in chips) 
Seat 3: Corruptable1 (570 in chips) 
Mahu2021: posts small blind 10
M@FFI87: posts big blind 20
*** HOLE CARDS ***
Dealt to Mahu2021 [5d 9s]
Corruptable1: raises 20 to 40
Mahu2021: folds 
M@FFI87: folds 
Uncalled bet (20) returned to Corruptable1
Corruptable1 collected 50 from pot
*** SUMMARY ***
Total pot 50 | Rake 0 
Seat 1: Mahu2021 (small blind) folded before Flop
Seat 2: M@FFI87 (big blind) folded before Flop
Seat 3: Corruptable1 (button) collected (50)



PokerStars Hand #255742627753: Tournament #3879459221, $0.46+$0.04 USD Hold'em No Limit - Level I (10/20) - 2025/04/15 10:45:28 CET [2025/04/15 4:45:28 ET]
Table '3879459221 1' 3-max Seat #1 is the button
Seat 1: Mahu2021 (470 in chips) 
Seat 2: M@FFI87 (430 in chips) 
Seat 3: Corruptable1 (600 in chips) 
M@FFI87: posts small blind 10
Corruptable1: posts big blind 20
*** HOLE CARDS ***
Dealt to Mahu2021 [Qs Qh]
Mahu2021: raises 20 to 40
M@FFI87: raises 390 to 430 and is all-in
Corruptable1: folds 
Mahu2021: calls 390
*** FLOP *** [3s Tc 7c]
*** TURN *** [3s Tc 7c] [Jc]
*** RIVER *** [3s Tc 7c Jc] [Th]
*** SHOW DOWN ***
M@FFI87: shows [Td Ts] (four of a kind, Tens)
Mahu2021: shows [Qs Qh] (two pair, Queens and Tens)
M@FFI87 collected 880 from pot
*** SUMMARY ***
Total pot 880 | Rake 0 
Board [3s Tc 7c Jc Th]
Seat 1: Mahu2021 (button) showed [Qs Qh] and lost with two pair, Queens and Tens
Seat 2: M@FFI87 (small blind) showed [Td Ts] and won (880) with four of a kind, Tens
Seat 3: Corruptable1 (big blind) folded before Flop



PokerStars Hand #255742629529: Tournament #3879459221, $0.46+$0.04 USD Hold'em No Limit - Level I (10/20) - 2025/04/15 10:45:48 CET [2025/04/15 4:45:48 ET]
Table '3879459221 1' 3-max Seat #2 is the button
Seat 1: Mahu2021 (40 in chips) 
Seat 2: M@FFI87 (880 in chips) 
Seat 3: Corruptable1 (580 in chips) 
Corruptable1: posts small blind 10
Mahu2021: posts big blind 20
*** HOLE CARDS ***
Dealt to Mahu2021 [5d 5c]
M@FFI87: raises 860 to 880 and is all-in
Corruptable1: folds 
Mahu2021: calls 20 and is all-in
Uncalled bet (840) returned to M@FFI87
*** FLOP *** [3s 8h 6c]
*** TURN *** [3s 8h 6c] [8d]
*** RIVER *** [3s 8h 6c 8d] [Th]
*** SHOW DOWN ***
Mahu2021: shows [5d 5c] (two pair, Eights and Fives)
M@FFI87: shows [Ac As] (two pair, Aces and Eights)
M@FFI87 collected 90 from pot
Mahu2021 finished the tournament in 3rd place
*** SUMMARY ***
Total pot 90 | Rake 0 
Board [3s 8h 6c 8d Th]
Seat 1: Mahu2021 (big blind) showed [5d 5c] and lost with two pair, Eights and Fives
Seat 2: M@FFI87 (button) showed [Ac As] and won (90) with two pair, Aces and Eights
Seat 3: Corruptable1 (small blind) folded before Flop



