PokerStars Hand #253936555625: Tournament #3836030857, $0.96+$0.04 USD Hold'em No Limit - Match Round I, Level I (25/50) - 2024/12/20 10:39:01 CET [2024/12/20 4:39:01 ET]
Table '3836030857 2' 4-max Seat #1 is the button
Seat 1: Mahu2021 (500 in chips) 
Seat 2: shy007guy (500 in chips) 
Seat 3: TeddiSmit (500 in chips) 
Seat 4: maria1281 (500 in chips) 
Mahu2021: posts the ante 10
shy007guy: posts the ante 10
TeddiSmit: posts the ante 10
maria1281: posts the ante 10
shy007guy: posts small blind 25
TeddiSmit: posts big blind 50
*** HOLE CARDS ***
Dealt to Mahu2021 [7c 2s]
maria1281: calls 50
Mahu2021: folds 
shy007guy: calls 25
TeddiSmit: raises 440 to 490 and is all-in
maria1281: folds 
shy007guy: calls 440 and is all-in
*** FLOP *** [4c As Td]
*** TURN *** [4c As Td] [9c]
*** RIVER *** [4c As Td 9c] [Qh]
*** SHOW DOWN ***
shy007guy: shows [9d Tc] (two pair, Tens and Nines)
TeddiSmit: shows [9s Jh] (a pair of Nines)
shy007guy collected 1070 from pot
TeddiSmit finished the tournament in 16th place
*** SUMMARY ***
Total pot 1070 | Rake 0 
Board [4c As Td 9c Qh]
Seat 1: Mahu2021 (button) folded before Flop (didn't bet)
Seat 2: shy007guy (small blind) showed [9d Tc] and won (1070) with two pair, Tens and Nines
Seat 3: TeddiSmit (big blind) showed [9s Jh] and lost with a pair of Nines
Seat 4: maria1281 folded before Flop



PokerStars Hand #253936558255: Tournament #3836030857, $0.96+$0.04 USD Hold'em No Limit - Match Round I, Level I (25/50) - 2024/12/20 10:39:28 CET [2024/12/20 4:39:28 ET]
Table '3836030857 2' 4-max Seat #2 is the button
Seat 1: Mahu2021 (490 in chips) 
Seat 2: shy007guy (1070 in chips) 
Seat 4: maria1281 (440 in chips) 
Mahu2021: posts the ante 10
shy007guy: posts the ante 10
maria1281: posts the ante 10
maria1281: posts small blind 25
Mahu2021: posts big blind 50
*** HOLE CARDS ***
Dealt to Mahu2021 [5c Ad]
shy007guy: folds 
maria1281: raises 380 to 430 and is all-in
Mahu2021: calls 380
*** FLOP *** [Jh 9c 5s]
*** TURN *** [Jh 9c 5s] [2d]
*** RIVER *** [Jh 9c 5s 2d] [3h]
*** SHOW DOWN ***
maria1281: shows [Th Js] (a pair of Jacks)
Mahu2021: shows [5c Ad] (a pair of Fives)
maria1281 collected 890 from pot
*** SUMMARY ***
Total pot 890 | Rake 0 
Board [Jh 9c 5s 2d 3h]
Seat 1: Mahu2021 (big blind) showed [5c Ad] and lost with a pair of Fives
Seat 2: shy007guy (button) folded before Flop (didn't bet)
Seat 4: maria1281 (small blind) showed [Th Js] and won (890) with a pair of Jacks



PokerStars Hand #253936559978: Tournament #3836030857, $0.96+$0.04 USD Hold'em No Limit - Match Round I, Level I (25/50) - 2024/12/20 10:39:45 CET [2024/12/20 4:39:45 ET]
Table '3836030857 2' 4-max Seat #4 is the button
Seat 1: Mahu2021 (50 in chips) 
Seat 2: shy007guy (1060 in chips) 
Seat 4: maria1281 (890 in chips) 
Mahu2021: posts the ante 10
shy007guy: posts the ante 10
maria1281: posts the ante 10
Mahu2021: posts small blind 25
shy007guy: posts big blind 50
*** HOLE CARDS ***
Dealt to Mahu2021 [7h 2c]
maria1281: folds 
Mahu2021: calls 15 and is all-in
Uncalled bet (10) returned to shy007guy
*** FLOP *** [Th 2d Kd]
*** TURN *** [Th 2d Kd] [Js]
*** RIVER *** [Th 2d Kd Js] [9d]
*** SHOW DOWN ***
Mahu2021: shows [7h 2c] (a pair of Deuces)
shy007guy: shows [5h 6d] (high card King)
Mahu2021 collected 110 from pot
*** SUMMARY ***
Total pot 110 | Rake 0 
Board [Th 2d Kd Js 9d]
Seat 1: Mahu2021 (small blind) showed [7h 2c] and won (110) with a pair of Deuces
Seat 2: shy007guy (big blind) showed [5h 6d] and lost with high card King
Seat 4: maria1281 (button) folded before Flop (didn't bet)



PokerStars Hand #253936561188: Tournament #3836030857, $0.96+$0.04 USD Hold'em No Limit - Match Round I, Level I (25/50) - 2024/12/20 10:39:59 CET [2024/12/20 4:39:59 ET]
Table '3836030857 2' 4-max Seat #1 is the button
Seat 1: Mahu2021 (110 in chips) 
Seat 2: shy007guy (1010 in chips) 
Seat 4: maria1281 (880 in chips) 
Mahu2021: posts the ante 10
shy007guy: posts the ante 10
maria1281: posts the ante 10
shy007guy: posts small blind 25
maria1281: posts big blind 50
*** HOLE CARDS ***
Dealt to Mahu2021 [9d 7d]
Mahu2021: folds 
shy007guy: calls 25
maria1281: checks 
*** FLOP *** [6c Th 7s]
shy007guy: checks 
maria1281: checks 
*** TURN *** [6c Th 7s] [Ah]
shy007guy: bets 130
maria1281: calls 130
*** RIVER *** [6c Th 7s Ah] [3c]
shy007guy: checks 
maria1281: checks 
*** SHOW DOWN ***
shy007guy: shows [5h Qd] (high card Ace)
maria1281: shows [8s 8d] (a pair of Eights)
maria1281 collected 390 from pot
*** SUMMARY ***
Total pot 390 | Rake 0 
Board [6c Th 7s Ah 3c]
Seat 1: Mahu2021 (button) folded before Flop (didn't bet)
Seat 2: shy007guy (small blind) showed [5h Qd] and lost with high card Ace
Seat 4: maria1281 (big blind) showed [8s 8d] and won (390) with a pair of Eights



PokerStars Hand #253936563943: Tournament #3836030857, $0.96+$0.04 USD Hold'em No Limit - Match Round I, Level I (25/50) - 2024/12/20 10:40:26 CET [2024/12/20 4:40:26 ET]
Table '3836030857 2' 4-max Seat #2 is the button
Seat 1: Mahu2021 (100 in chips) 
Seat 2: shy007guy (820 in chips) 
Seat 4: maria1281 (1080 in chips) 
Mahu2021: posts the ante 10
shy007guy: posts the ante 10
maria1281: posts the ante 10
maria1281: posts small blind 25
Mahu2021: posts big blind 50
*** HOLE CARDS ***
Dealt to Mahu2021 [2h 2s]
shy007guy: folds 
maria1281: raises 50 to 100
Mahu2021: calls 40 and is all-in
Uncalled bet (10) returned to maria1281
*** FLOP *** [Qs Jc 8c]
*** TURN *** [Qs Jc 8c] [Jd]
*** RIVER *** [Qs Jc 8c Jd] [Ks]
*** SHOW DOWN ***
maria1281: shows [4s Ah] (a pair of Jacks)
Mahu2021: shows [2h 2s] (two pair, Jacks and Deuces)
Mahu2021 collected 210 from pot
*** SUMMARY ***
Total pot 210 | Rake 0 
Board [Qs Jc 8c Jd Ks]
Seat 1: Mahu2021 (big blind) showed [2h 2s] and won (210) with two pair, Jacks and Deuces
Seat 2: shy007guy (button) folded before Flop (didn't bet)
Seat 4: maria1281 (small blind) showed [4s Ah] and lost with a pair of Jacks



PokerStars Hand #253936565667: Tournament #3836030857, $0.96+$0.04 USD Hold'em No Limit - Match Round I, Level I (25/50) - 2024/12/20 10:40:43 CET [2024/12/20 4:40:43 ET]
Table '3836030857 2' 4-max Seat #4 is the button
Seat 1: Mahu2021 (210 in chips) 
Seat 2: shy007guy (810 in chips) 
Seat 4: maria1281 (980 in chips) 
Mahu2021: posts the ante 10
shy007guy: posts the ante 10
maria1281: posts the ante 10
Mahu2021: posts small blind 25
shy007guy: posts big blind 50
*** HOLE CARDS ***
Dealt to Mahu2021 [5d Jh]
maria1281: folds 
Mahu2021: raises 150 to 200 and is all-in
shy007guy: calls 150
*** FLOP *** [7s 2s 4d]
*** TURN *** [7s 2s 4d] [6c]
*** RIVER *** [7s 2s 4d 6c] [Th]
*** SHOW DOWN ***
Mahu2021: shows [5d Jh] (high card Jack)
shy007guy: shows [8d Ac] (high card Ace)
shy007guy collected 430 from pot
Mahu2021 finished the tournament in 13th place
*** SUMMARY ***
Total pot 430 | Rake 0 
Board [7s 2s 4d 6c Th]
Seat 1: Mahu2021 (small blind) showed [5d Jh] and lost with high card Jack
Seat 2: shy007guy (big blind) showed [8d Ac] and won (430) with high card Ace
Seat 4: maria1281 (button) folded before Flop (didn't bet)



