PokerStars Hand #242814534532: Tournament #3570627039, $0.92+$0.08 USD Hold'em No Limit - Level I (10/20) - 2023/04/01 13:46:50 CET [2023/04/01 7:46:50 ET]
Table '3570627039 1' 3-max Seat #1 is the button
Seat 1: jojo7209 (500 in chips) 
Seat 2: Mahu2021 (500 in chips) 
Seat 3: home depo926 (500 in chips) 
Mahu2021: posts small blind 10
home depo926: posts big blind 20
*** HOLE CARDS ***
Dealt to Mahu2021 [9c 7s]
jojo7209: calls 20
Mahu2021: calls 10
home depo926: checks 
*** FLOP *** [Tc Ts Qh]
Mahu2021: checks 
home depo926: checks 
jojo7209: checks 
*** TURN *** [Tc Ts Qh] [3s]
Mahu2021: checks 
home depo926: checks 
jojo7209: checks 
*** RIVER *** [Tc Ts Qh 3s] [7d]
Mahu2021: checks 
home depo926: bets 80
jojo7209: folds 
Mahu2021: calls 80
*** SHOW DOWN ***
home depo926: shows [7h 9h] (two pair, Tens and Sevens)
Mahu2021: shows [9c 7s] (two pair, Tens and Sevens)
Mahu2021 collected 110 from pot
home depo926 collected 110 from pot
*** SUMMARY ***
Total pot 220 | Rake 0 
Board [Tc Ts Qh 3s 7d]
Seat 1: jojo7209 (button) folded on the River
Seat 2: Mahu2021 (small blind) showed [9c 7s] and won (110) with two pair, Tens and Sevens
Seat 3: home depo926 (big blind) showed [7h 9h] and won (110) with two pair, Tens and Sevens



PokerStars Hand #242814538959: Tournament #3570627039, $0.92+$0.08 USD Hold'em No Limit - Level I (10/20) - 2023/04/01 13:47:12 CET [2023/04/01 7:47:12 ET]
Table '3570627039 1' 3-max Seat #2 is the button
Seat 1: jojo7209 (480 in chips) 
Seat 2: Mahu2021 (510 in chips) 
Seat 3: home depo926 (510 in chips) 
home depo926: posts small blind 10
jojo7209: posts big blind 20
*** HOLE CARDS ***
Dealt to Mahu2021 [3s 6h]
Mahu2021: folds 
home depo926: calls 10
jojo7209: checks 
*** FLOP *** [5h 5c Tc]
home depo926: bets 20
jojo7209: folds 
Uncalled bet (20) returned to home depo926
home depo926 collected 40 from pot
*** SUMMARY ***
Total pot 40 | Rake 0 
Board [5h 5c Tc]
Seat 1: jojo7209 (big blind) folded on the Flop
Seat 2: Mahu2021 (button) folded before Flop (didn't bet)
Seat 3: home depo926 (small blind) collected (40)



PokerStars Hand #242814541699: Tournament #3570627039, $0.92+$0.08 USD Hold'em No Limit - Level I (10/20) - 2023/04/01 13:47:26 CET [2023/04/01 7:47:26 ET]
Table '3570627039 1' 3-max Seat #3 is the button
Seat 1: jojo7209 (460 in chips) 
Seat 2: Mahu2021 (510 in chips) 
Seat 3: home depo926 (530 in chips) 
jojo7209: posts small blind 10
Mahu2021: posts big blind 20
*** HOLE CARDS ***
Dealt to Mahu2021 [Jc 8s]
home depo926: calls 20
jojo7209: folds 
Mahu2021: checks 
*** FLOP *** [9c 3s 9s]
Mahu2021: checks 
home depo926: checks 
*** TURN *** [9c 3s 9s] [Kh]
Mahu2021: checks 
home depo926: checks 
*** RIVER *** [9c 3s 9s Kh] [Jh]
Mahu2021: checks 
home depo926: checks 
*** SHOW DOWN ***
Mahu2021: shows [Jc 8s] (two pair, Jacks and Nines)
home depo926: mucks hand 
Mahu2021 collected 50 from pot
*** SUMMARY ***
Total pot 50 | Rake 0 
Board [9c 3s 9s Kh Jh]
Seat 1: jojo7209 (small blind) folded before Flop
Seat 2: Mahu2021 (big blind) showed [Jc 8s] and won (50) with two pair, Jacks and Nines
Seat 3: home depo926 (button) mucked [Ts 8h]



PokerStars Hand #242814547076: Tournament #3570627039, $0.92+$0.08 USD Hold'em No Limit - Level I (10/20) - 2023/04/01 13:47:53 CET [2023/04/01 7:47:53 ET]
Table '3570627039 1' 3-max Seat #1 is the button
Seat 1: jojo7209 (450 in chips) 
Seat 2: Mahu2021 (540 in chips) 
Seat 3: home depo926 (510 in chips) 
Mahu2021: posts small blind 10
home depo926: posts big blind 20
*** HOLE CARDS ***
Dealt to Mahu2021 [5d 8s]
jojo7209: calls 20
Mahu2021: folds 
home depo926: checks 
*** FLOP *** [Kc 6c Ts]
home depo926: bets 20
jojo7209: calls 20
*** TURN *** [Kc 6c Ts] [8c]
home depo926: bets 20
jojo7209: calls 20
*** RIVER *** [Kc 6c Ts 8c] [4c]
home depo926: bets 20
jojo7209: folds 
Uncalled bet (20) returned to home depo926
home depo926 collected 130 from pot
*** SUMMARY ***
Total pot 130 | Rake 0 
Board [Kc 6c Ts 8c 4c]
Seat 1: jojo7209 (button) folded on the River
Seat 2: Mahu2021 (small blind) folded before Flop
Seat 3: home depo926 (big blind) collected (130)



PokerStars Hand #242814553607: Tournament #3570627039, $0.92+$0.08 USD Hold'em No Limit - Level I (10/20) - 2023/04/01 13:48:26 CET [2023/04/01 7:48:26 ET]
Table '3570627039 1' 3-max Seat #2 is the button
Seat 1: jojo7209 (390 in chips) 
Seat 2: Mahu2021 (530 in chips) 
Seat 3: home depo926 (580 in chips) 
home depo926: posts small blind 10
jojo7209: posts big blind 20
*** HOLE CARDS ***
Dealt to Mahu2021 [3c 6c]
Mahu2021: calls 20
home depo926: folds 
jojo7209: checks 
*** FLOP *** [Qs 7h 6h]
jojo7209: checks 
Mahu2021: checks 
*** TURN *** [Qs 7h 6h] [5s]
jojo7209: checks 
Mahu2021: checks 
*** RIVER *** [Qs 7h 6h 5s] [Qc]
jojo7209: checks 
Mahu2021: bets 50
jojo7209: calls 50
*** SHOW DOWN ***
Mahu2021: shows [3c 6c] (two pair, Queens and Sixes)
jojo7209: shows [Ks Kh] (two pair, Kings and Queens)
jojo7209 collected 150 from pot
*** SUMMARY ***
Total pot 150 | Rake 0 
Board [Qs 7h 6h 5s Qc]
Seat 1: jojo7209 (big blind) showed [Ks Kh] and won (150) with two pair, Kings and Queens
Seat 2: Mahu2021 (button) showed [3c 6c] and lost with two pair, Queens and Sixes
Seat 3: home depo926 (small blind) folded before Flop



PokerStars Hand #242814560423: Tournament #3570627039, $0.92+$0.08 USD Hold'em No Limit - Level II (15/30) - 2023/04/01 13:48:59 CET [2023/04/01 7:48:59 ET]
Table '3570627039 1' 3-max Seat #3 is the button
Seat 1: jojo7209 (470 in chips) 
Seat 2: Mahu2021 (460 in chips) 
Seat 3: home depo926 (570 in chips) 
jojo7209: posts small blind 15
Mahu2021: posts big blind 30
*** HOLE CARDS ***
Dealt to Mahu2021 [5d 5c]
home depo926: raises 30 to 60
jojo7209: calls 45
Mahu2021: raises 400 to 460 and is all-in
home depo926: raises 110 to 570 and is all-in
jojo7209: folds 
Uncalled bet (110) returned to home depo926
*** FLOP *** [6h Qd Kh]
*** TURN *** [6h Qd Kh] [6d]
*** RIVER *** [6h Qd Kh 6d] [Ks]
*** SHOW DOWN ***
Mahu2021: shows [5d 5c] (two pair, Kings and Sixes)
home depo926: shows [4c Ac] (two pair, Kings and Sixes - Ace kicker)
home depo926 collected 980 from pot
Mahu2021 finished the tournament in 3rd place
*** SUMMARY ***
Total pot 980 | Rake 0 
Board [6h Qd Kh 6d Ks]
Seat 1: jojo7209 (small blind) folded before Flop
Seat 2: Mahu2021 (big blind) showed [5d 5c] and lost with two pair, Kings and Sixes
Seat 3: home depo926 (button) showed [4c Ac] and won (980) with two pair, Kings and Sixes



