PokerStars Hand #249176861402: Tournament #3723143551, $1.84+$0.16 USD Hold'em No Limit - Level I (10/20) - 2024/03/01 17:33:16 CET [2024/03/01 11:33:16 ET]
Table '3723143551 1' 3-max Seat #1 is the button
Seat 1: hackett1 (500 in chips) 
Seat 2: Mahu2021 (500 in chips) 
Seat 3: maike.amaral (500 in chips) 
Mahu2021: posts small blind 10
maike.amaral: posts big blind 20
*** HOLE CARDS ***
Dealt to Mahu2021 [Kc 6d]
hackett1: folds 
Mahu2021: folds 
Uncalled bet (10) returned to maike.amaral
maike.amaral collected 20 from pot
*** SUMMARY ***
Total pot 20 | Rake 0 
Seat 1: hackett1 (button) folded before Flop (didn't bet)
Seat 2: Mahu2021 (small blind) folded before Flop
Seat 3: maike.amaral (big blind) collected (20)



PokerStars Hand #249176865366: Tournament #3723143551, $1.84+$0.16 USD Hold'em No Limit - Level I (10/20) - 2024/03/01 17:33:30 CET [2024/03/01 11:33:30 ET]
Table '3723143551 1' 3-max Seat #2 is the button
Seat 1: hackett1 (500 in chips) 
Seat 2: Mahu2021 (490 in chips) 
Seat 3: maike.amaral (510 in chips) 
maike.amaral: posts small blind 10
hackett1: posts big blind 20
*** HOLE CARDS ***
Dealt to Mahu2021 [Ad 8d]
Mahu2021: raises 20 to 40
maike.amaral: raises 470 to 510 and is all-in
hackett1: folds 
Mahu2021: folds 
Uncalled bet (470) returned to maike.amaral
maike.amaral collected 100 from pot
*** SUMMARY ***
Total pot 100 | Rake 0 
Seat 1: hackett1 (big blind) folded before Flop
Seat 2: Mahu2021 (button) folded before Flop
Seat 3: maike.amaral (small blind) collected (100)



PokerStars Hand #249176868618: Tournament #3723143551, $1.84+$0.16 USD Hold'em No Limit - Level I (10/20) - 2024/03/01 17:33:43 CET [2024/03/01 11:33:43 ET]
Table '3723143551 1' 3-max Seat #3 is the button
Seat 1: hackett1 (480 in chips) 
Seat 2: Mahu2021 (450 in chips) 
Seat 3: maike.amaral (570 in chips) 
hackett1: posts small blind 10
Mahu2021: posts big blind 20
*** HOLE CARDS ***
Dealt to Mahu2021 [Tc 8h]
maike.amaral: folds 
hackett1: folds 
Uncalled bet (10) returned to Mahu2021
Mahu2021 collected 20 from pot
Mahu2021: doesn't show hand 
*** SUMMARY ***
Total pot 20 | Rake 0 
Seat 1: hackett1 (small blind) folded before Flop
Seat 2: Mahu2021 (big blind) collected (20)
Seat 3: maike.amaral (button) folded before Flop (didn't bet)



PokerStars Hand #249176869955: Tournament #3723143551, $1.84+$0.16 USD Hold'em No Limit - Level I (10/20) - 2024/03/01 17:33:48 CET [2024/03/01 11:33:48 ET]
Table '3723143551 1' 3-max Seat #1 is the button
Seat 1: hackett1 (470 in chips) 
Seat 2: Mahu2021 (460 in chips) 
Seat 3: maike.amaral (570 in chips) 
Mahu2021: posts small blind 10
maike.amaral: posts big blind 20
*** HOLE CARDS ***
Dealt to Mahu2021 [Th 6d]
hackett1: folds 
Mahu2021: folds 
Uncalled bet (10) returned to maike.amaral
maike.amaral collected 20 from pot
*** SUMMARY ***
Total pot 20 | Rake 0 
Seat 1: hackett1 (button) folded before Flop (didn't bet)
Seat 2: Mahu2021 (small blind) folded before Flop
Seat 3: maike.amaral (big blind) collected (20)



PokerStars Hand #249176871315: Tournament #3723143551, $1.84+$0.16 USD Hold'em No Limit - Level I (10/20) - 2024/03/01 17:33:53 CET [2024/03/01 11:33:53 ET]
Table '3723143551 1' 3-max Seat #2 is the button
Seat 1: hackett1 (470 in chips) 
Seat 2: Mahu2021 (450 in chips) 
Seat 3: maike.amaral (580 in chips) 
maike.amaral: posts small blind 10
hackett1: posts big blind 20
*** HOLE CARDS ***
Dealt to Mahu2021 [9c Qc]
Mahu2021: calls 20
maike.amaral: calls 10
hackett1: checks 
*** FLOP *** [Qh As 5d]
maike.amaral: checks 
hackett1: checks 
Mahu2021: bets 60
maike.amaral: calls 60
hackett1: folds 
*** TURN *** [Qh As 5d] [7d]
maike.amaral: checks 
Mahu2021: checks 
*** RIVER *** [Qh As 5d 7d] [Jd]
maike.amaral: checks 
Mahu2021: checks 
*** SHOW DOWN ***
maike.amaral: shows [8h Jh] (a pair of Jacks)
Mahu2021: shows [9c Qc] (a pair of Queens)
Mahu2021 collected 180 from pot
*** SUMMARY ***
Total pot 180 | Rake 0 
Board [Qh As 5d 7d Jd]
Seat 1: hackett1 (big blind) folded on the Flop
Seat 2: Mahu2021 (button) showed [9c Qc] and won (180) with a pair of Queens
Seat 3: maike.amaral (small blind) showed [8h Jh] and lost with a pair of Jacks



PokerStars Hand #249176878719: Tournament #3723143551, $1.84+$0.16 USD Hold'em No Limit - Level I (10/20) - 2024/03/01 17:34:21 CET [2024/03/01 11:34:21 ET]
Table '3723143551 1' 3-max Seat #3 is the button
Seat 1: hackett1 (450 in chips) 
Seat 2: Mahu2021 (550 in chips) 
Seat 3: maike.amaral (500 in chips) 
hackett1: posts small blind 10
Mahu2021: posts big blind 20
*** HOLE CARDS ***
Dealt to Mahu2021 [8h 5h]
maike.amaral: folds 
hackett1: calls 10
Mahu2021: checks 
*** FLOP *** [Jh 3s 2s]
hackett1: checks 
Mahu2021: checks 
*** TURN *** [Jh 3s 2s] [Ac]
hackett1: checks 
Mahu2021: bets 40
hackett1: folds 
Uncalled bet (40) returned to Mahu2021
Mahu2021 collected 40 from pot
Mahu2021: doesn't show hand 
*** SUMMARY ***
Total pot 40 | Rake 0 
Board [Jh 3s 2s Ac]
Seat 1: hackett1 (small blind) folded on the Turn
Seat 2: Mahu2021 (big blind) collected (40)
Seat 3: maike.amaral (button) folded before Flop (didn't bet)



PokerStars Hand #249176886476: Tournament #3723143551, $1.84+$0.16 USD Hold'em No Limit - Level I (10/20) - 2024/03/01 17:34:50 CET [2024/03/01 11:34:50 ET]
Table '3723143551 1' 3-max Seat #1 is the button
Seat 1: hackett1 (430 in chips) 
Seat 2: Mahu2021 (570 in chips) 
Seat 3: maike.amaral (500 in chips) 
Mahu2021: posts small blind 10
maike.amaral: posts big blind 20
*** HOLE CARDS ***
Dealt to Mahu2021 [Tc 3h]
hackett1: raises 20 to 40
Mahu2021: folds 
maike.amaral: folds 
Uncalled bet (20) returned to hackett1
hackett1 collected 50 from pot
hackett1: doesn't show hand 
*** SUMMARY ***
Total pot 50 | Rake 0 
Seat 1: hackett1 (button) collected (50)
Seat 2: Mahu2021 (small blind) folded before Flop
Seat 3: maike.amaral (big blind) folded before Flop



PokerStars Hand #249176889830: Tournament #3723143551, $1.84+$0.16 USD Hold'em No Limit - Level I (10/20) - 2024/03/01 17:35:03 CET [2024/03/01 11:35:03 ET]
Table '3723143551 1' 3-max Seat #2 is the button
Seat 1: hackett1 (460 in chips) 
Seat 2: Mahu2021 (560 in chips) 
Seat 3: maike.amaral (480 in chips) 
maike.amaral: posts small blind 10
hackett1: posts big blind 20
*** HOLE CARDS ***
Dealt to Mahu2021 [Td 2d]
Mahu2021: folds 
maike.amaral: raises 40 to 60
hackett1: raises 400 to 460 and is all-in
maike.amaral: calls 400
*** FLOP *** [6s 5h 6d]
*** TURN *** [6s 5h 6d] [Th]
*** RIVER *** [6s 5h 6d Th] [2c]
*** SHOW DOWN ***
maike.amaral: shows [Js Ts] (two pair, Tens and Sixes)
hackett1: shows [8c 8d] (two pair, Eights and Sixes)
maike.amaral collected 920 from pot
hackett1 finished the tournament in 3rd place
*** SUMMARY ***
Total pot 920 | Rake 0 
Board [6s 5h 6d Th 2c]
Seat 1: hackett1 (big blind) showed [8c 8d] and lost with two pair, Eights and Sixes
Seat 2: Mahu2021 (button) folded before Flop (didn't bet)
Seat 3: maike.amaral (small blind) showed [Js Ts] and won (920) with two pair, Tens and Sixes



PokerStars Hand #249176895761: Tournament #3723143551, $1.84+$0.16 USD Hold'em No Limit - Level II (15/30) - 2024/03/01 17:35:25 CET [2024/03/01 11:35:25 ET]
Table '3723143551 1' 3-max Seat #3 is the button
Seat 2: Mahu2021 (560 in chips) 
Seat 3: maike.amaral (940 in chips) 
maike.amaral: posts small blind 15
Mahu2021: posts big blind 30
*** HOLE CARDS ***
Dealt to Mahu2021 [4c 4h]
maike.amaral: raises 60 to 90
Mahu2021: raises 470 to 560 and is all-in
maike.amaral: calls 470
*** FLOP *** [Tc Qd 5h]
*** TURN *** [Tc Qd 5h] [6d]
*** RIVER *** [Tc Qd 5h 6d] [3s]
*** SHOW DOWN ***
Mahu2021: shows [4c 4h] (a pair of Fours)
maike.amaral: shows [Qc Js] (a pair of Queens)
maike.amaral collected 1120 from pot
Mahu2021 finished the tournament in 2nd place
maike.amaral wins the tournament and receives $4.00 - congratulations!
*** SUMMARY ***
Total pot 1120 | Rake 0 
Board [Tc Qd 5h 6d 3s]
Seat 2: Mahu2021 (big blind) showed [4c 4h] and lost with a pair of Fours
Seat 3: maike.amaral (button) (small blind) showed [Qc Js] and won (1120) with a pair of Queens



