PokerStars Hand #253355538455: Tournament #3822403963, $1.84+$0.16 USD Hold'em No Limit - Level I (10/20) - 2024/11/11 11:32:31 CET [2024/11/11 5:32:31 ET]
Table '3822403963 1' 3-max Seat #1 is the button
Seat 1: Wezun721 (500 in chips) 
Seat 2: Mahu2021 (500 in chips) 
Seat 3: kingmarjo (500 in chips) 
Mahu2021: posts small blind 10
kingmarjo: posts big blind 20
*** HOLE CARDS ***
Dealt to Mahu2021 [6d 6s]
Wezun721: calls 20
Mahu2021: calls 10
kingmarjo: raises 100 to 120
Wezun721: folds 
Mahu2021: calls 100
*** FLOP *** [Qs Jh Ac]
Mahu2021: checks 
kingmarjo: bets 260
Mahu2021: folds 
Uncalled bet (260) returned to kingmarjo
kingmarjo collected 260 from pot
kingmarjo: doesn't show hand 
*** SUMMARY ***
Total pot 260 | Rake 0 
Board [Qs Jh Ac]
Seat 1: Wezun721 (button) folded before Flop
Seat 2: Mahu2021 (small blind) folded on the Flop
Seat 3: kingmarjo (big blind) collected (260)



PokerStars Hand #253355540684: Tournament #3822403963, $1.84+$0.16 USD Hold'em No Limit - Level I (10/20) - 2024/11/11 11:32:51 CET [2024/11/11 5:32:51 ET]
Table '3822403963 1' 3-max Seat #2 is the button
Seat 1: Wezun721 (480 in chips) 
Seat 2: Mahu2021 (380 in chips) 
Seat 3: kingmarjo (640 in chips) 
kingmarjo: posts small blind 10
Wezun721: posts big blind 20
*** HOLE CARDS ***
Dealt to Mahu2021 [Js 6c]
Mahu2021: folds 
kingmarjo: calls 10
Wezun721: raises 460 to 480 and is all-in
kingmarjo: folds 
Uncalled bet (460) returned to Wezun721
Wezun721 collected 40 from pot
*** SUMMARY ***
Total pot 40 | Rake 0 
Seat 1: Wezun721 (big blind) collected (40)
Seat 2: Mahu2021 (button) folded before Flop (didn't bet)
Seat 3: kingmarjo (small blind) folded before Flop



PokerStars Hand #253355541828: Tournament #3822403963, $1.84+$0.16 USD Hold'em No Limit - Level I (10/20) - 2024/11/11 11:33:01 CET [2024/11/11 5:33:01 ET]
Table '3822403963 1' 3-max Seat #3 is the button
Seat 1: Wezun721 (500 in chips) 
Seat 2: Mahu2021 (380 in chips) 
Seat 3: kingmarjo (620 in chips) 
Wezun721: posts small blind 10
Mahu2021: posts big blind 20
*** HOLE CARDS ***
Dealt to Mahu2021 [As Ah]
kingmarjo: folds 
Wezun721: calls 10
Mahu2021: raises 80 to 100
Wezun721: folds 
Uncalled bet (80) returned to Mahu2021
Mahu2021 collected 40 from pot
Mahu2021: doesn't show hand 
*** SUMMARY ***
Total pot 40 | Rake 0 
Seat 1: Wezun721 (small blind) folded before Flop
Seat 2: Mahu2021 (big blind) collected (40)
Seat 3: kingmarjo (button) folded before Flop (didn't bet)



PokerStars Hand #253355543586: Tournament #3822403963, $1.84+$0.16 USD Hold'em No Limit - Level I (10/20) - 2024/11/11 11:33:17 CET [2024/11/11 5:33:17 ET]
Table '3822403963 1' 3-max Seat #1 is the button
Seat 1: Wezun721 (480 in chips) 
Seat 2: Mahu2021 (400 in chips) 
Seat 3: kingmarjo (620 in chips) 
Mahu2021: posts small blind 10
kingmarjo: posts big blind 20
*** HOLE CARDS ***
Dealt to Mahu2021 [Kd 4d]
Wezun721: folds 
Mahu2021: calls 10
kingmarjo: checks 
*** FLOP *** [Th Qs 8h]
Mahu2021: checks 
kingmarjo: bets 60
Mahu2021: folds 
Uncalled bet (60) returned to kingmarjo
kingmarjo collected 40 from pot
kingmarjo: doesn't show hand 
*** SUMMARY ***
Total pot 40 | Rake 0 
Board [Th Qs 8h]
Seat 1: Wezun721 (button) folded before Flop (didn't bet)
Seat 2: Mahu2021 (small blind) folded on the Flop
Seat 3: kingmarjo (big blind) collected (40)



PokerStars Hand #253355545114: Tournament #3822403963, $1.84+$0.16 USD Hold'em No Limit - Level I (10/20) - 2024/11/11 11:33:31 CET [2024/11/11 5:33:31 ET]
Table '3822403963 1' 3-max Seat #2 is the button
Seat 1: Wezun721 (480 in chips) 
Seat 2: Mahu2021 (380 in chips) 
Seat 3: kingmarjo (640 in chips) 
kingmarjo: posts small blind 10
Wezun721: posts big blind 20
*** HOLE CARDS ***
Dealt to Mahu2021 [4h Tc]
Mahu2021: folds 
kingmarjo: folds 
Uncalled bet (10) returned to Wezun721
Wezun721 collected 20 from pot
*** SUMMARY ***
Total pot 20 | Rake 0 
Seat 1: Wezun721 (big blind) collected (20)
Seat 2: Mahu2021 (button) folded before Flop (didn't bet)
Seat 3: kingmarjo (small blind) folded before Flop



PokerStars Hand #253355545708: Tournament #3822403963, $1.84+$0.16 USD Hold'em No Limit - Level I (10/20) - 2024/11/11 11:33:36 CET [2024/11/11 5:33:36 ET]
Table '3822403963 1' 3-max Seat #3 is the button
Seat 1: Wezun721 (490 in chips) 
Seat 2: Mahu2021 (380 in chips) 
Seat 3: kingmarjo (630 in chips) 
Wezun721: posts small blind 10
Mahu2021: posts big blind 20
*** HOLE CARDS ***
Dealt to Mahu2021 [Ts As]
kingmarjo: folds 
Wezun721: calls 10
Mahu2021: raises 40 to 60
Wezun721: raises 430 to 490 and is all-in
Mahu2021: calls 320 and is all-in
Uncalled bet (110) returned to Wezun721
*** FLOP *** [2h Qc 4h]
*** TURN *** [2h Qc 4h] [8c]
*** RIVER *** [2h Qc 4h 8c] [2c]
*** SHOW DOWN ***
Wezun721: shows [9h 9s] (two pair, Nines and Deuces)
Mahu2021: shows [Ts As] (a pair of Deuces)
Wezun721 collected 760 from pot
Mahu2021 finished the tournament in 3rd place
*** SUMMARY ***
Total pot 760 | Rake 0 
Board [2h Qc 4h 8c 2c]
Seat 1: Wezun721 (small blind) showed [9h 9s] and won (760) with two pair, Nines and Deuces
Seat 2: Mahu2021 (big blind) showed [Ts As] and lost with a pair of Deuces
Seat 3: kingmarjo (button) folded before Flop (didn't bet)



