PokerStars Hand #255797244219: Tournament #3880780792, $0.96+$0.04 USD Hold'em No Limit - Match Round I, Level I (25/50) - 2025/04/19 9:24:56 CET [2025/04/19 3:24:56 ET]
Table '3880780792 3' 4-max Seat #1 is the button
Seat 1: comeecome88 (500 in chips) 
Seat 2: lisabree100 (500 in chips) 
Seat 3: shaftamasta1 (500 in chips) 
Seat 4: Mahu2021 (500 in chips) 
comeecome88: posts the ante 10
lisabree100: posts the ante 10
shaftamasta1: posts the ante 10
Mahu2021: posts the ante 10
lisabree100: posts small blind 25
shaftamasta1: posts big blind 50
*** HOLE CARDS ***
Dealt to Mahu2021 [Kc Jd]
Mahu2021: raises 50 to 100
comeecome88: folds 
lisabree100: folds 
shaftamasta1: calls 50
*** FLOP *** [6c 6d 4c]
shaftamasta1: bets 390 and is all-in
Mahu2021: folds 
Uncalled bet (390) returned to shaftamasta1
shaftamasta1 collected 265 from pot
shaftamasta1: doesn't show hand 
*** SUMMARY ***
Total pot 265 | Rake 0 
Board [6c 6d 4c]
Seat 1: comeecome88 (button) folded before Flop (didn't bet)
Seat 2: lisabree100 (small blind) folded before Flop
Seat 3: shaftamasta1 (big blind) collected (265)
Seat 4: Mahu2021 folded on the Flop



PokerStars Hand #255797245939: Tournament #3880780792, $0.96+$0.04 USD Hold'em No Limit - Match Round I, Level I (25/50) - 2025/04/19 9:25:17 CET [2025/04/19 3:25:17 ET]
Table '3880780792 3' 4-max Seat #2 is the button
Seat 1: comeecome88 (490 in chips) 
Seat 2: lisabree100 (465 in chips) 
Seat 3: shaftamasta1 (655 in chips) 
Seat 4: Mahu2021 (390 in chips) 
comeecome88: posts the ante 10
lisabree100: posts the ante 10
shaftamasta1: posts the ante 10
Mahu2021: posts the ante 10
shaftamasta1: posts small blind 25
Mahu2021: posts big blind 50
*** HOLE CARDS ***
Dealt to Mahu2021 [5h 5c]
comeecome88: folds 
lisabree100: folds 
shaftamasta1: folds 
Uncalled bet (25) returned to Mahu2021
Mahu2021 collected 90 from pot
Mahu2021: doesn't show hand 
*** SUMMARY ***
Total pot 90 | Rake 0 
Seat 1: comeecome88 folded before Flop (didn't bet)
Seat 2: lisabree100 (button) folded before Flop (didn't bet)
Seat 3: shaftamasta1 (small blind) folded before Flop
Seat 4: Mahu2021 (big blind) collected (90)



PokerStars Hand #255797246711: Tournament #3880780792, $0.96+$0.04 USD Hold'em No Limit - Match Round I, Level I (25/50) - 2025/04/19 9:25:27 CET [2025/04/19 3:25:27 ET]
Table '3880780792 3' 4-max Seat #3 is the button
Seat 1: comeecome88 (480 in chips) 
Seat 2: lisabree100 (455 in chips) 
Seat 3: shaftamasta1 (620 in chips) 
Seat 4: Mahu2021 (445 in chips) 
comeecome88: posts the ante 10
lisabree100: posts the ante 10
shaftamasta1: posts the ante 10
Mahu2021: posts the ante 10
Mahu2021: posts small blind 25
comeecome88: posts big blind 50
*** HOLE CARDS ***
Dealt to Mahu2021 [5d 2c]
lisabree100: raises 50 to 100
shaftamasta1: folds 
Mahu2021: folds 
comeecome88: calls 50
*** FLOP *** [Jh Ts 6s]
comeecome88: checks 
lisabree100: bets 50
comeecome88: raises 320 to 370 and is all-in
lisabree100: calls 295 and is all-in
Uncalled bet (25) returned to comeecome88
*** TURN *** [Jh Ts 6s] [4h]
*** RIVER *** [Jh Ts 6s 4h] [8d]
*** SHOW DOWN ***
comeecome88: shows [9h Qh] (a straight, Eight to Queen)
lisabree100: shows [Qs 8s] (a pair of Eights)
comeecome88 collected 955 from pot
lisabree100 finished the tournament in 12th place
*** SUMMARY ***
Total pot 955 | Rake 0 
Board [Jh Ts 6s 4h 8d]
Seat 1: comeecome88 (big blind) showed [9h Qh] and won (955) with a straight, Eight to Queen
Seat 2: lisabree100 showed [Qs 8s] and lost with a pair of Eights
Seat 3: shaftamasta1 (button) folded before Flop (didn't bet)
Seat 4: Mahu2021 (small blind) folded before Flop



PokerStars Hand #255797248660: Tournament #3880780792, $0.96+$0.04 USD Hold'em No Limit - Match Round I, Level I (25/50) - 2025/04/19 9:25:53 CET [2025/04/19 3:25:53 ET]
Table '3880780792 3' 4-max Seat #4 is the button
Seat 1: comeecome88 (980 in chips) 
Seat 3: shaftamasta1 (610 in chips) 
Seat 4: Mahu2021 (410 in chips) 
comeecome88: posts the ante 10
shaftamasta1: posts the ante 10
Mahu2021: posts the ante 10
comeecome88: posts small blind 25
shaftamasta1: posts big blind 50
*** HOLE CARDS ***
Dealt to Mahu2021 [7h Jd]
Mahu2021: folds 
comeecome88: raises 50 to 100
shaftamasta1: calls 50
*** FLOP *** [7c 8d Kh]
comeecome88: bets 58
shaftamasta1: folds 
Uncalled bet (58) returned to comeecome88
comeecome88 collected 230 from pot
comeecome88: doesn't show hand 
*** SUMMARY ***
Total pot 230 | Rake 0 
Board [7c 8d Kh]
Seat 1: comeecome88 (small blind) collected (230)
Seat 3: shaftamasta1 (big blind) folded on the Flop
Seat 4: Mahu2021 (button) folded before Flop (didn't bet)



PokerStars Hand #255797250260: Tournament #3880780792, $0.96+$0.04 USD Hold'em No Limit - Match Round I, Level I (25/50) - 2025/04/19 9:26:12 CET [2025/04/19 3:26:12 ET]
Table '3880780792 3' 4-max Seat #1 is the button
Seat 1: comeecome88 (1100 in chips) 
Seat 3: shaftamasta1 (500 in chips) 
Seat 4: Mahu2021 (400 in chips) 
comeecome88: posts the ante 10
shaftamasta1: posts the ante 10
Mahu2021: posts the ante 10
shaftamasta1: posts small blind 25
Mahu2021: posts big blind 50
*** HOLE CARDS ***
Dealt to Mahu2021 [8c As]
comeecome88: folds 
shaftamasta1: folds 
Uncalled bet (25) returned to Mahu2021
Mahu2021 collected 80 from pot
Mahu2021: doesn't show hand 
*** SUMMARY ***
Total pot 80 | Rake 0 
Seat 1: comeecome88 (button) folded before Flop (didn't bet)
Seat 3: shaftamasta1 (small blind) folded before Flop
Seat 4: Mahu2021 (big blind) collected (80)



PokerStars Hand #255797250816: Tournament #3880780792, $0.96+$0.04 USD Hold'em No Limit - Match Round I, Level I (25/50) - 2025/04/19 9:26:19 CET [2025/04/19 3:26:19 ET]
Table '3880780792 3' 4-max Seat #3 is the button
Seat 1: comeecome88 (1090 in chips) 
Seat 3: shaftamasta1 (465 in chips) 
Seat 4: Mahu2021 (445 in chips) 
comeecome88: posts the ante 10
shaftamasta1: posts the ante 10
Mahu2021: posts the ante 10
Mahu2021: posts small blind 25
comeecome88: posts big blind 50
*** HOLE CARDS ***
Dealt to Mahu2021 [4h 5d]
shaftamasta1: folds 
Mahu2021: raises 50 to 100
comeecome88: calls 50
*** FLOP *** [7h As 2h]
Mahu2021: bets 100
comeecome88: calls 100
*** TURN *** [7h As 2h] [5h]
Mahu2021: bets 235 and is all-in
comeecome88: calls 235
*** RIVER *** [7h As 2h 5h] [4s]
*** SHOW DOWN ***
Mahu2021: shows [4h 5d] (two pair, Fives and Fours)
comeecome88: shows [7s Ac] (two pair, Aces and Sevens)
comeecome88 collected 900 from pot
Mahu2021 finished the tournament in 10th place
*** SUMMARY ***
Total pot 900 | Rake 0 
Board [7h As 2h 5h 4s]
Seat 1: comeecome88 (big blind) showed [7s Ac] and won (900) with two pair, Aces and Sevens
Seat 3: shaftamasta1 (button) folded before Flop (didn't bet)
Seat 4: Mahu2021 (small blind) showed [4h 5d] and lost with two pair, Fives and Fours



