PokerStars Hand #253269665815: Tournament #3820407763, $1.84+$0.16 USD Hold'em No Limit - Level I (10/20) - 2024/11/05 20:34:01 CET [2024/11/05 14:34:01 ET]
Table '3820407763 1' 3-max Seat #1 is the button
Seat 1: airis939 (500 in chips) 
Seat 2: maxidavid2222 (500 in chips) 
Seat 3: Mahu2021 (500 in chips) 
maxidavid2222: posts small blind 10
Mahu2021: posts big blind 20
*** HOLE CARDS ***
Dealt to Mahu2021 [8c Kd]
airis939: raises 50 to 70
maxidavid2222: folds 
Mahu2021: folds 
Uncalled bet (50) returned to airis939
airis939 collected 50 from pot
*** SUMMARY ***
Total pot 50 | Rake 0 
Seat 1: airis939 (button) collected (50)
Seat 2: maxidavid2222 (small blind) folded before Flop
Seat 3: Mahu2021 (big blind) folded before Flop



PokerStars Hand #253269668778: Tournament #3820407763, $1.84+$0.16 USD Hold'em No Limit - Level I (10/20) - 2024/11/05 20:34:11 CET [2024/11/05 14:34:11 ET]
Table '3820407763 1' 3-max Seat #2 is the button
Seat 1: airis939 (530 in chips) 
Seat 2: maxidavid2222 (490 in chips) 
Seat 3: Mahu2021 (480 in chips) 
Mahu2021: posts small blind 10
airis939: posts big blind 20
*** HOLE CARDS ***
Dealt to Mahu2021 [6h Ts]
maxidavid2222: raises 20 to 40
Mahu2021: folds 
airis939: calls 20
*** FLOP *** [Jc 7d Ah]
airis939: checks 
maxidavid2222: bets 45
airis939: folds 
Uncalled bet (45) returned to maxidavid2222
maxidavid2222 collected 90 from pot
maxidavid2222: doesn't show hand 
*** SUMMARY ***
Total pot 90 | Rake 0 
Board [Jc 7d Ah]
Seat 1: airis939 (big blind) folded on the Flop
Seat 2: maxidavid2222 (button) collected (90)
Seat 3: Mahu2021 (small blind) folded before Flop



PokerStars Hand #253269673371: Tournament #3820407763, $1.84+$0.16 USD Hold'em No Limit - Level I (10/20) - 2024/11/05 20:34:28 CET [2024/11/05 14:34:28 ET]
Table '3820407763 1' 3-max Seat #3 is the button
Seat 1: airis939 (490 in chips) 
Seat 2: maxidavid2222 (540 in chips) 
Seat 3: Mahu2021 (470 in chips) 
airis939: posts small blind 10
maxidavid2222: posts big blind 20
*** HOLE CARDS ***
Dealt to Mahu2021 [2h 5s]
Mahu2021: folds 
airis939: calls 10
maxidavid2222: checks 
*** FLOP *** [As 7h 4c]
airis939: checks 
maxidavid2222: checks 
*** TURN *** [As 7h 4c] [Td]
airis939: checks 
maxidavid2222: checks 
*** RIVER *** [As 7h 4c Td] [Th]
airis939: bets 40
maxidavid2222: folds 
Uncalled bet (40) returned to airis939
airis939 collected 40 from pot
*** SUMMARY ***
Total pot 40 | Rake 0 
Board [As 7h 4c Td Th]
Seat 1: airis939 (small blind) collected (40)
Seat 2: maxidavid2222 (big blind) folded on the River
Seat 3: Mahu2021 (button) folded before Flop (didn't bet)



PokerStars Hand #253269678055: Tournament #3820407763, $1.84+$0.16 USD Hold'em No Limit - Level I (10/20) - 2024/11/05 20:34:44 CET [2024/11/05 14:34:44 ET]
Table '3820407763 1' 3-max Seat #1 is the button
Seat 1: airis939 (510 in chips) 
Seat 2: maxidavid2222 (520 in chips) 
Seat 3: Mahu2021 (470 in chips) 
maxidavid2222: posts small blind 10
Mahu2021: posts big blind 20
*** HOLE CARDS ***
Dealt to Mahu2021 [2s Qc]
airis939: calls 20
maxidavid2222: calls 10
Mahu2021: checks 
*** FLOP *** [Qd 8d 3h]
maxidavid2222: checks 
Mahu2021: bets 60
airis939: folds 
maxidavid2222: calls 60
*** TURN *** [Qd 8d 3h] [Kc]
maxidavid2222: checks 
Mahu2021: checks 
*** RIVER *** [Qd 8d 3h Kc] [7d]
maxidavid2222: checks 
Mahu2021: checks 
*** SHOW DOWN ***
maxidavid2222: shows [9c Qh] (a pair of Queens)
Mahu2021: mucks hand 
maxidavid2222 collected 180 from pot
*** SUMMARY ***
Total pot 180 | Rake 0 
Board [Qd 8d 3h Kc 7d]
Seat 1: airis939 (button) folded on the Flop
Seat 2: maxidavid2222 (small blind) showed [9c Qh] and won (180) with a pair of Queens
Seat 3: Mahu2021 (big blind) mucked [2s Qc]



PokerStars Hand #253269683437: Tournament #3820407763, $1.84+$0.16 USD Hold'em No Limit - Level I (10/20) - 2024/11/05 20:35:03 CET [2024/11/05 14:35:03 ET]
Table '3820407763 1' 3-max Seat #2 is the button
Seat 1: airis939 (490 in chips) 
Seat 2: maxidavid2222 (620 in chips) 
Seat 3: Mahu2021 (390 in chips) 
Mahu2021: posts small blind 10
airis939: posts big blind 20
*** HOLE CARDS ***
Dealt to Mahu2021 [Th Jc]
maxidavid2222: calls 20
Mahu2021: calls 10
airis939: checks 
*** FLOP *** [3c Td 9s]
Mahu2021: bets 40
airis939: raises 40 to 80
maxidavid2222: folds 
Mahu2021: calls 40
*** TURN *** [3c Td 9s] [7s]
Mahu2021: checks 
airis939: bets 40
Mahu2021: calls 40
*** RIVER *** [3c Td 9s 7s] [6c]
Mahu2021: checks 
airis939: bets 150
Mahu2021: calls 150
*** SHOW DOWN ***
airis939: shows [3s Tc] (two pair, Tens and Threes)
Mahu2021: mucks hand 
airis939 collected 600 from pot
*** SUMMARY ***
Total pot 600 | Rake 0 
Board [3c Td 9s 7s 6c]
Seat 1: airis939 (big blind) showed [3s Tc] and won (600) with two pair, Tens and Threes
Seat 2: maxidavid2222 (button) folded on the Flop
Seat 3: Mahu2021 (small blind) mucked [Th Jc]



PokerStars Hand #253269694222: Tournament #3820407763, $1.84+$0.16 USD Hold'em No Limit - Level I (10/20) - 2024/11/05 20:35:41 CET [2024/11/05 14:35:41 ET]
Table '3820407763 1' 3-max Seat #3 is the button
Seat 1: airis939 (800 in chips) 
Seat 2: maxidavid2222 (600 in chips) 
Seat 3: Mahu2021 (100 in chips) 
airis939: posts small blind 10
maxidavid2222: posts big blind 20
*** HOLE CARDS ***
Dealt to Mahu2021 [2h 2s]
Mahu2021: raises 80 to 100 and is all-in
airis939: calls 90
maxidavid2222: folds 
*** FLOP *** [5s 6s 9c]
*** TURN *** [5s 6s 9c] [9d]
*** RIVER *** [5s 6s 9c 9d] [Qh]
*** SHOW DOWN ***
airis939: shows [Ad 6h] (two pair, Nines and Sixes)
Mahu2021: shows [2h 2s] (two pair, Nines and Deuces)
airis939 collected 220 from pot
Mahu2021 finished the tournament in 3rd place
*** SUMMARY ***
Total pot 220 | Rake 0 
Board [5s 6s 9c 9d Qh]
Seat 1: airis939 (small blind) showed [Ad 6h] and won (220) with two pair, Nines and Sixes
Seat 2: maxidavid2222 (big blind) folded before Flop
Seat 3: Mahu2021 (button) showed [2h 2s] and lost with two pair, Nines and Deuces



