PokerStars Hand #254796987943: Tournament #3857322866, $0.46+$0.04 USD Hold'em No Limit - Level I (10/20) - 2025/02/10 9:48:44 CET [2025/02/10 3:48:44 ET]
Table '3857322866 1' 3-max Seat #1 is the button
Seat 1: 23paya23 (500 in chips) 
Seat 2: deduskalenin (500 in chips) 
Seat 3: Mahu2021 (500 in chips) 
deduskalenin: posts small blind 10
Mahu2021: posts big blind 20
*** HOLE CARDS ***
Dealt to Mahu2021 [7h 7s]
23paya23: calls 20
deduskalenin: calls 10
Mahu2021: raises 480 to 500 and is all-in
23paya23: folds 
deduskalenin: folds 
Uncalled bet (480) returned to Mahu2021
Mahu2021 collected 60 from pot
Mahu2021: doesn't show hand 
*** SUMMARY ***
Total pot 60 | Rake 0 
Seat 1: 23paya23 (button) folded before Flop
Seat 2: deduskalenin (small blind) folded before Flop
Seat 3: Mahu2021 (big blind) collected (60)



PokerStars Hand #254796988681: Tournament #3857322866, $0.46+$0.04 USD Hold'em No Limit - Level I (10/20) - 2025/02/10 9:48:54 CET [2025/02/10 3:48:54 ET]
Table '3857322866 1' 3-max Seat #2 is the button
Seat 1: 23paya23 (480 in chips) 
Seat 2: deduskalenin (480 in chips) 
Seat 3: Mahu2021 (540 in chips) 
Mahu2021: posts small blind 10
23paya23: posts big blind 20
*** HOLE CARDS ***
Dealt to Mahu2021 [Js 4c]
deduskalenin: folds 
Mahu2021: folds 
Uncalled bet (10) returned to 23paya23
23paya23 collected 20 from pot
*** SUMMARY ***
Total pot 20 | Rake 0 
Seat 1: 23paya23 (big blind) collected (20)
Seat 2: deduskalenin (button) folded before Flop (didn't bet)
Seat 3: Mahu2021 (small blind) folded before Flop



PokerStars Hand #254796989123: Tournament #3857322866, $0.46+$0.04 USD Hold'em No Limit - Level I (10/20) - 2025/02/10 9:48:59 CET [2025/02/10 3:48:59 ET]
Table '3857322866 1' 3-max Seat #3 is the button
Seat 1: 23paya23 (490 in chips) 
Seat 2: deduskalenin (480 in chips) 
Seat 3: Mahu2021 (530 in chips) 
23paya23: posts small blind 10
deduskalenin: posts big blind 20
*** HOLE CARDS ***
Dealt to Mahu2021 [5s 7s]
Mahu2021: calls 20
23paya23: folds 
deduskalenin: checks 
*** FLOP *** [4s 3h As]
deduskalenin: checks 
Mahu2021: checks 
*** TURN *** [4s 3h As] [Qd]
deduskalenin: bets 20
Mahu2021: calls 20
*** RIVER *** [4s 3h As Qd] [4d]
deduskalenin: bets 20
Mahu2021: folds 
Uncalled bet (20) returned to deduskalenin
deduskalenin collected 90 from pot
*** SUMMARY ***
Total pot 90 | Rake 0 
Board [4s 3h As Qd 4d]
Seat 1: 23paya23 (small blind) folded before Flop
Seat 2: deduskalenin (big blind) collected (90)
Seat 3: Mahu2021 (button) folded on the River



PokerStars Hand #254796990401: Tournament #3857322866, $0.46+$0.04 USD Hold'em No Limit - Level I (10/20) - 2025/02/10 9:49:16 CET [2025/02/10 3:49:16 ET]
Table '3857322866 1' 3-max Seat #1 is the button
Seat 1: 23paya23 (480 in chips) 
Seat 2: deduskalenin (530 in chips) 
Seat 3: Mahu2021 (490 in chips) 
deduskalenin: posts small blind 10
Mahu2021: posts big blind 20
*** HOLE CARDS ***
Dealt to Mahu2021 [4c Ts]
23paya23: calls 20
deduskalenin: calls 10
Mahu2021: checks 
*** FLOP *** [Qd 3s Js]
deduskalenin: checks 
Mahu2021: checks 
23paya23: checks 
*** TURN *** [Qd 3s Js] [Kd]
deduskalenin: bets 40
Mahu2021: calls 40
23paya23: folds 
*** RIVER *** [Qd 3s Js Kd] [7h]
deduskalenin: bets 80
Mahu2021: folds 
Uncalled bet (80) returned to deduskalenin
deduskalenin collected 140 from pot
*** SUMMARY ***
Total pot 140 | Rake 0 
Board [Qd 3s Js Kd 7h]
Seat 1: 23paya23 (button) folded on the Turn
Seat 2: deduskalenin (small blind) collected (140)
Seat 3: Mahu2021 (big blind) folded on the River



PokerStars Hand #254796992264: Tournament #3857322866, $0.46+$0.04 USD Hold'em No Limit - Level I (10/20) - 2025/02/10 9:49:38 CET [2025/02/10 3:49:38 ET]
Table '3857322866 1' 3-max Seat #2 is the button
Seat 1: 23paya23 (460 in chips) 
Seat 2: deduskalenin (610 in chips) 
Seat 3: Mahu2021 (430 in chips) 
Mahu2021: posts small blind 10
23paya23: posts big blind 20
*** HOLE CARDS ***
Dealt to Mahu2021 [Jh 7h]
deduskalenin: folds 
Mahu2021: raises 20 to 40
23paya23: calls 20
*** FLOP *** [8d As 3c]
Mahu2021: checks 
23paya23: checks 
*** TURN *** [8d As 3c] [Th]
Mahu2021: checks 
23paya23: checks 
*** RIVER *** [8d As 3c Th] [Qc]
Mahu2021: checks 
23paya23: bets 40
Mahu2021: folds 
Uncalled bet (40) returned to 23paya23
23paya23 collected 80 from pot
*** SUMMARY ***
Total pot 80 | Rake 0 
Board [8d As 3c Th Qc]
Seat 1: 23paya23 (big blind) collected (80)
Seat 2: deduskalenin (button) folded before Flop (didn't bet)
Seat 3: Mahu2021 (small blind) folded on the River



PokerStars Hand #254796993578: Tournament #3857322866, $0.46+$0.04 USD Hold'em No Limit - Level I (10/20) - 2025/02/10 9:49:55 CET [2025/02/10 3:49:55 ET]
Table '3857322866 1' 3-max Seat #3 is the button
Seat 1: 23paya23 (500 in chips) 
Seat 2: deduskalenin (610 in chips) 
Seat 3: Mahu2021 (390 in chips) 
23paya23: posts small blind 10
deduskalenin: posts big blind 20
*** HOLE CARDS ***
Dealt to Mahu2021 [Ks Kd]
Mahu2021: raises 370 to 390 and is all-in
23paya23: folds 
deduskalenin: calls 370
*** FLOP *** [Qh 6h 5h]
*** TURN *** [Qh 6h 5h] [2d]
*** RIVER *** [Qh 6h 5h 2d] [Jh]
*** SHOW DOWN ***
deduskalenin: shows [Qd Jd] (two pair, Queens and Jacks)
Mahu2021: shows [Ks Kd] (a pair of Kings)
deduskalenin collected 790 from pot
Mahu2021 finished the tournament in 3rd place
*** SUMMARY ***
Total pot 790 | Rake 0 
Board [Qh 6h 5h 2d Jh]
Seat 1: 23paya23 (small blind) folded before Flop
Seat 2: deduskalenin (big blind) showed [Qd Jd] and won (790) with two pair, Queens and Jacks
Seat 3: Mahu2021 (button) showed [Ks Kd] and lost with a pair of Kings



