PokerStars Hand #254858274272: Tournament #3858775610, $0.46+$0.04 USD Hold'em No Limit - Level I (10/20) - 2025/02/14 9:21:00 CET [2025/02/14 3:21:00 ET]
Table '3858775610 1' 3-max Seat #1 is the button
Seat 1: vciccio7777 (500 in chips) 
Seat 2: StfTheHunter08 (500 in chips) 
Seat 3: Mahu2021 (500 in chips) 
StfTheHunter08: posts small blind 10
Mahu2021: posts big blind 20
*** HOLE CARDS ***
Dealt to Mahu2021 [Jd 6c]
vciccio7777: raises 80 to 100
StfTheHunter08: raises 400 to 500 and is all-in
Mahu2021: folds 
vciccio7777: calls 400 and is all-in
*** FLOP *** [7s 6s 6d]
*** TURN *** [7s 6s 6d] [Js]
*** RIVER *** [7s 6s 6d Js] [9c]
*** SHOW DOWN ***
StfTheHunter08: shows [Ad 3c] (a pair of Sixes)
vciccio7777: shows [Kd Ac] (a pair of Sixes - Ace+King kicker)
vciccio7777 collected 1020 from pot
StfTheHunter08 finished the tournament in 3rd place
*** SUMMARY ***
Total pot 1020 | Rake 0 
Board [7s 6s 6d Js 9c]
Seat 1: vciccio7777 (button) showed [Kd Ac] and won (1020) with a pair of Sixes
Seat 2: StfTheHunter08 (small blind) showed [Ad 3c] and lost with a pair of Sixes
Seat 3: Mahu2021 (big blind) folded before Flop



PokerStars Hand #254858276374: Tournament #3858775610, $0.46+$0.04 USD Hold'em No Limit - Level I (10/20) - 2025/02/14 9:21:27 CET [2025/02/14 3:21:27 ET]
Table '3858775610 1' 3-max Seat #3 is the button
Seat 1: vciccio7777 (1020 in chips) 
Seat 3: Mahu2021 (480 in chips) 
Mahu2021: posts small blind 10
vciccio7777: posts big blind 20
*** HOLE CARDS ***
Dealt to Mahu2021 [Qc 4d]
Mahu2021: calls 10
vciccio7777: raises 80 to 100
Mahu2021: folds 
Uncalled bet (80) returned to vciccio7777
vciccio7777 collected 40 from pot
*** SUMMARY ***
Total pot 40 | Rake 0 
Seat 1: vciccio7777 (big blind) collected (40)
Seat 3: Mahu2021 (button) (small blind) folded before Flop



PokerStars Hand #254858277545: Tournament #3858775610, $0.46+$0.04 USD Hold'em No Limit - Level I (10/20) - 2025/02/14 9:21:41 CET [2025/02/14 3:21:41 ET]
Table '3858775610 1' 3-max Seat #1 is the button
Seat 1: vciccio7777 (1040 in chips) 
Seat 3: Mahu2021 (460 in chips) 
vciccio7777: posts small blind 10
Mahu2021: posts big blind 20
*** HOLE CARDS ***
Dealt to Mahu2021 [Kd 4d]
vciccio7777: folds 
Uncalled bet (10) returned to Mahu2021
Mahu2021 collected 20 from pot
Mahu2021: doesn't show hand 
*** SUMMARY ***
Total pot 20 | Rake 0 
Seat 1: vciccio7777 (button) (small blind) folded before Flop
Seat 3: Mahu2021 (big blind) collected (20)



PokerStars Hand #254858277936: Tournament #3858775610, $0.46+$0.04 USD Hold'em No Limit - Level I (10/20) - 2025/02/14 9:21:46 CET [2025/02/14 3:21:46 ET]
Table '3858775610 1' 3-max Seat #3 is the button
Seat 1: vciccio7777 (1030 in chips) 
Seat 3: Mahu2021 (470 in chips) 
Mahu2021: posts small blind 10
vciccio7777: posts big blind 20
*** HOLE CARDS ***
Dealt to Mahu2021 [5c 7s]
Mahu2021: calls 10
vciccio7777: checks 
*** FLOP *** [4c 9h 6d]
vciccio7777: checks 
Mahu2021: checks 
*** TURN *** [4c 9h 6d] [8h]
vciccio7777: bets 40
Mahu2021: calls 40
*** RIVER *** [4c 9h 6d 8h] [Jd]
vciccio7777: checks 
Mahu2021: bets 40
vciccio7777: calls 40
*** SHOW DOWN ***
Mahu2021: shows [5c 7s] (a straight, Five to Nine)
vciccio7777: mucks hand 
Mahu2021 collected 200 from pot
*** SUMMARY ***
Total pot 200 | Rake 0 
Board [4c 9h 6d 8h Jd]
Seat 1: vciccio7777 (big blind) mucked [8s 3c]
Seat 3: Mahu2021 (button) (small blind) showed [5c 7s] and won (200) with a straight, Five to Nine



PokerStars Hand #254858279623: Tournament #3858775610, $0.46+$0.04 USD Hold'em No Limit - Level I (10/20) - 2025/02/14 9:22:08 CET [2025/02/14 3:22:08 ET]
Table '3858775610 1' 3-max Seat #1 is the button
Seat 1: vciccio7777 (930 in chips) 
Seat 3: Mahu2021 (570 in chips) 
vciccio7777: posts small blind 10
Mahu2021: posts big blind 20
*** HOLE CARDS ***
Dealt to Mahu2021 [Qh 9d]
vciccio7777: raises 80 to 100
Mahu2021: folds 
Uncalled bet (80) returned to vciccio7777
vciccio7777 collected 40 from pot
*** SUMMARY ***
Total pot 40 | Rake 0 
Seat 1: vciccio7777 (button) (small blind) collected (40)
Seat 3: Mahu2021 (big blind) folded before Flop



PokerStars Hand #254858280470: Tournament #3858775610, $0.46+$0.04 USD Hold'em No Limit - Level I (10/20) - 2025/02/14 9:22:19 CET [2025/02/14 3:22:19 ET]
Table '3858775610 1' 3-max Seat #3 is the button
Seat 1: vciccio7777 (950 in chips) 
Seat 3: Mahu2021 (550 in chips) 
Mahu2021: posts small blind 10
vciccio7777: posts big blind 20
*** HOLE CARDS ***
Dealt to Mahu2021 [Ts 7d]
Mahu2021: folds 
Uncalled bet (10) returned to vciccio7777
vciccio7777 collected 20 from pot
*** SUMMARY ***
Total pot 20 | Rake 0 
Seat 1: vciccio7777 (big blind) collected (20)
Seat 3: Mahu2021 (button) (small blind) folded before Flop



PokerStars Hand #254858280811: Tournament #3858775610, $0.46+$0.04 USD Hold'em No Limit - Level I (10/20) - 2025/02/14 9:22:23 CET [2025/02/14 3:22:23 ET]
Table '3858775610 1' 3-max Seat #1 is the button
Seat 1: vciccio7777 (960 in chips) 
Seat 3: Mahu2021 (540 in chips) 
vciccio7777: posts small blind 10
Mahu2021: posts big blind 20
*** HOLE CARDS ***
Dealt to Mahu2021 [4h 7d]
vciccio7777: calls 10
Mahu2021: checks 
*** FLOP *** [5s 9d 3c]
Mahu2021: checks 
vciccio7777: bets 40
Mahu2021: folds 
Uncalled bet (40) returned to vciccio7777
vciccio7777 collected 40 from pot
*** SUMMARY ***
Total pot 40 | Rake 0 
Board [5s 9d 3c]
Seat 1: vciccio7777 (button) (small blind) collected (40)
Seat 3: Mahu2021 (big blind) folded on the Flop



PokerStars Hand #254858281999: Tournament #3858775610, $0.46+$0.04 USD Hold'em No Limit - Level I (10/20) - 2025/02/14 9:22:38 CET [2025/02/14 3:22:38 ET]
Table '3858775610 1' 3-max Seat #3 is the button
Seat 1: vciccio7777 (980 in chips) 
Seat 3: Mahu2021 (520 in chips) 
Mahu2021: posts small blind 10
vciccio7777: posts big blind 20
*** HOLE CARDS ***
Dealt to Mahu2021 [6d Ad]
Mahu2021: raises 20 to 40
vciccio7777: calls 20
*** FLOP *** [Js Ac 4s]
vciccio7777: bets 80
Mahu2021: raises 400 to 480 and is all-in
vciccio7777: calls 400
*** TURN *** [Js Ac 4s] [Qd]
*** RIVER *** [Js Ac 4s Qd] [Jd]
*** SHOW DOWN ***
vciccio7777: shows [Jc 4h] (a full house, Jacks full of Fours)
Mahu2021: shows [6d Ad] (two pair, Aces and Jacks)
vciccio7777 collected 1040 from pot
Mahu2021 finished the tournament in 2nd place
vciccio7777 wins the tournament - congratulations!
vciccio7777 wins a '$1.50 Power Path Step 2 Ticket' ticket
*** SUMMARY ***
Total pot 1040 | Rake 0 
Board [Js Ac 4s Qd Jd]
Seat 1: vciccio7777 (big blind) showed [Jc 4h] and won (1040) with a full house, Jacks full of Fours
Seat 3: Mahu2021 (button) (small blind) showed [6d Ad] and lost with two pair, Aces and Jacks



