PokerStars Hand #244507924439: Tournament #3609909783, $0.92+$0.08 USD Hold'em No Limit - Level I (10/20) - 2023/06/28 12:29:03 CET [2023/06/28 6:29:03 ET]
Table '3609909783 1' 3-max Seat #1 is the button
Seat 1: Mahu2021 (500 in chips) 
Seat 2: Monkey_D_Raffi (500 in chips) 
Seat 3: ognjeeen (500 in chips) 
Monkey_D_Raffi: posts small blind 10
ognjeeen: posts big blind 20
*** HOLE CARDS ***
Dealt to Mahu2021 [As 5d]
Mahu2021: calls 20
Monkey_D_Raffi: folds 
ognjeeen: raises 20 to 40
Mahu2021: calls 20
*** FLOP *** [2d 9d 4d]
ognjeeen: bets 40
Mahu2021: folds 
Uncalled bet (40) returned to ognjeeen
ognjeeen collected 90 from pot
*** SUMMARY ***
Total pot 90 | Rake 0 
Board [2d 9d 4d]
Seat 1: Mahu2021 (button) folded on the Flop
Seat 2: Monkey_D_Raffi (small blind) folded before Flop
Seat 3: ognjeeen (big blind) collected (90)



PokerStars Hand #244507926709: Tournament #3609909783, $0.92+$0.08 USD Hold'em No Limit - Level I (10/20) - 2023/06/28 12:29:20 CET [2023/06/28 6:29:20 ET]
Table '3609909783 1' 3-max Seat #2 is the button
Seat 1: Mahu2021 (460 in chips) 
Seat 2: Monkey_D_Raffi (490 in chips) 
Seat 3: ognjeeen (550 in chips) 
ognjeeen: posts small blind 10
Mahu2021: posts big blind 20
*** HOLE CARDS ***
Dealt to Mahu2021 [Kh 2c]
Monkey_D_Raffi: folds 
ognjeeen: calls 10
Mahu2021: checks 
*** FLOP *** [6d 7s Ah]
ognjeeen: checks 
Mahu2021: checks 
*** TURN *** [6d 7s Ah] [9c]
ognjeeen: checks 
Mahu2021: checks 
*** RIVER *** [6d 7s Ah 9c] [9d]
ognjeeen: checks 
Mahu2021: checks 
*** SHOW DOWN ***
ognjeeen: shows [8s Jc] (a pair of Nines)
Mahu2021: shows [Kh 2c] (a pair of Nines - Ace+King kicker)
Mahu2021 collected 40 from pot
*** SUMMARY ***
Total pot 40 | Rake 0 
Board [6d 7s Ah 9c 9d]
Seat 1: Mahu2021 (big blind) showed [Kh 2c] and won (40) with a pair of Nines
Seat 2: Monkey_D_Raffi (button) folded before Flop (didn't bet)
Seat 3: ognjeeen (small blind) showed [8s Jc] and lost with a pair of Nines



PokerStars Hand #244507928545: Tournament #3609909783, $0.92+$0.08 USD Hold'em No Limit - Level I (10/20) - 2023/06/28 12:29:33 CET [2023/06/28 6:29:33 ET]
Table '3609909783 1' 3-max Seat #3 is the button
Seat 1: Mahu2021 (480 in chips) 
Seat 2: Monkey_D_Raffi (490 in chips) 
Seat 3: ognjeeen (530 in chips) 
Mahu2021: posts small blind 10
Monkey_D_Raffi: posts big blind 20
*** HOLE CARDS ***
Dealt to Mahu2021 [7s Ts]
ognjeeen: folds 
Mahu2021: calls 10
Monkey_D_Raffi: raises 20 to 40
Mahu2021: calls 20
*** FLOP *** [6s Ah 6d]
Mahu2021: checks 
Monkey_D_Raffi: checks 
*** TURN *** [6s Ah 6d] [Qh]
Mahu2021: checks 
Monkey_D_Raffi: bets 20
Mahu2021: folds 
Uncalled bet (20) returned to Monkey_D_Raffi
Monkey_D_Raffi collected 80 from pot
*** SUMMARY ***
Total pot 80 | Rake 0 
Board [6s Ah 6d Qh]
Seat 1: Mahu2021 (small blind) folded on the Turn
Seat 2: Monkey_D_Raffi (big blind) collected (80)
Seat 3: ognjeeen (button) folded before Flop (didn't bet)



PokerStars Hand #244507930245: Tournament #3609909783, $0.92+$0.08 USD Hold'em No Limit - Level I (10/20) - 2023/06/28 12:29:46 CET [2023/06/28 6:29:46 ET]
Table '3609909783 1' 3-max Seat #1 is the button
Seat 1: Mahu2021 (440 in chips) 
Seat 2: Monkey_D_Raffi (530 in chips) 
Seat 3: ognjeeen (530 in chips) 
Monkey_D_Raffi: posts small blind 10
ognjeeen: posts big blind 20
*** HOLE CARDS ***
Dealt to Mahu2021 [9c Td]
Mahu2021: folds 
Monkey_D_Raffi: raises 20 to 40
ognjeeen: raises 20 to 60
Monkey_D_Raffi: raises 20 to 80
ognjeeen: calls 20
*** FLOP *** [7s Ac 9d]
Monkey_D_Raffi: checks 
ognjeeen: checks 
*** TURN *** [7s Ac 9d] [2c]
Monkey_D_Raffi: checks 
ognjeeen: checks 
*** RIVER *** [7s Ac 9d 2c] [6s]
Monkey_D_Raffi: bets 40
ognjeeen: calls 40
*** SHOW DOWN ***
Monkey_D_Raffi: shows [Js Jh] (a pair of Jacks)
ognjeeen: mucks hand 
Monkey_D_Raffi collected 240 from pot
*** SUMMARY ***
Total pot 240 | Rake 0 
Board [7s Ac 9d 2c 6s]
Seat 1: Mahu2021 (button) folded before Flop (didn't bet)
Seat 2: Monkey_D_Raffi (small blind) showed [Js Jh] and won (240) with a pair of Jacks
Seat 3: ognjeeen (big blind) mucked [6d 4d]



PokerStars Hand #244507933431: Tournament #3609909783, $0.92+$0.08 USD Hold'em No Limit - Level I (10/20) - 2023/06/28 12:30:09 CET [2023/06/28 6:30:09 ET]
Table '3609909783 1' 3-max Seat #2 is the button
Seat 1: Mahu2021 (440 in chips) 
Seat 2: Monkey_D_Raffi (650 in chips) 
Seat 3: ognjeeen (410 in chips) 
ognjeeen: posts small blind 10
Mahu2021: posts big blind 20
*** HOLE CARDS ***
Dealt to Mahu2021 [7s 8d]
Monkey_D_Raffi: folds 
ognjeeen: raises 40 to 60
Mahu2021: calls 40
*** FLOP *** [5c 4d 5s]
ognjeeen: bets 60
Mahu2021: calls 60
*** TURN *** [5c 4d 5s] [3c]
ognjeeen: bets 120
Mahu2021: calls 120
*** RIVER *** [5c 4d 5s 3c] [Kd]
ognjeeen: bets 170 and is all-in
Mahu2021: folds 
Uncalled bet (170) returned to ognjeeen
ognjeeen collected 480 from pot
*** SUMMARY ***
Total pot 480 | Rake 0 
Board [5c 4d 5s 3c Kd]
Seat 1: Mahu2021 (big blind) folded on the River
Seat 2: Monkey_D_Raffi (button) folded before Flop (didn't bet)
Seat 3: ognjeeen (small blind) collected (480)



PokerStars Hand #244507936147: Tournament #3609909783, $0.92+$0.08 USD Hold'em No Limit - Level I (10/20) - 2023/06/28 12:30:30 CET [2023/06/28 6:30:30 ET]
Table '3609909783 1' 3-max Seat #3 is the button
Seat 1: Mahu2021 (200 in chips) 
Seat 2: Monkey_D_Raffi (650 in chips) 
Seat 3: ognjeeen (650 in chips) 
Mahu2021: posts small blind 10
Monkey_D_Raffi: posts big blind 20
*** HOLE CARDS ***
Dealt to Mahu2021 [6d As]
ognjeeen: raises 20 to 40
Mahu2021: raises 160 to 200 and is all-in
Monkey_D_Raffi: folds 
ognjeeen: calls 160
*** FLOP *** [6c 8d Js]
*** TURN *** [6c 8d Js] [7c]
*** RIVER *** [6c 8d Js 7c] [9d]
*** SHOW DOWN ***
Mahu2021: shows [6d As] (a pair of Sixes)
ognjeeen: shows [9h Ac] (a pair of Nines)
ognjeeen collected 420 from pot
Mahu2021 finished the tournament in 3rd place
*** SUMMARY ***
Total pot 420 | Rake 0 
Board [6c 8d Js 7c 9d]
Seat 1: Mahu2021 (small blind) showed [6d As] and lost with a pair of Sixes
Seat 2: Monkey_D_Raffi (big blind) folded before Flop
Seat 3: ognjeeen (button) showed [9h Ac] and won (420) with a pair of Nines



