PokerStars Hand #252855384444: Tournament #3810256891, $1.84+$0.16 USD Hold'em No Limit - Level I (10/20) - 2024/10/10 9:56:15 CET [2024/10/10 3:56:15 ET]
Table '3810256891 1' 3-max Seat #1 is the button
Seat 1: Mahu2021 (500 in chips) 
Seat 2: padvlinder3 (500 in chips) 
Seat 3: maisfdp1 (500 in chips) 
padvlinder3: posts small blind 10
maisfdp1: posts big blind 20
*** HOLE CARDS ***
Dealt to Mahu2021 [2s Ks]
Mahu2021: calls 20
padvlinder3: calls 10
maisfdp1: raises 480 to 500 and is all-in
Mahu2021: folds 
padvlinder3: folds 
Uncalled bet (480) returned to maisfdp1
maisfdp1 collected 60 from pot
maisfdp1: doesn't show hand 
*** SUMMARY ***
Total pot 60 | Rake 0 
Seat 1: Mahu2021 (button) folded before Flop
Seat 2: padvlinder3 (small blind) folded before Flop
Seat 3: maisfdp1 (big blind) collected (60)



PokerStars Hand #252855385681: Tournament #3810256891, $1.84+$0.16 USD Hold'em No Limit - Level I (10/20) - 2024/10/10 9:56:31 CET [2024/10/10 3:56:31 ET]
Table '3810256891 1' 3-max Seat #2 is the button
Seat 1: Mahu2021 (480 in chips) 
Seat 2: padvlinder3 (480 in chips) 
Seat 3: maisfdp1 (540 in chips) 
maisfdp1: posts small blind 10
Mahu2021: posts big blind 20
*** HOLE CARDS ***
Dealt to Mahu2021 [4c Js]
padvlinder3: raises 40 to 60
maisfdp1: calls 50
Mahu2021: folds 
*** FLOP *** [2d Jd 5h]
maisfdp1: bets 480 and is all-in
padvlinder3: calls 420 and is all-in
Uncalled bet (60) returned to maisfdp1
*** TURN *** [2d Jd 5h] [8s]
*** RIVER *** [2d Jd 5h 8s] [Tc]
*** SHOW DOWN ***
maisfdp1: shows [Ts Jh] (two pair, Jacks and Tens)
padvlinder3: shows [Qc Ac] (high card Ace)
maisfdp1 collected 980 from pot
padvlinder3 finished the tournament in 3rd place
*** SUMMARY ***
Total pot 980 | Rake 0 
Board [2d Jd 5h 8s Tc]
Seat 1: Mahu2021 (big blind) folded before Flop
Seat 2: padvlinder3 (button) showed [Qc Ac] and lost with high card Ace
Seat 3: maisfdp1 (small blind) showed [Ts Jh] and won (980) with two pair, Jacks and Tens



PokerStars Hand #252855387338: Tournament #3810256891, $1.84+$0.16 USD Hold'em No Limit - Level I (10/20) - 2024/10/10 9:56:53 CET [2024/10/10 3:56:53 ET]
Table '3810256891 1' 3-max Seat #1 is the button
Seat 1: Mahu2021 (460 in chips) 
Seat 3: maisfdp1 (1040 in chips) 
Mahu2021: posts small blind 10
maisfdp1: posts big blind 20
*** HOLE CARDS ***
Dealt to Mahu2021 [Ac 3d]
Mahu2021: raises 20 to 40
maisfdp1: raises 1000 to 1040 and is all-in
Mahu2021: calls 420 and is all-in
Uncalled bet (580) returned to maisfdp1
*** FLOP *** [Jc Jd 6c]
*** TURN *** [Jc Jd 6c] [Ah]
*** RIVER *** [Jc Jd 6c Ah] [2d]
*** SHOW DOWN ***
maisfdp1: shows [Ad 6h] (two pair, Aces and Jacks)
Mahu2021: shows [Ac 3d] (two pair, Aces and Jacks)
maisfdp1 collected 460 from pot
Mahu2021 collected 460 from pot
*** SUMMARY ***
Total pot 920 | Rake 0 
Board [Jc Jd 6c Ah 2d]
Seat 1: Mahu2021 (button) (small blind) showed [Ac 3d] and won (460) with two pair, Aces and Jacks
Seat 3: maisfdp1 (big blind) showed [Ad 6h] and won (460) with two pair, Aces and Jacks



PokerStars Hand #252855388443: Tournament #3810256891, $1.84+$0.16 USD Hold'em No Limit - Level I (10/20) - 2024/10/10 9:57:08 CET [2024/10/10 3:57:08 ET]
Table '3810256891 1' 3-max Seat #3 is the button
Seat 1: Mahu2021 (460 in chips) 
Seat 3: maisfdp1 (1040 in chips) 
maisfdp1: posts small blind 10
Mahu2021: posts big blind 20
*** HOLE CARDS ***
Dealt to Mahu2021 [Kd 2d]
maisfdp1: calls 10
Mahu2021: checks 
*** FLOP *** [5d 9h 7h]
Mahu2021: checks 
maisfdp1: checks 
*** TURN *** [5d 9h 7h] [7s]
Mahu2021: checks 
maisfdp1: bets 20
Mahu2021: calls 20
*** RIVER *** [5d 9h 7h 7s] [Kh]
Mahu2021: checks 
maisfdp1: bets 20
Mahu2021: raises 60 to 80
maisfdp1: folds 
Uncalled bet (60) returned to Mahu2021
Mahu2021 collected 120 from pot
Mahu2021: doesn't show hand 
*** SUMMARY ***
Total pot 120 | Rake 0 
Board [5d 9h 7h 7s Kh]
Seat 1: Mahu2021 (big blind) collected (120)
Seat 3: maisfdp1 (button) (small blind) folded on the River



PokerStars Hand #252855389887: Tournament #3810256891, $1.84+$0.16 USD Hold'em No Limit - Level I (10/20) - 2024/10/10 9:57:27 CET [2024/10/10 3:57:27 ET]
Table '3810256891 1' 3-max Seat #1 is the button
Seat 1: Mahu2021 (520 in chips) 
Seat 3: maisfdp1 (980 in chips) 
Mahu2021: posts small blind 10
maisfdp1: posts big blind 20
*** HOLE CARDS ***
Dealt to Mahu2021 [6c Ad]
Mahu2021: raises 20 to 40
maisfdp1: raises 940 to 980 and is all-in
Mahu2021: calls 480 and is all-in
Uncalled bet (460) returned to maisfdp1
*** FLOP *** [9s 2h 8s]
*** TURN *** [9s 2h 8s] [Kh]
*** RIVER *** [9s 2h 8s Kh] [7d]
*** SHOW DOWN ***
maisfdp1: shows [Jd Td] (a straight, Seven to Jack)
Mahu2021: shows [6c Ad] (high card Ace)
maisfdp1 collected 1040 from pot
Mahu2021 finished the tournament in 2nd place
maisfdp1 wins the tournament and receives $4.00 - congratulations!
*** SUMMARY ***
Total pot 1040 | Rake 0 
Board [9s 2h 8s Kh 7d]
Seat 1: Mahu2021 (button) (small blind) showed [6c Ad] and lost with high card Ace
Seat 3: maisfdp1 (big blind) showed [Jd Td] and won (1040) with a straight, Seven to Jack



