PokerStars Hand #248740201714: Tournament #3712452861, $1.84+$0.16 USD Hold'em No Limit - Level I (10/20) - 2024/02/07 15:47:56 CET [2024/02/07 9:47:56 ET]
Table '3712452861 1' 3-max Seat #1 is the button
Seat 1: Mahu2021 (500 in chips) 
Seat 2: GROATE (500 in chips) 
Seat 3: kispit90 (500 in chips) 
GROATE: posts small blind 10
kispit90: posts big blind 20
*** HOLE CARDS ***
Dealt to Mahu2021 [4c 9s]
Mahu2021: folds 
GROATE: raises 40 to 60
kispit90: folds 
Uncalled bet (40) returned to GROATE
GROATE collected 40 from pot
*** SUMMARY ***
Total pot 40 | Rake 0 
Seat 1: Mahu2021 (button) folded before Flop (didn't bet)
Seat 2: GROATE (small blind) collected (40)
Seat 3: kispit90 (big blind) folded before Flop



PokerStars Hand #248740203990: Tournament #3712452861, $1.84+$0.16 USD Hold'em No Limit - Level I (10/20) - 2024/02/07 15:48:07 CET [2024/02/07 9:48:07 ET]
Table '3712452861 1' 3-max Seat #2 is the button
Seat 1: Mahu2021 (500 in chips) 
Seat 2: GROATE (520 in chips) 
Seat 3: kispit90 (480 in chips) 
kispit90: posts small blind 10
Mahu2021: posts big blind 20
*** HOLE CARDS ***
Dealt to Mahu2021 [7d Jh]
GROATE: folds 
kispit90: raises 20 to 40
Mahu2021: calls 20
*** FLOP *** [Th 8s 8h]
kispit90: checks 
Mahu2021: checks 
*** TURN *** [Th 8s 8h] [2s]
kispit90: bets 80
Mahu2021: folds 
Uncalled bet (80) returned to kispit90
kispit90 collected 80 from pot
kispit90: doesn't show hand 
*** SUMMARY ***
Total pot 80 | Rake 0 
Board [Th 8s 8h 2s]
Seat 1: Mahu2021 (big blind) folded on the Turn
Seat 2: GROATE (button) folded before Flop (didn't bet)
Seat 3: kispit90 (small blind) collected (80)



PokerStars Hand #248740207032: Tournament #3712452861, $1.84+$0.16 USD Hold'em No Limit - Level I (10/20) - 2024/02/07 15:48:20 CET [2024/02/07 9:48:20 ET]
Table '3712452861 1' 3-max Seat #3 is the button
Seat 1: Mahu2021 (460 in chips) 
Seat 2: GROATE (520 in chips) 
Seat 3: kispit90 (520 in chips) 
Mahu2021: posts small blind 10
GROATE: posts big blind 20
*** HOLE CARDS ***
Dealt to Mahu2021 [Th Kh]
kispit90: folds 
Mahu2021: raises 40 to 60
GROATE: calls 40
*** FLOP *** [2s 3c 5d]
Mahu2021: checks 
GROATE: bets 60
Mahu2021: calls 60
*** TURN *** [2s 3c 5d] [As]
Mahu2021: checks 
GROATE: bets 80
Mahu2021: raises 80 to 160
GROATE: raises 240 to 400 and is all-in
Mahu2021: folds 
Uncalled bet (240) returned to GROATE
GROATE collected 560 from pot
*** SUMMARY ***
Total pot 560 | Rake 0 
Board [2s 3c 5d As]
Seat 1: Mahu2021 (small blind) folded on the Turn
Seat 2: GROATE (big blind) collected (560)
Seat 3: kispit90 (button) folded before Flop (didn't bet)



PokerStars Hand #248740212653: Tournament #3712452861, $1.84+$0.16 USD Hold'em No Limit - Level I (10/20) - 2024/02/07 15:48:46 CET [2024/02/07 9:48:46 ET]
Table '3712452861 1' 3-max Seat #1 is the button
Seat 1: Mahu2021 (180 in chips) 
Seat 2: GROATE (800 in chips) 
Seat 3: kispit90 (520 in chips) 
GROATE: posts small blind 10
kispit90: posts big blind 20
*** HOLE CARDS ***
Dealt to Mahu2021 [Kd 3s]
Mahu2021: raises 160 to 180 and is all-in
GROATE: folds 
kispit90: folds 
Uncalled bet (160) returned to Mahu2021
Mahu2021 collected 50 from pot
Mahu2021: doesn't show hand 
*** SUMMARY ***
Total pot 50 | Rake 0 
Seat 1: Mahu2021 (button) collected (50)
Seat 2: GROATE (small blind) folded before Flop
Seat 3: kispit90 (big blind) folded before Flop



PokerStars Hand #248740214867: Tournament #3712452861, $1.84+$0.16 USD Hold'em No Limit - Level I (10/20) - 2024/02/07 15:48:56 CET [2024/02/07 9:48:56 ET]
Table '3712452861 1' 3-max Seat #2 is the button
Seat 1: Mahu2021 (210 in chips) 
Seat 2: GROATE (790 in chips) 
Seat 3: kispit90 (500 in chips) 
kispit90: posts small blind 10
Mahu2021: posts big blind 20
*** HOLE CARDS ***
Dealt to Mahu2021 [7s 6c]
GROATE: raises 60 to 80
kispit90: calls 70
Mahu2021: folds 
*** FLOP *** [6h 2c 3h]
kispit90: checks 
GROATE: bets 60
kispit90: calls 60
*** TURN *** [6h 2c 3h] [Ah]
kispit90: checks 
GROATE: bets 100
kispit90: folds 
Uncalled bet (100) returned to GROATE
GROATE collected 300 from pot
*** SUMMARY ***
Total pot 300 | Rake 0 
Board [6h 2c 3h Ah]
Seat 1: Mahu2021 (big blind) folded before Flop
Seat 2: GROATE (button) collected (300)
Seat 3: kispit90 (small blind) folded on the Turn



PokerStars Hand #248740220693: Tournament #3712452861, $1.84+$0.16 USD Hold'em No Limit - Level I (10/20) - 2024/02/07 15:49:22 CET [2024/02/07 9:49:22 ET]
Table '3712452861 1' 3-max Seat #3 is the button
Seat 1: Mahu2021 (190 in chips) 
Seat 2: GROATE (950 in chips) 
Seat 3: kispit90 (360 in chips) 
Mahu2021: posts small blind 10
GROATE: posts big blind 20
*** HOLE CARDS ***
Dealt to Mahu2021 [Qd 8c]
kispit90: folds 
Mahu2021: raises 40 to 60
GROATE: calls 40
*** FLOP *** [4d Ah Jc]
Mahu2021: bets 130 and is all-in
GROATE: calls 130
*** TURN *** [4d Ah Jc] [4h]
*** RIVER *** [4d Ah Jc 4h] [3h]
*** SHOW DOWN ***
Mahu2021: shows [Qd 8c] (a pair of Fours)
GROATE: shows [8s Jh] (two pair, Jacks and Fours)
GROATE collected 380 from pot
Mahu2021 finished the tournament in 3rd place
*** SUMMARY ***
Total pot 380 | Rake 0 
Board [4d Ah Jc 4h 3h]
Seat 1: Mahu2021 (small blind) showed [Qd 8c] and lost with a pair of Fours
Seat 2: GROATE (big blind) showed [8s Jh] and won (380) with two pair, Jacks and Fours
Seat 3: kispit90 (button) folded before Flop (didn't bet)



