PokerStars Hand #244627792028: Tournament #3612652422, $0.92+$0.08 USD Hold'em No Limit - Level I (10/20) - 2023/07/04 22:14:24 CET [2023/07/04 16:14:24 ET]
Table '3612652422 1' 3-max Seat #1 is the button
Seat 1: timi2020 (500 in chips) 
Seat 2: Mahu2021 (500 in chips) 
Seat 3: sk1nsey (500 in chips) 
Mahu2021: posts small blind 10
sk1nsey: posts big blind 20
*** HOLE CARDS ***
Dealt to Mahu2021 [Ts Qh]
timi2020: raises 20 to 40
Mahu2021: calls 30
sk1nsey: folds 
*** FLOP *** [6h 6s 5s]
Mahu2021: checks 
timi2020: bets 20
Mahu2021: calls 20
*** TURN *** [6h 6s 5s] [6d]
Mahu2021: checks 
timi2020: checks 
*** RIVER *** [6h 6s 5s 6d] [2d]
Mahu2021: bets 80
timi2020: folds 
Uncalled bet (80) returned to Mahu2021
Mahu2021 collected 140 from pot
Mahu2021: doesn't show hand 
*** SUMMARY ***
Total pot 140 | Rake 0 
Board [6h 6s 5s 6d 2d]
Seat 1: timi2020 (button) folded on the River
Seat 2: Mahu2021 (small blind) collected (140)
Seat 3: sk1nsey (big blind) folded before Flop



PokerStars Hand #244627807138: Tournament #3612652422, $0.92+$0.08 USD Hold'em No Limit - Level I (10/20) - 2023/07/04 22:15:04 CET [2023/07/04 16:15:04 ET]
Table '3612652422 1' 3-max Seat #2 is the button
Seat 1: timi2020 (440 in chips) 
Seat 2: Mahu2021 (580 in chips) 
Seat 3: sk1nsey (480 in chips) 
sk1nsey: posts small blind 10
timi2020: posts big blind 20
*** HOLE CARDS ***
Dealt to Mahu2021 [8c 7c]
Mahu2021: raises 20 to 40
sk1nsey: raises 440 to 480 and is all-in
timi2020: folds 
Mahu2021: folds 
Uncalled bet (440) returned to sk1nsey
sk1nsey collected 100 from pot
*** SUMMARY ***
Total pot 100 | Rake 0 
Seat 1: timi2020 (big blind) folded before Flop
Seat 2: Mahu2021 (button) folded before Flop
Seat 3: sk1nsey (small blind) collected (100)



PokerStars Hand #244627811861: Tournament #3612652422, $0.92+$0.08 USD Hold'em No Limit - Level I (10/20) - 2023/07/04 22:15:16 CET [2023/07/04 16:15:16 ET]
Table '3612652422 1' 3-max Seat #3 is the button
Seat 1: timi2020 (420 in chips) 
Seat 2: Mahu2021 (540 in chips) 
Seat 3: sk1nsey (540 in chips) 
timi2020: posts small blind 10
Mahu2021: posts big blind 20
*** HOLE CARDS ***
Dealt to Mahu2021 [8s 5h]
sk1nsey: folds 
timi2020: raises 400 to 420 and is all-in
Mahu2021: folds 
Uncalled bet (400) returned to timi2020
timi2020 collected 40 from pot
timi2020: doesn't show hand 
*** SUMMARY ***
Total pot 40 | Rake 0 
Seat 1: timi2020 (small blind) collected (40)
Seat 2: Mahu2021 (big blind) folded before Flop
Seat 3: sk1nsey (button) folded before Flop (didn't bet)



PokerStars Hand #244627814893: Tournament #3612652422, $0.92+$0.08 USD Hold'em No Limit - Level I (10/20) - 2023/07/04 22:15:23 CET [2023/07/04 16:15:23 ET]
Table '3612652422 1' 3-max Seat #1 is the button
Seat 1: timi2020 (440 in chips) 
Seat 2: Mahu2021 (520 in chips) 
Seat 3: sk1nsey (540 in chips) 
Mahu2021: posts small blind 10
sk1nsey: posts big blind 20
*** HOLE CARDS ***
Dealt to Mahu2021 [9d Td]
timi2020: folds 
Mahu2021: calls 10
sk1nsey: checks 
*** FLOP *** [2d 4s 5h]
Mahu2021: checks 
sk1nsey: checks 
*** TURN *** [2d 4s 5h] [3d]
Mahu2021: checks 
sk1nsey: bets 20
Mahu2021: folds 
Uncalled bet (20) returned to sk1nsey
sk1nsey collected 40 from pot
*** SUMMARY ***
Total pot 40 | Rake 0 
Board [2d 4s 5h 3d]
Seat 1: timi2020 (button) folded before Flop (didn't bet)
Seat 2: Mahu2021 (small blind) folded on the Turn
Seat 3: sk1nsey (big blind) collected (40)



PokerStars Hand #244627822585: Tournament #3612652422, $0.92+$0.08 USD Hold'em No Limit - Level I (10/20) - 2023/07/04 22:15:43 CET [2023/07/04 16:15:43 ET]
Table '3612652422 1' 3-max Seat #2 is the button
Seat 1: timi2020 (440 in chips) 
Seat 2: Mahu2021 (500 in chips) 
Seat 3: sk1nsey (560 in chips) 
sk1nsey: posts small blind 10
timi2020: posts big blind 20
*** HOLE CARDS ***
Dealt to Mahu2021 [Qs 5d]
Mahu2021: folds 
sk1nsey: folds 
Uncalled bet (10) returned to timi2020
timi2020 collected 20 from pot
timi2020: doesn't show hand 
*** SUMMARY ***
Total pot 20 | Rake 0 
Seat 1: timi2020 (big blind) collected (20)
Seat 2: Mahu2021 (button) folded before Flop (didn't bet)
Seat 3: sk1nsey (small blind) folded before Flop



PokerStars Hand #244627825012: Tournament #3612652422, $0.92+$0.08 USD Hold'em No Limit - Level I (10/20) - 2023/07/04 22:15:49 CET [2023/07/04 16:15:49 ET]
Table '3612652422 1' 3-max Seat #3 is the button
Seat 1: timi2020 (450 in chips) 
Seat 2: Mahu2021 (500 in chips) 
Seat 3: sk1nsey (550 in chips) 
timi2020: posts small blind 10
Mahu2021: posts big blind 20
*** HOLE CARDS ***
Dealt to Mahu2021 [Td Tc]
sk1nsey: folds 
timi2020: raises 430 to 450 and is all-in
Mahu2021: calls 430
*** FLOP *** [Kh 5d 2h]
*** TURN *** [Kh 5d 2h] [3s]
*** RIVER *** [Kh 5d 2h 3s] [Ac]
*** SHOW DOWN ***
timi2020: shows [9h Ad] (a pair of Aces)
Mahu2021: shows [Td Tc] (a pair of Tens)
timi2020 collected 900 from pot
*** SUMMARY ***
Total pot 900 | Rake 0 
Board [Kh 5d 2h 3s Ac]
Seat 1: timi2020 (small blind) showed [9h Ad] and won (900) with a pair of Aces
Seat 2: Mahu2021 (big blind) showed [Td Tc] and lost with a pair of Tens
Seat 3: sk1nsey (button) folded before Flop (didn't bet)



PokerStars Hand #244627830470: Tournament #3612652422, $0.92+$0.08 USD Hold'em No Limit - Level I (10/20) - 2023/07/04 22:16:03 CET [2023/07/04 16:16:03 ET]
Table '3612652422 1' 3-max Seat #1 is the button
Seat 1: timi2020 (900 in chips) 
Seat 2: Mahu2021 (50 in chips) 
Seat 3: sk1nsey (550 in chips) 
Mahu2021: posts small blind 10
sk1nsey: posts big blind 20
*** HOLE CARDS ***
Dealt to Mahu2021 [4c 6s]
timi2020: folds 
Mahu2021: folds 
Uncalled bet (10) returned to sk1nsey
sk1nsey collected 20 from pot
*** SUMMARY ***
Total pot 20 | Rake 0 
Seat 1: timi2020 (button) folded before Flop (didn't bet)
Seat 2: Mahu2021 (small blind) folded before Flop
Seat 3: sk1nsey (big blind) collected (20)



PokerStars Hand #244627832672: Tournament #3612652422, $0.92+$0.08 USD Hold'em No Limit - Level I (10/20) - 2023/07/04 22:16:09 CET [2023/07/04 16:16:09 ET]
Table '3612652422 1' 3-max Seat #2 is the button
Seat 1: timi2020 (900 in chips) 
Seat 2: Mahu2021 (40 in chips) 
Seat 3: sk1nsey (560 in chips) 
sk1nsey: posts small blind 10
timi2020: posts big blind 20
*** HOLE CARDS ***
Dealt to Mahu2021 [Kd 3c]
Mahu2021: raises 20 to 40 and is all-in
sk1nsey: raises 40 to 80
timi2020: folds 
Uncalled bet (40) returned to sk1nsey
*** FLOP *** [6d 6s 4d]
*** TURN *** [6d 6s 4d] [3d]
*** RIVER *** [6d 6s 4d 3d] [Kh]
*** SHOW DOWN ***
sk1nsey: shows [Kc Ad] (two pair, Kings and Sixes)
Mahu2021: shows [Kd 3c] (two pair, Kings and Sixes - lower kicker)
sk1nsey collected 100 from pot
Mahu2021 finished the tournament in 3rd place
*** SUMMARY ***
Total pot 100 | Rake 0 
Board [6d 6s 4d 3d Kh]
Seat 1: timi2020 (big blind) folded before Flop
Seat 2: Mahu2021 (button) showed [Kd 3c] and lost with two pair, Kings and Sixes
Seat 3: sk1nsey (small blind) showed [Kc Ad] and won (100) with two pair, Kings and Sixes



