PokerStars Hand #244358398988: Tournament #3606465043, $0.92+$0.08 USD Hold'em No Limit - Level I (10/20) - 2023/06/19 20:34:49 CET [2023/06/19 14:34:49 ET]
Table '3606465043 1' 3-max Seat #1 is the button
Seat 1: Mahu2021 (500 in chips) 
Seat 2: RehtniV (500 in chips) 
Seat 3: Otis tardaa (500 in chips) 
RehtniV: posts small blind 10
Otis tardaa: posts big blind 20
*** HOLE CARDS ***
Dealt to Mahu2021 [8c 9d]
Mahu2021: folds 
RehtniV: calls 10
Otis tardaa: checks 
*** FLOP *** [Qc 3h Ah]
RehtniV: checks 
Otis tardaa: bets 40
RehtniV: calls 40
*** TURN *** [Qc 3h Ah] [6h]
RehtniV: checks 
Otis tardaa: bets 120
RehtniV: folds 
Uncalled bet (120) returned to Otis tardaa
Otis tardaa collected 120 from pot
Otis tardaa: doesn't show hand 
*** SUMMARY ***
Total pot 120 | Rake 0 
Board [Qc 3h Ah 6h]
Seat 1: Mahu2021 (button) folded before Flop (didn't bet)
Seat 2: RehtniV (small blind) folded on the Turn
Seat 3: Otis tardaa (big blind) collected (120)



PokerStars Hand #244358409051: Tournament #3606465043, $0.92+$0.08 USD Hold'em No Limit - Level I (10/20) - 2023/06/19 20:35:21 CET [2023/06/19 14:35:21 ET]
Table '3606465043 1' 3-max Seat #2 is the button
Seat 1: Mahu2021 (500 in chips) 
Seat 2: RehtniV (440 in chips) 
Seat 3: Otis tardaa (560 in chips) 
Otis tardaa: posts small blind 10
Mahu2021: posts big blind 20
*** HOLE CARDS ***
Dealt to Mahu2021 [5d 4c]
RehtniV: calls 20
Otis tardaa: calls 10
Mahu2021: checks 
*** FLOP *** [2s 7h Ts]
Otis tardaa: checks 
Mahu2021: checks 
RehtniV: checks 
*** TURN *** [2s 7h Ts] [3c]
Otis tardaa: checks 
Mahu2021: bets 60
RehtniV: calls 60
Otis tardaa: calls 60
*** RIVER *** [2s 7h Ts 3c] [6c]
Otis tardaa: checks 
Mahu2021: bets 420 and is all-in
RehtniV: calls 360 and is all-in
Otis tardaa: folds 
Uncalled bet (60) returned to Mahu2021
*** SHOW DOWN ***
Mahu2021: shows [5d 4c] (a straight, Three to Seven)
RehtniV: shows [6d Tc] (two pair, Tens and Sixes)
Mahu2021 collected 960 from pot
RehtniV finished the tournament in 3rd place
*** SUMMARY ***
Total pot 960 | Rake 0 
Board [2s 7h Ts 3c 6c]
Seat 1: Mahu2021 (big blind) showed [5d 4c] and won (960) with a straight, Three to Seven
Seat 2: RehtniV (button) showed [6d Tc] and lost with two pair, Tens and Sixes
Seat 3: Otis tardaa (small blind) folded on the River



PokerStars Hand #244358423736: Tournament #3606465043, $0.92+$0.08 USD Hold'em No Limit - Level I (10/20) - 2023/06/19 20:36:07 CET [2023/06/19 14:36:07 ET]
Table '3606465043 1' 3-max Seat #1 is the button
Seat 1: Mahu2021 (1020 in chips) 
Seat 3: Otis tardaa (480 in chips) 
Mahu2021: posts small blind 10
Otis tardaa: posts big blind 20
*** HOLE CARDS ***
Dealt to Mahu2021 [8c 2c]
Mahu2021: folds 
Uncalled bet (10) returned to Otis tardaa
Otis tardaa collected 20 from pot
Otis tardaa: doesn't show hand 
*** SUMMARY ***
Total pot 20 | Rake 0 
Seat 1: Mahu2021 (button) (small blind) folded before Flop
Seat 3: Otis tardaa (big blind) collected (20)



PokerStars Hand #244358425131: Tournament #3606465043, $0.92+$0.08 USD Hold'em No Limit - Level I (10/20) - 2023/06/19 20:36:12 CET [2023/06/19 14:36:12 ET]
Table '3606465043 1' 3-max Seat #3 is the button
Seat 1: Mahu2021 (1010 in chips) 
Seat 3: Otis tardaa (490 in chips) 
Otis tardaa: posts small blind 10
Mahu2021: posts big blind 20
*** HOLE CARDS ***
Dealt to Mahu2021 [2c Kh]
Otis tardaa: calls 10
Mahu2021: checks 
*** FLOP *** [4c 3c Qc]
Mahu2021: checks 
Otis tardaa: checks 
*** TURN *** [4c 3c Qc] [7h]
Mahu2021: checks 
Otis tardaa: checks 
*** RIVER *** [4c 3c Qc 7h] [3d]
Mahu2021: bets 20
Otis tardaa: calls 20
*** SHOW DOWN ***
Mahu2021: shows [2c Kh] (a pair of Threes)
Otis tardaa: shows [Ah Jd] (a pair of Threes - Ace kicker)
Otis tardaa collected 80 from pot
*** SUMMARY ***
Total pot 80 | Rake 0 
Board [4c 3c Qc 7h 3d]
Seat 1: Mahu2021 (big blind) showed [2c Kh] and lost with a pair of Threes
Seat 3: Otis tardaa (button) (small blind) showed [Ah Jd] and won (80) with a pair of Threes



PokerStars Hand #244358433354: Tournament #3606465043, $0.92+$0.08 USD Hold'em No Limit - Level I (10/20) - 2023/06/19 20:36:38 CET [2023/06/19 14:36:38 ET]
Table '3606465043 1' 3-max Seat #1 is the button
Seat 1: Mahu2021 (970 in chips) 
Seat 3: Otis tardaa (530 in chips) 
Mahu2021: posts small blind 10
Otis tardaa: posts big blind 20
*** HOLE CARDS ***
Dealt to Mahu2021 [2c Th]
Mahu2021: folds 
Uncalled bet (10) returned to Otis tardaa
Otis tardaa collected 20 from pot
Otis tardaa: doesn't show hand 
*** SUMMARY ***
Total pot 20 | Rake 0 
Seat 1: Mahu2021 (button) (small blind) folded before Flop
Seat 3: Otis tardaa (big blind) collected (20)



PokerStars Hand #244358434739: Tournament #3606465043, $0.92+$0.08 USD Hold'em No Limit - Level I (10/20) - 2023/06/19 20:36:42 CET [2023/06/19 14:36:42 ET]
Table '3606465043 1' 3-max Seat #3 is the button
Seat 1: Mahu2021 (960 in chips) 
Seat 3: Otis tardaa (540 in chips) 
Otis tardaa: posts small blind 10
Mahu2021: posts big blind 20
*** HOLE CARDS ***
Dealt to Mahu2021 [8s Ah]
Otis tardaa: folds 
Uncalled bet (10) returned to Mahu2021
Mahu2021 collected 20 from pot
Mahu2021: doesn't show hand 
*** SUMMARY ***
Total pot 20 | Rake 0 
Seat 1: Mahu2021 (big blind) collected (20)
Seat 3: Otis tardaa (button) (small blind) folded before Flop



PokerStars Hand #244358436995: Tournament #3606465043, $0.92+$0.08 USD Hold'em No Limit - Level I (10/20) - 2023/06/19 20:36:49 CET [2023/06/19 14:36:49 ET]
Table '3606465043 1' 3-max Seat #1 is the button
Seat 1: Mahu2021 (970 in chips) 
Seat 3: Otis tardaa (530 in chips) 
Mahu2021: posts small blind 10
Otis tardaa: posts big blind 20
*** HOLE CARDS ***
Dealt to Mahu2021 [Js 4s]
Mahu2021: calls 10
Otis tardaa: checks 
*** FLOP *** [Ad 2d 4d]
Otis tardaa: bets 20
Mahu2021: calls 20
*** TURN *** [Ad 2d 4d] [Jh]
Otis tardaa: bets 20
Mahu2021: raises 120 to 140
Otis tardaa: raises 350 to 490 and is all-in
Mahu2021: calls 350
*** RIVER *** [Ad 2d 4d Jh] [Jd]
*** SHOW DOWN ***
Otis tardaa: shows [8s Ac] (two pair, Aces and Jacks)
Mahu2021: shows [Js 4s] (a full house, Jacks full of Fours)
Mahu2021 collected 1060 from pot
Otis tardaa finished the tournament in 2nd place
Mahu2021 wins the tournament and receives $2.00 - congratulations!
*** SUMMARY ***
Total pot 1060 | Rake 0 
Board [Ad 2d 4d Jh Jd]
Seat 1: Mahu2021 (button) (small blind) showed [Js 4s] and won (1060) with a full house, Jacks full of Fours
Seat 3: Otis tardaa (big blind) showed [8s Ac] and lost with two pair, Aces and Jacks



