PokerStars Hand #249469517515: Tournament #3730013492, $1.84+$0.16 USD Hold'em No Limit - Level I (10/20) - 2024/03/17 14:56:43 CET [2024/03/17 9:56:43 ET]
Table '3730013492 1' 3-max Seat #1 is the button
Seat 1: Paula009201 (500 in chips) 
Seat 2: Mahu2021 (500 in chips) 
Seat 3: Lövar (500 in chips) 
Mahu2021: posts small blind 10
Lövar: posts big blind 20
*** HOLE CARDS ***
Dealt to Mahu2021 [8s 9d]
Paula009201: raises 40 to 60
Mahu2021: folds 
Lövar: calls 40
*** FLOP *** [9h As Qs]
Lövar: checks 
Paula009201: checks 
*** TURN *** [9h As Qs] [8d]
Lövar: checks 
Paula009201: checks 
*** RIVER *** [9h As Qs 8d] [2h]
Lövar: checks 
Paula009201: checks 
*** SHOW DOWN ***
Lövar: shows [Ks 4d] (high card Ace)
Paula009201: shows [Td Tc] (a pair of Tens)
Paula009201 collected 130 from pot
*** SUMMARY ***
Total pot 130 | Rake 0 
Board [9h As Qs 8d 2h]
Seat 1: Paula009201 (button) showed [Td Tc] and won (130) with a pair of Tens
Seat 2: Mahu2021 (small blind) folded before Flop
Seat 3: Lövar (big blind) showed [Ks 4d] and lost with high card Ace



PokerStars Hand #249469520282: Tournament #3730013492, $1.84+$0.16 USD Hold'em No Limit - Level I (10/20) - 2024/03/17 14:57:00 CET [2024/03/17 9:57:00 ET]
Table '3730013492 1' 3-max Seat #2 is the button
Seat 1: Paula009201 (570 in chips) 
Seat 2: Mahu2021 (490 in chips) 
Seat 3: Lövar (440 in chips) 
Lövar: posts small blind 10
Paula009201: posts big blind 20
*** HOLE CARDS ***
Dealt to Mahu2021 [Jh 3s]
Mahu2021: folds 
Lövar: calls 10
Paula009201: raises 20 to 40
Lövar: calls 20
*** FLOP *** [7c Jd 8d]
Lövar: bets 80
Paula009201: calls 80
*** TURN *** [7c Jd 8d] [Th]
Lövar: checks 
Paula009201: checks 
*** RIVER *** [7c Jd 8d Th] [7s]
Lövar: checks 
Paula009201: checks 
*** SHOW DOWN ***
Lövar: shows [8c 6s] (two pair, Eights and Sevens)
Paula009201: mucks hand 
Lövar collected 240 from pot
*** SUMMARY ***
Total pot 240 | Rake 0 
Board [7c Jd 8d Th 7s]
Seat 1: Paula009201 (big blind) mucked [5h As]
Seat 2: Mahu2021 (button) folded before Flop (didn't bet)
Seat 3: Lövar (small blind) showed [8c 6s] and won (240) with two pair, Eights and Sevens



PokerStars Hand #249469525502: Tournament #3730013492, $1.84+$0.16 USD Hold'em No Limit - Level I (10/20) - 2024/03/17 14:57:30 CET [2024/03/17 9:57:30 ET]
Table '3730013492 1' 3-max Seat #3 is the button
Seat 1: Paula009201 (450 in chips) 
Seat 2: Mahu2021 (490 in chips) 
Seat 3: Lövar (560 in chips) 
Paula009201: posts small blind 10
Mahu2021: posts big blind 20
*** HOLE CARDS ***
Dealt to Mahu2021 [Qd 9d]
Lövar: folds 
Paula009201: raises 40 to 60
Mahu2021: calls 40
*** FLOP *** [Td 3s Qh]
Paula009201: checks 
Mahu2021: bets 120
Paula009201: calls 120
*** TURN *** [Td 3s Qh] [7h]
Paula009201: checks 
Mahu2021: bets 310 and is all-in
Paula009201: calls 270 and is all-in
Uncalled bet (40) returned to Mahu2021
*** RIVER *** [Td 3s Qh 7h] [Ah]
*** SHOW DOWN ***
Paula009201: shows [7c 7d] (three of a kind, Sevens)
Mahu2021: shows [Qd 9d] (a pair of Queens)
Paula009201 collected 900 from pot
*** SUMMARY ***
Total pot 900 | Rake 0 
Board [Td 3s Qh 7h Ah]
Seat 1: Paula009201 (small blind) showed [7c 7d] and won (900) with three of a kind, Sevens
Seat 2: Mahu2021 (big blind) showed [Qd 9d] and lost with a pair of Queens
Seat 3: Lövar (button) folded before Flop (didn't bet)



PokerStars Hand #249469529413: Tournament #3730013492, $1.84+$0.16 USD Hold'em No Limit - Level I (10/20) - 2024/03/17 14:57:54 CET [2024/03/17 9:57:54 ET]
Table '3730013492 1' 3-max Seat #1 is the button
Seat 1: Paula009201 (900 in chips) 
Seat 2: Mahu2021 (40 in chips) 
Seat 3: Lövar (560 in chips) 
Mahu2021: posts small blind 10
Lövar: posts big blind 20
*** HOLE CARDS ***
Dealt to Mahu2021 [2d 4c]
Paula009201: calls 20
Mahu2021: folds 
Lövar: checks 
*** FLOP *** [Kd Qd 8d]
Lövar: checks 
Paula009201: checks 
*** TURN *** [Kd Qd 8d] [4s]
Lövar: bets 20
Paula009201: folds 
Uncalled bet (20) returned to Lövar
Lövar collected 50 from pot
*** SUMMARY ***
Total pot 50 | Rake 0 
Board [Kd Qd 8d 4s]
Seat 1: Paula009201 (button) folded on the Turn
Seat 2: Mahu2021 (small blind) folded before Flop
Seat 3: Lövar (big blind) collected (50)



PokerStars Hand #249469532198: Tournament #3730013492, $1.84+$0.16 USD Hold'em No Limit - Level I (10/20) - 2024/03/17 14:58:10 CET [2024/03/17 9:58:10 ET]
Table '3730013492 1' 3-max Seat #2 is the button
Seat 1: Paula009201 (880 in chips) 
Seat 2: Mahu2021 (30 in chips) 
Seat 3: Lövar (590 in chips) 
Lövar: posts small blind 10
Paula009201: posts big blind 20
*** HOLE CARDS ***
Dealt to Mahu2021 [Ts Ac]
Mahu2021: raises 10 to 30 and is all-in
Lövar: calls 20
Paula009201: calls 10
*** FLOP *** [5c 3h 6d]
Lövar: bets 45
Paula009201: calls 45
*** TURN *** [5c 3h 6d] [8s]
Lövar: bets 180
Paula009201: calls 180
*** RIVER *** [5c 3h 6d 8s] [5s]
Lövar: bets 335 and is all-in
Paula009201: folds 
Uncalled bet (335) returned to Lövar
*** SHOW DOWN ***
Lövar: shows [3c 3d] (a full house, Threes full of Fives)
Lövar collected 450 from side pot
Mahu2021: shows [Ts Ac] (a pair of Fives)
Lövar collected 90 from main pot
Mahu2021 finished the tournament in 3rd place
*** SUMMARY ***
Total pot 540 Main pot 90. Side pot 450. | Rake 0 
Board [5c 3h 6d 8s 5s]
Seat 1: Paula009201 (big blind) folded on the River
Seat 2: Mahu2021 (button) showed [Ts Ac] and lost with a pair of Fives
Seat 3: Lövar (small blind) showed [3c 3d] and won (540) with a full house, Threes full of Fives



