PokerStars Hand #249010381506: Tournament #3719276451, $1.84+$0.16 USD Hold'em No Limit - Level I (10/20) - 2024/02/21 17:57:49 CET [2024/02/21 11:57:49 ET]
Table '3719276451 1' 3-max Seat #1 is the button
Seat 1: Mahu2021 (500 in chips) 
Seat 2: Zuganos (500 in chips) 
Seat 3: StanyNikolov (500 in chips) 
Zuganos: posts small blind 10
StanyNikolov: posts big blind 20
*** HOLE CARDS ***
Dealt to Mahu2021 [9c 3h]
Mahu2021: folds 
Zuganos: calls 10
StanyNikolov: checks 
*** FLOP *** [6d Ks Th]
Zuganos: checks 
StanyNikolov: checks 
*** TURN *** [6d Ks Th] [4s]
Zuganos: checks 
StanyNikolov: checks 
*** RIVER *** [6d Ks Th 4s] [Ac]
Zuganos: checks 
StanyNikolov: checks 
*** SHOW DOWN ***
Zuganos: shows [5d Qd] (high card Ace)
StanyNikolov: shows [8c Qh] (high card Ace - King+Queen+Ten+Eight kicker)
StanyNikolov collected 40 from pot
*** SUMMARY ***
Total pot 40 | Rake 0 
Board [6d Ks Th 4s Ac]
Seat 1: Mahu2021 (button) folded before Flop (didn't bet)
Seat 2: Zuganos (small blind) showed [5d Qd] and lost with high card Ace
Seat 3: StanyNikolov (big blind) showed [8c Qh] and won (40) with high card Ace



PokerStars Hand #249010385824: Tournament #3719276451, $1.84+$0.16 USD Hold'em No Limit - Level I (10/20) - 2024/02/21 17:58:10 CET [2024/02/21 11:58:10 ET]
Table '3719276451 1' 3-max Seat #2 is the button
Seat 1: Mahu2021 (500 in chips) 
Seat 2: Zuganos (480 in chips) 
Seat 3: StanyNikolov (520 in chips) 
StanyNikolov: posts small blind 10
Mahu2021: posts big blind 20
*** HOLE CARDS ***
Dealt to Mahu2021 [5s Ts]
Zuganos: folds 
StanyNikolov: folds 
Uncalled bet (10) returned to Mahu2021
Mahu2021 collected 20 from pot
Mahu2021: doesn't show hand 
*** SUMMARY ***
Total pot 20 | Rake 0 
Seat 1: Mahu2021 (big blind) collected (20)
Seat 2: Zuganos (button) folded before Flop (didn't bet)
Seat 3: StanyNikolov (small blind) folded before Flop



PokerStars Hand #249010386776: Tournament #3719276451, $1.84+$0.16 USD Hold'em No Limit - Level I (10/20) - 2024/02/21 17:58:14 CET [2024/02/21 11:58:14 ET]
Table '3719276451 1' 3-max Seat #3 is the button
Seat 1: Mahu2021 (510 in chips) 
Seat 2: Zuganos (480 in chips) 
Seat 3: StanyNikolov (510 in chips) 
Mahu2021: posts small blind 10
Zuganos: posts big blind 20
*** HOLE CARDS ***
Dealt to Mahu2021 [7h 4h]
StanyNikolov: raises 20 to 40
Mahu2021: calls 30
Zuganos: calls 20
*** FLOP *** [7d Ad Qc]
Mahu2021: checks 
Zuganos: checks 
StanyNikolov: checks 
*** TURN *** [7d Ad Qc] [5c]
Mahu2021: checks 
Zuganos: checks 
StanyNikolov: checks 
*** RIVER *** [7d Ad Qc 5c] [3c]
Mahu2021: bets 40
Zuganos: raises 100 to 140
StanyNikolov: folds 
Mahu2021: folds 
Uncalled bet (100) returned to Zuganos
Zuganos collected 200 from pot
Zuganos: doesn't show hand 
*** SUMMARY ***
Total pot 200 | Rake 0 
Board [7d Ad Qc 5c 3c]
Seat 1: Mahu2021 (small blind) folded on the River
Seat 2: Zuganos (big blind) collected (200)
Seat 3: StanyNikolov (button) folded on the River



PokerStars Hand #249010394200: Tournament #3719276451, $1.84+$0.16 USD Hold'em No Limit - Level I (10/20) - 2024/02/21 17:58:50 CET [2024/02/21 11:58:50 ET]
Table '3719276451 1' 3-max Seat #1 is the button
Seat 1: Mahu2021 (430 in chips) 
Seat 2: Zuganos (600 in chips) 
Seat 3: StanyNikolov (470 in chips) 
Zuganos: posts small blind 10
StanyNikolov: posts big blind 20
*** HOLE CARDS ***
Dealt to Mahu2021 [Td 5h]
Mahu2021: folds 
Zuganos: calls 10
StanyNikolov: checks 
*** FLOP *** [Ts 6d 7c]
Zuganos: bets 40
StanyNikolov: raises 410 to 450 and is all-in
Zuganos: calls 410
*** TURN *** [Ts 6d 7c] [5d]
*** RIVER *** [Ts 6d 7c 5d] [7h]
*** SHOW DOWN ***
Zuganos: shows [7d 9c] (three of a kind, Sevens)
StanyNikolov: shows [Th 4s] (two pair, Tens and Sevens)
Zuganos collected 940 from pot
StanyNikolov finished the tournament in 3rd place
*** SUMMARY ***
Total pot 940 | Rake 0 
Board [Ts 6d 7c 5d 7h]
Seat 1: Mahu2021 (button) folded before Flop (didn't bet)
Seat 2: Zuganos (small blind) showed [7d 9c] and won (940) with three of a kind, Sevens
Seat 3: StanyNikolov (big blind) showed [Th 4s] and lost with two pair, Tens and Sevens



PokerStars Hand #249010400807: Tournament #3719276451, $1.84+$0.16 USD Hold'em No Limit - Level I (10/20) - 2024/02/21 17:59:21 CET [2024/02/21 11:59:21 ET]
Table '3719276451 1' 3-max Seat #2 is the button
Seat 1: Mahu2021 (430 in chips) 
Seat 2: Zuganos (1070 in chips) 
Zuganos: posts small blind 10
Mahu2021: posts big blind 20
*** HOLE CARDS ***
Dealt to Mahu2021 [Ts 5h]
Zuganos: raises 40 to 60
Mahu2021: folds 
Uncalled bet (40) returned to Zuganos
Zuganos collected 40 from pot
Zuganos: doesn't show hand 
*** SUMMARY ***
Total pot 40 | Rake 0 
Seat 1: Mahu2021 (big blind) folded before Flop
Seat 2: Zuganos (button) (small blind) collected (40)



PokerStars Hand #249010402288: Tournament #3719276451, $1.84+$0.16 USD Hold'em No Limit - Level I (10/20) - 2024/02/21 17:59:29 CET [2024/02/21 11:59:29 ET]
Table '3719276451 1' 3-max Seat #1 is the button
Seat 1: Mahu2021 (410 in chips) 
Seat 2: Zuganos (1090 in chips) 
Mahu2021: posts small blind 10
Zuganos: posts big blind 20
*** HOLE CARDS ***
Dealt to Mahu2021 [Qs 7c]
Mahu2021: raises 20 to 40
Zuganos: calls 20
*** FLOP *** [Kd 8d 9c]
Zuganos: checks 
Mahu2021: checks 
*** TURN *** [Kd 8d 9c] [6s]
Zuganos: checks 
Mahu2021: bets 80
Zuganos: raises 970 to 1050 and is all-in
Mahu2021: calls 290 and is all-in
Uncalled bet (680) returned to Zuganos
*** RIVER *** [Kd 8d 9c 6s] [4c]
*** SHOW DOWN ***
Zuganos: shows [3d Kh] (a pair of Kings)
Mahu2021: shows [Qs 7c] (high card King)
Zuganos collected 820 from pot
Mahu2021 finished the tournament in 2nd place
Zuganos wins the tournament and receives $6.00 - congratulations!
*** SUMMARY ***
Total pot 820 | Rake 0 
Board [Kd 8d 9c 6s 4c]
Seat 1: Mahu2021 (button) (small blind) showed [Qs 7c] and lost with high card King
Seat 2: Zuganos (big blind) showed [3d Kh] and won (820) with a pair of Kings



