PokerStars Hand #255044668087: Tournament #3863118478, $4.60+$0.40 USD Hold'em No Limit - Level I (10/20) - 2025/02/26 9:15:16 CET [2025/02/26 3:15:16 ET]
Table '3863118478 1' 3-max Seat #1 is the button
Seat 1: Mahu2021 (500 in chips) 
Seat 2: krizchan23 (500 in chips) 
Seat 3: omarocampo99 (500 in chips) 
krizchan23: posts small blind 10
omarocampo99: posts big blind 20
*** HOLE CARDS ***
Dealt to Mahu2021 [7c As]
Mahu2021: folds 
krizchan23: raises 20 to 40
omarocampo99: calls 20
*** FLOP *** [9d 2s Ks]
krizchan23: bets 40
omarocampo99: folds 
Uncalled bet (40) returned to krizchan23
krizchan23 collected 80 from pot
krizchan23: doesn't show hand 
*** SUMMARY ***
Total pot 80 | Rake 0 
Board [9d 2s Ks]
Seat 1: Mahu2021 (button) folded before Flop (didn't bet)
Seat 2: krizchan23 (small blind) collected (80)
Seat 3: omarocampo99 (big blind) folded on the Flop



PokerStars Hand #255044669378: Tournament #3863118478, $4.60+$0.40 USD Hold'em No Limit - Level I (10/20) - 2025/02/26 9:15:34 CET [2025/02/26 3:15:34 ET]
Table '3863118478 1' 3-max Seat #2 is the button
Seat 1: Mahu2021 (500 in chips) 
Seat 2: krizchan23 (540 in chips) 
Seat 3: omarocampo99 (460 in chips) 
omarocampo99: posts small blind 10
Mahu2021: posts big blind 20
*** HOLE CARDS ***
Dealt to Mahu2021 [8d 9s]
krizchan23: raises 20 to 40
omarocampo99: folds 
Mahu2021: calls 20
*** FLOP *** [9h Kh Ts]
Mahu2021: checks 
krizchan23: bets 40
Mahu2021: calls 40
*** TURN *** [9h Kh Ts] [6c]
Mahu2021: checks 
krizchan23: checks 
*** RIVER *** [9h Kh Ts 6c] [9c]
Mahu2021: checks 
krizchan23: checks 
*** SHOW DOWN ***
Mahu2021: shows [8d 9s] (three of a kind, Nines)
krizchan23: mucks hand 
Mahu2021 collected 170 from pot
*** SUMMARY ***
Total pot 170 | Rake 0 
Board [9h Kh Ts 6c 9c]
Seat 1: Mahu2021 (big blind) showed [8d 9s] and won (170) with three of a kind, Nines
Seat 2: krizchan23 (button) mucked [As Js]
Seat 3: omarocampo99 (small blind) folded before Flop



PokerStars Hand #255044670494: Tournament #3863118478, $4.60+$0.40 USD Hold'em No Limit - Level I (10/20) - 2025/02/26 9:15:49 CET [2025/02/26 3:15:49 ET]
Table '3863118478 1' 3-max Seat #3 is the button
Seat 1: Mahu2021 (590 in chips) 
Seat 2: krizchan23 (460 in chips) 
Seat 3: omarocampo99 (450 in chips) 
Mahu2021: posts small blind 10
krizchan23: posts big blind 20
*** HOLE CARDS ***
Dealt to Mahu2021 [Ks Js]
omarocampo99: raises 20 to 40
Mahu2021: calls 30
krizchan23: calls 20
*** FLOP *** [Qc 5d 9c]
Mahu2021: checks 
krizchan23: bets 40
omarocampo99: folds 
Mahu2021: folds 
Uncalled bet (40) returned to krizchan23
krizchan23 collected 120 from pot
krizchan23: doesn't show hand 
*** SUMMARY ***
Total pot 120 | Rake 0 
Board [Qc 5d 9c]
Seat 1: Mahu2021 (small blind) folded on the Flop
Seat 2: krizchan23 (big blind) collected (120)
Seat 3: omarocampo99 (button) folded on the Flop



PokerStars Hand #255044672089: Tournament #3863118478, $4.60+$0.40 USD Hold'em No Limit - Level I (10/20) - 2025/02/26 9:16:11 CET [2025/02/26 3:16:11 ET]
Table '3863118478 1' 3-max Seat #1 is the button
Seat 1: Mahu2021 (550 in chips) 
Seat 2: krizchan23 (540 in chips) 
Seat 3: omarocampo99 (410 in chips) 
krizchan23: posts small blind 10
omarocampo99: posts big blind 20
*** HOLE CARDS ***
Dealt to Mahu2021 [4h 3d]
Mahu2021: folds 
krizchan23: folds 
Uncalled bet (10) returned to omarocampo99
omarocampo99 collected 20 from pot
omarocampo99: doesn't show hand 
*** SUMMARY ***
Total pot 20 | Rake 0 
Seat 1: Mahu2021 (button) folded before Flop (didn't bet)
Seat 2: krizchan23 (small blind) folded before Flop
Seat 3: omarocampo99 (big blind) collected (20)



PokerStars Hand #255044672438: Tournament #3863118478, $4.60+$0.40 USD Hold'em No Limit - Level I (10/20) - 2025/02/26 9:16:16 CET [2025/02/26 3:16:16 ET]
Table '3863118478 1' 3-max Seat #2 is the button
Seat 1: Mahu2021 (550 in chips) 
Seat 2: krizchan23 (530 in chips) 
Seat 3: omarocampo99 (420 in chips) 
omarocampo99: posts small blind 10
Mahu2021: posts big blind 20
*** HOLE CARDS ***
Dealt to Mahu2021 [4s 9s]
krizchan23: calls 20
omarocampo99: raises 34 to 54
Mahu2021: folds 
krizchan23: calls 34
*** FLOP *** [8c 5h Qd]
omarocampo99: bets 42
krizchan23: calls 42
*** TURN *** [8c 5h Qd] [6h]
omarocampo99: bets 70
krizchan23: raises 270 to 340
omarocampo99: folds 
Uncalled bet (270) returned to krizchan23
krizchan23 collected 352 from pot
krizchan23: doesn't show hand 
*** SUMMARY ***
Total pot 352 | Rake 0 
Board [8c 5h Qd 6h]
Seat 1: Mahu2021 (big blind) folded before Flop
Seat 2: krizchan23 (button) collected (352)
Seat 3: omarocampo99 (small blind) folded on the Turn



PokerStars Hand #255044675015: Tournament #3863118478, $4.60+$0.40 USD Hold'em No Limit - Level I (10/20) - 2025/02/26 9:16:52 CET [2025/02/26 3:16:52 ET]
Table '3863118478 1' 3-max Seat #3 is the button
Seat 1: Mahu2021 (530 in chips) 
Seat 2: krizchan23 (716 in chips) 
Seat 3: omarocampo99 (254 in chips) 
Mahu2021: posts small blind 10
krizchan23: posts big blind 20
*** HOLE CARDS ***
Dealt to Mahu2021 [7h Kd]
omarocampo99: folds 
Mahu2021: raises 20 to 40
krizchan23: calls 20
*** FLOP *** [8h 9s Ad]
Mahu2021: bets 40
krizchan23: folds 
Uncalled bet (40) returned to Mahu2021
Mahu2021 collected 80 from pot
Mahu2021: doesn't show hand 
*** SUMMARY ***
Total pot 80 | Rake 0 
Board [8h 9s Ad]
Seat 1: Mahu2021 (small blind) collected (80)
Seat 2: krizchan23 (big blind) folded on the Flop
Seat 3: omarocampo99 (button) folded before Flop (didn't bet)



PokerStars Hand #255044675772: Tournament #3863118478, $4.60+$0.40 USD Hold'em No Limit - Level I (10/20) - 2025/02/26 9:17:03 CET [2025/02/26 3:17:03 ET]
Table '3863118478 1' 3-max Seat #1 is the button
Seat 1: Mahu2021 (570 in chips) 
Seat 2: krizchan23 (676 in chips) 
Seat 3: omarocampo99 (254 in chips) 
krizchan23: posts small blind 10
omarocampo99: posts big blind 20
*** HOLE CARDS ***
Dealt to Mahu2021 [9s Ks]
Mahu2021: raises 20 to 40
krizchan23: calls 30
omarocampo99: folds 
*** FLOP *** [3s As 3h]
krizchan23: bets 20
Mahu2021: calls 20
*** TURN *** [3s As 3h] [Tc]
krizchan23: bets 60
Mahu2021: calls 60
*** RIVER *** [3s As 3h Tc] [5d]
krizchan23: bets 140
Mahu2021: folds 
Uncalled bet (140) returned to krizchan23
krizchan23 collected 260 from pot
krizchan23: doesn't show hand 
*** SUMMARY ***
Total pot 260 | Rake 0 
Board [3s As 3h Tc 5d]
Seat 1: Mahu2021 (button) folded on the River
Seat 2: krizchan23 (small blind) collected (260)
Seat 3: omarocampo99 (big blind) folded before Flop



PokerStars Hand #255044677341: Tournament #3863118478, $4.60+$0.40 USD Hold'em No Limit - Level II (15/30) - 2025/02/26 9:17:25 CET [2025/02/26 3:17:25 ET]
Table '3863118478 1' 3-max Seat #2 is the button
Seat 1: Mahu2021 (450 in chips) 
Seat 2: krizchan23 (816 in chips) 
Seat 3: omarocampo99 (234 in chips) 
omarocampo99: posts small blind 15
Mahu2021: posts big blind 30
*** HOLE CARDS ***
Dealt to Mahu2021 [As 7h]
krizchan23: raises 30 to 60
omarocampo99: folds 
Mahu2021: calls 30
*** FLOP *** [6d Ad 7s]
Mahu2021: checks 
krizchan23: bets 60
Mahu2021: calls 60
*** TURN *** [6d Ad 7s] [Kc]
Mahu2021: checks 
krizchan23: bets 60
Mahu2021: raises 270 to 330 and is all-in
krizchan23: calls 270
*** RIVER *** [6d Ad 7s Kc] [Ks]
*** SHOW DOWN ***
Mahu2021: shows [As 7h] (two pair, Aces and Kings)
krizchan23: shows [9h Ah] (two pair, Aces and Kings - Nine kicker)
krizchan23 collected 915 from pot
Mahu2021 finished the tournament in 3rd place
*** SUMMARY ***
Total pot 915 | Rake 0 
Board [6d Ad 7s Kc Ks]
Seat 1: Mahu2021 (big blind) showed [As 7h] and lost with two pair, Aces and Kings
Seat 2: krizchan23 (button) showed [9h Ah] and won (915) with two pair, Aces and Kings
Seat 3: omarocampo99 (small blind) folded before Flop



