PokerStars Hand #255644909425: Tournament #3877182168, $0.46+$0.04 USD Hold'em No Limit - Level I (10/20) - 2025/04/08 13:07:52 CET [2025/04/08 7:07:52 ET]
Table '3877182168 1' 3-max Seat #1 is the button
Seat 1: sandri836 (500 in chips) 
Seat 2: Mahu2021 (500 in chips) 
Seat 3: Halkoba (500 in chips) 
Mahu2021: posts small blind 10
Halkoba: posts big blind 20
*** HOLE CARDS ***
Dealt to Mahu2021 [Kd 6c]
sandri836: raises 50 to 70
Mahu2021: folds 
Halkoba: folds 
Uncalled bet (50) returned to sandri836
sandri836 collected 50 from pot
*** SUMMARY ***
Total pot 50 | Rake 0 
Seat 1: sandri836 (button) collected (50)
Seat 2: Mahu2021 (small blind) folded before Flop
Seat 3: Halkoba (big blind) folded before Flop



PokerStars Hand #255644911424: Tournament #3877182168, $0.46+$0.04 USD Hold'em No Limit - Level I (10/20) - 2025/04/08 13:08:10 CET [2025/04/08 7:08:10 ET]
Table '3877182168 1' 3-max Seat #2 is the button
Seat 1: sandri836 (530 in chips) 
Seat 2: Mahu2021 (490 in chips) 
Seat 3: Halkoba (480 in chips) 
Halkoba: posts small blind 10
sandri836: posts big blind 20
*** HOLE CARDS ***
Dealt to Mahu2021 [2h 3s]
Mahu2021: folds 
Halkoba: folds 
Uncalled bet (10) returned to sandri836
sandri836 collected 20 from pot
*** SUMMARY ***
Total pot 20 | Rake 0 
Seat 1: sandri836 (big blind) collected (20)
Seat 2: Mahu2021 (button) folded before Flop (didn't bet)
Seat 3: Halkoba (small blind) folded before Flop



PokerStars Hand #255644912222: Tournament #3877182168, $0.46+$0.04 USD Hold'em No Limit - Level I (10/20) - 2025/04/08 13:08:17 CET [2025/04/08 7:08:17 ET]
Table '3877182168 1' 3-max Seat #3 is the button
Seat 1: sandri836 (540 in chips) 
Seat 2: Mahu2021 (490 in chips) 
Seat 3: Halkoba (470 in chips) 
sandri836: posts small blind 10
Mahu2021: posts big blind 20
*** HOLE CARDS ***
Dealt to Mahu2021 [7s Qd]
Halkoba: raises 20 to 40
sandri836: calls 30
Mahu2021: folds 
*** FLOP *** [2s Qc 2d]
sandri836: checks 
Halkoba: checks 
*** TURN *** [2s Qc 2d] [7c]
sandri836: checks 
Halkoba: checks 
*** RIVER *** [2s Qc 2d 7c] [8c]
sandri836: checks 
Halkoba: checks 
*** SHOW DOWN ***
sandri836: shows [Kc 9s] (a pair of Deuces)
Halkoba: mucks hand 
sandri836 collected 100 from pot
*** SUMMARY ***
Total pot 100 | Rake 0 
Board [2s Qc 2d 7c 8c]
Seat 1: sandri836 (small blind) showed [Kc 9s] and won (100) with a pair of Deuces
Seat 2: Mahu2021 (big blind) folded before Flop
Seat 3: Halkoba (button) mucked [Jh Th]



PokerStars Hand #255644915163: Tournament #3877182168, $0.46+$0.04 USD Hold'em No Limit - Level I (10/20) - 2025/04/08 13:08:43 CET [2025/04/08 7:08:43 ET]
Table '3877182168 1' 3-max Seat #1 is the button
Seat 1: sandri836 (600 in chips) 
Seat 2: Mahu2021 (470 in chips) 
Seat 3: Halkoba (430 in chips) 
Mahu2021: posts small blind 10
Halkoba: posts big blind 20
*** HOLE CARDS ***
Dealt to Mahu2021 [6s 6c]
sandri836: raises 20 to 40
Mahu2021: raises 430 to 470 and is all-in
Halkoba: folds 
sandri836: calls 430
*** FLOP *** [9h Tc As]
*** TURN *** [9h Tc As] [Jc]
*** RIVER *** [9h Tc As Jc] [2s]
*** SHOW DOWN ***
Mahu2021: shows [6s 6c] (a pair of Sixes)
sandri836: shows [5h 4s] (high card Ace)
Mahu2021 collected 960 from pot
*** SUMMARY ***
Total pot 960 | Rake 0 
Board [9h Tc As Jc 2s]
Seat 1: sandri836 (button) showed [5h 4s] and lost with high card Ace
Seat 2: Mahu2021 (small blind) showed [6s 6c] and won (960) with a pair of Sixes
Seat 3: Halkoba (big blind) folded before Flop



PokerStars Hand #255644917093: Tournament #3877182168, $0.46+$0.04 USD Hold'em No Limit - Level I (10/20) - 2025/04/08 13:09:00 CET [2025/04/08 7:09:00 ET]
Table '3877182168 1' 3-max Seat #2 is the button
Seat 1: sandri836 (130 in chips) 
Seat 2: Mahu2021 (960 in chips) 
Seat 3: Halkoba (410 in chips) 
Halkoba: posts small blind 10
sandri836: posts big blind 20
*** HOLE CARDS ***
Dealt to Mahu2021 [Ks Qs]
Mahu2021: raises 20 to 40
Halkoba: folds 
sandri836: raises 90 to 130 and is all-in
Mahu2021: calls 90
*** FLOP *** [Qc 8d 3h]
*** TURN *** [Qc 8d 3h] [Tc]
*** RIVER *** [Qc 8d 3h Tc] [Jc]
*** SHOW DOWN ***
sandri836: shows [Ac 3s] (a pair of Threes)
Mahu2021: shows [Ks Qs] (a pair of Queens)
Mahu2021 collected 270 from pot
sandri836 finished the tournament in 3rd place
*** SUMMARY ***
Total pot 270 | Rake 0 
Board [Qc 8d 3h Tc Jc]
Seat 1: sandri836 (big blind) showed [Ac 3s] and lost with a pair of Threes
Seat 2: Mahu2021 (button) showed [Ks Qs] and won (270) with a pair of Queens
Seat 3: Halkoba (small blind) folded before Flop



PokerStars Hand #255644919530: Tournament #3877182168, $0.46+$0.04 USD Hold'em No Limit - Level I (10/20) - 2025/04/08 13:09:21 CET [2025/04/08 7:09:21 ET]
Table '3877182168 1' 3-max Seat #3 is the button
Seat 2: Mahu2021 (1100 in chips) 
Seat 3: Halkoba (400 in chips) 
Halkoba: posts small blind 10
Mahu2021: posts big blind 20
*** HOLE CARDS ***
Dealt to Mahu2021 [3h 2h]
Halkoba: raises 20 to 40
Mahu2021: calls 20
*** FLOP *** [3s 4c 9c]
Mahu2021: bets 40
Halkoba: calls 40
*** TURN *** [3s 4c 9c] [8c]
Mahu2021: bets 40
Halkoba: calls 40
*** RIVER *** [3s 4c 9c 8c] [2d]
Mahu2021: bets 240
Halkoba: calls 240
*** SHOW DOWN ***
Mahu2021: shows [3h 2h] (two pair, Threes and Deuces)
Halkoba: mucks hand 
Mahu2021 collected 720 from pot
*** SUMMARY ***
Total pot 720 | Rake 0 
Board [3s 4c 9c 8c 2d]
Seat 2: Mahu2021 (big blind) showed [3h 2h] and won (720) with two pair, Threes and Deuces
Seat 3: Halkoba (button) (small blind) mucked [Kc 4h]



PokerStars Hand #255644921886: Tournament #3877182168, $0.46+$0.04 USD Hold'em No Limit - Level I (10/20) - 2025/04/08 13:09:42 CET [2025/04/08 7:09:42 ET]
Table '3877182168 1' 3-max Seat #2 is the button
Seat 2: Mahu2021 (1460 in chips) 
Seat 3: Halkoba (40 in chips) 
Mahu2021: posts small blind 10
Halkoba: posts big blind 20
*** HOLE CARDS ***
Dealt to Mahu2021 [Ks 8h]
Mahu2021: raises 20 to 40
Halkoba: calls 20 and is all-in
*** FLOP *** [2s 3s As]
*** TURN *** [2s 3s As] [9s]
*** RIVER *** [2s 3s As 9s] [6s]
*** SHOW DOWN ***
Halkoba: shows [9d Kc] (a flush, Ace high)
Mahu2021: shows [Ks 8h] (a flush, Ace high - King higher)
Mahu2021 collected 80 from pot
Halkoba finished the tournament in 2nd place
Mahu2021 wins the tournament - congratulations!
Mahu2021 wins a '$1.00 Power Path Step 2 Ticket' ticket
*** SUMMARY ***
Total pot 80 | Rake 0 
Board [2s 3s As 9s 6s]
Seat 2: Mahu2021 (button) (small blind) showed [Ks 8h] and won (80) with a flush, Ace high
Seat 3: Halkoba (big blind) showed [9d Kc] and lost with a flush, Ace high



